name,price,rating,image_url,image_path,source,category_name,product_url
Spec Skin Cover For Macbook Air Pre 2018 Multicolour,257,0.0,No Image,No Image,Noon,fashion,https://www.noon.com/egypt-en/spec-skin-cover-for-macbook-air-pre-2018-multicolour/N52131934A/p/?o=df2851b5cf2aa89d
CALVIN KLEIN Men's Leather Chronograph Watch K2G271CX,"8,500",0.0,No Image,No Image,Noon,fashion,https://www.noon.com/egypt-en/men-s-leather-chronograph-watch-k2g271cx/N20469592A/p/?o=ea5821e82bb76d7f
E-Train Laptop Backpack Grey,799,0.0,No Image,No Image,Noon,fashion,https://www.noon.com/egypt-en/laptop-backpack-grey/N51915556A/p/?o=dce9a6d8867888dc
Bubblegum Skin Cover For Macbook Air 11 Multicolour,257,0.0,No Image,No Image,Noon,fashion,https://www.noon.com/egypt-en/bubblegum-skin-cover-for-macbook-air-11-multicolour/N52274126A/p/?o=a075d9a133b6feaa
Colorful Tie Dye Skin Cover For Macbook Pro Touch Bar 15 2015 Multicolour,257,0.0,No Image,No Image,Noon,fashion,https://www.noon.com/egypt-en/colorful-tie-dye-skin-cover-for-macbook-pro-touch-bar-15-2015-multicolour/N52285516A/p/?o=ac222627738d3edf
Girl GuitarPrinted Laptop Sticker Multicolor,283,0.0,No Image,No Image,Noon,fashion,https://www.noon.com/egypt-en/girl-guitarprinted-laptop-sticker-multicolor/N41257158A/p/?o=a289434194f4c38d
Anime Girl Printed Laptop Sticker Multicolor,257,0.0,No Image,No Image,Noon,fashion,https://www.noon.com/egypt-en/anime-girl-printed-laptop-sticker-multicolor/N41257336A/p/?o=b4c496ee187a050d
Fast Print Leaves Patterns Printed Laptop Sticker Multicolor,257,0.0,No Image,No Image,Noon,fashion,https://www.noon.com/egypt-en/leaves-patterns-printed-laptop-sticker-multicolor/N40825803A/p/?o=f45c8156cf06908d
G-SHOCK Men's Wrist Watch,"17,081",3.910,No Image,No Image,Noon,fashion,https://www.noon.com/egypt-en/men-s-wrist-watch/N43409320A/p/?o=b6cc2a51e885fcaa
Q&Q Men's Rubber Analog Watch Vs66J004Y,"1,290",0.0,No Image,No Image,Noon,fashion,https://www.noon.com/egypt-en/men-s-rubber-analog-watch-vs66j004y/N50819174A/p/?o=e2247ef179532e8b
Twisty Skin Cover For Macbook Pro Touch Bar 15 2015 Multicolour,257,0.0,No Image,No Image,Noon,fashion,https://www.noon.com/egypt-en/twisty-skin-cover-for-macbook-pro-touch-bar-15-2015-multicolour/N52285919A/p/?o=e33bd5754a63b5eb
Retro 3-Tier Modern Desk White/Natural,"3,330",0.0,No Image,No Image,Noon,fashion,https://www.noon.com/egypt-en/3-tier-modern-desk-white-natural/N44082988A/p/?o=f539da3bf60b04db
Blue Skin Cover For Macbook Pro 13 2015 Multicolour,257,0.0,No Image,No Image,Noon,fashion,https://www.noon.com/egypt-en/blue-skin-cover-for-macbook-pro-13-2015-multicolour/N52279479A/p/?o=d2e19f92fda54f7b
CASIO Men's Stainless Steel Analog Watch MTP-E170B-1B - 40 mm - Black,"6,820",0.0,No Image,No Image,Noon,fashion,https://www.noon.com/egypt-en/men-s-stainless-steel-analog-watch-mtp-e170b-1b-40-mm-black/N44624222A/p/?o=cdc496a3b15ae25c
Marble With Pink Skin Cover For Macbook Pro Touch Bar 2016 Multicolour,257,0.0,No Image,No Image,Noon,fashion,https://www.noon.com/egypt-en/marble-with-pink-skin-cover-for-macbook-pro-touch-bar-2016-multicolour/N52281545A/p/?o=c8989311761f61fc
Flower L Skin Cover For Macbook Air 11 Multicolour,257,0.0,No Image,No Image,Noon,fashion,https://www.noon.com/egypt-en/flower-l-skin-cover-for-macbook-air-11-multicolour/N52274291A/p/?o=d3170c0b71dd9f7d
Fast Print Inscription Motivation Printed Laptop Sticker Multicolour,257,0.0,No Image,No Image,Noon,fashion,https://www.noon.com/egypt-en/inscription-motivation-printed-laptop-sticker-multicolour/N41033681A/p/?o=e190b14b05788b4c
Painted Winter Flowers Skin Cover For Macbook Pro 17 (2015) Multicolour,257,0.0,No Image,No Image,Noon,fashion,https://www.noon.com/egypt-en/painted-winter-flowers-skin-cover-for-macbook-pro-17-2015-multicolour/N52280515A/p/?o=eff1a79692686d7d
In Your Shoe Green Crochet Fishnet Dress,899,0.0,No Image,No Image,Noon,fashion,https://www.noon.com/egypt-en/green-crochet-fishnet-dress/ZF9A354A29B35E0CEAF59Z/p/?o=c834d715a07a446a
SHEIN V-Neck Ruched Long Sleeve Elastic Cuff Split Hem Bodycon Dress Maxi Women Outfit,"1,399",0.0,No Image,No Image,Noon,fashion,https://www.noon.com/egypt-en/shein-v-neck-ruched-long-sleeve-elastic-cuff-split-hem-bodycon-dress-maxi-women-outfit/Z8B0599CE42DDB1573227Z/p/?o=c8bf1c84ef46ffea
trendyol Anthracite Tumbled/Faded Effect Fitted/Body Otruan Accessory Detail Flexible Knitted Blouse,603,0.0,No Image,No Image,Noon,fashion,https://www.noon.com/egypt-en/anthracite-tumbled-faded-effect-fitted-body-otruan-accessory-detail-flexible-knitted-blouse/Z0BC9A11E7AAE421C04BBZ/p/?o=c41feb2873be8d7b
"trendyol Tie Waist, Pocket Detailed Aerobin in Black TCTSS21AU0238",320,0.0,No Image,No Image,Noon,fashion,https://www.noon.com/egypt-en/tie-waist-pocket-detailed-aerobin-in-black-tctss21au0238/ZCCDDA8F3B6A37C7078BBZ/p/?o=zccdda8f3b6a37c7078bbz-1
Baraem Fashionable Pointed Style,336,4.01,No Image,No Image,Noon,fashion,https://www.noon.com/egypt-en/fashionable-pointed-style/Z43B95132B3D54DBD36A6Z/p/?o=z43b95132b3d54dbd36a6z-3
trendyol Black Asymmetric Collar Cut Out Detailed Stretch Snap Knitted Body TWOSS23BD00014,416,5.04,No Image,No Image,Noon,fashion,https://www.noon.com/egypt-en/black-asymmetric-collar-cut-out-detailed-stretch-snap-knitted-body-twoss23bd00014/Z71080AA504239E0C9AC9Z/p/?o=z71080aa504239e0c9ac9z-3
trendyol Shirt - White - Oversize,"1,039",4.162,No Image,No Image,Noon,fashion,https://www.noon.com/egypt-en/shirt-white-oversize/Z3923C2C593133B2451E3Z/p/?o=z3923c2c593133b2451e3z-2
trendyol women Dress,"1,197",0.0,No Image,No Image,Noon,fashion,https://www.noon.com/egypt-en/women-dress/Z2FDDAF5AF7023068A046Z/p/?o=z2fddaf5af7023068a046z-1
trendyol Anthracite Glitter Knitwear Sweater Trousers Bottom-Top Set TCTAW25US00010,"1,258",4.52,No Image,No Image,Noon,fashion,https://www.noon.com/egypt-en/anthracite-glitter-knitwear-sweater-trousers-bottom-top-set-tctaw25us00010/Z1E214B7FC4BA60E897C0Z/p/?o=z1e214b7fc4ba60e897c0z-4
Fashion Group Saree lined sequin blouse,500,0.0,No Image,No Image,Noon,fashion,https://www.noon.com/egypt-en/saree-lined-sequin-blouse/Z0EF0E8B912D253FF62D2Z/p/?o=z0ef0e8b912d253ff62d2z-1
trendyol Multicolored Abstract Gather/Drape Mini Abstract Printed Pleated Bodycon Knit Dress TWOSS25EL00099,"1,034",0.0,No Image,No Image,Noon,fashion,https://www.noon.com/egypt-en/multicolored-abstract-gather-drape-mini-abstract-printed-pleated-bodycon-knit-dress-twoss25el00099/Z13E9B70E8B65A59E89C4Z/p/?o=z13e9b70e8b65a59e89c4z-1
Fashion Group Women's short sleeve dress,625,0.0,No Image,No Image,Noon,fashion,https://www.noon.com/egypt-en/women-s-short-sleeve-dress/Z65BCAA0337775F1DA65CZ/p/?o=z65bcaa0337775f1da65cz-2
MANIKAN Women's Clothes Designed for more daily comfort use made of soft and flexible Lycra fabric materials,243.65,4.010,No Image,No Image,Noon,fashion,https://www.noon.com/egypt-en/manikan-women-s-clothes-designed-for-more-daily-comfort-use-made-of-soft-and-flexible-lycra-fabric-materials/Z45FD90038E91C8AB1953Z/p/?o=z45fd90038e91c8ab1953z-1
"trendyol Burgundy and Stone Colored 2-pack - Stretch Corded Knitted Body, Stand Collar",800,0.0,No Image,No Image,Noon,fashion,https://www.noon.com/egypt-en/burgundy-and-stone-colored-2-pack-stretch-corded-knitted-body-stand-collar/Z180BC9D93DFB27D81548Z/p/?o=ab214922effbc1de
Just for Women Tencel Jupsuite,"2,190",0.0,No Image,No Image,Noon,fashion,https://www.noon.com/egypt-en/tencel-jupsuite/ZFAA4A386C6E310221996Z/p/?o=c27ed8a421ce83ac
ONLY Womens Mette V-Neck Longsleeve Smock Top Woven,693,5.01,No Image,No Image,Noon,fashion,https://www.noon.com/egypt-en/only-womens-mette-v-neck-longsleeve-smock-top-woven/Z38301DD9A7E91870D6C3Z/p/?o=z38301dd9a7e91870d6c3z-1
trendyol Anthracite More Sustainable Modal Content Drape Detailed Degaje Collar Knitted Blouse,523,5.01,No Image,No Image,Noon,fashion,https://www.noon.com/egypt-en/anthracite-more-sustainable-modal-content-drape-detailed-degaje-collar-knitted-blouse/ZB6022DC14CA788F65A13Z/p/?o=f56df3991dd77c2b
trendyol Black Micro Fabric Back Slit Detail Sports Knitted Top/Blouse,493,0.0,No Image,No Image,Noon,fashion,https://www.noon.com/egypt-en/black-micro-fabric-back-slit-detail-sports-knitted-top-blouse/ZFEF70602E7004000F0EBZ/p/?o=cdae2136e480e05e
trendyol Brown Fitted Accessory Knitted Dress TPRAW25EL00166,"1,449",5.01,No Image,No Image,Noon,fashion,https://www.noon.com/egypt-en/brown-fitted-accessory-knitted-dress-tpraw25el00166/Z675402CA59A2B301F52DZ/p/?o=z675402ca59a2b301f52dz-1
trendyol Ecru Embroidered Detailed Woven Shirt,926,0.0,No Image,No Image,Noon,fashion,https://www.noon.com/egypt-en/ecru-embroidered-detailed-woven-shirt/Z7174D952DD57C19154B9Z/p/?o=z7174d952dd57c19154b9z-4
trendyol Beige Back Lace Detail Pocket Regular Gabardine Jacket,"1,494",0.0,No Image,No Image,Noon,fashion,https://www.noon.com/egypt-en/beige-back-lace-detail-pocket-regular-gabardine-jacket/ZB9DAD8427215639B6E86Z/p/?o=a2f95fa8411234fc
"MANIKAN Women's clothing with lace details, adjustable straps, made of soft and light tulle, comfortable design",301.97,0.0,No Image,No Image,Noon,fashion,https://www.noon.com/egypt-en/manikan-women-s-clothing-with-lace-details-adjustable-straps-made-of-soft-and-light-tulle-comfortable-design/Z69C4E97DF1BC6642C6C1Z/p/?o=z69c4e97df1bc6642c6c1z-1
VERO MODA Vmida Sl Frill Top Jrs Ga,359,0.0,No Image,No Image,Noon,fashion,https://www.noon.com/egypt-en/vmida-sl-frill-top-jrs-ga/Z65E17BF37459BDE1A868Z/p/?o=z65e17bf37459bde1a868z-3
"trendyol Flexible Knitted Body with Stand Collar and Gather Detail - Claret Red,",879.79,3.25,No Image,No Image,Noon,fashion,https://www.noon.com/egypt-en/flexible-knitted-body-with-stand-collar-and-gather-detail-claret-red/Z4C5F4E48946DD5EF1092Z/p/?o=c9ebad0b68095b5f
trendyol Burgundy Color Block Short / Mini Polo Neck Knitwear Dress,"1,197",0.0,No Image,No Image,Noon,fashion,https://www.noon.com/egypt-en/burgundy-color-block-short-mini-polo-neck-knitwear-dress/ZCB4ECAF023D1C6A98740Z/p/?o=c4e26a63b2aefc4c
trendyol Ecru Removable Bow Regular Fit Woven Shirt,"1,899",0.0,No Image,No Image,Noon,fashion,https://www.noon.com/egypt-en/ecru-removable-bow-regular-fit-woven-shirt/Z0539750790AEECCBBE26Z/p/?o=c86aa70d5640abeb
Women's dress,800,0.0,No Image,No Image,Noon,fashion,https://www.noon.com/egypt-en/women-s-dress/ZE0C69FDFF7D12DF993F9Z/p/?o=a2225c23ccb5ed0f
trendyol Anthracite Viscose/Soft Fabric Stretchy Knitted Blouse with Fingering Detail TWOAW25BZ00014,844,5.01,No Image,No Image,Noon,fashion,https://www.noon.com/egypt-en/anthracite-viscose-soft-fabric-stretchy-knitted-blouse-with-fingering-detail-twoaw25bz00014/ZCE7F56A0C318DDA34FE8Z/p/?o=zce7f56a0c318dda34fe8z-5
trendyol Navy Blue Double Breasted Closure Woven Gilet Dress,"1,076",0.0,No Image,No Image,Noon,fashion,https://www.noon.com/egypt-en/navy-blue-double-breasted-closure-woven-gilet-dress/ZA8D6684E3233F6EF22D0Z/p/?o=c446b85c607e762f
trendyol Light Blue Utility Pocket Detail Zero Arm Regular Fit Woven Shirt,587,0.0,No Image,No Image,Noon,fashion,https://www.noon.com/egypt-en/light-blue-utility-pocket-detail-zero-arm-regular-fit-woven-shirt/Z42BD9730C634DC6CDC19Z/p/?o=fb430bd93374997f
trendyol Beige Midi Length Crinkle Woven Shirt,853,0.0,No Image,No Image,Noon,fashion,https://www.noon.com/egypt-en/beige-midi-length-crinkle-woven-shirt/Z9F6DA0576F5FE018EFC4Z/p/?o=bd57e0bcbf862eda
trendyol Dried Rose Wide Cut Mini Woven Dress,566,0.0,No Image,No Image,Noon,fashion,https://www.noon.com/egypt-en/dried-rose-wide-cut-mini-woven-dress/Z17BC3BBDEB0B8404B25BZ/p/?o=z17bc3bbdeb0b8404b25bz-5
trendyol Dress - Gray - Shift,881.73,4.110,No Image,No Image,Noon,fashion,https://www.noon.com/egypt-en/dress-gray-shift/Z8C33CABF0C0444427B1CZ/p/?o=z8c33cabf0c0444427b1cz-3
SHEIN  Women's New Solid Color Retro Red Knitted Elastic,899,0.0,No Image,No Image,Noon,fashion,https://www.noon.com/egypt-en/shein-women-s-new-solid-color-retro-red-knitted-elastic/ZCFF88E23C94B78BE1183Z/p/?o=b87f26bd54bbd76c
trendyol Multi Color Collar Detailed Woven Dress,662,4.45,No Image,No Image,Noon,fashion,https://www.noon.com/egypt-en/multi-color-collar-detailed-woven-dress/ZDE7BDF4F6C85B5B5F06DZ/p/?o=c60da1f563a421fd
trendyol Ecru Lace Collar Woven Shirt with Ruffle Detail on the Front,878,5.01,No Image,No Image,Noon,fashion,https://www.noon.com/egypt-en/ecru-lace-collar-woven-shirt-with-ruffle-detail-on-the-front/Z07D3A0AE0313F1E41B78Z/p/?o=a194c92499a27b0a
فاشون جروب بلوزة نسائى شيفون اسود,550,0.0,No Image,No Image,Noon,fashion,https://www.noon.com/egypt-en/product/ZEDFC17779F938E9D6245Z/p/?o=zedfc17779f938e9d6245z-4
SHEIN Summer Clothes Street Slim Fitting Tops Rave Outfits  Neck Long Sleeve Hot Diamond TOP,699,5.01,No Image,No Image,Noon,fashion,https://www.noon.com/egypt-en/shein-summer-clothes-street-slim-fitting-tops-rave-outfits-neck-long-sleeve-hot-diamond-top/ZDB671EF0B059A398C919Z/p/?o=a8e306eac3bae8cb
VERO MODA Vmfleur Sl Tencel Top Ga,"2,599",0.0,No Image,No Image,Noon,fashion,https://www.noon.com/egypt-en/vmfleur-sl-tencel-top-ga/Z10C8D1D023CBBC9AC371Z/p/?o=b75b1c762e01798e
trendyol Ecru Regular Fit Half Patch Zippered Hooded Shirt,808,0.0,No Image,No Image,Noon,fashion,https://www.noon.com/egypt-en/ecru-regular-fit-half-patch-zippered-hooded-shirt/Z20C793C628E174E1E239Z/p/?o=bed97a2c9ea6bcbf
Fashion Group Long soiree dress,840,0.0,No Image,No Image,Noon,fashion,https://www.noon.com/egypt-en/long-soiree-dress/Z88F51781680694762A5DZ/p/?o=z88f51781680694762a5dz-1
VERO MODA AWKERRY 2/4 O-NECK TOP NOOS,440,0.0,No Image,No Image,Noon,fashion,https://www.noon.com/egypt-en/awkerry-2-4-o-neck-top-noos/Z196871709A75378B4240Z/p/?o=z196871709a75378b4240z-2
trendyol Ecru Premium Viscous Soft Fabric Fitted/Fitted Moon Sleeve Knitted Blouse,692,4.16,No Image,No Image,Noon,fashion,https://www.noon.com/egypt-en/ecru-premium-viscous-soft-fabric-fitted-fitted-moon-sleeve-knitted-blouse/ZD23150B5B93BAD9F777EZ/p/?o=fac1105c0987382a
ONLY Womens Ancona Shortsleeve V-Neck Dress,804,4.62,No Image,No Image,Noon,fashion,https://www.noon.com/egypt-en/only-womens-ancona-shortsleeve-v-neck-dress/Z98D56CFC93CCDDFE134AZ/p/?o=z98d56cfc93ccddfe134az-3
trendyol Lilac Fitted Square Neck Camisole Knit Plus Size Basic T-Shirt,407,0.0,No Image,No Image,Noon,fashion,https://www.noon.com/egypt-en/lilac-fitted-square-neck-camisole-knit-plus-size-basic-t-shirt/Z306C6691DDBB044B1877Z/p/?o=dd792b26541a6d9e
SHEINWomen Off Shoulder Solid Color Long Sleeve Single Breasted Fuzzy PULLOVER Fall Cloth For Women,749,0.0,No Image,No Image,Noon,fashion,https://www.noon.com/egypt-en/sheinwomen-off-shoulder-solid-color-long-sleeve-single-breasted-fuzzy-pullover-fall-cloth-for-women/Z3FABE454A391C447C9E2Z/p/?o=fd85e63a2bf1bbea
zecotex  Women's Comfortable Loose Esdal 2024,600,4.247,No Image,No Image,Noon,fashion,https://www.noon.com/egypt-en/women-s-comfortable-loose-esdal-2024/Z243000C786AC5A428233Z/p/?o=z243000c786ac5a428233z-1
trendyol Fitted Melange Zippered Stand Collar Moon Sleeve Thick Vest TWOSS24YE00011,908,5.02,No Image,No Image,Noon,fashion,https://www.noon.com/egypt-en/fitted-melange-zippered-stand-collar-moon-sleeve-thick-vest-twoss24ye00011/Z9B1A1C9DF7FAC316047CZ/p/?o=z9b1a1c9df7fac316047cz-1
Fashion Group SHORT LYCRA LINGERIE DRESS,225,0.0,No Image,No Image,Noon,fashion,https://www.noon.com/egypt-en/short-lycra-lingerie-dress/Z0BB2946D3EA913A5C302Z/p/?o=z0bb2946d3ea913a5c302z-3
trendyol Soft Button Black T-Shirt and Shorts Set -,751,0.0,No Image,No Image,Noon,fashion,https://www.noon.com/egypt-en/soft-button-black-t-shirt-and-shorts-set/Z91A275F2B2FD3C928AF9Z/p/?o=f61af3fe1609b8af
trendyol More Sustainable Black Fitted/Bodycon Shirred VNeck Long Sleeve Stretchy Knitted Blouse,909,0.0,No Image,No Image,Noon,fashion,https://www.noon.com/egypt-en/more-sustainable-black-fitted-bodycon-shirred-vneck-long-sleeve-stretchy-knitted-blouse/ZFA2FE3B7F893BC91F323Z/p/?o=d101d904356ed1ce
Fashion Group Off shoulder chiffon dress,780,0.0,No Image,No Image,Noon,fashion,https://www.noon.com/egypt-en/off-shoulder-chiffon-dress/ZC99424216F45A73C00FAZ/p/?o=zc99424216f45a73c00faz-2
Carina Basic Round Hem Shirt,715,0.0,No Image,No Image,Noon,fashion,https://www.noon.com/egypt-en/basic-round-hem-shirt/ZF2490D949C77F70ECCBEZ/p/?o=a202338d7a0d626c
Just Chill Skin Cover For Macbook Air 13 2018 2021 Multicolour,257,0.0,No Image,No Image,Noon,fashion,https://www.noon.com/egypt-en/just-chill-skin-cover-for-macbook-air-13-2018-2021-multicolour/N52287988A/p/?o=af28b8a1a98fb03a
Drawing Tablet Handwriting Pad Lcd Writing Board 8.5 Inchinch,"1,511",0.0,No Image,No Image,Noon,fashion,https://www.noon.com/egypt-en/drawing-tablet-handwriting-pad-lcd-writing-board-8-5-inchinch/N53320620A/p/?o=a307177b4f6c604c
Clue Ribbed Round Neck Top,600,0.0,No Image,No Image,Noon,fashion,https://www.noon.com/egypt-en/ribbed-round-neck-top/ZE747A032900E488A791FZ/p/?o=ze747a032900e488a791fz-5
Elle Skin Cover For Macbook Pro Touch Bar 2016 Multicolour,257,0.0,No Image,No Image,Noon,fashion,https://www.noon.com/egypt-en/elle-skin-cover-for-macbook-pro-touch-bar-2016-multicolour/N52283144A/p/?o=c64648abb593407d
Fast Print Cubes Colorful Printed Laptop Sticker Multicolour,257,0.0,No Image,No Image,Noon,fashion,https://www.noon.com/egypt-en/cubes-colorful-printed-laptop-sticker-multicolour/N41063223A/p/?o=a4b68f5563fef81a
Sensitive Is The New Everything Skin Cover For Macbook Pro 16 (2019) Multicolour,257,0.0,No Image,No Image,Noon,fashion,https://www.noon.com/egypt-en/sensitive-is-the-new-everything-skin-cover-for-macbook-pro-16-2019-multicolour/N52296793A/p/?o=edb696576546bfec
Sardines Skin Cover For Macbook Air 11 Multicolour,257,0.0,No Image,No Image,Noon,fashion,https://www.noon.com/egypt-en/sardines-skin-cover-for-macbook-air-11-multicolour/N52275392A/p/?o=f8e0b7c0708c43df
TIMEX men Indiglo Chronograph Watch TW2R47600,"9,050",0.0,No Image,No Image,Noon,fashion,https://www.noon.com/egypt-en/men-indiglo-chronograph-watch-tw2r47600/N19627821A/p/?o=f19c20c88343f8bb
Baby Printed Bibs,180,0.0,No Image,No Image,Noon,fashion,https://www.noon.com/egypt-en/baby-printed-bibs/N52088806A/p/?o=c1a37ea3e6051deb
Michael Kors Women's Casual Analog Wrist Watch MK5879,"3,788",0.0,No Image,No Image,Noon,fashion,https://www.noon.com/egypt-en/women-s-casual-analog-wrist-watch-mk5879/N34448748A/p/?o=f3ad49b3d6cc7d5a
Skipping Jump Rope With Counter- Foam Handles,330,0.0,No Image,No Image,Noon,fashion,https://www.noon.com/egypt-en/skipping-jump-rope-with-counter-foam-handles/N53314565A/p/?o=e4803d26ed2d022a
Purple Lacquer Skin Cover For Macbook Air Pre 2018 Multicolour,196,0.0,No Image,No Image,Noon,fashion,https://www.noon.com/egypt-en/purple-lacquer-skin-cover-for-macbook-air-pre-2018-multicolour/N52131976A/p/?o=f603f16bff5bad1b
Fatah Bundle Of 6 Soft Cotton Socks For Baby Boys & Girls,206,0.0,No Image,No Image,Noon,fashion,https://www.noon.com/egypt-en/bundle-of-6-soft-cotton-socks-for-baby-boys-girls/Z41E760E3FF5158FB83BBZ/p/?o=z41e760e3ff5158fb83bbz-1
Carina Lounge Shirt with Drawstring Waist,715,5.01,No Image,No Image,Noon,fashion,https://www.noon.com/egypt-en/lounge-shirt-with-drawstring-waist/Z356E032B1E25169B513AZ/p/?o=z356e032b1e25169b513az-4
Black And White Tops Skin Cover For Laptop Multicolour,257,0.0,No Image,No Image,Noon,fashion,https://www.noon.com/egypt-en/black-and-white-tops-skin-cover-for-laptop-multicolour/N52285108A/p/?o=dbd3477415fa81ce
Carina Dropped Shoulder Lounge Shirt,660,0.0,No Image,No Image,Noon,fashion,https://www.noon.com/egypt-en/dropped-shoulder-lounge-shirt/ZD41F8353CEAEDC8E9212Z/p/?o=zd41f8353ceaedc8e9212z-4
Caesar Basic Sweatpants Black,266,4.19,No Image,No Image,Noon,fashion,https://www.noon.com/egypt-en/basic-sweatpants-black/N38958839V/p/?o=d523dbcd87c1517f
فتاه مجموعة من 5 شرابات قطن ناعمة غير مرئية للرجال,342,0.0,No Image,No Image,Noon,fashion,https://www.noon.com/egypt-en/5/ZCDD32A9C5F91F36539C5Z/p/?o=zcdd32a9c5f91f36539c5z-1
Bonzana Skin Cover For Macbook Pro Touch Bar 2016 Multicolour,257,0.0,No Image,No Image,Noon,fashion,https://www.noon.com/egypt-en/bonzana-skin-cover-for-macbook-pro-touch-bar-2016-multicolour/N52282926A/p/?o=e855d35c0d6d013d
Nocturnal Skin Cover For Macbook Air 13 Multicolour,257,0.0,No Image,No Image,Noon,fashion,https://www.noon.com/egypt-en/nocturnal-skin-cover-for-macbook-air-13-multicolour/N52133092A/p/?o=e75be4b593dea2fb
TOMMY HILFIGER Men's Water Resistant Chronograph Watch 1791695,"2,766",5.01,No Image,No Image,Noon,fashion,https://www.noon.com/egypt-en/men-s-water-resistant-chronograph-watch-1791695/N30386495A/p/?o=ca72e0904890dcce
Ice Cream Skin Cover For Macbook Air 13 (2017) Multicolour,257,0.0,No Image,No Image,Noon,fashion,https://www.noon.com/egypt-en/ice-cream-skin-cover-for-macbook-air-13-2017-multicolour/N52276445A/p/?o=ad8aa1360f532faf
Flower W Skin Cover For Macbook Pro Retina 15 (2015) Multicolour,257,0.0,No Image,No Image,Noon,fashion,https://www.noon.com/egypt-en/flower-w-skin-cover-for-macbook-pro-retina-15-2015-multicolour/N52291740A/p/?o=dc772ffe7d093afc
Fast Print Dark Background Lines Printed Laptop Sticker Multicolour,257,0.0,No Image,No Image,Noon,fashion,https://www.noon.com/egypt-en/dark-background-lines-printed-laptop-sticker-multicolour/N43625064A/p/?o=d8f253d53b0ef9fe
SKMEI Men's Fashion Outdoor Sports  Multifunction Alarm 5Bar Waterproof Digital Watch  1796,700,4.413,No Image,No Image,Noon,fashion,https://www.noon.com/egypt-en/men-s-fashion-outdoor-sports-multifunction-alarm-5bar-waterproof-digital-watch-1796/N52153618A/p/?o=c798150583f04f6f
Black BallPrinted Laptop Sticker 13.3 Inch Multicolor Multicolor,257,0.0,No Image,No Image,Noon,fashion,https://www.noon.com/egypt-en/black-ballprinted-laptop-sticker-13-3-inch-multicolor-multicolor/N41258701A/p/?o=a351179735467c9a
Multi Pants Hangers Rack For Closet Organization Stainless Steel S Shape Layer Clothes Hangers Black,330,0.0,No Image,No Image,Noon,fashion,https://www.noon.com/egypt-en/multi-pants-hangers-rack-for-closet-organization-stainless-steel-s-shape-layer-clothes-hangers-black/N53271589A/p/?o=aab2f7efcb6bf3cc
Carina High side - N lavender,259.99,3.811,No Image,No Image,Noon,fashion,https://www.noon.com/egypt-en/high-side-n-lavender/N46259807V/p/?o=cdd0c8ff6510fbcf
Carina Long Plain Shirt Dress,825,4.42,No Image,No Image,Noon,fashion,https://www.noon.com/egypt-en/long-plain-shirt-dress/ZB028B4F14FC0AA51CDB4Z/p/?o=zb028b4f14fc0aa51cdb4z-5
Caesar women sport t-shirt with half sleeves,185,4.25,No Image,No Image,Noon,fashion,https://www.noon.com/egypt-en/women-sport-t-shirt-with-half-sleeves/Z626B573DC0856428AE82Z/p/?o=z626b573dc0856428ae82z-1
FOSSIL women Stella Stainless Steel Analog Wrist Watch ES3049,"5,995",0.0,No Image,No Image,Noon,fashion,https://www.noon.com/egypt-en/women-stella-stainless-steel-analog-wrist-watch-es3049/N34265487A/p/?o=eb48bfdcfcb7219c
G-SHOCK Men's Analog/Digital Watch GA-110RG-1ADR,"11,920",4.115,No Image,No Image,Noon,fashion,https://www.noon.com/egypt-en/men-s-analog-digital-watch-ga-110rg-1adr/N11026170A/p/?o=eabf83b98e37bf7e
TOMMY HILFIGER Men's Stainless Steel Chronograph Wrist Watch 1791397,"3,199",4.249,No Image,No Image,Noon,fashion,https://www.noon.com/egypt-en/men-s-stainless-steel-chronograph-wrist-watch-1791397/N40583494A/p/?o=fad9f85365abd06c
Air Conditioning Cover 1.5 Horse Blue 816grams,190,3.89,No Image,No Image,Noon,fashion,https://www.noon.com/egypt-en/air-conditioning-cover-1-5-horse-blue-816grams/N51541470A/p/?o=b9f173c122f97eab
Fast Print Bmw Rear View Headlight Printed Laptop Skin Cover Multicolour,257,0.0,No Image,No Image,Noon,fashion,https://www.noon.com/egypt-en/bmw-rear-view-headlight-printed-laptop-skin-cover-multicolour/N43626428A/p/?o=e6f96b5970242d7f
Magic Hour Skin Cover For Macbook Multicolour,257,0.0,No Image,No Image,Noon,fashion,https://www.noon.com/egypt-en/magic-hour-skin-cover-for-macbook-multicolour/N52131368A/p/?o=df4d3b7b73242f5b
Coco Cocktail Skin Cover For Macbook Air 13 2018 2021 Multicolour,257,0.0,No Image,No Image,Noon,fashion,https://www.noon.com/egypt-en/coco-cocktail-skin-cover-for-macbook-air-13-2018-2021-multicolour/N52288082A/p/?o=fc666bb7c9737b1f
Bundle of Two baseball sport cap hat,229,3.842,No Image,No Image,Noon,fashion,https://www.noon.com/egypt-en/bundle-of-two-baseball-sport-cap-hat/ZF910E0B25F8FF9BF95EEZ/p/?o=zf910e0b25f8ff9bf95eez-1
Spoon Stainless Steel 6Pcs Silver,700,0.0,No Image,No Image,Noon,fashion,https://www.noon.com/egypt-en/spoon-stainless-steel-6pcs-silver/N53310147A/p/?o=aa5c7babf94330ac
Retro TV Stand Black,"2,916",5.01,No Image,No Image,Noon,fashion,https://www.noon.com/egypt-en/tv-stand-black/N44082989A/p/?o=d6337d10f640776e
Lulu Waiting By The Train Tracks Skin Cover For Macbook Multicolour,257,0.0,No Image,No Image,Noon,fashion,https://www.noon.com/egypt-en/lulu-waiting-by-the-train-tracks-skin-cover-for-macbook-multicolour/N52131645A/p/?o=a477b2e3c6798a5e
Lifestylish BN-58 Ballerina leather stylish flat - Black,375,3.725,No Image,No Image,Noon,fashion,https://www.noon.com/egypt-en/lifestylish-bn-58-ballerina-leather-stylish-flat-black/ZF2D8E21BCBF732D10B76Z/p/?o=zf2d8e21bcbf732d10b76z-1
Ducati Printed Coaster Multicolour 9x9cm,108,0.0,No Image,No Image,Noon,fashion,https://www.noon.com/egypt-en/ducati-printed-coaster-multicolour-9x9cm/N32973069A/p/?o=f380ae464395badf
GERRY WEBER EcoVero long sleeve blouse Multicolour,"4,900",0.0,No Image,No Image,Noon,fashion,https://www.noon.com/egypt-en/ecovero-long-sleeve-blouse-multicolour/N52483668V/p/?o=e853e176fc910d1d
Fast Print Bmw M3 E92 Printed Laptop Sleeve Multicolor,257,0.0,No Image,No Image,Noon,fashion,https://www.noon.com/egypt-en/bmw-m3-e92-printed-laptop-sleeve-multicolor/N43628647A/p/?o=b1f6af71cd8a832a
Wild Monkeys Skin Cover For Macbook Pro 13 2015 Multicolour,257,0.0,No Image,No Image,Noon,fashion,https://www.noon.com/egypt-en/wild-monkeys-skin-cover-for-macbook-pro-13-2015-multicolour/N52278272A/p/?o=e3ea10d1e74eb2ae
