Title,Price_EGP,Rating,Scraped_At
"Oraimo Watch 6 OSW-807 Smart Watch — 2.04″ Full Touch Display, Bluetooth 5.3 Calling, Heart Rate, SpO₂ & Stress Monitoring, 105+ Sports Modes, IP68 - Black",949.0,4.0,2026-03-15 23:46:43
"Redmi Watch 5 Active Smartwatch, 2.0 Inch LCD Display, 18 Day Battery, 140+ Sports Modes, Heart Rate and SPO₂ Tracking, 5ATM Waterproof, Calls, Fitness Tracker -Black|1 year manufacturer warranty",1617.0,4.4,2026-03-15 23:46:43
"Redmi Watch 5 Active Smartwatch, 2.0 Inch LCD Display, 18 Day Battery, 140+ Sports Modes, Heart Rate and SPO₂ Tracking, 5ATM Waterproof, Calls, Fitness Tracker, Silver|1 year manufacturer warranty",1766.0,4.4,2026-03-15 23:46:43
"Oraimo Watch 2R OSW-30 Smart Watch — 1.39″ HD Display, Bluetooth Calling, Heart Rate & SpO₂ Tracker, 120+ Sports Modes, IP68 Water Resistant - Black",999.0,4.0,2026-03-15 23:46:43
"Oraimo Watch 4 Plus OSW-801 Smart Watch — 2.01″ Full Touch Display, Bluetooth Calling, Heart Rate & SpO₂ Monitoring, 100+ Sports Modes, 7-Day Battery, IP68 - Black",949.0,4.0,2026-03-15 23:46:43
"HUAWEI Band 10 Smart Watch, Metallic Design and Comfortable Wearing, Pro-level Sleep Analysis, Emotional Health Aid, 100 Workout Modes, Robust Battery Life, IOS and Android, Pink",2199.0,4.5,2026-03-15 23:46:43
"CMF Watch Pro 2 Smartwatch for Men Women, Fitness Tracker with Heart Rate, SpO₂ Monitoring,120 Sports Model, Bluetooth Calls with AI Noise Reduction, IP68 Waterproof with GPS for Android IOS Dark Grey",2540.0,4.3,2026-03-15 23:46:43
"Oraimo Smart Watch 5 Lite (OSW-804), 2.01"" HD Full Touch Screen IP68, Normal Usage Time 7 days Standby Time More than 28 days, Antibacterial Eartips – Black (12 Months Warranty)",884.0,4.2,2026-03-15 23:46:43
"Amazfit Pop 3R Amoled Display Smartwatch, Black|1 year manufacturer warranty 064",1966.66,3.9,2026-03-15 23:46:43
"Xiaomi Redmi Watch 5 Lite Black features a 1.96"" AMOLED display, built-in GPS, Bluetooth calling, advanced health & workout tracking, and 18-day battery life | 1-year manufacturer warranty.",2252.2,4.4,2026-03-15 23:46:43
"Xiaomi Redmi Watch 5 Lite Light Gold features a 1.96"" AMOLED display, built-in GPS, Bluetooth calling, advanced health & workout tracking, and 18-day battery life | 1-year manufacturer warranty.",2161.75,4.4,2026-03-15 23:46:43
"CMF by Nothing Watch Pro, 1.96"" AMOLED Smartwatch, Bluetooth Calling, Fitness Tracking, Multi-Sport Modes, Ash Gray",1939.03,4.0,2026-03-15 23:46:43
"JOYROOM JR-FC2 Pro 350 mAh 48mm, Smartwatch for Men & Women with Bluetooth Make/Answer Calls Fitness Modes and Sleep Modes Multi-app Message Reminder and languages Arabic, English and other, Grey",1399.5,5.0,2026-03-15 23:46:43
"HUAWEI WATCH FIT 4 Smart Watch, 1.82"" Display, 100+ Sports modes, Fitness & Health Tracker, Emotional Wellbeing Assistant, up to 10-Day Battery Life, iOS & Android Compatible, White",5499.0,4.5,2026-03-15 23:46:43
"Generic X8 Plus Ultra Smartwatch: Modern, Heart Rate Monitor, 2.1 inches, Blue",640.0,3.5,2026-03-15 23:46:43
"ADHOMAX New X8 Ultra max smart watch 2.2"" HD Display, Fitness Tracker, Calls, Music, SpO2, Weather, Calender, Wireless Charging, wearfitpro app IOS, android for men, women (black + white Strap)",599.0,4.1,2026-03-15 23:46:43
"Curve Smart Watch for Women Men, 1.43"" AMOLED Smartwatch with Bluetooth Calling Heart Rate/Blood Oxygen/Sleep/Stress Monitoring 178+ Sports Modes IP68 Waterproof (Black)",1999.0,4.2,2026-03-15 23:46:43
HainoTeko HainoTeko12 Waterproof Smartwatch With Builtin Wireless Earbuds Large Screen AMOLED Display 3 Pair Straps and Charging Cable Designed for Mens Black,2250.0,4.0,2026-03-15 23:46:43
"Mibro Smartwatch Lite 3, HD Vivid Display 1.3-inch AMOLED,100+ sports modes,Hands-free wrist calling feature, Bluetooth V5.3, PPG Heart Rate/Sp02 Sensor/Accelerometer, Dark Gray - 12 Months Warranty",2105.0,4.2,2026-03-15 23:46:43
"Oraimo Watch 5 (OSW-805) Smartwatch with Bluetooth Calling, 2.01"" HD Display, 24/7 Health Monitor (Heart Rate, SpO2), 100+ Sports Modes, 7-Day Battery, 1ATM Waterproof - Sunset Pink",0.0,5.0,2026-03-15 23:46:43
"ConnectME SP8 Ultra Max Smart Watch, 49 mm Screen Size, Orange",647.0,3.1,2026-03-15 23:46:43
"AGPTEK Smart Watch for Women, 1.3'' Full Touch Fitness LW11 Watch with Female Health Tracking, Heart Rate Monitor, IP68 Waterproof Outdoor Sports Smartwatch for Android iOS Phones",2223.0,4.2,2026-03-15 23:46:43
"CMF Watch Pro 2 Smartwatch for Men Women, Fitness Tracker with Heart Rate, SPO₂ Monitoring,120 Sports Model, Bluetooth Calls with AI Noise Reduction, IP68 Waterproof with GPS for Android iOS Orange",2379.0,4.3,2026-03-15 23:46:43
"Samsung Galaxy Fit3 Smartwatch, Exercise and Sleep Tracking, Fall Detection, Bluetooth, 40mm, Gray",0.0,4.3,2026-03-15 23:46:43
"Honor MagicWatch 2 Smartwatch, 14 Day Battery Life, 15 Fitness Modes, SpO2 Monitor, Swimming Heart Rate Monitor, Stress Sleep Tracking, Bluetooth Call, 46mm, Charcoal Black",4250.0,4.5,2026-03-15 23:46:43
"Joyroom JR-FT5 Fit-Life Series Smart Watch, Bluetooth Calling Smartwatch, 1.83″ HD Display, Advanced Health Monitoring, 80+ Sports Modes, IP68 Waterproof, Rose Gold | 12-Month Warranty",1850.0,3.6,2026-03-15 23:46:43
"HUAWEI WATCH FIT 3 Smartwatch, 1.82"" AMOLED Display, Ultra-Slim Design, All-Round Fitness Management, Comprehensive Health Management, Durable Battery Life, Compatible with iOS & Android, Black",4777.77,4.6,2026-03-15 23:46:43
"CMF by Nothing Watch Pro 2, 1.96"" Ultra-Clear AMOLED Smartwatch, Advanced Health Monitoring, AI Features, Dark Grey",2683.16,4.2,2026-03-15 23:46:43
"Xiaomi Band 9 Active Smartwatch, 18 Days of Continuous Use, 1.47"" TFT Display, 24-Hour Health, Enhanced Chip, Interchangeable Frame, Compatible with iPhone & Android Black|1 year manufacturer warranty",1369.0,4.1,2026-03-15 23:46:43
"Amazfit Pop 3S Amoled Display Smartwatch, Black/Silver|1 year manufacturer warranty 095",2129.0,3.9,2026-03-15 23:46:43
"Itel Smartwatch Edge R1 Pro (ISW-O43) designed for fitness enthusiasts, professionals, and adventurers. 1.43-inch AMOLED HD display, 466x466 resolution, IP68,12 Months Warranty, Shine Gold",1599.0,4.8,2026-03-15 23:46:43
"MERV X10 Series10 Multifunctional Sports Smartwatch, 46MM, Super AMOLED Display (Black)",699.0,3.2,2026-03-15 23:46:43
"Haino Teko 25 Waterproof Smart Watch with AMOLED Display, 3 Interchangeable Straps, Voice Assistant, Charging Cable, Designed for Men - Black - (Black)",1870.0,3.5,2026-03-15 23:46:43
ME17 Ultra 3 Smart Watch 2.21 Inch Large Screen Touch Screen Support Heart Rate Pressure Sleep Monitor with 2 Straps and Magnetic Charger (Orange),425.0,4.0,2026-03-15 23:46:43
Generic T800 Ultra NFC Smart Watch Bluetooth Call Wireless Charging Sport Smartwatch (Orange),320.38,2.4,2026-03-15 23:46:43
"Smart Watches for Women(Answer/Make Call),1.19"" AMOLED Fitness Watch, Heart Rate Sleep Blood Pressure Monitor, IP68 Waterproof,100+ Sports Modes Fitness Tracker Smartwatch for iOS Android -Rose Gold",3150.0,4.1,2026-03-15 23:46:43
"itel ICON-2 Smartwatch with BT Calling, 1.83"" HD Display, 550 nits Peak Brightness, Functional Crown, IP68, 150+ Watch Faces, 24Hr Health Monitor and Voice Assistant (Black)",890.0,3.8,2026-03-15 23:46:43
Generic T1000 Ultra NFC Smart Watch Bluetooth Call Wireless Charging Sport Smartwatch (Black),328.0,2.6,2026-03-15 23:46:43
"HONOR Band 10 Smartwatch, 1.57"" AMOLED Display, Lightweight Dual-Curve Design, 96 Workout Modes, Daily Health Snapshot, Bluetooth, Black | 1 year manufacturer warranty",2199.0,5.0,2026-03-15 23:46:43
"CMF Watch 3 Pro Smart Watch for Men Women, Bluetooth Call AI Smartwatch with Energy Score, Heart Rate Tracking, Sleep Monitor, GPS & 130+ Sport Modes, Fitness Tracker for Android iOS, IP68 Green",4269.0,4.3,2026-03-15 23:46:43
"SKMEI Men's Digital Sports Watch 50m Waterproof LED Military Multifunction Smart Watch Stopwatch Countdown Auto Date Alarm - 1251, Black, Strap",449.0,4.1,2026-03-15 23:46:43
"AGPTEK Smart Watch for Men, 1.3'' Full Touch Fitness LW11 Watch with Heart Rate Monitor, DIY Watch Face, Message Notification, IP68 Waterproof Outdoor Sports Smartwatch for Android iOS Phones, Black",3300.0,4.0,2026-03-15 23:46:43
"Mibro Smartwatch C4,Up to 10 days of daily use, 45 days in basic mode, 5 hours of music playback,6 hours of Bluetooth calls, App message push,Incoming call push,Silver - 12 Months warranty",1741.15,4.4,2026-03-15 23:46:43
Smart Watch X9 PRO 2 With Super-AMOLED Display supports Chat GPT/NFC/Calls Anser - Color (Gold),899.0,4.2,2026-03-15 23:46:43
Oraimo OSW-820 Smart Watch 5R Premium Smartwatch Sleek and Robust for Active Lifestyles - Black,1725.0,3.6,2026-03-15 23:46:43
"Efolen Smart Watches for Women with Diamonds (Answer/Make Call), 1.57'' Bluetooth Smartwatch for Android iOS Phones, Waterproof Fitness Watch with Heart Rate/AI Voice for Women(Silver)",3499.0,4.0,2026-03-15 23:46:43
Joyroom JR-FT5 Fit-Life series Waterproof IP68 Smartwatch With Answer/Make Call - Black,1119.8,3.5,2026-03-15 23:46:43
"Spirit 2 Smart Watch (Answer/Make Calls), 1.39"" HD Touch Screen Smartwatch for Men Women Fitness Tracker with 100+ Sport Modes/Heart Rate/Blood Oxygen/Sleep Monitor IP68 Waterproof (Black)",1444.0,0.0,2026-03-15 23:46:43
