name,price,rating,image_url,image_path,category,source
Amanda Milano Luminous Finish Face Loose Powder 2 Beige,350,4.436,No Image,No Image,beauty & makeup,Noon
REAL TECHNIQUES Synthetic-Bristles-Application Gold,155,5.02,No Image,No Image,beauty & makeup,Noon
Amanda Milano Diva Deep Black Matte Dip Liner,189,4.415,No Image,No Image,beauty & makeup,Noon
"face care set Feather 3 Piece Ladies Razor For Facial And Body Hair Yellow/Pink/Purple + Multifunction Facial Stirring Brush, Soft Silicone Mask Brush, Cosmetics Tools, Face Clean Brush, Face Mask Tools, Double Head Silicone Face Mask Brush random color s6",300,0.0,No Image,No Image,beauty & makeup,Noon
Shein 24pcs Nails Short French Beautify And CharmYourself,199.99,2.17,No Image,No Image,beauty & makeup,Noon
Shein Multi-purpose makeup bag,270,4.62,No Image,No Image,beauty & makeup,Noon
Foolzy 4 Drawers Cosmetic Jewellery Organizer Box With Removable Mirror Clear,375,3.5103,No Image,No Image,beauty & makeup,Noon
Facial Body Flawless Shaver  Hair Remover Face Hair Remover Trimmer Rose/White,130,2.26,No Image,No Image,beauty & makeup,Noon
mala beauty Matte Lipstick 06,395,4.2143,No Image,No Image,beauty & makeup,Noon
LA ROCHE-POSAY Effaclar Micellar Water Clear,591,4.563,https://f.nooncdn.com/p/v1559907942/N13707557A_1.jpg?width=800,product_images/LA ROCHEPOSAY Effaclar Micellar Water Clear.jpg,beauty & makeup,Noon
SHEGLAM Fairy Wand Precision Highlighter Pen - Cloud White,249,3.77,https://f.nooncdn.com/p/pnsku/N70044904V/45/_/1707363177/c0701752-4cd7-41a6-b262-c7e5f0acc1ff.jpg?width=800,product_images/SHEGLAM Fairy Wand Precision Highlighter Pen  Clou.jpg,beauty & makeup,Noon
ROSE BERRY RoseBerry Long Lasting Waterproof Eyeliner Pencil - 104 ( Dark Blue ),79,4.2302,https://f.nooncdn.com/p/pzsku/Z801AAD9F9CEDB72B363FZ/45/1751867628/1c36cad5-6ecd-4645-904a-b902ed476d1c.jpg?width=800,product_images/ROSE BERRY RoseBerry Long Lasting Waterproof Eyeli.jpg,beauty & makeup,Noon
Rock Pow 15-Piece Vol. 1 Face And Eye Makeup Brush Set Brown/Rose Gold/Black,260,3.911,https://f.nooncdn.com/p/v1665819257/N53357668A_1.jpg?width=800,product_images/Rock Pow 15Piece Vol 1 Face And Eye Makeup Brush S.jpg,beauty & makeup,Noon
"2-Tier 360° Rotating Acrylic Makeup and Perfume Organizer with Large Capacity – Clear Luxury Cosmetic Storage Stand for Skincare Products, Beauty Essentials, Creams, Serums, Makeup Tools and Perfumes for Vanity, Bedroom and Bathroom",295,3.7498,https://f.nooncdn.com/p/a4690c11c34e53b684932aa3972b5b43|pzsku/ZEBF132D07CA64E391D5AZ/45/1770037727/6ec06d5b-754d-4d62-8db4-6e902b275061.jpg?width=800,product_images/2Tier 360 Rotating Acrylic Makeup and Perfume Orga.jpg,beauty & makeup,Noon
مبراة أقلام مكياج بمخرجين مبراة ذات شفرة مزدوجة لأقلام تحديد العيون، وأقلام الشفاه، وأقلام التجميل (لون عشوائي),90,0.0,https://f.nooncdn.com/p/pzsku/ZDEFE798E86227903B3A5Z/45/1747824956/1c5e5ad2-58ef-4741-982b-8c0f7f675d77.jpg?width=800,product_images/مبراة أقلام مكياج بمخرجين مبراة ذات شفرة مزدوجة لأ.jpg,beauty & makeup,Noon
BOURJOIS PARIS Little Round Pot Blusher 2.5 g 34 Rose D'or,525,4.2310,https://f.nooncdn.com/p/pnsku/N20426146A/45/_/1758808115/916624e1-3fa4-4e3a-b45a-32d2472b10ba.jpg?width=800,product_images/BOURJOIS PARIS Little Round Pot Blusher 25 g 34 Ro.jpg,beauty & makeup,Noon
SHEGLAM Glam 101 Sheer Tinted Lipstick & Liner Duo-Cherry Glaze CherryGlaze,298.95,4.111,https://f.nooncdn.com/p/pnsku/N70108758V/45/_/1725957186/be42a755-ef75-4f91-9789-17354e32f4c7.jpg?width=800,product_images/SHEGLAM Glam 101 Sheer Tinted Lipstick  Liner DuoC.jpg,beauty & makeup,Noon
Maybelline New York Fit Me Matte + Poreless – 112 Soft Beige,400,4.4510,https://f.nooncdn.com/p/pnsku/N29782173A/45/_/1751032027/7518a2db-123e-46a5-9dd2-5a31b2c36da1.jpg?width=800,product_images/Maybelline New York Fit Me Matte  Poreless  112 So.jpg,beauty & makeup,Noon
ROSE BERRY Brown Mascara for Natural & Perfect Look,160,4.326,https://f.nooncdn.com/p/pzsku/ZEEA0D238237E020A3081Z/45/1756626032/a905b533-ac9e-4272-8c02-8543ef05f66f.jpg?width=800,product_images/ROSE BERRY Brown Mascara for Natural  Perfect Look.jpg,beauty & makeup,Noon
Rose gold Ultra HD foundation NO :103,169,4.03,https://f.nooncdn.com/p/c47607ebc2d15508a54e6c54177469a0|pzsku/Z87C52CE313601CC8AA47Z/45/1768770620/2667bd6e-548a-4da3-ad99-e15871842dd4.jpg?width=800,product_images/Rose gold Ultra HD foundation NO 103.jpg,beauty & makeup,Noon
topface Instyle Extreme Matte Lip Paint 013 Pink,256,3.514,https://f.nooncdn.com/p/pnsku/N70078634V/45/_/1716714112/afad7bcc-d329-4b3b-b098-9b1fd06ab650.jpg?width=800,product_images/topface Instyle Extreme Matte Lip Paint 013 Pink.jpg,beauty & makeup,Noon
Make-Up 12 Pcs Brushes Multicolour,250,1.03,https://f.nooncdn.com/p/v1635096232/N51547319A_1.jpg?width=800,product_images/MakeUp 12 Pcs Brushes Multicolour.jpg,beauty & makeup,Noon
Amanda Milano Fiber Extensions Mascara 01 Black,369,4.636,https://f.nooncdn.com/p/v1586513501/N36590965A_1.jpg?width=800,product_images/Amanda Milano Fiber Extensions Mascara 01 Black.jpg,beauty & makeup,Noon
"3 in 1 Curl Defining Brush, Curl Styling Brush, Reduce Pulling and Separating Curls, Curl Defining Brush, Shaping and Defining Curls Multicolor",109,0.0,https://f.nooncdn.com/p/pzsku/ZF4504554634964142FD3Z/45/1763269490/cbe0d360-1d51-42dd-855d-9578c12b1236.jpg?width=800,product_images/3 in 1 Curl Defining Brush Curl Styling Brush Redu.jpg,beauty & makeup,Noon
OPI Washable nail file,90,4.127,No Image,No Image,beauty & makeup,Noon
BG Micellar Water 200ml,229,5.05,No Image,No Image,beauty & makeup,Noon
360 Degree Rotating Makeup Organizer Clear,284,4.362,No Image,No Image,beauty & makeup,Noon
ROSE BERRY RoseBerry Long Lasting Waterproof Eyeliner Pencil -  110 ( pure blue ),79,4.2302,No Image,No Image,beauty & makeup,Noon
SHEGLAM Sun Sculpt Liquid Contour Maple Syrup,350,3.87,No Image,No Image,beauty & makeup,Noon
Menow New Lash Doubling Mascara Pro - 8.5ml,149.95,4.448,No Image,No Image,beauty & makeup,Noon
Energy Beauty Bar Face Massaging Pen Gold,148,4.05,No Image,No Image,beauty & makeup,Noon
SHEGLAM Good Grip Hydrating 45Ml Primer,429.95,4.2101,No Image,No Image,beauty & makeup,Noon
SHEGLAM Lip Facts Lip Liner-Solo Dance Solo Dance,299,2.53,No Image,No Image,beauty & makeup,Noon
MY-M Advance Liquid Blush - Berry Bloom (03),400,4.46,No Image,No Image,beauty & makeup,Noon
Catrice Glam & Doll Sensitive Volume Mascara 010 Ultra Black,288,3.840,No Image,No Image,beauty & makeup,Noon
مجموعة العناية بالوجه من Feather، ماكينة حلاقة نسائية مكونة من 3 قطع لشعر الوجه والجسم، أصفر/وردي/أرجواني + فرشاة متعددة الوظائف لتحريك الوجه، فرشاة قناع ناعمة من السيليكون، أدوات تجميل، فرشاة تنظيف الوجه، أدوات قناع الوجه، فرشاة قناع الوجه من السيليكون برأس مزدوج، لون عشوائي s4,300,0.0,No Image,No Image,beauty & makeup,Noon
L'OREAL PARIS 24H Infallible Tinted Serum Shade Medium 4-5,790,4.2215,No Image,No Image,beauty & makeup,Noon
SHEGLAM Good Grip Hydrating Primer - Blueberry+AHA multicolor,766.95,5.02,No Image,No Image,beauty & makeup,Noon
MAYBELLINE NEW YORK Color Sensational Matte Metallics Lipstick Copper Rose,85,3.820,No Image,No Image,beauty & makeup,Noon
CYBELE Rich Cream Lipstick Wild Berries 129,168.20,4.22,No Image,No Image,beauty & makeup,Noon
SHEGLAM Playing Cupid Cream Blush - No.Romance,639,0.0,No Image,No Image,beauty & makeup,Noon
"MAYBELLINE NEW YORK MAYBELLINE LIFTER PLUMP PLUMPING LIP GLOSS WITH CHILI PEPPER, INTENSE HYDRATION & LASTING PLUMP, 001 BLUSH BLAZE",549,4.2581,No Image,No Image,beauty & makeup,Noon
Creative Crystal Makeup Brush Storage Box Heart Gold,217,4.38,No Image,No Image,beauty & makeup,Noon
3D Face Massage Roller Silver 168grams,150,3.54,No Image,No Image,beauty & makeup,Noon
ESSENCE GOLD Lash Princess False Lash Effect Mascara Extreme Black | Dramatic Volume & Length | Smudge Proof Long Lasting | Volumizer & Extender for Bold Lashes (Pack of 1) Black,300,2.63,No Image,No Image,beauty & makeup,Noon
SHEIN-3D Rose Pattern Waterproof Temporary Tattoo Stickers,179.99,0.0,No Image,No Image,beauty & makeup,Noon
"Acrylic 2-Tier Stackable Organizer, Multi-Purpose Storage Shelf for Space Saving, Ideal for Cosmetics, Perfumes, Skincare and Kitchen Essentials, Modern Design for Bathroom, Kitchen and Countertop, Size 30×17 cm-Clear",295,3.7498,No Image,No Image,beauty & makeup,Noon
Oral-B Manual 1 2 3 Touthbrush MultiColor 100grams,149,4.25,No Image,No Image,beauty & makeup,Noon
sokany SK-923 Smart Dry Nail Dryer  with Gel Polish Lamps - 3-Speed IR Touch-Free,474,5.01,No Image,No Image,beauty & makeup,Noon
Crystal Round Makeup Brush Holder Silver,175.85,3.16,No Image,No Image,beauty & makeup,Noon
"3-piece clear acrylic makeup organizer set with lid for storing cotton pads, cleansing swabs, and cosmetic tools in a stylish and practical way.",210,4.519,No Image,No Image,beauty & makeup,Noon
360 Degree Octagon Shaped Rotating Cosmetic Organizer Clear,255,4.2109,https://f.nooncdn.com/p/v1621773315/N17075919A_1.jpg?width=800,product_images/360 Degree Octagon Shaped Rotating Cosmetic Organi.jpg,beauty & makeup,Noon
Catrice Plumping Lip Liner I Like To Mauve It 190,180,4.6132,https://f.nooncdn.com/p/pzsku/Z9A624426191B5B70B13CZ/45/_/1733208393/f246e328-fc69-437e-b19d-d25f0f3492e7.jpg?width=800,product_images/Catrice Plumping Lip Liner I Like To Mauve It 190.jpg,beauty & makeup,Noon
SHEGLAM Color Bloom Liquid Blush Petal Talk 5.2ml,320,4.546,https://f.nooncdn.com/p/pnsku/N70002624V/45/_/1695302201/79360eb3-63b4-4189-b058-d16939daaf02.jpg?width=800,product_images/SHEGLAM Color Bloom Liquid Blush Petal Talk 52ml.jpg,beauty & makeup,Noon
18 Color Long-Lasting Eye Shadow Multicolour,260,4.191,https://f.nooncdn.com/p/v1564494691/N28758562A_1.jpg?width=800,product_images/18 Color LongLasting Eye Shadow Multicolour.jpg,beauty & makeup,Noon
SHEGLAM Glow Bloom Liquid Highlighter-Bellini Brunch,334,4.459,https://f.nooncdn.com/p/pnsku/N70040917V/45/_/1717509800/ac16a12d-359a-4721-8370-172b99a34682.jpg?width=800,product_images/SHEGLAM Glow Bloom Liquid HighlighterBellini Brunc.jpg,beauty & makeup,Noon
pinkdose Base Maker Miracle Sponge Orange,280,4.57,https://f.nooncdn.com/p/v1610739303/N43672839A_1.jpg?width=800,product_images/pinkdose Base Maker Miracle Sponge Orange.jpg,beauty & makeup,Noon
Last Look Long-Lasting Glow Jelly Blush - Model 5003-04,99.95,4.86,https://f.nooncdn.com/p/pzsku/Z2E928C22EE8471CD0407Z/45/1755420556/415d8c31-da08-465d-a695-b5b43448ce19.jpg?width=800,product_images/Last Look LongLasting Glow Jelly Blush  Model 5003.jpg,beauty & makeup,Noon
Portable Eye Lashes Curling Clip Makeup Tool Silver,99,3.371,https://f.nooncdn.com/p/v1604153493/N41450811A_1.jpg?width=800,product_images/Portable Eye Lashes Curling Clip Makeup Tool Silve.jpg,beauty & makeup,Noon
CYBELE Desire Superstay Lipstick Caramel Nude 14,200,4.4250,https://f.nooncdn.com/p/pzsku/Z809C90BD0ED2C84F0B5DZ/45/_/1727174356/45460b97-2ded-4a99-b876-c1a3042d087a.jpg?width=800,product_images/CYBELE Desire Superstay Lipstick Caramel Nude 14.jpg,beauty & makeup,Noon
topface Longlasting Waterproof Dipliner Carbon Black + Stylo Kajal Eyeliner 007,219,0.0,https://f.nooncdn.com/p/pzsku/ZC18E3D9F023A9BB7D06EZ/45/1752691533/a3cefc35-010d-44fa-95d9-628bea251be1.jpg?width=800,product_images/topface Longlasting Waterproof Dipliner Carbon Bla.jpg,beauty & makeup,Noon
NOTE COSMETIQUE Loose Powder 02 Light Beige,500,4.913,https://f.nooncdn.com/p/pzsku/Z0D9DB7C658B531CB1D24Z/45/_/1735051196/b44d44ba-7e75-4e68-ac5b-f66d78eb2e4f.jpg?width=800,product_images/NOTE COSMETIQUE Loose Powder 02 Light Beige.jpg,beauty & makeup,Noon
Facial Hair Removal Epilator White/Rosegold,134,3.2916,https://f.nooncdn.com/p/v1608131963/N19780371A_1.jpg?width=800,product_images/Facial Hair Removal Epilator WhiteRosegold.jpg,beauty & makeup,Noon
mala beauty Matte Lipstick 08,395,4.2143,https://f.nooncdn.com/p/pzsku/Z6F5F6CABF6A7CCEECD6EZ/45/1756904272/d640b606-8591-412f-94a1-d15efe27b3e1.jpg?width=800,product_images/mala beauty Matte Lipstick 08.jpg,beauty & makeup,Noon
topface Longlasting Waterproof Dipliner Carbon Black,171,4.432,https://f.nooncdn.com/p/pnsku/N70078536V/45/_/1767607250/72b0d897-64a7-4024-aee7-acbe49ce94c7.jpg?width=800,product_images/topface Longlasting Waterproof Dipliner Carbon Bla.jpg,beauty & makeup,Noon
"Multi-use bags, three pieces of different sizes, and an organizer for makeup and creams, pink color",220,4.742,https://f.nooncdn.com/p/pzsku/Z4DFD0DE2DE8083C2154DZ/45/_/1714908868/cd4909e3-b901-4eae-bd60-fbb65665aea1.jpg?width=800,product_images/Multiuse bags three pieces of different sizes and .jpg,beauty & makeup,Noon
MAYBELLINE NEW YORK Fit Me Matte + Poreless Foundation Powder 105 Natural Ivory,461.75,4.337,https://f.nooncdn.com/p/v1561892768/N27137749A_1.jpg?width=800,product_images/MAYBELLINE NEW YORK Fit Me Matte  Poreless Foundat.jpg,beauty & makeup,Noon
4-Step Pedicure Paddle Brush Multicolor,69,5.01,https://f.nooncdn.com/p/v1610051425/N43406082A_1.jpg?width=800,product_images/4Step Pedicure Paddle Brush Multicolor.jpg,beauty & makeup,Noon
LANGMANNI Liquid Lip Stick &Lip Liner 2PCS Color 05,188,3.816,https://f.nooncdn.com/p/pzsku/ZCA107FC6610707A2956DZ/45/_/1736103915/f79ddc97-c083-4f85-89af-d851abde6aef.jpg?width=800,product_images/LANGMANNI Liquid Lip Stick Lip Liner 2PCS Color 05.jpg,beauty & makeup,Noon
flormar Semi-Matte Finish Cut-Tip Liquid Eye Pencil Black,377,4.27,https://f.nooncdn.com/p/pnsku/N70043595V/45/_/1706789677/5fed4e5a-7567-4959-9581-acae14e8c148.jpg?width=800,product_images/flormar SemiMatte Finish CutTip Liquid Eye Pencil .jpg,beauty & makeup,Noon
Rose Gold 5D LASH Mascara waterproof LASH EXTENSION EFFECT 13 ml,143,4.01,No Image,No Image,beauty & makeup,Noon
Makeup Brush Holder Gold,189,0.0,No Image,No Image,beauty & makeup,Noon
Skincare Micro-Needle Facial Body Roller,200,4.111,No Image,No Image,beauty & makeup,Noon
deoc BAYEB Pink Burst Tint,199,4.327,No Image,No Image,beauty & makeup,Noon
NOTE COSMETIQUE Baked Highlighter 01 Moonlight,406,3.69,No Image,No Image,beauty & makeup,Noon
Make-Up Organizer Clear/Black,338.95,3.889,No Image,No Image,beauty & makeup,Noon
CloverIsland 360 Degree Rotating Makeup Organizer Clear,245,4.2136,No Image,No Image,beauty & makeup,Noon
Catrice Glossin' Glow Tinted Lip Oil 070,324,4.515,No Image,No Image,beauty & makeup,Noon
Catrice Instant Bright Serum Concealer 020W,262,2.98,No Image,No Image,beauty & makeup,Noon
Large Makeup Remover Pad - Multicolor,85,5.01,No Image,No Image,beauty & makeup,Noon
Last Look Liquid Blush - 02,99.95,4.256,No Image,No Image,beauty & makeup,Noon
Makeup Cosmetic Beauty Sponge Blender Pink,140,0.0,No Image,No Image,beauty & makeup,Noon
ROSE BERRY Lip gloss marshmallow -02,170,3.928,No Image,No Image,beauty & makeup,Noon
Amanda Milano smart matt lip stick No.17,146,5.01,No Image,No Image,beauty & makeup,Noon
mala beauty Bronzing Powder Shade 1,490,4.215,No Image,No Image,beauty & makeup,Noon
4 in 1 Facial Mask Bowl Mixing Brush Spoon Set for Facial Skin Care and DIY Makeup for Girls Women (Assorted Colors),49,3.46,No Image,No Image,beauty & makeup,Noon
CYBELE Gel Lip Liner 04 Dusty Rose,209.10,4.5562,No Image,No Image,beauty & makeup,Noon
Luna Super Lasting Lipstick 7/11,168,4.037,No Image,No Image,beauty & makeup,Noon
Facial Cleansing Brush Pink,280,4.88,No Image,No Image,beauty & makeup,Noon
BOURJOIS PARIS Twist Extreme Fiber Mascara 8 ml 24 Black,271.70,4.0447,No Image,No Image,beauty & makeup,Noon
Wetell A Mini RazorSimplify Your Life Mini Carry -on 3Blades,99,0.0,No Image,No Image,beauty & makeup,Noon
kolagra makeup Foundation SPF30+ Light,219,3.947,No Image,No Image,beauty & makeup,Noon
Lameila Nude Eyeshadow Palette Multicolour,234,4.01,No Image,No Image,beauty & makeup,Noon
NOTE COSMETIQUE Baked Blusher 01 Pleasure,428,3.217,No Image,No Image,beauty & makeup,Noon
"Colored artificial nails, 72 pieces, 3 shades",150,5.01,No Image,No Image,beauty & makeup,Noon
"ROSE BERRY Long Lasting Eyeliner Pencil (Brown), Semi Matte Brown",105,4.2154,No Image,No Image,beauty & makeup,Noon
Makeup Blending Brush,550,0.0,https://f.nooncdn.com/p/pzsku/Z46192FBF8D85493729F3Z/45/_/1721647825/7ba48817-6fda-41f6-a60d-7b131d395103.jpg?width=800,product_images/Makeup Blending Brush.jpg,beauty & makeup,Noon
Essence Lash Princess False Lash Effect Mascara Purple,234,4.04,https://f.nooncdn.com/p/pnsku/N70248743V/45/_/1760691389/30efd5f0-9945-449d-9538-c03d29c55d10.jpg?width=800,product_images/Essence Lash Princess False Lash Effect Mascara Pu.jpg,beauty & makeup,Noon
East Lady Make Up Brush Organizer Gold,154.95,3.47,https://f.nooncdn.com/p/v1616671919/N44690051A_1.jpg?width=800,product_images/East Lady Make Up Brush Organizer Gold.jpg,beauty & makeup,Noon
SHEGLAM Color Bloom Liquid Blush  5.2ml On Point,405,4.539,https://f.nooncdn.com/p/pnsku/N70045896V/45/_/1708094228/7d4d9c7d-15b4-4256-aac0-e5115ce3386e.jpg?width=800,product_images/SHEGLAM Color Bloom Liquid Blush  52ml On Point.jpg,beauty & makeup,Noon
SHEGLAM Good Grip Glow Illuminating Primer gold,550,3.73,https://f.nooncdn.com/p/pnsku/N70256474V/45/_/1762419728/12cd672a-fbab-4e8a-99d8-bfdc41f61d37.jpg?width=800,product_images/SHEGLAM Good Grip Glow Illuminating Primer gold.jpg,beauty & makeup,Noon
"Monaya Creamy Lipstick Hydrating Lipstick– Creamy Satin Color, Smooth & Moisturizing Formula, Long-Lasting Lip Color for Soft & Supple Lips L010-L302",159,3.851,https://f.nooncdn.com/p/pzsku/ZB2682981D12C027D34D8Z/45/_/1772963351/6d07343e-830b-4256-befe-0317a2b39f32.jpg?width=800,product_images/Monaya Creamy Lipstick Hydrating Lipstick Creamy S.jpg,beauty & makeup,Noon
"L'OREAL PARIS L’Oréal Paris Plump Ambition Hyaluron Lip Oil, Plumping Lip Oil With Hyaluronic Acid and Tripeptides for 24H Hydrated Lip, 5ml, La Nuit Sparkle 510",628,4.624,https://f.nooncdn.com/p/pzsku/Z54CBA9A446FC66DB8B2CZ/45/1748254696/b2c8a5f4-5a44-46c8-ab05-2e2200a1f27d.jpg?width=800,product_images/LOREAL PARIS LOréal Paris Plump Ambition Hyaluron .jpg,beauty & makeup,Noon
Sharpener Used AllTools Mekaup - Durable Makeup Tool Sharpener 1PC may vary color,120,0.0,https://f.nooncdn.com/p/pzsku/Z601F7989DC4819C3E46DZ/45/1764440357/a37fce5a-09ea-4cd0-9134-c2955e75ada4.jpg?width=800,product_images/Sharpener Used AllTools Mekaup  Durable Makeup Too.jpg,beauty & makeup,Noon
"MAYBELLINE NEW YORK MAYBELLINE LIFTER PLUMP PLUMPING LIP GLOSS WITH CHILI PEPPER, INTENSE HYDRATION & LASTING PLUMP, 003 PINK STING",499,4.2581,https://f.nooncdn.com/p/pzsku/Z30EFDE1A29CA06ADEDC8Z/45/1753107279/3e690e0a-b48c-457d-b12a-aff3e1fe7209.jpg?width=800,product_images/MAYBELLINE NEW YORK MAYBELLINE LIFTER PLUMP PLUMPI.jpg,beauty & makeup,Noon
5-In-1 Beauty Care Massager Pink,125,0.0,https://f.nooncdn.com/p/v1569329733/N30105582A_1.jpg?width=800,product_images/5In1 Beauty Care Massager Pink.jpg,beauty & makeup,Noon
flormar Highly Pigmented & Matte Finish Waterproof Lipliner Pencil 211 Classical Brown,216,3.961,https://f.nooncdn.com/p/pnsku/N70043599V/45/_/1767607878/a5e2bb4c-dcbf-48e0-84fa-f865db0e4926.jpg?width=800,product_images/flormar Highly Pigmented  Matte Finish Waterproof .jpg,beauty & makeup,Noon
3-Piece Massage Bath Brush Multicolour 5.7cm,160,0.0,https://f.nooncdn.com/p/v1617786749/N46345142A_1.jpg?width=800,product_images/3Piece Massage Bath Brush Multicolour 57cm.jpg,beauty & makeup,Noon
Shein Pink square shaped artificial nails 24PCS,120,2.16,https://f.nooncdn.com/p/pzsku/Z3BEA05599733D289B410Z/45/1749555590/3e55f58d-4302-4567-bc49-baef1c845cb7.jpg?width=800,product_images/Shein Pink square shaped artificial nails 24PCS.jpg,beauty & makeup,Noon
BH Cosmetics Lavish Elegance15 Piece Makeup Brush Set with Bag,299.95,3.74,https://f.nooncdn.com/p/pzsku/Z3FA8D815139FAA52A444Z/45/1768064135/ebfa2d0f-c016-4436-b043-d6d86ac6c720.jpg?width=800,product_images/BH Cosmetics Lavish Elegance15 Piece Makeup Brush .jpg,beauty & makeup,Noon
schick 2+1 Double-hair removal razors with aloe vera lubricating strip,210,2.23,https://f.nooncdn.com/p/pzsku/Z1053F91DFB994745B150Z/45/_/1739701730/8d61dac2-f6b3-4046-8565-f0be31d18f57.jpg?width=800,product_images/schick 21 Doublehair removal razors with aloe vera.jpg,beauty & makeup,Noon
CYBELE Desire Lipstick Pencil 02 Beige Rose,190,4.21,https://f.nooncdn.com/p/v1630598622/N50625446A_1.jpg?width=800,product_images/CYBELE Desire Lipstick Pencil 02 Beige Rose.jpg,beauty & makeup,Noon
set of false nail,89,4.01,https://f.nooncdn.com/p/pzsku/Z0C202FED0E1F87594341Z/45/1768248975/91ea792a-2662-4e22-8902-fa7015fe5db1.jpg?width=800,product_images/set of false nail.jpg,beauty & makeup,Noon
ROSE BERRY Bold Booster Plumping Lip Liner – Long Lasting Matte Finish – Precise Definition & Fuller Look - 119,150,3.9117,https://f.nooncdn.com/p/pzsku/ZCA84B6487299D8D4BF72Z/45/_/1771722136/c8994924-32e6-4ee0-a9a8-10a2183dd289.jpg?width=800,product_images/ROSE BERRY Bold Booster Plumping Lip Liner  Long L.jpg,beauty & makeup,Noon
Emilia Cosmetics Barbie Lip Gloss - Tube,260,3.53,https://f.nooncdn.com/p/pzsku/Z8C0C5AA624ADFB9F70FAZ/45/_/1722073649/5f837cf6-a981-416b-a097-d45b5c2a7ff8.jpg?width=800,product_images/Emilia Cosmetics Barbie Lip Gloss  Tube.jpg,beauty & makeup,Noon
LA Girl Fanatic Blush Palette Island Hottie,415,4.239,https://f.nooncdn.com/p/v1616482285/N36538688A_1.jpg?width=800,product_images/LA Girl Fanatic Blush Palette Island Hottie.jpg,beauty & makeup,Noon
SHEGLAM Love Dive Tender Heart Powder Blush- Coraldially Yours,399,4.44,No Image,No Image,beauty & makeup,Noon
Amanda Milano Nude Look Loose powder by Amanda - 2,390,2.45,No Image,No Image,beauty & makeup,Noon
ROSE BERRY Concealer & Blusher Cream Multicolour,290,3.990,No Image,No Image,beauty & makeup,Noon
TANAKO Aloe Vera Soothing Magic Lip Balm Green,45.25,4.0802,No Image,No Image,beauty & makeup,Noon
rose berry eyebrow shaping wax,245,3.54,No Image,No Image,beauty & makeup,Noon
flormar Dewy Lip Glaze Moisturizing Semi-Transparent Lip Gloss 4.5ml 026 Party Glow,325,4.24,No Image,No Image,beauty & makeup,Noon
Kokuryu Beauty Sponge Multicolour,95,3.79,No Image,No Image,beauty & makeup,Noon
"Hair Brush, Detangling Brush, Feather Shape Design Multi Color Lightweight Easy to Carry",49,0.0,No Image,No Image,beauty & makeup,Noon
viona 70-Piece Make-Up Cleaning Cotton Pads White,79.95,4.6126,No Image,No Image,beauty & makeup,Noon
قطعة واحدة من إسفنجة إزالة المكياج ملتنظيف الوجه والجسم الوان عشوائيه,59,4.419,No Image,No Image,beauty & makeup,Noon
Makeup Organizer With 4 Drawers Clear,440,3.415,No Image,No Image,beauty & makeup,Noon
MAC STUDIO FIX POWDER PLUS FOUNDATION NC20 NC20,420,3.3697,No Image,No Image,beauty & makeup,Noon
Facial Massage Jade Roller Green 100grams,120,3.73,No Image,No Image,beauty & makeup,Noon
"Might Cinema 2-in-1 Dual-Ended Blusher Stick - Creamy Matte & Shimmer Blush and Highlighter Stick for Cheeks, Velvet Touch Blendable Blusher with Moisturizing Beeswax, Castor Oil, and Vitamin E, Long-Lasting Face Makeup, Portable Cosmetic Stick for Daily Use and Travel, Highlighting Cheekbones, All Skin Tones Friendly",185,4.02,No Image,No Image,beauty & makeup,Noon
Trina Facial Hair Removal Blades For Women 2 Pieces,217,0.0,No Image,No Image,beauty & makeup,Noon
360 Rotating Makeup Organizer Adjustable Cosmetic Storage Display Case Large Capacity Cosmetic Shelf Acrylic Clear,249.99,4.259,No Image,No Image,beauty & makeup,Noon
"elf Cream Glide Lip Liner, Shape & Sculpt Lips, High-Pigment Pencil, Semi-Matte Finish, Spill The Tea Beige",999,0.0,No Image,No Image,beauty & makeup,Noon
Rose Berry Long-Lasting Blush Powder – 04 Cool Confident,260,4.02,No Image,No Image,beauty & makeup,Noon
SHEGLAM Real Flow Laminating Brow Pen-Chocolate.,260,4.02,No Image,No Image,beauty & makeup,Noon
5-In-1 Electric Face Cleansing Massage Brush Set White/Pink 13.5 x 10 x 3centimeter,149.80,3.240,No Image,No Image,beauty & makeup,Noon
LA Girl HD Pro Setting Powder Translucent,250,3.625,No Image,No Image,beauty & makeup,Noon
"REAL TECHNIQUES Set Of 6 Makeup Brush Set With 2 Sponge Blenders For Eyeshadow, Foundation, Blush And Concealer Multicolour",198,3.516,No Image,No Image,beauty & makeup,Noon
LA Girl Pro Conceal HD Concealer GC992 Green,206.30,3.81,No Image,No Image,beauty & makeup,Noon
Hair Styling Brush 1pc multicolor,95,4.242,No Image,No Image,beauty & makeup,Noon
Catrice Glam And Doll False Lashes Mascara 010 Black,347,4.3162,No Image,No Image,beauty & makeup,Noon
Rose Berry Loose Setting Powder 15g - 02,229.95,4.73,https://f.nooncdn.com/p/0801bdcc8f1e5696961ba041eff2207f|pzsku/Z10A5CC4B5CD32F6D43D1Z/45/1768521464/591490be-11ac-4b0b-a643-cb1c008b8044.jpg?width=800,product_images/Rose Berry Loose Setting Powder 15g  02.jpg,beauty & makeup,Noon
Helena Wood Pedicure File Light Brown 25x6centimeter,90,4.350,https://f.nooncdn.com/p/v1545118893/N19833516A_2.jpg?width=800,product_images/Helena Wood Pedicure File Light Brown 25x6centimet.jpg,beauty & makeup,Noon
SHEGLAM Face & Under Eye  PowdeR Natural Linen Natural Linen,545,4.815,https://f.nooncdn.com/p/pnsku/N70045147V/45/_/1707451258/3eb39638-acd1-49f7-9f06-7ad478dc6c15.jpg?width=800,product_images/SHEGLAM Face  Under Eye  PowdeR Natural Linen Natu.jpg,beauty & makeup,Noon
36 Piece Flexible Hair Roller Multicolour 25cm,290,3.05,https://f.nooncdn.com/p/v1596182614/N39557556A_1.jpg?width=800,product_images/36 Piece Flexible Hair Roller Multicolour 25cm.jpg,beauty & makeup,Noon
Rare Beauty Soft Pinch Luminous Powder Blush - Truth,"2,999",5.03,https://f.nooncdn.com/p/pzsku/ZEC1D8AE6170FFBA61BD7Z/45/_/1739374759/358f8ce0-e266-40e3-b0ab-ae95f2d305db.jpg?width=800,product_images/Rare Beauty Soft Pinch Luminous Powder Blush  Trut.jpg,beauty & makeup,Noon
