name,price,rating,image_url,image_path,category,source
general 360 Rotating Makeup Organizer Adjustable Cosmetic Storage Display Case Large Capacity Cosmetic Shelf Acrylic Clear,221.55,4.41,https://f.nooncdn.com/p/v1642439740/N52425133A_1.jpg?width=800,product_images/general 360 Rotating Makeup Organizer Adjustable C.jpg,beauty & makeup,Noon
CYBELE Extra Volume 3D Mascara 01 Dark black,278,4.43,https://f.nooncdn.com/p/pnsku/N30389060A/45/_/1740311870/3f84b76f-f634-4a7c-91b4-261c044156c6.jpg?width=800,product_images/CYBELE Extra Volume 3D Mascara 01 Dark black.jpg,beauty & makeup,Noon
REAL TECHNIQUES Everyday Essentials Multi Use Brush Set Multicolour,226.90,3.75,https://f.nooncdn.com/p/pnsku/N31489433A/45/_/1764242295/19624504-aee4-44af-8478-cd629679486a.jpg?width=800,product_images/REAL TECHNIQUES Everyday Essentials Multi Use Brus.jpg,beauty & makeup,Noon
Essence Extreme Shine Volume Lipgloss | Glazed Berry | High Shine Non Sticky Finish | Plumping Effect for Full Lips | Vegan Cruelty Free | Long Lasting Glossy Lip Colour (Pack of 1) Glazed Berry,225.35,4.6597,https://f.nooncdn.com/p/pnsku/N70131792V/45/_/1732852042/f1352b6c-006e-4ffe-b64b-6ec238fdbd12.jpg?width=800,product_images/Essence Extreme Shine Volume Lipgloss  Glazed Berr.jpg,beauty & makeup,Noon
MAYBELLINE NEW YORK MAYBELLINE LIFTER LINER 04 OUT OF LINE - Lip Liner Makeup with Hyaluronic Acid,336,4.61,https://f.nooncdn.com/p/pzsku/Z12DEE1CD579639F97ED6Z/45/_/1737277710/53179600-042b-4df1-953e-3f8ef8846659.jpg?width=800,product_images/MAYBELLINE NEW YORK MAYBELLINE LIFTER LINER 04 OUT.jpg,beauty & makeup,Noon
garnier Micellar Water Face Cleanser And Daily Makeup Remover Clear,253,4.57,https://f.nooncdn.com/p/pnsku/N11294362A/45/_/1770374400/38889d8e-0cc8-49a3-8c2f-f0fee4e0d8f1.jpg?width=800,product_images/garnier Micellar Water Face Cleanser And Daily Mak.jpg,beauty & makeup,Noon
flormar Waterproof Lipliner Pencil 244 Chocolate Fondue,185,4.540,https://f.nooncdn.com/p/pnsku/N38923101A/45/_/1767607926/1711fe96-1265-49f7-865e-a82bd5b11e74.jpg?width=800,product_images/flormar Waterproof Lipliner Pencil 244 Chocolate F.jpg,beauty & makeup,Noon
Essence Extreme Shine Volume Lip Gloss | 01 Crystal Clear | Natural Shine | Plumping Effect | Moisturising & Volumizing Lip Gloss for Adults Crystal Clear,268,4.61,https://f.nooncdn.com/p/pnsku/N51100195A/45/_/1767607769/3e294149-f7ef-47a4-8a09-6b0aafcf9879.jpg?width=800,product_images/Essence Extreme Shine Volume Lip Gloss  01 Crystal.jpg,beauty & makeup,Noon
SEPHORA black Eye Liner Kohl and 12 hour permanent,100,4.11,https://f.nooncdn.com/p/pzsku/Z4232DA071ACEC8F9D142Z/45/1748644221/4fef3853-fd95-4e29-b639-f8aad28ff1c2.jpg?width=800,product_images/SEPHORA black Eye Liner Kohl and 12 hour permanent.jpg,beauty & makeup,Noon
garnier SkinActive Micellar Cleansing Water All in One- Clear 100 ml,93,4.57,https://f.nooncdn.com/p/pnsku/N16546877A/45/_/1719935252/1140087b-6e21-421a-b273-bb27e944b1f3.jpg?width=800,product_images/garnier SkinActive Micellar Cleansing Water All in.jpg,beauty & makeup,Noon
Essence Long Lasting Eye Pencil | 02 Hot Chocolate | Waterproof & Smudgeproof Eyeliner | Soft Creamy Texture for Smooth Application | Bold Defined Look | Up to 18H Stay | Easy Twist Pencil | 0.28g 02 Hot Chocolate,136,4.1558,https://f.nooncdn.com/p/pnsku/N11031377A/45/_/1767607752/07adba19-b65e-41dc-8a6d-53ab0b3170e2.jpg?width=800,product_images/Essence Long Lasting Eye Pencil  02 Hot Chocolate .jpg,beauty & makeup,Noon
SHEGLAM Lip Rules Liner & Gloss Pen Play Fair,280.05,4.5408,https://f.nooncdn.com/p/pnsku/N70102494V/45/_/1724308363/9553b58e-752d-4cb4-9dba-b8e9c7998912.jpg?width=800,product_images/SHEGLAM Lip Rules Liner  Gloss Pen Play Fair.jpg,beauty & makeup,Noon
Essence Lash Princess False Lash Effect Mascara Extreme Black | Dramatic Volume & Length | Smudge Proof Long Lasting | Volumizer & Extender for Bold Lashes (Pack of 1) Black,130,2.610,https://f.nooncdn.com/p/pnsku/N11031427A/45/_/1764242442/72c031d4-aba1-4695-abf3-a115ea7d4c95.jpg?width=800,product_images/Essence Lash Princess False Lash Effect Mascara Ex.jpg,beauty & makeup,Noon
"Shein Long Artificial Nails – 144 Pcs Set in 12 Colors, Easy to Wear & Apply",120,3.936,https://f.nooncdn.com/p/55546ae9badf544494d8797f9aa0c89d|pzsku/ZB77C8D06B8B822988802Z/45/1770473958/229e6f59-b08d-4791-a624-49de52ab708c.jpg?width=800,product_images/Shein Long Artificial Nails  144 Pcs Set in 12 Col.jpg,beauty & makeup,Noon
Maybelline New York Superstay Matte Ink Liquid Lipstick - 65 Seductress 65 Seductress,508,4.44,https://f.nooncdn.com/p/pnsku/N24089097A/45/_/1764242323/6124312a-0ebe-44f7-a0dc-b7872cbf3428.jpg?width=800,product_images/Maybelline New York Superstay Matte Ink Liquid Lip.jpg,beauty & makeup,Noon
ROSE BERRY Luxury Eyeliner Pencil - Black,94.40,4.52,https://f.nooncdn.com/p/v1607346452/N41534316A_1.jpg?width=800,product_images/ROSE BERRY Luxury Eyeliner Pencil  Black.jpg,beauty & makeup,Noon
MAYBELLINE NEW YORK Fit Me Eye Concealer Light 10,331,4.33,https://f.nooncdn.com/p/pnsku/N11031272A/45/_/1767607807/2df7cf28-4621-4241-a33a-d0e1c9f1282f.jpg?width=800,product_images/MAYBELLINE NEW YORK Fit Me Eye Concealer Light 10.jpg,beauty & makeup,Noon
LEAVES Whitening Micellar Water and Makeup Remover For oily Skin 200ml,153,4.3419,https://f.nooncdn.com/p/pzsku/Z6A51B35111A630462A82Z/45/1750080762/37348ca3-59ec-4e23-9032-57c522187220.jpg?width=800,product_images/LEAVES Whitening Micellar Water and Makeup Remover.jpg,beauty & makeup,Noon
BH Cosmetics Lavish Elegance 15 Piece Brush Set With Bag Multicolour,282.50,4.3886,https://f.nooncdn.com/p/v1647781781/N52924044A_1.jpg?width=800,product_images/BH Cosmetics Lavish Elegance 15 Piece Brush Set Wi.jpg,beauty & makeup,Noon
SHEGLAM 101 Love Cake Colorful Liquid Blush,299,4.3567,https://f.nooncdn.com/p/pnsku/N70040963V/45/_/1706104914/f5ccda10-f2ab-4f42-bd94-a759e5f6d0a2.jpg?width=800,product_images/SHEGLAM 101 Love Cake Colorful Liquid Blush.jpg,beauty & makeup,Noon
Fix 13-Piece Professional Makeup Brush Set Multicolour,120,3.1583,https://f.nooncdn.com/p/pzsku/Z36EC6D3DC308D7401298Z/45/1756763344/3bb6879a-dda8-48ac-b633-abaca4c3c11b.jpg?width=800,product_images/Fix 13Piece Professional Makeup Brush Set Multicol.jpg,beauty & makeup,Noon
"Garnier Skinactive Micellar Cleansing Water, with Salicylic Acid, For Acne Prone Skin 400ml",242,4.6535,https://f.nooncdn.com/p/pzsku/ZB2578C9DD192CE9C88EDZ/45/_/1721997280/63d999a4-5327-4910-bc82-05713af4bfc8.jpg?width=800,product_images/Garnier Skinactive Micellar Cleansing Water with S.jpg,beauty & makeup,Noon
Shein Short Solid Color False Nails Multicolour - 60 PCS,80,3.7213,https://f.nooncdn.com/p/pzsku/ZE60064048068FBF79FDBZ/45/_/1775726512/335961d2-47f6-41a4-8a89-0333028b572a.jpg?width=800,product_images/Shein Short Solid Color False Nails Multicolour  6.jpg,beauty & makeup,Noon
Capixy Lashes Treatment Serum,413,4.4974,https://f.nooncdn.com/p/pzsku/Z0629C9D8A2E67F6A427BZ/45/_/1698755945/f9d5ad32-450f-4c25-9e7d-0d5feaa00b73.jpg?width=800,product_images/Capixy Lashes Treatment Serum.jpg,beauty & makeup,Noon
AVON True Color Nourishing Lip Oils Blossom Shade Transparent,270.70,4.7891,https://f.nooncdn.com/p/pnsku/N70058602V/45/_/1767607769/dc02180d-0871-4de5-b8a4-6b8b775ff8d9.jpg?width=800,product_images/AVON True Color Nourishing Lip Oils Blossom Shade .jpg,beauty & makeup,Noon
MAYBELLINE NEW YORK Fit Me Eye Concealer Anti- Cernes- Sand 20,454,4.33,https://f.nooncdn.com/p/pnsku/N11031271A/45/_/1774447487/0d5fec2a-7a52-4c87-b7a5-c33f1b7d3131.jpg?width=800,product_images/MAYBELLINE NEW YORK Fit Me Eye Concealer Anti Cern.jpg,beauty & makeup,Noon
Maybelline New York Volum' Express The Colossal Washable Mascara - Black Black,244,4.12,https://f.nooncdn.com/p/pnsku/N13625792A/45/_/1767607682/ca23528c-ad73-4ce1-987b-aae1022c0df7.jpg?width=800,product_images/Maybelline New York Volum Express The Colossal Was.jpg,beauty & makeup,Noon
MAYBELLINE NEW YORK Super Stay Vinyl Ink Longwear Transfer Proof Liquid Matte Lipstick 35 Cheeky,510,4.45,https://f.nooncdn.com/p/pzsku/ZE1904C2A93B9AE1B7DB9Z/45/1765448746/36db8c16-092e-4b00-b0cc-803a5a2957e5.jpg?width=800,product_images/MAYBELLINE NEW YORK Super Stay Vinyl Ink Longwear .jpg,beauty & makeup,Noon
Elizabeth Helen Make-Up Fixer Spray Clear Vitamin-E - 150 Ml,352,4.5145,https://f.nooncdn.com/p/pzsku/Z467E607E12BF78CB7D22Z/45/1744884504/f04bbe99-adac-4879-9a7f-c3d9238c43e0.jpg?width=800,product_images/Elizabeth Helen MakeUp Fixer Spray Clear VitaminE .jpg,beauty & makeup,Noon
ROSE BERRY Translucent Loose Setting Powder,167.80,4.382,https://f.nooncdn.com/p/v1643890760/N52532806A_1.jpg?width=800,product_images/ROSE BERRY Translucent Loose Setting Powder.jpg,beauty & makeup,Noon
MAYBELLINE NEW YORK Lash Sensational Full Fan Effect Mascara-04 Intense Black Intense Black,348,4.41,https://f.nooncdn.com/p/pnsku/N13625782A/45/_/1764173554/2af8a483-0d22-4822-8e9b-72b08036cf03.jpg?width=800,product_images/MAYBELLINE NEW YORK Lash Sensational Full Fan Effe.jpg,beauty & makeup,Noon
viona 70-Piece Make-Up Remover Cotton Pads White,80,4.4456,https://f.nooncdn.com/p/pnsku/N43367038A/45/_/1764242335/3e35696d-8f3e-4968-ad36-e6dabdcc557e.jpg?width=800,product_images/viona 70Piece MakeUp Remover Cotton Pads White.jpg,beauty & makeup,Noon
Eva Care Acetone Nail Polish Remover Fragrance Free Multicolor,50,4.4294,https://f.nooncdn.com/p/pnsku/N22225784A/45/_/1767608025/037c69f8-219b-4ec7-ad70-d97f064898f2.jpg?width=800,product_images/Eva Care Acetone Nail Polish Remover Fragrance Fre.jpg,beauty & makeup,Noon
Maybelline New York Lifter Gloss Lip Gloss-  008 Stone 008 Stone,430,4.69,https://f.nooncdn.com/p/pnsku/N43092737A/45/_/1764242515/e26f029d-5fa7-4741-9f68-7a442d25a65b.jpg?width=800,product_images/Maybelline New York Lifter Gloss Lip Gloss  008 St.jpg,beauty & makeup,Noon
Nyx Professional Makeup Brow Glue Eyebrow Gel 5G,140,3.8103,https://f.nooncdn.com/p/45dc1b34c1595eb58567eda771b8e480|pzsku/ZE64D16E13B3E31B1C541Z/45/1769968878/45a24689-5d08-486b-845e-8acf0e8be1f0.jpg?width=800,product_images/Nyx Professional Makeup Brow Glue Eyebrow Gel 5G.jpg,beauty & makeup,Noon
Skinside Hyaluronic Acid Foundation Serum - Light 25 ml,289,4.420,https://f.nooncdn.com/p/pzsku/ZE9FB0D3C87924574D3FCZ/45/_/1771672656/bb306446-18f8-4ddb-b751-f1f18d92c3c8.jpg?width=800,product_images/Skinside Hyaluronic Acid Foundation Serum  Light 2.jpg,beauty & makeup,Noon
"MAYBELLINE NEW YORK LASH SENSATIONAL SKY HIGH MASCARA, BLACK, 36H, LENGTHENING, VOLUMIZING, +2MM LENGTH ON ASIAN LASHES Black",433,3.45,https://f.nooncdn.com/p/pnsku/N52474852A/45/_/1744023308/9203a4f1-8660-4213-84d7-7b8177081acf.jpg?width=800,product_images/MAYBELLINE NEW YORK LASH SENSATIONAL SKY HIGH MASC.jpg,beauty & makeup,Noon
Shein Clusters 120Pcs Individual Cluster Lashes Lash Extension,499,4.0261,https://f.nooncdn.com/p/pzsku/ZDFF1A6D62B50D4C7F8DCZ/45/1767808586/3ec5d0be-e7e3-448b-a9eb-10017e1b898e.jpg?width=800,product_images/Shein Clusters 120Pcs Individual Cluster Lashes La.jpg,beauty & makeup,Noon
SHEGLAM Insta-Ready Face And Under Eye Setting Powder Duo - Bubblegum Pink,460,4.3258,https://f.nooncdn.com/p/pnsku/N70045184V/45/_/1707451329/15aa5c08-e2b1-4c66-af22-ffae5b969442.jpg?width=800,product_images/SHEGLAM InstaReady Face And Under Eye Setting Powd.jpg,beauty & makeup,Noon
topface 3Dimension Volume Mascara Black,287,4.695,https://f.nooncdn.com/p/pnsku/N70078565V/45/_/1716713933/7afc1176-9b09-42f1-837d-224db10d2fa7.jpg?width=800,product_images/topface 3Dimension Volume Mascara Black.jpg,beauty & makeup,Noon
flormar Sheer Up Semi-Transparent Shiny Lipstick 004 Warm Peach,304.60,4.831,https://f.nooncdn.com/p/pnsku/N70043566V/45/_/1706789677/ce0f4f5c-f082-4873-97c1-58f9ec93c89b.jpg?width=800,product_images/flormar Sheer Up SemiTransparent Shiny Lipstick 00.jpg,beauty & makeup,Noon
Leylak eyelashes and eyebrows serum,326.25,4.1238,https://f.nooncdn.com/p/pzsku/Z60AA098A6BD2F41FED17Z/45/_/1772628998/64b86a83-e486-41da-91e3-924e8eab2176.jpg?width=800,product_images/Leylak eyelashes and eyebrows serum.jpg,beauty & makeup,Noon
MAYBELLINE NEW YORK Colossal Kajal Argan Oil Eyeliner - 12H Extra Black,150.70,4.33,https://f.nooncdn.com/p/pnsku/N20426193A/45/_/1767607784/925fe0e6-305a-4bd4-9479-0e9e7f2e05ab.jpg?width=800,product_images/MAYBELLINE NEW YORK Colossal Kajal Argan Oil Eyeli.jpg,beauty & makeup,Noon
Maybelline New York The Falsies Lash Lift   - 01 Black 01 Black,423,4.32,https://f.nooncdn.com/p/pnsku/N33775896A/45/_/1764236063/af36a62b-35a4-44ae-b1f0-f4ce7a957f0f.jpg?width=800,product_images/Maybelline New York The Falsies Lash Lift    01 Bl.jpg,beauty & makeup,Noon
SHEGLAM Camera On Smooth And Blur Primer clear,417.30,4.355,https://f.nooncdn.com/p/pnsku/N70251463V/45/_/1761461486/bd8d6ff3-4859-43b6-b31c-91dbcc22c825.jpg?width=800,product_images/SHEGLAM Camera On Smooth And Blur Primer clear.jpg,beauty & makeup,Noon
Golden Rose 12 Colors Clear Lipstick Pencil Set - Rouge,755,4.4248,https://f.nooncdn.com/p/pzsku/Z88013AB116A3F1CDD847Z/45/1750076241/cd40f28e-5202-4fe9-9c8c-9bbafd2e3f0e.jpg?width=800,product_images/Golden Rose 12 Colors Clear Lipstick Pencil Set  R.jpg,beauty & makeup,Noon
L'OREAL PARIS L’Oréal Paris Volume Million Lashes Panorama Mascara in Black,676,4.41,https://f.nooncdn.com/p/pzsku/ZEB4260E51A00F83CA67CZ/45/_/1702376384/375b6f2e-39cf-4d8f-97d1-639cc8e404dc.jpg?width=800,product_images/LOREAL PARIS LOréal Paris Volume Million Lashes Pa.jpg,beauty & makeup,Noon
Shein 3pcs Powder Puff Soft Face Triangle Makeup Puff for Loose Powder Body Cosmetic Foundation Sponges Beauty Blender Makeup Tool Multicolors,65,4.2336,https://f.nooncdn.com/p/pzsku/ZD2C91A0E4BDF7242C257Z/45/1766230749/15f62492-912c-4d80-9c1c-fd30c9aed649.jpg?width=800,product_images/Shein 3pcs Powder Puff Soft Face Triangle Makeup P.jpg,beauty & makeup,Noon
Maybelline New York Fit Me Eye Concealer 15 Fair 15,371,4.1771,No Image,No Image,beauty & makeup,Noon
Nivea Universal All Purpose Moisturizing Cream Tin Blue 150ml,197.30,4.51,https://f.nooncdn.com/p/pnsku/N13345722A/45/_/1765870629/ddade667-a648-4728-84d3-10bfab37a1e6.jpg?width=800,product_images/Nivea Universal All Purpose Moisturizing Cream Tin.jpg,beauty & makeup,Noon
"Monaya G005 Matte & Moist Lasting Lip Gloss -Long-Lasting, Moisturizing, Non-Drying Matte Finish, 2x3ml",189,3.892,https://f.nooncdn.com/p/pzsku/Z290068E6C3C196526ABEZ/45/_/1775805336/4aa76495-7006-406c-a769-f19b051d07f5.jpg?width=800,product_images/Monaya G005 Matte  Moist Lasting Lip Gloss LongLas.jpg,beauty & makeup,Noon
SESH - Happy glow - Brightening Serum,700,4.188,https://f.nooncdn.com/p/pzsku/ZD04829CBCC0CA3988629Z/45/1767808762/3bd10b4f-3bf9-46f0-8489-6cf26afd9a44.jpg?width=800,product_images/SESH  Happy glow  Brightening Serum.jpg,beauty & makeup,Noon
SHEGLAM GLAM 101 LIPSTICK & LINER DUO - Berry Whip,320,4.33,https://f.nooncdn.com/p/pnsku/N70056221V/45/_/1717509811/1c0438d2-1e9a-49cf-a69d-5c7574ca692b.jpg?width=800,product_images/SHEGLAM GLAM 101 LIPSTICK  LINER DUO  Berry Whip.jpg,beauty & makeup,Noon
VICHY Minéral 89 Daily Booster Fortifying And Plumping 50ml,"1,017",4.7253,https://f.nooncdn.com/p/pnsku/N13707565A/45/_/1773313661/2844be58-2d2d-4656-b50b-68e58e124e5d.jpg?width=800,product_images/VICHY Minéral 89 Daily Booster Fortifying And Plum.jpg,beauty & makeup,Noon
CeraVe Moisturizing Lotion For Dry To Very Dry Skin With Hyaluronic Acid 473ml,929,4.56,https://f.nooncdn.com/p/pnsku/N51083231A/45/_/1772101748/eb9c3cc3-72b3-41d7-b47c-cc8f390a634f.jpg?width=800,product_images/CeraVe Moisturizing Lotion For Dry To Very Dry Ski.jpg,beauty & makeup,Noon
FLOAT ON BLUSH COLOR BLOOM LIQUID  MATTE FINISH FLOAT ON,85,0.0,https://f.nooncdn.com/p/pzsku/ZF465042C5BD3FC3CD4EEZ/45/1762947947/ada03f73-d3bc-479b-b688-3a0502275890.jpg?width=800,product_images/FLOAT ON BLUSH COLOR BLOOM LIQUID  MATTE FINISH FL.jpg,beauty & makeup,Noon
Jade Roller Guasha Skin Scraper Facial Massager Set Multicolour,80,3.9906,https://f.nooncdn.com/p/v1621432389/N47547118A_1.jpg?width=800,product_images/Jade Roller Guasha Skin Scraper Facial Massager Se.jpg,beauty & makeup,Noon
10-Piece Stylish Fashion Makeup Brushes Pink/Gold/Black,160,4.212,https://f.nooncdn.com/p/pnsku/N43678651A/45/_/1708943266/d2f7073a-ef4b-4e6d-89fc-75f0b0e79831.jpg?width=800,product_images/10Piece Stylish Fashion Makeup Brushes PinkGoldBla.jpg,beauty & makeup,Noon
"Monaya S005 Mousse Blush Cream,Lightweight, Makeup for Natural Glow, Lip & Cheek Tint,  Makeup Essential – 4g Each",219,3.775,https://f.nooncdn.com/p/pzsku/Z90E4954C5DA2231A3C48Z/45/1756960388/7a8e69e9-c85f-4be6-a9f0-48593fa5dcb5.jpg?width=800,product_images/Monaya S005 Mousse Blush CreamLightweight Makeup f.jpg,beauty & makeup,Noon
Color Bloom Liquid Blush Matte Finish-Devoted  Gel Cream Blush  Long Lasting Non-Fading Highly Pigmented Lightweight Long Wear Smooth Blusher Devoted,85,0.0,https://f.nooncdn.com/p/pzsku/Z34CE8B6B7E822B663C7AZ/45/1762948019/00fa7d17-4aa5-47c3-8eb5-ed89905ce4a2.jpg?width=800,product_images/Color Bloom Liquid Blush Matte FinishDevoted  Gel .jpg,beauty & makeup,Noon
4 -Piece Makeup Sponges Blender Set Multicolour,81,4.549,https://f.nooncdn.com/p/v1635663892/N51640303A_1.jpg?width=800,product_images/4 Piece Makeup Sponges Blender Set Multicolour.jpg,beauty & makeup,Noon
SHEGLAM Glide Control Liquid Eyeliner Matte Black,253,3.54,https://f.nooncdn.com/p/pnsku/N70253433V/45/_/1761844193/f5f66f93-ee3b-4120-bf7f-a14e9531ae97.jpg?width=800,product_images/SHEGLAM Glide Control Liquid Eyeliner Matte Black.jpg,beauty & makeup,Noon
ARTDECO BLUSH COUTURE DIAMONDS & LIGHTS - Two-tone and velvety rouge in a noble design,999,5.02,https://f.nooncdn.com/p/pzsku/Z6FB2D07F886DE50E9B01Z/45/_/1739040463/b5b0cc55-346f-49a4-8230-a5523d8c3d3a.jpg?width=800,product_images/ARTDECO BLUSH COUTURE DIAMONDS  LIGHTS  Twotone an.jpg,beauty & makeup,Noon
"Shell makeup brush set with mirror, makeup brush set for lipstick and eyeshadow, cream brush, beauty tool, multi-colored (multi-colored)",170,3.33,https://f.nooncdn.com/p/fe376cb1c46d57ee94968f1644c5fb73|pzsku/Z4274D278B36DBA853A6BZ/45/1769077262/8bae029a-9b92-4f81-a765-e05d5bc22744.jpg?width=800,product_images/Shell makeup brush set with mirror makeup brush se.jpg,beauty & makeup,Noon
Queen By Lord Lifter Lip Gloss 06 Lip Drip,300,3.923,https://f.nooncdn.com/p/pzsku/ZB8D2102414CF31CE1AC2Z/45/_/1740911537/e6698662-27be-4966-a3a8-ba1e04a07a69.jpg?width=800,product_images/Queen By Lord Lifter Lip Gloss 06 Lip Drip.jpg,beauty & makeup,Noon
تتراهيدرو باقة الترطيب المكثف للجسم,480,5.04,https://f.nooncdn.com/p/pzsku/Z8501DF3D300A746025ECZ/45/1744447086/c0fd7722-5184-4ef4-be7c-c969ae2d70fe.jpg?width=800,product_images/تتراهيدرو باقة الترطيب المكثف للجسم.jpg,beauty & makeup,Noon
Facial And Skin Cleansing Brush Multicolour,63.50,4.351,https://f.nooncdn.com/p/pzsku/Z8D64F59BFC74B635A4A9Z/45/_/1702752082/ff77101f-0cba-46d3-bec8-08441b831fb5.jpg?width=800,product_images/Facial And Skin Cleansing Brush Multicolour.jpg,beauty & makeup,Noon
soralone 2 Soralone Cica Cream Gel 60ml,590,0.0,No Image,No Image,beauty & makeup,Noon
SHEGLAM Wing It Waterproof Liner Duo Black,299.98,4.626,No Image,No Image,beauty & makeup,Noon
SHEGLAM Glam 101 Lipstick And Lip Liner Duo - Deep Caramel Brown,309,3.783,No Image,No Image,beauty & makeup,Noon
SHEGLAM MATTE ALLURE MINI LIQUID LIPSTICK SET - FEEL REAL,500,4.421,No Image,No Image,beauty & makeup,Noon
Pack Of 4 Egg Blending Sponge With Case Multicolour,99,5.02,No Image,No Image,beauty & makeup,Noon
SHEGLAM EZ GLIDE MATTE EYELINER PENCIL Negro,247,3.859,No Image,No Image,beauty & makeup,Noon
SHEGLAM Sweet Cheeks Blush Trio - Private Cabana Multicolour,347,4.65,No Image,No Image,beauty & makeup,Noon
CeraVe AM Facial Moisturizing Lotion SPF30 with Hyaluronic Acid 52ml,432,4.6495,No Image,No Image,beauty & makeup,Noon
Queen By Lord Lifter Lip Gloss 05 Curious,300,4.331,No Image,No Image,beauty & makeup,Noon
Mother Naked Hot Girl Essentials Bundle | 4-in-1 get-glowy-and-go kit | Maximum hot girl energy,"1,180",4.75,No Image,No Image,beauty & makeup,Noon
Flamingo Pack Of 1 Facial Touch-Up Razor Multicolour,98.80,3.725,No Image,No Image,beauty & makeup,Noon
Feather-Flamingo 3-Piece Facial Touch-Up Razor Set Yellow/Pink/Purple 15cm,99,4.1173,No Image,No Image,beauty & makeup,Noon
"flormar Eyeliner Set, 12 Colors Multicolour",156.40,3.91,No Image,No Image,beauty & makeup,Noon
SHEGLAM Lip Dazzler Glitter Kit - Debutante Multicolour,360,4.161,No Image,No Image,beauty & makeup,Noon
SHEGLAM Mini Liquid Lipstick Set 6.9ml Nude Beach,480,4.19,No Image,No Image,beauty & makeup,Noon
SHEGLAM Glam 101 Lipstick & Liner Duo Macaron,299.20,4.0242,No Image,No Image,beauty & makeup,Noon
Feather 3-Piece Flamingos Facial Touch-up Stainless Steel Safe Razor Purple/Yellow/Pink 26grams,72.45,3.81,No Image,No Image,beauty & makeup,Noon
Beauty Makeup Sponge Blender Multicolour,52,3.55,No Image,No Image,beauty & makeup,Noon
Makeup Sponges - One Package - 10 Pcs Multicolour,35.95,4.031,No Image,No Image,beauty & makeup,Noon
SHEGLAM Matte Allure Private Tourl Liquid Lipstick Set 3 Pieces Multicolour,425,0.0,No Image,No Image,beauty & makeup,Noon
Ever Beauty magic blush color changing 24h (sensitive area - cheek - lips),248,3.83,https://f.nooncdn.com/p/pzsku/Z05A5FFD7AD7D79221869Z/45/1762374669/c7e62ce8-648a-4214-b502-db14989c5197.jpg?width=800,product_images/Ever Beauty magic blush color changing 24h sensiti.jpg,beauty & makeup,Noon
MOOD All-Over Sugar Rush Set,450,3.821,https://f.nooncdn.com/p/pzsku/Z4E8BB4A46478517255A7Z/45/1762681623/8c37b75f-51a9-4d32-885d-e22a432eb0e9.jpg?width=800,product_images/MOOD AllOver Sugar Rush Set.jpg,beauty & makeup,Noon
1piece Glass Nail File  multicolour,80,2.84,https://f.nooncdn.com/p/pzsku/Z6C752A7B5EA8BC7A0615Z/45/1760563121/bc9c497c-d598-4053-b5e4-49a99d5e528f.jpg?width=800,product_images/1piece Glass Nail File  multicolour.jpg,beauty & makeup,Noon
CeraVe Moisturising Cream For Dry Skin - 177ml,492,4.51,https://f.nooncdn.com/p/pnsku/N51083228A/45/_/1693492291/acdd229b-fe63-4ff2-9155-9bae09e856fb.jpg?width=800,product_images/CeraVe Moisturising Cream For Dry Skin  177ml.jpg,beauty & makeup,Noon
Queen By Lord Lifter Lip Gloss 00 Glamorous,300,4.317,https://f.nooncdn.com/p/pzsku/ZDD393420D226456C024CZ/45/1741914850/e2801a71-4a3e-47d1-a31a-649030a362b8.jpg?width=800,product_images/Queen By Lord Lifter Lip Gloss 00 Glamorous.jpg,beauty & makeup,Noon
"MAYBELLINE NEW YORK Lifter Gloss, Hydrating Lip Gloss with Hyaluronic Acid, 5.4 ml, Shade: 003 Moon 003 Moon",430,4.69,https://f.nooncdn.com/p/pnsku/N43092732A/45/_/1764173634/87a45e67-7894-4003-9270-1ce19037fc52.jpg?width=800,product_images/MAYBELLINE NEW YORK Lifter Gloss Hydrating Lip Glo.jpg,beauty & makeup,Noon
SHEGLAM Real Flow Laminating Brow Pen Espresso,263,5.04,https://f.nooncdn.com/p/pnsku/N70253402V/45/_/1761843298/4fb88cb5-51cb-4004-914a-f62371682767.jpg?width=800,product_images/SHEGLAM Real Flow Laminating Brow Pen Espresso.jpg,beauty & makeup,Noon
ROSE BERRY Long Lasting And Waterproof Eyeliner Pencil Black,60.25,4.02,https://f.nooncdn.com/p/v1649578157/N52209162A_1.jpg?width=800,product_images/ROSE BERRY Long Lasting And Waterproof Eyeliner Pe.jpg,beauty & makeup,Noon
schick 3-Piece Intuition Sensitive Care Moisturizing Razor Blade Refills Multicolour 10grams,749,4.3319,https://f.nooncdn.com/p/pnsku/N34527588A/45/_/1721486152/138c0a5b-9a97-4910-997b-d5436a186533.jpg?width=800,product_images/schick 3Piece Intuition Sensitive Care Moisturizin.jpg,beauty & makeup,Noon
Technic Invite Only Pressed Pigment Eyeshadow Palette,299,4.3160,https://f.nooncdn.com/p/pzsku/Z6BBC5EE4592DA0814BD2Z/45/_/1706905354/17d0f211-9ab9-499e-ba26-18bbf8833d90.jpg?width=800,product_images/Technic Invite Only Pressed Pigment Eyeshadow Pale.jpg,beauty & makeup,Noon
MOOD All-Over Santorini Set,450,4.748,https://f.nooncdn.com/p/pzsku/Z7403991A04F8E697A5D8Z/45/1762681494/0e8e8728-7421-4ebb-a06f-72511735c4d3.jpg?width=800,product_images/MOOD AllOver Santorini Set.jpg,beauty & makeup,Noon
deoc BAYEB Eyebrow gel,199,3.9463,https://f.nooncdn.com/p/pzsku/Z9E40098E1E7B0AD51DF9Z/45/_/1711244267/d9fc4f63-498c-4e22-beb5-fd92f9f4ed04.jpg?width=800,product_images/deoc BAYEB Eyebrow gel.jpg,beauty & makeup,Noon
4 -Piece Makeup Sponge With Case Multicolour,99,4.429,https://f.nooncdn.com/p/v1635663892/N51640304A_1.jpg?width=800,product_images/4 Piece Makeup Sponge With Case Multicolour.jpg,beauty & makeup,Noon
MAYBELLINE NEW YORK Instant Age Rewind Eraser Concealer 07 - Sand,412,4.42,https://f.nooncdn.com/p/pzsku/Z0104E2D642BF1D88631CZ/45/1764270475/4e3cc1ce-0ca9-4220-ac97-977d254d9b5d.jpg?width=800,product_images/MAYBELLINE NEW YORK Instant Age Rewind Eraser Conc.jpg,beauty & makeup,Noon
Queen By Lord Lifter Lip Gloss 04 Chic Lip,300,3.920,https://f.nooncdn.com/p/pzsku/ZEB32C97A2B78C8222246Z/45/1767808206/5917e140-20c3-41c9-b55c-d6b44f1dc5d2.jpg?width=800,product_images/Queen By Lord Lifter Lip Gloss 04 Chic Lip.jpg,beauty & makeup,Noon
"Shein Luxury Makeup Brush Set – 13 Professional Brushes with 5 Beauty Blenders for Powder, Eyeshadow & Contour Multicolour",179,2.47,https://f.nooncdn.com/p/pzsku/Z09FE60C8E179990949C8Z/45/_/1773078735/6563aefa-11b0-4271-b2ad-5311b8c0f404.jpg?width=800,product_images/Shein Luxury Makeup Brush Set  13 Professional Bru.jpg,beauty & makeup,Noon
Capixy Lashes Treatment Serum - 10ml,398,4.2167,https://f.nooncdn.com/p/pzsku/ZF81095682E11CF6B52FAZ/45/_/1735857060/d8b6cef8-3dfa-4c65-9937-9f8f0acfa2d4.jpg?width=800,product_images/Capixy Lashes Treatment Serum  10ml.jpg,beauty & makeup,Noon
SHEGLAM Pout Phresh Color Changing Lipstick- Avocado,290,4.415,https://f.nooncdn.com/p/pnsku/N70125090V/45/_/1730095562/0dbdcf88-00dc-45f0-a8a1-88bf76a8c77f.jpg?width=800,product_images/SHEGLAM Pout Phresh Color Changing Lipstick Avocad.jpg,beauty & makeup,Noon
