name,price,rating,image_url,image_path,category,source
"4-In-1 Mask Bowl, Mask Stick, Mask Brush And Gauge Set Assorted",59,4.1321,https://f.nooncdn.com/p/v1625676420/N15543411A_1.jpg?width=800,product_images/4In1 Mask Bowl Mask Stick Mask Brush And Gauge Set.jpg,beauty & makeup,Noon
Shein Short almond-shaped reflective mirror artificial nails 24PCS,188,3.813,https://f.nooncdn.com/p/pzsku/Z3768643B257B312EB4F2Z/45/_/1740149650/0209a551-f00d-4d26-b50b-de58c133383c.jpg?width=800,product_images/Shein Short almondshaped reflective mirror artific.jpg,beauty & makeup,Noon
SHEGLAM Do It All 2-In-1 Eyeliner Black,405,0.0,https://f.nooncdn.com/p/pnsku/N70138328V/45/_/1735537703/d9dc4c4e-10fc-4114-92d1-1fa3e4533b8c.jpg?width=800,product_images/SHEGLAM Do It All 2In1 Eyeliner Black.jpg,beauty & makeup,Noon
MAYBELLINE NEW YORK Maybelline Fit Me Foundation for Normal to Oily Skin Glass - 128 Warm Beige 30 ml,225,2.58,https://f.nooncdn.com/p/pzsku/ZD98DEEDA98D17F7C1929Z/45/_/1736416679/de675016-6c2a-44dc-af2f-fb4084fb20cf.jpg?width=800,product_images/MAYBELLINE NEW YORK Maybelline Fit Me Foundation f.jpg,beauty & makeup,Noon
BOURJOIS PARIS Bourjois Velvet The Pencil Lipstick -14 Amuse Rouge,70,3.991,https://f.nooncdn.com/p/pzsku/ZD4AAADC40A3C3B400319Z/45/_/1664024162/5b9ce025-192e-4267-a9ba-8a0dc3df9130.jpg?width=800,product_images/BOURJOIS PARIS Bourjois Velvet The Pencil Lipstick.jpg,beauty & makeup,Noon
Makeup Foundation Sponge Blender Blending Puff Flawless Powder Beauty Tool Pink,99,5.02,https://f.nooncdn.com/p/v1635096232/N51547322A_1.jpg?width=800,product_images/Makeup Foundation Sponge Blender Blending Puff Fla.jpg,beauty & makeup,Noon
Artskin Ultimate Warm Neutrals Eyeshadow Palette - B,199.95,4.410,https://f.nooncdn.com/p/0801bdcc8f1e5696961ba041eff2207f|pzsku/Z456F9D4C1E854D5DC1C0Z/45/1768998414/124e56b2-bcf3-431d-ae8d-c22b165b29f9.jpg?width=800,product_images/Artskin Ultimate Warm Neutrals Eyeshadow Palette  .jpg,beauty & makeup,Noon
Jade Facial Roller Green/Silver,120,3.45,No Image,No Image,beauty & makeup,Noon
Essence Baby Got Blush | Shade 40 Coral Crush | Liquid Blush | Lightweight Quick Drying Gel Formula | Buildable Natural Vegan Makeup for Cheeks | Radiant Glow Soft Finish Coral Crush 40,260,4.2136,No Image,No Image,beauty & makeup,Noon
StarVille collage Cream,200,4.240,No Image,No Image,beauty & makeup,Noon
360 Degree Rotating Makeup Organizer Adjustable Cosmetics Round Rotating Storage Stand Rack Large Capacity Shelf Clear,285,4.318,No Image,No Image,beauty & makeup,Noon
Catrice Eye Brow Stylist Pencil With Brush 030 Brow-N-Eyed Peas,217,4.5318,No Image,No Image,beauty & makeup,Noon
3-Piece Eyebrow And Facial Hair Trimmer Blue/Pink/Yellow,99,3.952,No Image,No Image,beauty & makeup,Noon
ROSE BERRY Lash Volume False Lash Effect Mascara Brown,150,4.0471,No Image,No Image,beauty & makeup,Noon
SHEGLAM Lock'd In Setting Spray Purple,398.95,4.871,No Image,No Image,beauty & makeup,Noon
Menow Waterproof HD Concealer 02 - 7.5ml,89.95,4.2107,No Image,No Image,beauty & makeup,Noon
"Silicone Eyelashes, Eyeliner Tool, Precise Eyelash Styling, Natural Look No Clumping, Easy to Use",66,0.0,No Image,No Image,beauty & makeup,Noon
"L'OREAL PARIS Infaillible 32H Fresh Wear Foundation -Spf 25 + Vitamin C 145 Cool Rose, packaging may vary 145 Cool Rose",769,4.557,No Image,No Image,beauty & makeup,Noon
LA Girl Pro.Conceal HD Concealer GC973 Creamy Beige,226.70,3.5139,No Image,No Image,beauty & makeup,Noon
ROSE BERRY Brow Blade Pencil Waterprrof Dark brown - Orignal,300,4.07,No Image,No Image,beauty & makeup,Noon
ROSE BERRY Concealer To Define Facial Features 203,155,3.833,No Image,No Image,beauty & makeup,Noon
Anti Aging Jade Therapy Scraping Tool Light Green 30grams,64.95,3.411,No Image,No Image,beauty & makeup,Noon
topface Baked Choice Rich Touch Blush On 004 Pink,330,4.013,No Image,No Image,beauty & makeup,Noon
Portable Travel Makeup cosmetic Bag Organizer Multicolor,255,2.919,No Image,No Image,beauty & makeup,Noon
"Monaya F001 Perfect Matte Liquid Foundation – Full Coverage, Waterproof, Long-Lasting, (30ml) – Affordable Makeup, Oil-Free, Concealer Effect - F101#",179,3.750,No Image,No Image,beauty & makeup,Noon
"Shein 13-Piece Professional Makeup Brush Set with 2 Sponges – Soft Brushes for Foundation, Concealer, Blush, Powder, Contouring & Eyeshadow – Complete Beauty Tools for Beginners & Pros",355,0.0,No Image,No Image,beauty & makeup,Noon
L'OREAL PARIS L'Oréal Paris Glotion Lumi Le Liquid Blush Shade Glowy Berry Glow 645,603,4.4171,No Image,No Image,beauty & makeup,Noon
ROSE BERRY Brow Blade Pencil Waterproof Dark Brown,149.95,4.4165,No Image,No Image,beauty & makeup,Noon
Bioderma Sébium H2O Micellar Solution - Clear,288,4.412,No Image,No Image,beauty & makeup,Noon
10-Piece Flexible Hair Roller Set Pink 24cm,160,4.016,No Image,No Image,beauty & makeup,Noon
AnneFish 4-Piece Travel Perfume Bottle Multicolour,120.70,4.0839,No Image,No Image,beauty & makeup,Noon
ROSE BERRY Eyeshadow  40 Color Multicolour,691.15,4.410,No Image,No Image,beauty & makeup,Noon
"Mn MENOW 9-Color Eyeshadow Palette, Makeup Kit with Neutral and Shimmer Shades, B",89.95,4.016,No Image,No Image,beauty & makeup,Noon
SHEGLAM Complexion Pro Long Lasting Breathable Matte Foundation Porcelain,688,4.4304,No Image,No Image,beauty & makeup,Noon
Men's Grooming Finger Brush Multicolour,85,3.633,No Image,No Image,beauty & makeup,Noon
BOURJOIS PARIS Healthy Mix Clean Foundation - 50C Rose Ivory,575,4.255,No Image,No Image,beauty & makeup,Noon
Beauty Makeup Sponge Blender Blue,110,5.01,No Image,No Image,beauty & makeup,Noon
5-In-1 Electric Facial Cleaner Massager Kit Pink/White,198.95,4.042,https://f.nooncdn.com/p/v1533119064/N13891577A_1.jpg?width=800,product_images/5In1 Electric Facial Cleaner Massager Kit PinkWhit.jpg,beauty & makeup,Noon
"L'OREAL PARIS Infaillible Grip 24H Matte Liquid Liner - 01 Matte Black, 5.7 ML",740.85,4.090,https://f.nooncdn.com/p/v1661864344/N36493511A_1.jpg?width=800,product_images/LOREAL PARIS Infaillible Grip 24H Matte Liquid Lin.jpg,beauty & makeup,Noon
50-Piece Disposable Eyelash Mascara Brush Set Black/Pink,85,4.46,https://f.nooncdn.com/p/v1580193456/N34059073A_1.jpg?width=800,product_images/50Piece Disposable Eyelash Mascara Brush Set Black.jpg,beauty & makeup,Noon
SHEGLAM Baked Glow Setting Powder - Translucent White,339.95,4.364,https://f.nooncdn.com/p/pnsku/N70046380V/45/_/1707928293/6bbbb07a-6c8e-45d3-b5dd-57d7f97598ef.jpg?width=800,product_images/SHEGLAM Baked Glow Setting Powder  Translucent Whi.jpg,beauty & makeup,Noon
Catrice Soft Glam Filter Stick 030,351,3.89,https://f.nooncdn.com/p/pzsku/Z98242CEFBD879CDBD409Z/45/1748425178/1e4bbdec-2428-44f8-aa7b-244b20aee1ac.jpg?width=800,product_images/Catrice Soft Glam Filter Stick 030.jpg,beauty & makeup,Noon
mala beauty Highlighter White Crystal,395,4.089,https://f.nooncdn.com/p/pzsku/Z2952C82E76AF771DE992Z/45/_/1734953991/1d31b4ab-2ca0-48e5-94fd-ce45d5d2ec38.jpg?width=800,product_images/mala beauty Highlighter White Crystal.jpg,beauty & makeup,Noon
CYBELE Lip Liner Pencil No. 3 Fuschia,190,0.0,https://f.nooncdn.com/p/pzsku/Z616BD4494714AF53A576Z/45/1749895475/65e27435-1285-463b-a9f0-52c96612377e.jpg?width=800,product_images/CYBELE Lip Liner Pencil No 3 Fuschia.jpg,beauty & makeup,Noon
Menow New Long Lasting Dynamic Liquid Eyeliner - 0.4g,89.95,4.367,https://f.nooncdn.com/p/pzsku/Z9383E01B67122FB2F12AZ/45/_/1727615594/4de331e0-c029-4fc9-9721-4d7e1ca442f5.jpg?width=800,product_images/Menow New Long Lasting Dynamic Liquid Eyeliner  04.jpg,beauty & makeup,Noon
Eye Brow Pencil Beige,521.65,3.03,https://f.nooncdn.com/p/v1606110925/N33948249A_1.jpg?width=800,product_images/Eye Brow Pencil Beige.jpg,beauty & makeup,Noon
BOURJOIS PARIS Healthy Mix Anti-Fatigue Foundation 30 ml 53 Light Beige,575,4.43,https://f.nooncdn.com/p/pnsku/N11114331A/45/_/1741002037/49fadb1e-c8ff-47f1-9b30-d33eb962215b.jpg?width=800,product_images/BOURJOIS PARIS Healthy Mix AntiFatigue Foundation .jpg,beauty & makeup,Noon
mala beauty Concealer 13,380,4.2106,https://f.nooncdn.com/p/pzsku/Z6D3CAD6A8B47C141CD7AZ/45/_/1734955750/fcde9d5c-fe4f-4197-b752-0c676a06a4a9.jpg?width=800,product_images/mala beauty Concealer 13.jpg,beauty & makeup,Noon
Gillette Venus Sensitive Smooth Razor For Women With 4 Cartridges Multicolour,699,5.01,https://f.nooncdn.com/p/v1611230297/N43873233A_1.jpg?width=800,product_images/Gillette Venus Sensitive Smooth Razor For Women Wi.jpg,beauty & makeup,Noon
Bioderma Sensibio H2O 500ML– Victoria Beckham Limited Edition,931.09,0.0,https://f.nooncdn.com/p/pnsku/N70314420V/45/_/1773654831/d0a0a996-1e4a-49cf-b76c-6050df1b8d04.jpg?width=800,product_images/Bioderma Sensibio H2O 500ML Victoria Beckham Limit.jpg,beauty & makeup,Noon
SHEGLAM Dynamatte Boom Long Lasting Matte Lipstick High Key Brown,291.10,4.027,https://f.nooncdn.com/p/pnsku/N70058299V/45/_/1711458130/53e06f06-4006-441f-8b7f-765ca863b573.jpg?width=800,product_images/SHEGLAM Dynamatte Boom Long Lasting Matte Lipstick.jpg,beauty & makeup,Noon
topface Supernova Volume Lip Gloss 08 Dream,280,4.821,https://f.nooncdn.com/p/pnsku/N70078656V/45/_/1716714162/0702e67a-fcb1-45e5-ace0-618b2aff26ed.jpg?width=800,product_images/topface Supernova Volume Lip Gloss 08 Dream.jpg,beauty & makeup,Noon
Silicone Ultrasonic Facial Cleanser Brush Multicolour,280,0.0,https://f.nooncdn.com/p/v1638433609/N52074989A_1.jpg?width=800,product_images/Silicone Ultrasonic Facial Cleanser Brush Multicol.jpg,beauty & makeup,Noon
Essence | I Love Extreme Crazy Volume Waterproof Mascara 12ml | Black | Volumizing & Long Lasting | Smudge Proof | Bold Eye Makeup | Intense Colour | Curling & Extension Effect Waterproof Black,199,2.82,https://f.nooncdn.com/p/v1679644592/N53351852A_2.jpg?width=800,product_images/Essence  I Love Extreme Crazy Volume Waterproof Ma.jpg,beauty & makeup,Noon
Crystal hair removal is an easy hair removal,129,2.26,https://f.nooncdn.com/p/pzsku/Z649E18F80DCBBB30B371Z/45/1758661429/1b3de8e0-9f16-4bc5-85de-e6056e81dd2c.jpg?width=800,product_images/Crystal hair removal is an easy hair removal.jpg,beauty & makeup,Noon
FOREVER52 Waterproof kohl Pencil Jet Black,148.95,2.9171,https://f.nooncdn.com/p/pnsku/N20716482A/45/_/1767607802/5b5490c5-4a9b-456c-b5f0-92af61a4ddad.jpg?width=800,product_images/FOREVER52 Waterproof kohl Pencil Jet Black.jpg,beauty & makeup,Noon
3-Piece shaving Ladies Razor For Facial And Body Hair Yellow/Pink/Purple,150,0.0,https://f.nooncdn.com/p/pzsku/ZE3E011E6F3DC937E52F7Z/45/_/1734632689/0e3e40dd-32d4-4d38-bfc2-95c3b2f9ae1c.jpg?width=800,product_images/3Piece shaving Ladies Razor For Facial And Body Ha.jpg,beauty & makeup,Noon
AZHA Foundation 02- 25 ml provides perfect natural coverage to hide dark circles,395,4.217,https://f.nooncdn.com/p/pzsku/Z0A5B3697F9665B718C7AZ/45/1749728274/c3d5ef3c-c378-4d36-bb9c-1c12d13ed760.jpg?width=800,product_images/AZHA Foundation 02 25 ml provides perfect natural .jpg,beauty & makeup,Noon
Facial Roller & Massager Pink,122,0.0,https://f.nooncdn.com/p/v1610484474/N43678105A_1.jpg?width=800,product_images/Facial Roller  Massager Pink.jpg,beauty & makeup,Noon
"Monaya M009 Big Eyes Extended The Thick Mascara,PROFESSIONAL MAKEUP Volumizing, Lengthening, & Defining-Black",210,3.314,https://f.nooncdn.com/p/pzsku/Z76DC9F25B0868F03CE1DZ/45/_/1775807204/5b7d39fd-6863-43e8-94dc-3ffb56065b15.jpg?width=800,product_images/Monaya M009 Big Eyes Extended The Thick MascaraPRO.jpg,beauty & makeup,Noon
1Pcs Makeup Puff Water Drop Soft Beauty Sponge Foundation Blender Blending Puff Powder Smooth Beauty Cosmetic Tool Kits Set Pink,140,0.0,No Image,No Image,beauty & makeup,Noon
Shayd Cosmetica Plumping Lip Gloss,299,5.04,No Image,No Image,beauty & makeup,Noon
"Wetell Shaver Sensitive 3 Women's Razor - 3 precision Blades For Longer-Lasting results, a Moisturizing Strip Enriched For a Smooth Shave without irritation",179,0.0,No Image,No Image,beauty & makeup,Noon
Essence Lash Without Limits Waterproof Extreme Lengthening & Volume Mascara 03(LE) Black Waterproof,234,3.84,No Image,No Image,beauty & makeup,Noon
rhode A Creamy Blush For Buildable Color + Baby-Soft Cheeks 0.18 Oz.-piggy,625,3.45,No Image,No Image,beauty & makeup,Noon
"Monaya L008 Creamy Lipstick colors，Super Lustrous Lipstick, Creamy Formula For Soft, Fuller-Looking Lips, Moisturized Feel",159,3.579,No Image,No Image,beauty & makeup,Noon
topface Supernova Volume Lip Gloss 07 Chakra,280,4.810,No Image,No Image,beauty & makeup,Noon
Double Roller Face Massager Green/Gold 135mm,120,4.2191,No Image,No Image,beauty & makeup,Noon
Might Cinema (Might Cinema) Smoothing Anti-Aging Concealer for All Skin Types-5078-103,87.77,4.021,No Image,No Image,beauty & makeup,Noon
ROSE BERRY Flawless Filter Liquid Highlighter – 02 Fair Light,242,3.843,No Image,No Image,beauty & makeup,Noon
Jade Roller  Facial Massager Green,230,0.0,No Image,No Image,beauty & makeup,Noon
"Monaya S003 Silky Cream Liquid Blush,Leaving a Matte Dewy Makeup Look,Easy to Apply and Create a Natural Flush,Long Lasting and Lightweight Cheek Blush Face Makeup",279,2.913,No Image,No Image,beauty & makeup,Noon
Double Face Cleanser Face Brush Soft Hair Silicone Face Washer Manual Makeup Remover Deep Cleansing Brush Random Color,250,0.0,No Image,No Image,beauty & makeup,Noon
Essence Get Big Lashes Volume Boost Mascara | Volumizing & Curling Formula for Bold Long Lashes | Lightweight Non-Clumping Black Mascara | Long-Lasting Smudge-Proof Eye Makeup | 12 ml Black Boost,249.95,3.4367,No Image,No Image,beauty & makeup,Noon
MAYBELLINE NEW YORK Master Strobing Liquid Illuminating Highlighter Light/Iridescent,199,3.876,https://f.nooncdn.com/p/pnsku/N29235984A/45/_/1767607890/09c53d8e-590c-4e36-8e82-2556238d244f.jpg?width=800,product_images/MAYBELLINE NEW YORK Master Strobing Liquid Illumin.jpg,beauty & makeup,Noon
Essence Hydra Kiss Gloss | What The Fake! Plump Lip Filler 01 | Volumizing Hydrating Lip Plumper | Glossy Shine for All Skin Tones | Vegan Paraben Free Cruelty Free Oh My Plump!,260,4.4107,https://f.nooncdn.com/p/pnsku/N51100192A/45/_/1704881486/81f32485-d5f3-4111-bfe3-eef63e930663.jpg?width=800,product_images/Essence Hydra Kiss Gloss  What The Fake Plump Lip .jpg,beauty & makeup,Noon
SHEGLAM Pouty Lip Balm - Perfect Shine Hot Stuff,267.15,4.5395,https://f.nooncdn.com/p/pnsku/N70046034V/45/_/1708094199/99b5186f-d44e-4da5-bdec-ef18152079f5.jpg?width=800,product_images/SHEGLAM Pouty Lip Balm  Perfect Shine Hot Stuff.jpg,beauty & makeup,Noon
ESSENTIALS Lip Gloss Temptation Star Dust,227,3.9189,https://f.nooncdn.com/p/v1641771735/N52374406A_1.jpg?width=800,product_images/ESSENTIALS Lip Gloss Temptation Star Dust.jpg,beauty & makeup,Noon
Mother Naked Strawberry Milk Lip Treat XL | 18ml | Creamy Soft Pink Glossy Tint | Strawberry Milkshake Flavour | Suitable For Mixing With Other Tints | Vitamin E,500,4.629,https://f.nooncdn.com/p/e22db680370e541fa2178d030a0f5730|pzsku/Z15B621634A60892BE487Z/45/1771324937/1f72456e-16e0-427e-8a4f-66631f30b9f6.jpg?width=800,product_images/Mother Naked Strawberry Milk Lip Treat XL  18ml  C.jpg,beauty & makeup,Noon
"MAYBELLINE NEW YORK MAYBELLINE SUPER STAY LUMI-MATTE FOUNDATION 30H LONGWEAR, LIGHTWEIGHT, WATERPROOF, SWEATPROOF, HEATPROOF, STAY TRUE TO TONE ALL DAY, 115",554,4.2753,https://f.nooncdn.com/p/pzsku/Z6AD80F1AE110796810FDZ/45/1748099588/77db3d43-65bd-4ae1-a60e-d9c1a8682109.jpg?width=800,product_images/MAYBELLINE NEW YORK MAYBELLINE SUPER STAY LUMIMATT.jpg,beauty & makeup,Noon
L'OREAL PARIS 24H Infallible Tinted Serum Shade Very Light 0.5-2,789,4.2215,https://f.nooncdn.com/p/pzsku/Z88E539C36090C3D9A40FZ/45/_/1740041522/537270ae-2dca-468a-8935-c251edf750e1.jpg?width=800,product_images/LOREAL PARIS 24H Infallible Tinted Serum Shade Ver.jpg,beauty & makeup,Noon
"RT [RT 400] Blush Brush Makeup Brush, For Loose, Cream, or Pressed Blush, Rosy Glow Cheeks, Fluffy Powder Brush, Aluminum Ferrules, Synthetic Bristles, Vegan [RT 400]",149.99,3.97,https://f.nooncdn.com/p/pzsku/ZC18B391E2CF7E6235CD5Z/45/1760467716/d1615bbd-ccb9-4d27-94f0-a2996ad580a3.jpg?width=800,product_images/RT RT 400 Blush Brush Makeup Brush For Loose Cream.jpg,beauty & makeup,Noon
Mavala Scientifique K+ Nail Hardener Pro Keratin Blue,310,3.7781,https://f.nooncdn.com/p/pnsku/N21507737A/45/_/1767607781/d353273f-c4ac-4704-b4bf-3a9f6559dba3.jpg?width=800,product_images/Mavala Scientifique K Nail Hardener Pro Keratin Bl.jpg,beauty & makeup,Noon
Solid black color eyeliner - waterproof - matte - for eyes,97,4.24,https://f.nooncdn.com/p/pzsku/Z7D3BF4AED7930CA59CA3Z/45/_/1736046877/c7e03a6b-ab45-4f66-bd01-c4d4678b6d27.jpg?width=800,product_images/Solid black color eyeliner  waterproof  matte  for.jpg,beauty & makeup,Noon
SHEGLAM Streamline Brow & Eyeliner Gel Multicolour,310,4.644,No Image,No Image,beauty & makeup,Noon
Silicone Face Mask Brush And Mud Mask Applicator + high quailty makeup brush,350,0.0,No Image,No Image,beauty & makeup,Noon
Monaya Matte Liquid Foundation Balm Natural Finish 30ml - F003-F302,159,4.043,No Image,No Image,beauty & makeup,Noon
SHEGLAM Matte Allure Lipstick Rouge A Levresmat Allure/4G- Rendevous,450,0.0,No Image,No Image,beauty & makeup,Noon
Luna Emollient Lip Therapy White,85,4.3286,No Image,No Image,beauty & makeup,Noon
Maybelline New York Superstay Matte Ink Liquid Pinks Lipstick - 170 Initiator 170 Initiator,508,4.44,No Image,No Image,beauty & makeup,Noon
Roller Massager With Facial Tool Set Green,560.40,0.0,No Image,No Image,beauty & makeup,Noon
Maybelline New York Fit Me Matte + Poreless – 104 soft Ivory,343.10,4.356,No Image,No Image,beauty & makeup,Noon
"Star Diamond style Self Adhesive Eyelash Glue Pen Magic Eyeliner Easy to Wear Long-lasting Natural Fast Makeup Eyelid Eye Liner Lash Pens   (Black, 1 piece)",129,0.0,No Image,No Image,beauty & makeup,Noon
ROSE BERRY Lip liner set 12 pic,420,3.9117,No Image,No Image,beauty & makeup,Noon
ROSE BERRY Buttery Bliss Blush Stick – 03 Mulled Wine,130,4.029,No Image,No Image,beauty & makeup,Noon
European Style Makeup Brush Holder Gold,159.95,4.26,No Image,No Image,beauty & makeup,Noon
Dermatique Maquillage Corrective Foundation SPF30 Medium Sand Medium Sand - 25ml,225,5.01,No Image,No Image,beauty & makeup,Noon
Jade Face Roller Massager Green/Rose Gold 17.5 x 8.5cm,120,4.04,No Image,No Image,beauty & makeup,Noon
"Multi-use bags, three pieces of different sizes, and an organizer for makeup and creams, black color",240,4.742,No Image,No Image,beauty & makeup,Noon
REAL TECHNIQUES Face And Foundation Brush From Real Techniques 200 orange,119.95,4.520,No Image,No Image,beauty & makeup,Noon
SHEGLAM LIQUID BLUSH cutie pie 5.2 ml Cutie Pie,309,4.816,No Image,No Image,beauty & makeup,Noon
flormar All Day Fix Matte Setting Spray Clear,338,4.59,No Image,No Image,beauty & makeup,Noon
Rocket Beauty Sponge Blender Makeup Sponge Applicator For Small Areas Black,140,0.0,No Image,No Image,beauty & makeup,Noon
SHEGLAM Line Define Waterproof Liquid Eyeliner 05Ml Black,261,4.665,No Image,No Image,beauty & makeup,Noon
3-Piece Curly Hair Brush Black 21grams,119,4.4124,No Image,No Image,beauty & makeup,Noon
LA Girl Get Feverish Fanatic Eyeshadow Palette Multicolour,449,4.6115,No Image,No Image,beauty & makeup,Noon
Random Color Detangling Comb Set,69,4.59,No Image,No Image,beauty & makeup,Noon
"MAYBELLINE NEW YORK Cloudtopia Cheek & Lip Mousse – Blurred, Pigmented Blush – Light as a Cloud  Cheek Color",575,0.0,No Image,No Image,beauty & makeup,Noon
Women Painless Face Hair Remover Rose/White,150,3.79,No Image,No Image,beauty & makeup,Noon
flormar Full Color Ultra High Pigment & Shiny Finish Nail Polish 048 Fiery Red New,104,5.03,No Image,No Image,beauty & makeup,Noon
Moroccan Brush Multicolour,330,5.02,https://f.nooncdn.com/p/v1650793853/N53239857A_1.jpg?width=800,product_images/Moroccan Brush Multicolour.jpg,beauty & makeup,Noon
Olibolla Plump Glossy lip care 10ml - 02 Strawberry Milk,149.95,4.212,https://f.nooncdn.com/p/0801bdcc8f1e5696961ba041eff2207f|pzsku/ZDBC05DA63045A2A5259EZ/45/1769008032/f2d3df6c-085b-4c4d-8371-48e2ff46f117.jpg?width=800,product_images/Olibolla Plump Glossy lip care 10ml  02 Strawberry.jpg,beauty & makeup,Noon
SHEGLAM Lip Facts Lip Liner-Momojo Momojo,230,0.0,https://f.nooncdn.com/p/pnsku/N70169547V/45/_/1745311866/d2f5ca56-db56-45aa-b0d4-fbdfe61cd33f.jpg?width=800,product_images/SHEGLAM Lip Facts Lip LinerMomojo Momojo.jpg,beauty & makeup,Noon
L'OREAL PARIS Infallible More Than Concealer 24h Corrector Full Coverage - 323 Fawn,575,3.011,https://f.nooncdn.com/p/pzsku/Z16D45934FF309A404435Z/45/_/1772111600/e924579f-d688-4215-93a0-6683cc984e30.jpg?width=800,product_images/LOREAL PARIS Infallible More Than Concealer 24h Co.jpg,beauty & makeup,Noon
Jade Beauty Wheel for facial massage+ With  guasha stone,145,0.0,https://f.nooncdn.com/p/d6bb494fafe95d5dbc7a7608c6da52f6|pzsku/Z85E4B6EC85155C26D67AZ/45/1768504872/ffea1d15-7602-4f6f-a468-34eaebd798f5.jpg?width=800,product_images/Jade Beauty Wheel for facial massage With  guasha .jpg,beauty & makeup,Noon
SHEGLAM Sun Sculpt Liquid Contour - Golden Sun Golden Sun,316,4.1104,https://f.nooncdn.com/p/pnsku/N70045151V/45/_/1707451270/fb6693c7-6e70-47b1-bd77-3fd340a7dbe2.jpg?width=800,product_images/SHEGLAM Sun Sculpt Liquid Contour  Golden Sun Gold.jpg,beauty & makeup,Noon
3-In-1 Derma Roller White/Red,350,5.02,https://f.nooncdn.com/p/v1566477868/N29204129A_1.jpg?width=800,product_images/3In1 Derma Roller WhiteRed.jpg,beauty & makeup,Noon
L'OREAL PARIS La Vie En Glow Highlighting Powder Palette Warm Glow,290,4.440,https://f.nooncdn.com/p/v1616482285/N28245230A_1.jpg?width=800,product_images/LOREAL PARIS La Vie En Glow Highlighting Powder Pa.jpg,beauty & makeup,Noon
ROSE BERRY Primer gel Roseberry,180,3.736,https://f.nooncdn.com/p/pzsku/Z6F91B23A14D45BE6C96DZ/45/1764950424/740991c7-f98f-421e-a0fe-832df55f6960.jpg?width=800,product_images/ROSE BERRY Primer gel Roseberry.jpg,beauty & makeup,Noon
SHEGLAM Color Bloom Liquid Blush Matte 5.2ml Risky Business,346,4.346,https://f.nooncdn.com/p/pnsku/N70002632V/45/_/1695302221/b70996b4-0027-443b-87ca-4a764aab6245.jpg?width=800,product_images/SHEGLAM Color Bloom Liquid Blush Matte 52ml Risky .jpg,beauty & makeup,Noon
"MAYBELLINE NEW YORK SuperStay Vinyl Ink Longwear Transfer Proof Gloss Lipstick, 155 UpBeat, Pink Mix",326,3.1138,https://f.nooncdn.com/p/pzsku/Z4645B062E3A37A6626C1Z/45/_/1711619644/a561b608-7b2b-44f8-af14-b91bbfcb9dab.jpg?width=800,product_images/MAYBELLINE NEW YORK SuperStay Vinyl Ink Longwear T.jpg,beauty & makeup,Noon
SHEGLAM 101 Glam Lipstick Liner Duo Soft Chai,300,3.845,https://f.nooncdn.com/p/pnsku/N70041804V/45/_/1706513577/45b5bd56-a636-45a2-bb30-cd2a705a0dc8.jpg?width=800,product_images/SHEGLAM 101 Glam Lipstick Liner Duo Soft Chai.jpg,beauty & makeup,Noon
A set of nail files for polishing and care,80,4.634,https://f.nooncdn.com/p/pzsku/Z6593E10B97B83904D8CCZ/45/_/1732363070/094ba617-bc91-4b70-8cff-ccb10db244d1.jpg?width=800,product_images/A set of nail files for polishing and care.jpg,beauty & makeup,Noon
topface Waterproof Lipliner 110 Purple,107,4.219,https://f.nooncdn.com/p/pnsku/N70078419V/45/_/1718211207/558db5eb-7823-4e52-a6d6-f7c65a1f4cf5.jpg?width=800,product_images/topface Waterproof Lipliner 110 Purple.jpg,beauty & makeup,Noon
"Golden Arrows 10-piece makeup brush set with 2 soft sponges for applying powder, lipstick, lip gloss, and multi-colored eyeshadow",138.50,0.0,https://f.nooncdn.com/p/pzsku/ZFB58D0C2D0C022A4F36AZ/45/_/1775215036/1d65884e-1db1-40a5-a525-58e5092cc098.jpg?width=800,product_images/Golden Arrows 10piece makeup brush set with 2 soft.jpg,beauty & makeup,Noon
"Shein 24Pcs French Tip Press On Nails, Almond Medium Size False Nails",199.99,3.76,No Image,No Image,beauty & makeup,Noon
5-In-1 Electric Facial Cleansing Face Care Massager Pink/White,139.95,3.27,No Image,No Image,beauty & makeup,Noon
"MAYBELLINE NEW YORK MAYBELLINE SUPER STAY LUMI-MATTE FOUNDATION 30H LONGWEAR, LIGHTWEIGHT, WATERPROOF, SWEATPROOF, HEATPROOF, STAY TRUE TO TONE ALL DAY, 108",466,4.2753,No Image,No Image,beauty & makeup,Noon
360 Degree Rotating Lipstick Organizer Clear,255,3.998,No Image,No Image,beauty & makeup,Noon
"L'OREAL PARIS Paris Colour Riche Extraordinaire Lip Color, 104 Dancing Rose",104,3.5104,No Image,No Image,beauty & makeup,Noon
SHEGLAM Glow Addict Lip Balm Rocky Road,411.10,4.73,No Image,No Image,beauty & makeup,Noon
LA Girl HD Pro Concealer GC975 Medium Bisque,254,3.81,No Image,No Image,beauty & makeup,Noon
Multi-use mustache and beard scissors,105,0.0,No Image,No Image,beauty & makeup,Noon
SHEGLAM Triple Threat Correcting Primer 3 In 1 Color Pore Minimizing Facial Makeup Multicolour,454.95,4.241,No Image,No Image,beauty & makeup,Noon
Detangling Hair Brush Pink,82,3.416,No Image,No Image,beauty & makeup,Noon
"MAYBELLINE NEW YORK MAYBELLINE SUPER STAY LUMI-MATTE FOUNDATION 30H LONGWEAR, LIGHTWEIGHT, WATERPROOF, SWEATPROOF, HEATPROOF, STAY TRUE TO TONE ALL DAY, 118",688,4.2753,No Image,No Image,beauty & makeup,Noon
Mirror accessories organizer Multicolor,180,0.0,No Image,No Image,beauty & makeup,Noon
"Wetell Women's Razor With 3 Nano-Precision Blades And a 360° Moisturizing Strip, Enriched With Aloe Vera And Vitamin E For Sensitive Skin, a Flexible Head That fits the Contours, And Protective Rubber Fins For a Smooth And safe Shave Without Irritation.",109,0.0,No Image,No Image,beauty & makeup,Noon
Biobalance Eyelash Growth Serum 6 Ml,745,4.114,No Image,No Image,beauty & makeup,Noon
shaving brush 1 pcs,70,0.0,No Image,No Image,beauty & makeup,Noon
SESH Melt The Day Away,500,4.358,No Image,No Image,beauty & makeup,Noon
Amanda Milano smart matt lip stick No.30,147,5.01,No Image,No Image,beauty & makeup,Noon
Luna Solar Gel Nail polish -l Baby Pink No.1016 - 10 ml,86,3.6100,No Image,No Image,beauty & makeup,Noon
Transparent travel cosmetic bag for women and girls - 3 pieces,255,0.0,No Image,No Image,beauty & makeup,Noon
topface Instyle Lasting Finish Concealer 05 Beige,214,3.64,No Image,No Image,beauty & makeup,Noon
Double Wheel Face Roller,55,3.610,No Image,No Image,beauty & makeup,Noon
