name,price,rating,image_url,image_path,category,source
Makeup Organizer 360 Degree Rotating Adjustable Multicolour,366.80,4.47,https://f.nooncdn.com/p/v1642439737/N52425119A_1.jpg?width=800,product_images/Makeup Organizer 360 Degree Rotating Adjustable Mu.jpg,beauty & makeup,Noon
Disaar Vitamin C Waterproof Whitening Foundation,115,4.11,https://f.nooncdn.com/p/v1580273156/N21254700A_1.jpg?width=800,product_images/Disaar Vitamin C Waterproof Whitening Foundation.jpg,beauty & makeup,Noon
Eva Care Facial Wash And Make-Up Remover Enriched With Milk Proteins For All Skin Types 1 piece multicolor,65,4.4257,https://f.nooncdn.com/p/pnsku/N22225724A/45/_/1759930638/9a4ce33c-67cf-4252-bec1-8a6710bb6ac9.jpg?width=800,product_images/Eva Care Facial Wash And MakeUp Remover Enriched W.jpg,beauty & makeup,Noon
Portable Jade Facial  Roller Green/Gold 14cm,120,4.210,https://f.nooncdn.com/p/v1555082328/N23603844A_1.jpg?width=800,product_images/Portable Jade Facial  Roller GreenGold 14cm.jpg,beauty & makeup,Noon
SHEGLAM EYESHADOW BURGUNDY Palette,705,5.01,https://f.nooncdn.com/p/pnsku/N70056606V/45/_/1710867651/7e364649-9eda-4888-9307-f56518015711.jpg?width=800,product_images/SHEGLAM EYESHADOW BURGUNDY Palette.jpg,beauty & makeup,Noon
Essence Baby Got Blush | Liquid Blush Stick with Soft Sponge Applicator | Buildable & Quick-Drying Formula | Natural Radiant Glow for Cheeks | Vegan Makeup for All Skin Tones Blushin Berry 20,268,4.2136,https://f.nooncdn.com/p/pnsku/N70082502V/45/_/1767607664/c81dfe2d-171c-4f73-9393-c030d448350f.jpg?width=800,product_images/Essence Baby Got Blush  Liquid Blush Stick with So.jpg,beauty & makeup,Noon
Electric Makeup Brush Cleaner Reusable Portable USB Makeup Brush Cleaning Machine Quick Drying Cleaning Makeup Brush Cleaning Kit Multi Color,275,4.07,https://f.nooncdn.com/p/pzsku/Z86315B4458A6E5D81C14Z/45/_/1729095106/b75b8399-0d9d-4472-899f-0c2b69324205.jpg?width=800,product_images/Electric Makeup Brush Cleaner Reusable Portable US.jpg,beauty & makeup,Noon
viona 50-Piece Make-Up Remover Cotton Pads White,68.14,4.3272,https://f.nooncdn.com/p/pnsku/N43367037A/45/_/1741002037/6a18874d-3655-46b5-b87a-d7ff65a48c71.jpg?width=800,product_images/viona 50Piece MakeUp Remover Cotton Pads White.jpg,beauty & makeup,Noon
Pure White Cosmetics Cream 4 Dark Spots Corrector Gold,132.95,4.1248,https://f.nooncdn.com/p/v1639403876/N52155038A_1.jpg?width=800,product_images/Pure White Cosmetics Cream 4 Dark Spots Corrector .jpg,beauty & makeup,Noon
SHEGLAM SKIN STICK Midnight Hour 0.23 oz/6.5g,514,3.85,https://f.nooncdn.com/p/pnsku/N70064044V/45/_/1713777312/b6c495a9-5d12-4dd5-8ce6-962e90445333.jpg?width=800,product_images/SHEGLAM SKIN STICK Midnight Hour 023 oz65g.jpg,beauty & makeup,Noon
"Mn MENOW Lash Doubling Mascara, Rose Gold, Professional Volume and Length, 13ml",149.95,4.520,https://f.nooncdn.com/p/pzsku/ZE1D8A5AED3BF968BC4F8Z/45/1758804330/80c1b1f5-09ff-47fc-ba1f-ac4d151cb095.jpg?width=800,product_images/Mn MENOW Lash Doubling Mascara Rose Gold Professio.jpg,beauty & makeup,Noon
ROSE BERRY Mascara Roseberry Brows&edges,320,4.630,No Image,No Image,beauty & makeup,Noon
Portable Cosmetic Makeup Bag Multicolor,179,3.864,No Image,No Image,beauty & makeup,Noon
Shaan Soothing Gel 200 gm,176,4.41,No Image,No Image,beauty & makeup,Noon
CYBELE Matte Lipstick 302 Nude,181.80,4.42,No Image,No Image,beauty & makeup,Noon
Gua Sha Facial Tools Set and Jade Roller for Face green 5.5x2.2x1.5cm,113,4.16,No Image,No Image,beauty & makeup,Noon
SHEGLAM Lip Rules Liner & Gloss Pen-Golden Rule Golden Rule,299.20,4.391,No Image,No Image,beauty & makeup,Noon
MIXUEER Eyebrow & Face Razor Set – 4 Pcs Precision Facial Hair Trimmer for Women ( Pink ),120,0.0,No Image,No Image,beauty & makeup,Noon
BOURJOIS PARIS Healthy Mix Anti-Fatigue Foundation 30 ml 51 Light Vanilla,575,4.43,No Image,No Image,beauty & makeup,Noon
SHEGLAM Pout-Perfect Shine Lip Plumper - First Crush Rosy,565,4.49,No Image,No Image,beauty & makeup,Noon
SHEGLAM Like Magic 12Hr Full Coverage Concealer - Golden,290,4.558,No Image,No Image,beauty & makeup,Noon
SHEGLAM Blush Shimaer Finish Red,450,4.01,No Image,No Image,beauty & makeup,Noon
MAYBELLINE NEW YORK MAYBELLINE LIFTER LINER 08 FINE LINE - Lip Liner Makeup with Hyaluronic Acid,336,4.61,No Image,No Image,beauty & makeup,Noon
SHEGLAM Love Stained Lip Tint Marker - Bright Side Red,405,4.68,No Image,No Image,beauty & makeup,Noon
REVOLUTION Reloaded Powder Highlighter,240,4.2138,No Image,No Image,beauty & makeup,Noon
Makeup Sponge Blender Purple,190,5.01,No Image,No Image,beauty & makeup,Noon
"Might Cinema Professional Eyeshadow Palette, 80 Colours, Matte and Shimmer Shades",399.95,4.713,No Image,No Image,beauty & makeup,Noon
Vibrating Facial Roller And Massager Pink,124,3.37,No Image,No Image,beauty & makeup,Noon
viona 100 Piece Make Up Cleaning Cotton Pads - White,99,4.6353,No Image,No Image,beauty & makeup,Noon
SHEGLAM Essential Square Eyeshadow Quad-Serendipity Brand Beauty Makeup Face Paint Cosmetic For Women Girls Perfect For Winter Ideal For Y2K Fancy Fashion Suitable For Birthday Christmas Gift Party Ready Best Color Multicolour,349,0.0,No Image,No Image,beauty & makeup,Noon
Shein 4 Pieces Triangle Powder Puff Face Multicolor Makeup Puff for Loose Powder Soft Body Cosmetic Foundation Sponge Mineral Powder Wet Dry Makeup Tool Multicolour,64,4.4185,No Image,No Image,beauty & makeup,Noon
SHEGLAM Snatch 'N' Blush Stick – Next Dimension Cream Blush Next Dimension,420,5.03,No Image,No Image,beauty & makeup,Noon
Orglam Cinnamon Tint Aloe Vera Based (NATURAL),135,3.7150,No Image,No Image,beauty & makeup,Noon
Makeup Blender Beauty Sponge With Bottle Gift Set - 5 Pcs Multicolour,88,4.2279,No Image,No Image,beauty & makeup,Noon
Maybelline New York Fit Me Eye Concealer -  30 Cafe CafÃ© 30,303.20,4.4716,No Image,No Image,beauty & makeup,Noon
Eye And Face Massager assorted Multicolour 12cm,178.50,3.7357,No Image,No Image,beauty & makeup,Noon
flormar Sheer Up Lipstick 020 Hidden Desire,356,4.425,No Image,No Image,beauty & makeup,Noon
Makeup Organizer Box - 4 Drawers Multicolour,399,4.52,No Image,No Image,beauty & makeup,Noon
Maybelline New York Fit Me Matte + Poreless – 105 Natural Ivory,399,4.3587,No Image,No Image,beauty & makeup,Noon
"MAYBELLINE NEW YORK Super Stay Vinyl Ink Nude Shock 100 CHARMED, 16H Longwear Transfer Proof Liquid Lipstick",402,4.45,No Image,No Image,beauty & makeup,Noon
Finishing Touch Facial Body Flawless Shaver Multicolour,180,3.625,No Image,No Image,beauty & makeup,Noon
ANASTASIA BEVERLY HILLS Brow Definer Brown,110,4.1539,No Image,No Image,beauty & makeup,Noon
Fashion Large Round Head Buffer Foundation Brush Multicolour,92,3.874,No Image,No Image,beauty & makeup,Noon
3-Piece Face And Eyebrow Hair Removal Safety Razor Multicolour,99,3.550,https://f.nooncdn.com/p/v1621244732/N47459169A_1.jpg?width=800,product_images/3Piece Face And Eyebrow Hair Removal Safety Razor .jpg,beauty & makeup,Noon
SHEGLAM Lip Rules Liner & Gloss Pen - Judgey Much Judgey Much,324.95,4.4155,https://f.nooncdn.com/p/pnsku/N70103574V/45/_/1724644927/37783e8a-28cd-4c90-b213-aeb9aca09075.jpg?width=800,product_images/SHEGLAM Lip Rules Liner  Gloss Pen  Judgey Much Ju.jpg,beauty & makeup,Noon
Jade Face Roller Massager With Gua Sha Scraper Green/Rose Gold 17.5 x 8.5cm,135,3.73,https://f.nooncdn.com/p/v1587821447/N37423190A_1.jpg?width=800,product_images/Jade Face Roller Massager With Gua Sha Scraper Gre.jpg,beauty & makeup,Noon
"MAYBELLINE NEW YORK Sunkisser Liquid Glow Blush With Vitamin E, 06 City Sizzle",392,4.2193,https://f.nooncdn.com/p/pzsku/Z41176AD977A845381A59Z/45/_/1734127030/bfd27876-8cd3-4682-9acc-02d7e3a90dda.jpg?width=800,product_images/MAYBELLINE NEW YORK Sunkisser Liquid Glow Blush Wi.jpg,beauty & makeup,Noon
18-Piece Makeup Set – 5 Velvet Triangular Powder Puffs + 13 Professional Soft Makeup Brushes for Face & Eyes,165,1.04,https://f.nooncdn.com/p/pzsku/Z1DB1BCA2B4F55A25EF3EZ/45/1766147951/0c737afe-8032-4b38-ad2d-6ed3ba498131.jpg?width=800,product_images/18Piece Makeup Set  5 Velvet Triangular Powder Puf.jpg,beauty & makeup,Noon
SHEGLAM Like Magic 12Hr Full Coverage Concealer Sand,265,4.4423,https://f.nooncdn.com/p/pnsku/N70084098V/45/_/1717920468/5929841d-290b-4606-a9c6-58262a488c17.jpg?width=800,product_images/SHEGLAM Like Magic 12Hr Full Coverage Concealer Sa.jpg,beauty & makeup,Noon
50-Piece Disposable Eyelash Brush Makeup Kit Green,99,3.83,https://f.nooncdn.com/p/v1618332326/N46538336A_1.jpg?width=800,product_images/50Piece Disposable Eyelash Brush Makeup Kit Green.jpg,beauty & makeup,Noon
SHEGLAM Glam 101 Lipstick & Liner Duo Warm Nutmeg,285,4.0242,https://f.nooncdn.com/p/pnsku/N70084306V/45/_/1717920721/5dd9e552-2f62-4b0b-908b-e99a53442163.jpg?width=800,product_images/SHEGLAM Glam 101 Lipstick  Liner Duo Warm Nutmeg.jpg,beauty & makeup,Noon
SHEGLAM The Wizard of OZ™ |  Click Your Heels Lip Gloss pink,376,5.01,https://f.nooncdn.com/p/pnsku/N70253373V/45/_/1761839669/63ffa0ac-8204-4a66-b93d-e9659fa752cf.jpg?width=800,product_images/SHEGLAM The Wizard of OZ   Click Your Heels Lip Gl.jpg,beauty & makeup,Noon
"Monaya Eyebrow Powder - 3 Colors Set, Natural & Long-Lasting Formula, 3.6g Each, Affordable Makeup Solution",190,4.116,https://f.nooncdn.com/p/pzsku/Z3953AA3CE0309B25D144Z/45/1756374033/66ad8c31-8898-42c5-986f-b986f4dc1686.jpg?width=800,product_images/Monaya Eyebrow Powder  3 Colors Set Natural  LongL.jpg,beauty & makeup,Noon
Professional makeup brush set,139,0.0,https://f.nooncdn.com/p/pzsku/Z79431939E8C7CB39B128Z/45/1765307404/c27e1974-698d-4276-8ff9-3f893ac1a16b.jpg?width=800,product_images/Professional makeup brush set.jpg,beauty & makeup,Noon
"MAYBELLINE NEW YORK Cloudtopia Cheek & Lip Mousse – Blurred, Pigmented Blush – Light as a Cloud Cheek Color",575,5.01,https://f.nooncdn.com/p/pzsku/ZC9708404B51B0953B904Z/45/_/1774960158/4411bf6a-267e-439b-96be-882e76cce9ad.jpg?width=800,product_images/MAYBELLINE NEW YORK Cloudtopia Cheek  Lip Mousse  .jpg,beauty & makeup,Noon
4 In 1 Electric Facial Cleansing Device Multicolour,615,4.64,https://f.nooncdn.com/p/v1544791531/N19874635A_1.jpg?width=800,product_images/4 In 1 Electric Facial Cleansing Device Multicolou.jpg,beauty & makeup,Noon
Luna Nail Lacquer Luna 10 ml - No. 601 No.601,71,4.1521,https://f.nooncdn.com/p/pnsku/N41934495A/45/_/1747130724/9654ec10-3933-42c9-9afc-186a2b41adfe.jpg?width=800,product_images/Luna Nail Lacquer Luna 10 ml  No 601 No601.jpg,beauty & makeup,Noon
"Concealer sponge, 3 pieces, multi colour",55,4.466,https://f.nooncdn.com/p/pzsku/ZA41FD9A73367DCFF12BBZ/45/_/1773164646/b8b02a34-c47d-4b7c-b371-f87c58814720.jpg?width=800,product_images/Concealer sponge 3 pieces multi colour.jpg,beauty & makeup,Noon
BOURJOIS PARIS Always Fabulous Stick Foundcealer – 100 –Rose Ivory,215,3.9503,https://f.nooncdn.com/p/v1616144557/N30301240A_1.jpg?width=800,product_images/BOURJOIS PARIS Always Fabulous Stick Foundcealer  .jpg,beauty & makeup,Noon
SHEGLAM Pout-Perfect Shine Lip Plumper - Spring Fever Pink,275,4.654,https://f.nooncdn.com/p/pnsku/N70046350V/45/_/1707910264/1d958259-aec1-46b0-867a-b43c48578f6b.jpg?width=800,product_images/SHEGLAM PoutPerfect Shine Lip Plumper  Spring Feve.jpg,beauty & makeup,Noon
NYX PROFESSIONAL MAKEUP Nyx Professional Makup The Brow Glue 5.0GM,129,3.134,https://f.nooncdn.com/p/pzsku/Z70E5286A67A0C314F0DBZ/45/1766660747/c858ca95-8001-4f61-9e39-9f73beb37874.jpg?width=800,product_images/NYX PROFESSIONAL MAKEUP Nyx Professional Makup The.jpg,beauty & makeup,Noon
SHEGLAM Clear Away Eye & Lip Makeup Remover,460,4.37,No Image,No Image,beauty & makeup,Noon
ROSE BERRY Luxury Eyeliner Pencil - Brown,120,4.145,No Image,No Image,beauty & makeup,Noon
QUALITA 100 Pieces Make-Up Cotton,129.95,4.5123,No Image,No Image,beauty & makeup,Noon
Nail File Set – Colorful Design for Smoothing and Shining Nails,142,0.0,No Image,No Image,beauty & makeup,Noon
MAYBELLINE NEW YORK Brow Fast Sculpt Eyebrow Mascara   04 Medium Brown,263,4.3457,No Image,No Image,beauty & makeup,Noon
2 Pieces Triangle Powder Puff Face Multicolor Makeup  for Loose Powder Soft Body Cosmetic Foundation Sponge Mineral Powder Wet Dry Makeup Tool Multicolour,42.50,4.119,No Image,No Image,beauty & makeup,Noon
Twist&Go Intense Power Serum Lash 10ml - With Peptide - almond oil & coconut oil - avocado oil &olive oil -coconut oil -For Fuller Longer - Stronger Lashes - Eye brows & Eyelashes,155,3.632,No Image,No Image,beauty & makeup,Noon
SHEGLAM POUT-PERFECT SHINE LIP PLUMPER-WALK ON THE BEACH,309.20,4.515,No Image,No Image,beauty & makeup,Noon
Abou Yousef Style Makeup Brushes Set 10Pcs - Multi Color,89.95,3.8279,No Image,No Image,beauty & makeup,Noon
Double silicone facial cleansing brush with mask applicator – deep cleansing and gentle exfoliation for the skin – suitable for all skin types (MULTICOLOUR),90,0.0,No Image,No Image,beauty & makeup,Noon
SHEGLAM Lip Dazzler Glitter Kit - Center Stage Center Stage,398,4.664,No Image,No Image,beauty & makeup,Noon
SHEGLAM 101 Sheer Tinted Lipstick & Liner Duo- strawberry sorbet,349.95,4.111,No Image,No Image,beauty & makeup,Noon
SHEGLAM Crystal Glaze Moisturizing Lip Care- Strawberry Milk,292.65,4.5126,No Image,No Image,beauty & makeup,Noon
ALice Travel Essentials Kit Brush Multi-Color,93,3.729,No Image,No Image,beauty & makeup,Noon
"Dual Facial Cleansing brush, Black Head Makeup Removing White",127.50,5.02,No Image,No Image,beauty & makeup,Noon
Sephora Black Eyeliner Pencil Waterproof 12H,73.50,0.0,No Image,No Image,beauty & makeup,Noon
Travel Toiletry Bag Multicolour,220,4.193,No Image,No Image,beauty & makeup,Noon
Me Now 12-Piece M.N menow Lip Liners -12 Colors lip liners,299,3.616,No Image,No Image,beauty & makeup,Noon
SHEGLAM Go Go Glow Highlighting Body Mist Frosted Opal,505,4.555,No Image,No Image,beauty & makeup,Noon
MENOW·PRO Lash Doubling Mascara 3D Effect 10 Ml - 01,139.95,4.199,No Image,No Image,beauty & makeup,Noon
Nail Brushes Set with Nail Stickers And Nail Dotting Pens Multicolour,400,5.01,No Image,No Image,beauty & makeup,Noon
ROSE BERRY RoseBerry Bold Booster Lip Plumper – Toffee Kiss (Shade 03),140,3.861,No Image,No Image,beauty & makeup,Noon
Rose berry soft matte & easy liquid lipstick set,649,5.02,No Image,No Image,beauty & makeup,Noon
Wet N Wild Color Icon Eyeshadow 10 Pan Palette 10 G E758 Rose In The Air,229,4.4401,No Image,No Image,beauty & makeup,Noon
Portable Facial Massage Roller Assorted,120,4.3213,No Image,No Image,beauty & makeup,Noon
Cybele's Extra Volume 3D Mascara 01 Dark black,300,3.019,No Image,No Image,beauty & makeup,Noon
50-Piece Disposable Eyelash Brush Set Black/Pink,155,5.01,No Image,No Image,beauty & makeup,Noon
LANEIGE Minni Lip Sleeping Mask Berry,56,3.71,No Image,No Image,beauty & makeup,Noon
Shein Portable Mini Makeup Brush Set with Soft Bristles – Essential Starter Kit for Beginners,95,2.242,No Image,No Image,beauty & makeup,Noon
Essence Baby Got Blush 50 Cherry Cherry Baby,325,4.568,No Image,No Image,beauty & makeup,Noon
SHEGLAM Glam 101 Lipstick And Liner Duo Praline Pie,220.85,3.620,No Image,No Image,beauty & makeup,Noon
Inglot AMC Eyeliner Gel Black,550,4.1204,https://f.nooncdn.com/p/v1608788971/N14352203A_1.jpg?width=800,product_images/Inglot AMC Eyeliner Gel Black.jpg,beauty & makeup,Noon
SHEGLAM Matte Allure Mini Liquid Lipstick Set Private Tour Multicolour,449,4.512,https://f.nooncdn.com/p/pnsku/N70045155V/45/_/1717509827/a1caead5-ee08-42a6-95d6-c6ea6be8cdd9.jpg?width=800,product_images/SHEGLAM Matte Allure Mini Liquid Lipstick Set Priv.jpg,beauty & makeup,Noon
"MAYBELLINE NEW YORK Super Stay Vinyl Ink Longwear Transfer Proof Gloss Lipstick, 40 WITTY",512,4.45,https://f.nooncdn.com/p/pzsku/Z38EC00BA0BD0074C89A2Z/45/1752569399/aad8038f-7d3a-40d4-a2f4-97bba803c2c3.jpg?width=800,product_images/MAYBELLINE NEW YORK Super Stay Vinyl Ink Longwear .jpg,beauty & makeup,Noon
Facial Roller Green,165,5.01,https://f.nooncdn.com/p/v1555081546/N23596284A_1.jpg?width=800,product_images/Facial Roller Green.jpg,beauty & makeup,Noon
Menow Waterproof HD Concealer 01 - 7.5ml,79.95,3.984,https://f.nooncdn.com/p/pzsku/Z9FAEF13EFF4FA1F345F0Z/45/_/1706737633/c88b4564-c0cd-46d9-9129-f550fb91b573.jpg?width=800,product_images/Menow Waterproof HD Concealer 01  75ml.jpg,beauty & makeup,Noon
"M3 Shaver sensitive 3 Women's Razor - 3 Precision Blades For longer-lasting Results, a Moisturizing Strip Enriched With Aloe Vera And Vitamin E For a Smooth Shave Without Irritation, and An Ergonomic Design That Moves Smoothly",159,0.0,https://f.nooncdn.com/p/pzsku/ZCBDD1107701032B16EACZ/45/1762696221/ecbbdeaf-421f-4095-bc77-de24a7b1ab6f.jpg?width=800,product_images/M3 Shaver sensitive 3 Womens Razor  3 Precision Bl.jpg,beauty & makeup,Noon
Essence I Love Extreme Volume Mascara Black | Extra Large Fiber Brush for Intense Full Lashes | Ultra-Black Pigments | Vegan & Cruelty Free | Long Lasting Flake Free Formula | Made in Italy 01 Black Volume,197,2.82,https://f.nooncdn.com/p/pnsku/N11031396A/45/_/1764241926/08988498-0a7e-4297-a78f-625dd1f34d34.jpg?width=800,product_images/Essence I Love Extreme Volume Mascara Black  Extra.jpg,beauty & makeup,Noon
SHEGLAM Cheeky Color Jam Spring Blossom,350,5.07,https://f.nooncdn.com/p/pnsku/N70127345V/45/_/1730951250/7b347772-f3da-4774-bc99-d4826c50a18c.jpg?width=800,product_images/SHEGLAM Cheeky Color Jam Spring Blossom.jpg,beauty & makeup,Noon
CYBELE Rich Cream Lipstick Brown 136,168.20,4.22,https://f.nooncdn.com/p/pnsku/N37405245A/45/_/1764242142/ce71a3eb-af68-4b22-98ce-564e1fed7b3a.jpg?width=800,product_images/CYBELE Rich Cream Lipstick Brown 136.jpg,beauty & makeup,Noon
Facial Massager Jade Roller Green,130,4.114,https://f.nooncdn.com/p/v1560399640/N23337809A_1.jpg?width=800,product_images/Facial Massager Jade Roller Green.jpg,beauty & makeup,Noon
Nerciso Miracle For long lashes,99,4.510,https://f.nooncdn.com/p/pzsku/Z527D8BF95332ECE021C0Z/45/1764238624/8662723c-4649-4681-b39b-e4efc40da23b.jpg?width=800,product_images/Nerciso Miracle For long lashes.jpg,beauty & makeup,Noon
4-Piece Nail Polishing File Set Grey,86,4.539,https://f.nooncdn.com/p/v1566058564/N29032169A_1.jpg?width=800,product_images/4Piece Nail Polishing File Set Grey.jpg,beauty & makeup,Noon
Maybelline New York Superstay Matte Ink Liquid Pinks Lipstick - 10 Dreamer Dreamer 10,499.95,4.42,https://f.nooncdn.com/p/v1601792604/N13159552A_1.jpg?width=800,product_images/Maybelline New York Superstay Matte Ink Liquid Pin.jpg,beauty & makeup,Noon
"1-Piece Dual-Ended Silicone Face Mask Brush for Cleaning, Massaging, and Applying Various Face Masks, Facial Cleansing, Cream, and Makeup Application Multicolour",79,5.02,https://f.nooncdn.com/p/pzsku/ZCDF3218A0BFFC496A656Z/45/1766864868/21f6a543-89b9-471d-a679-72128eda2c92.jpg?width=800,product_images/1Piece DualEnded Silicone Face Mask Brush for Clea.jpg,beauty & makeup,Noon
"Monaya Z003 the POREfessional PRIMER, Long-Lasting Make Up Wear, Clear, 1 Count",209,3.424,https://f.nooncdn.com/p/pzsku/Z96D464A2140F3766EA85Z/45/1758183828/45286b94-0d01-4873-87c4-382e72b4b530.jpg?width=800,product_images/Monaya Z003 the POREfessional PRIMER LongLasting M.jpg,beauty & makeup,Noon
flormar Style Matic Lipliner 0.35g SL01 Rosewood,315,4.213,https://f.nooncdn.com/p/pnsku/N70043546V/45/_/1732554900/5d64c961-6e34-42ad-98e5-37867d7b66e4.jpg?width=800,product_images/flormar Style Matic Lipliner 035g SL01 Rosewood.jpg,beauty & makeup,Noon
Essence Baby Got Blush Liquid Blush 30 Dusty Rose | Natural Look Vegan Blush | Quick-Drying Buildable Color for Cheeks | Travel-Friendly Soft Sponge Applicator Dusty Rose 30,350,4.2136,https://f.nooncdn.com/p/pnsku/N70082503V/45/_/1767607857/8f3f95eb-2fd5-460b-85d8-dce092f918f1.jpg?width=800,product_images/Essence Baby Got Blush Liquid Blush 30 Dusty Rose .jpg,beauty & makeup,Noon
SHEGLAM Sunk***D Body Highlighter -  30 G Eros,590,4.01,No Image,No Image,beauty & makeup,Noon
SHEGLAM Strawberry Whirl Cheek & Lip Cream Stack Strawberry,263.95,4.527,https://f.nooncdn.com/p/pnsku/N70204545V/45/_/1755582691/76b4726e-ea87-4f29-9013-0c095fec7d32.jpg?width=800,product_images/SHEGLAM Strawberry Whirl Cheek  Lip Cream Stack St.jpg,beauty & makeup,Noon
"Shein A pair of luxurious, fluffy faux fur eyelashes with a natural look",380,3.827,No Image,No Image,beauty & makeup,Noon
MAYBELLINE NEW YORK Super Stay Teddy Tint Plushwear And Transferproof 10 Current Mood,434,4.3980,No Image,No Image,beauty & makeup,Noon
topface Lip Brush F17 Rose Gold-White,207,3.23,No Image,No Image,beauty & makeup,Noon
L'OREAL PARIS L'Oréal Paris Glotion Lumi Le Liquid Blush Shade 630 Glow True Rose,609,4.4171,No Image,No Image,beauty & makeup,Noon
Stainless Steel Facial Hair Remover Multicolour,135,3.4674,No Image,No Image,beauty & makeup,Noon
Mother Naked Tres Leches Lip Treat | 15ml | Nude Beige Glossy Tint | Sweet Cream Flavour | Vitamin E,400,4.672,No Image,No Image,beauty & makeup,Noon
4-Piece Nail File Set Grey,119,4.84,No Image,No Image,beauty & makeup,Noon
AS SEEN ON TV Cosmetic Makeup Organizer Box - 4 Drawers Clear,262.85,3.6171,No Image,No Image,beauty & makeup,Noon
Tinkle Razor  Stainless To Draw And Define Eyebrows Multicolour,180,4.011,No Image,No Image,beauty & makeup,Noon
CYBELE Desire Lipstick Pencil No. 15,200,4.4250,No Image,No Image,beauty & makeup,Noon
SHEGLAM Merrygoround Wateractivated Shadow Palette 11 G Welcome To Our Playground,499,4.34,No Image,No Image,beauty & makeup,Noon
BOURJOIS PARIS Rouge Velvet The Lipstick 2.4 g 13 Nohalicious,568,4.32,No Image,No Image,beauty & makeup,Noon
Natural Boar Bristle Hair Brush Multicolour 0.068kg,107,4.0130,No Image,No Image,beauty & makeup,Noon
REVOLUTION Reloaded Eyeshadow Palette Iconic 3.0,306,4.6349,No Image,No Image,beauty & makeup,Noon
shAyzee Jade Roller Massager With Facial Tool Set Green,92,4.612,No Image,No Image,beauty & makeup,Noon
SHEGLAM Peel Talk Lip Tint - Tongue Twister Red,317,3.845,No Image,No Image,beauty & makeup,Noon
Alice Smooth Essence Face Razor  - 4 Pieces,180,4.84,No Image,No Image,beauty & makeup,Noon
REAL TECHNIQUES RT Travel Fantasy Mini Travel Brush Set Rust,349,4.5163,No Image,No Image,beauty & makeup,Noon
50-Piece Double Sided Sanding Nail File Set Pink/Blue,339,5.01,No Image,No Image,beauty & makeup,Noon
SHEGLAM Flutter Wink Volumizing Mascara Volumizing Black,325.35,4.5300,No Image,No Image,beauty & makeup,Noon
Facial Cleansing Brush 4 In 1 Rechargeable Waterproof Face Brush Multicolour,575,3.84,No Image,No Image,beauty & makeup,Noon
SHEGLAM Insta-Ready Face & Under Eye Setting Powder Duo - Taro Taro,447.10,4.4170,No Image,No Image,beauty & makeup,Noon
SHEGLAM Starlight Velvet Lipstick 3.5G Deep Under,308,3.99,No Image,No Image,beauty & makeup,Noon
flormar Sheer Up Lipstick 021 Sweet Moment,356,4.825,No Image,No Image,beauty & makeup,Noon
flormar Highly Pigmented & Matte Finish Waterproof Lipliner Pencil 202 Soft Pink Brown,216,4.540,No Image,No Image,beauty & makeup,Noon
"Might Cinema Contour Stick, Multi-Shade Contouring, Cream Formula, 4 Colors Stick",99.95,3.79,No Image,No Image,beauty & makeup,Noon
2-Piece Jade Roller Set Green,170,5.02,No Image,No Image,beauty & makeup,Noon
REAL TECHNIQUES Sculpting Makeup Brush For Contouring Pink,147.95,4.376,No Image,No Image,beauty & makeup,Noon
Heart-Shape Cosmetic Makeup Brush Organizer Clear,140,3.97,No Image,No Image,beauty & makeup,Noon
REAL TECHNIQUES Travel Fantasy Mini Brush Set Multicolour,369.60,4.5293,https://f.nooncdn.com/p/pnsku/N53406240A/45/_/1767608067/6cb88fb1-f14c-4a27-9c3a-54f161498bca.jpg?width=800,product_images/REAL TECHNIQUES Travel Fantasy Mini Brush Set Mult.jpg,beauty & makeup,Noon
SHEGLAM SO LIPPY LIP LINER SET 3PCS ESPRESSO KISSES,416,4.817,https://f.nooncdn.com/p/pnsku/N70044830V/45/_/1707361318/934cb8db-06ae-4432-bcc5-2a0c1580680d.jpg?width=800,product_images/SHEGLAM SO LIPPY LIP LINER SET 3PCS ESPRESSO KISSE.jpg,beauty & makeup,Noon
SHEGLAM All-In-One Volume And Length Mascara - Washable Black,311.95,3.4372,https://f.nooncdn.com/p/pnsku/N70046244V/45/_/1707895886/38e23720-448b-499d-805b-a5e2767dc7f5.jpg?width=800,product_images/SHEGLAM AllInOne Volume And Length Mascara  Washab.jpg,beauty & makeup,Noon
BOURJOIS PARIS Twist Up The Volume Mascara – 001 –Ultra Black,655,4.32,https://f.nooncdn.com/p/v1668417406/N52913390A_1.jpg?width=800,product_images/BOURJOIS PARIS Twist Up The Volume Mascara  001 Ul.jpg,beauty & makeup,Noon
Pen Shaped Electric Nail Drill Machine With 6 Bits Pink/Silver,318,2.813,https://f.nooncdn.com/p/v1558693279/N25978351A_1.jpg?width=800,product_images/Pen Shaped Electric Nail Drill Machine With 6 Bits.jpg,beauty & makeup,Noon
Kolagra Makeup Perfecting Concealer Light,180,3.444,https://f.nooncdn.com/p/pzsku/Z66EBA467D5E227CB7FA5Z/45/_/1676291563/a9c941f7-3d5a-44f6-9033-cab4b3132a35.jpg?width=800,product_images/Kolagra Makeup Perfecting Concealer Light.jpg,beauty & makeup,Noon
Magic Leverag 18-Piece Leverage Hair Roller Set Multicolour,320,3.67,https://f.nooncdn.com/p/v1560173144/N23615364A_1.jpg?width=800,product_images/Magic Leverag 18Piece Leverage Hair Roller Set Mul.jpg,beauty & makeup,Noon
ROSE BERRY book All-in-One Makeup Book Palette Multicolor,999,3.910,https://f.nooncdn.com/p/pzsku/Z9080C2AF7B4DBEA1D3C2Z/45/1767808636/e53505e4-216e-48a9-980a-af850a57456c.jpg?width=800,product_images/ROSE BERRY book AllinOne Makeup Book Palette Multi.jpg,beauty & makeup,Noon
"Shein Multi-Use Foundation Brush – Professional Brush for Foundation, Concealer, Blush & Face Contouring",99,4.412,https://f.nooncdn.com/p/pzsku/Z1F5468AF456C60A83165Z/45/1764830616/eb036b39-6dc0-4152-8e66-b8f757444d7d.jpg?width=800,product_images/Shein MultiUse Foundation Brush  Professional Brus.jpg,beauty & makeup,Noon
Electric Nail Block Beauty Grooming Kit White/Silver/Grey,299,3.8636,https://f.nooncdn.com/p/v1562758257/N12871846A_1.jpg?width=800,product_images/Electric Nail Block Beauty Grooming Kit WhiteSilve.jpg,beauty & makeup,Noon
