name,price,rating,image_url,image_path,category,source
Carina Short Sleeves Cotton Dress,275,5.03,https://f.nooncdn.com/p/pzsku/Z52484422490ACA40ECBDZ/45/1746611681/a49015d6-f26e-434e-ad32-18689a6c6601.jpg?width=800,product_images/Carina Short Sleeves Cotton Dress.jpg,fashion,Noon
"Vanilla Women's Cotton Boyshort Panties, 2-Pack, Black with Leopard Print Bow, Animal Print Pattern, Stretch Fabric",215,4.02,https://f.nooncdn.com/p/pzsku/Z0642EC14F029B8E86F3CZ/45/1766435808/8a15c84e-4174-45c0-8a74-1d03e1d7dbe1.jpg?width=800,product_images/Vanilla Womens Cotton Boyshort Panties 2Pack Black.jpg,fashion,Noon
"Elegant women's dress with a classic casual design, V-neck, and front buttons - perfect for all occasions",800,0.0,https://f.nooncdn.com/p/pzsku/Z835B1CA809BBE32A83D4Z/45/1762130879/ad01568e-9cb6-4a50-967b-d71ccd4aff1b.jpg?width=800,product_images/Elegant womens dress with a classic casual design .jpg,fashion,Noon
Clue Chic V-Neck Midi Dress,780,0.0,https://f.nooncdn.com/p/pzsku/ZF72300190E6CB52DCCC3Z/45/1745845712/9ef91175-6a6b-4816-9b55-fa7b574b7b4f.jpg?width=800,product_images/Clue Chic VNeck Midi Dress.jpg,fashion,Noon
Carina Printed V-Neck Dress,880,5.01,https://f.nooncdn.com/p/pzsku/Z630C90FB36C0D53C6ADBZ/45/1746611684/4be043b8-3790-4cb4-95ac-c7b6bf6cab53.jpg?width=800,product_images/Carina Printed VNeck Dress.jpg,fashion,Noon
Carina Black Slim Fit Dress,605,5.02,https://f.nooncdn.com/p/pzsku/ZA3A5BC9B4FE554C3542FZ/45/1745396007/5b8d85c6-8926-494b-a56e-0e287656c15b.jpg?width=800,product_images/Carina Black Slim Fit Dress.jpg,fashion,Noon
FOREVER 21 Square Hoop Earrings,280,0.0,https://f.nooncdn.com/p/pzsku/Z2CD788ED4869540C568EZ/45/_/1741612453/1aaa94c1-50c8-4856-b613-d812be81d90b.jpg?width=800,product_images/FOREVER 21 Square Hoop Earrings.jpg,fashion,Noon
Clue Tencel Wide Leg Pants,600,5.04,https://f.nooncdn.com/p/pzsku/Z4BB4BA5363302AD5763FZ/45/_/1741602058/a094a9e5-f3e9-4ff4-9e75-bacca9308128.jpg?width=800,product_images/Clue Tencel Wide Leg Pants.jpg,fashion,Noon
Clue Chic Black & White Printed Pants,600,0.0,https://f.nooncdn.com/p/pzsku/Z1E5047A189B86129D9DEZ/45/1745845894/faed814e-e547-4721-88a8-fe55db18fc1e.jpg?width=800,product_images/Clue Chic Black  White Printed Pants.jpg,fashion,Noon
Clue Leopard Print Tencel Pants,600,5.03,https://f.nooncdn.com/p/pzsku/Z61EA8C103DB81C4FB5C5Z/45/_/1741602013/0115026e-dee9-4dde-a7e7-70256492e88c.jpg?width=800,product_images/Clue Leopard Print Tencel Pants.jpg,fashion,Noon
Carina Round Neck Cami Short Dress,330,0.0,https://f.nooncdn.com/p/pzsku/Z2EAAB5AEFED137ACCE51Z/45/1746611601/6317dc4c-cfc1-4104-935c-c4ac2ccfc973.jpg?width=800,product_images/Carina Round Neck Cami Short Dress.jpg,fashion,Noon
Carina Oversized V-Neck Dress,"1,100",0.0,https://f.nooncdn.com/p/pzsku/ZE7FA30CF42CB4D940C35Z/45/1746611678/c5eef701-29b0-44da-a9d2-2959f4493cf1.jpg?width=800,product_images/Carina Oversized VNeck Dress.jpg,fashion,Noon
Carina Chic Printed Midi Dress,660,0.0,https://f.nooncdn.com/p/pzsku/Z7D9C0BCD5359C0D73D8DZ/45/1746611664/78a13757-6ce0-4c1a-b99a-ab298bf711e4.jpg?width=800,product_images/Carina Chic Printed Midi Dress.jpg,fashion,Noon
Clue Leopard Print Maxi Dress,"1,020",5.02,https://f.nooncdn.com/p/pzsku/ZC41F47F6873272AF2B17Z/45/_/1741601911/4647b4a8-cb34-4b4c-bc5e-9c1dc326e87f.jpg?width=800,product_images/Clue Leopard Print Maxi Dress.jpg,fashion,Noon
Carina Cotton Collared Short Dress,385,0.0,https://f.nooncdn.com/p/pzsku/Z040A060DD6918DC875C7Z/45/1746611666/2e8a42fd-b06a-4cbc-8c54-659ae08fe6e2.jpg?width=800,product_images/Carina Cotton Collared Short Dress.jpg,fashion,Noon
Clue Folded Hem White Jeans,"1,200",4.12,https://f.nooncdn.com/p/pzsku/Z35D7C5D7D536218EB94CZ/45/1745845725/de7a67da-bbb6-4726-9c0d-60248c84a559.jpg?width=800,product_images/Clue Folded Hem White Jeans.jpg,fashion,Noon
Clue Relaxed Elegance Tencel Shirt,900,5.01,https://f.nooncdn.com/p/pzsku/Z23D12EF551B54047D722Z/45/_/1741601898/0960ebb2-545d-447c-a229-23169e017a57.jpg?width=800,product_images/Clue Relaxed Elegance Tencel Shirt.jpg,fashion,Noon
Clue Chic Wide-Leg Tencel Pants,600,5.01,https://f.nooncdn.com/p/pzsku/Z1403A0562F7B98DB89BDZ/45/1745845896/47272bba-4f98-4aca-a419-b40005dcb46a.jpg?width=800,product_images/Clue Chic WideLeg Tencel Pants.jpg,fashion,Noon
Clue Timeless Tencel Crew Neck Top,384,5.01,https://f.nooncdn.com/p/pzsku/Z30403C75D4219F032E6FZ/45/_/1741602031/37349087-c668-4459-9a59-6d7c941ac81f.jpg?width=800,product_images/Clue Timeless Tencel Crew Neck Top.jpg,fashion,Noon
Clue Printed V-Neck Midi Dress,900,0.0,https://f.nooncdn.com/p/pzsku/Z6F7367D73C0EAFA40C93Z/45/1745845909/4b164e47-9b0b-4296-8e74-1a97bed04ef0.jpg?width=800,product_images/Clue Printed VNeck Midi Dress.jpg,fashion,Noon
Clue Dropped Shoulder Shirt,720,0.0,https://f.nooncdn.com/p/pzsku/Z8B053E893B86D46B5181Z/45/_/1741601944/6ccb3091-3ed6-424a-9c80-c85f4c66564b.jpg?width=800,product_images/Clue Dropped Shoulder Shirt.jpg,fashion,Noon
Clue Chic Printed V-Neck Dress,"1,140",0.0,https://f.nooncdn.com/p/pzsku/Z44EE83080D926A55E155Z/45/1745845901/74611dab-9437-4cf3-8a33-b3fdf3432dfd.jpg?width=800,product_images/Clue Chic Printed VNeck Dress.jpg,fashion,Noon
Clue Classic Relaxed Fit Dress,900,5.01,https://f.nooncdn.com/p/pzsku/Z156D51F295C300F14857Z/45/1745845767/73cf7c94-a2cb-4a41-8ce0-54e8ff4d0638.jpg?width=800,product_images/Clue Classic Relaxed Fit Dress.jpg,fashion,Noon
Carina Everyday Black Pants,715,5.01,https://f.nooncdn.com/p/pzsku/Z7B2974F86DCDEDD5F009Z/45/1745396054/cddb1fef-824c-4ef2-a2bb-5645c5688a2c.jpg?width=800,product_images/Carina Everyday Black Pants.jpg,fashion,Noon
Clue Solid Pattern Hooded Cardigan,900,4.01,https://f.nooncdn.com/p/pzsku/ZDFAF05312F68A653CCFDZ/45/_/1741602023/2e861ca7-7891-4588-a60e-63ef6b79dd2b.jpg?width=800,product_images/Clue Solid Pattern Hooded Cardigan.jpg,fashion,Noon
Clue Textured Pattern Midi Kimono,600,0.0,https://f.nooncdn.com/p/pzsku/ZE02959F04AE5C46E9DBCZ/45/_/1741601956/0e409d40-a2a6-4a7f-8fd5-c7891ad79005.jpg?width=800,product_images/Clue Textured Pattern Midi Kimono.jpg,fashion,Noon
Clue Relaxed Tencel Wide-Leg Pants,780,3.43,https://f.nooncdn.com/p/pzsku/ZD665FF327560677AB61CZ/45/_/1741602184/8519a1aa-53b9-4e62-bab6-e7af30b3bdda.jpg?width=800,product_images/Clue Relaxed Tencel WideLeg Pants.jpg,fashion,Noon
Clue Black Cargo Jeans,900,0.0,No Image,No Image,fashion,Noon
FOREVER 21 Notched Double-Breasted Coat,"2,800",0.0,No Image,No Image,fashion,Noon
Clue Elegant Maxi Abaya,"1,080",4.62,No Image,No Image,fashion,Noon
Clue Dropped shoulder Lounge T-Shirt,780,0.0,No Image,No Image,fashion,Noon
Carina Printed V-Neck Maxi Dress,"1,100",5.01,No Image,No Image,fashion,Noon
Clue Palm Printed Green Kimono,780,5.01,No Image,No Image,fashion,Noon
Clue Spaghetti Strap Tencel Top,320,5.01,No Image,No Image,fashion,Noon
Premium Soft Royal Chiffon Hijab - Elegant Drape & Full Coverage - Multi Colors,219,4.816,No Image,No Image,fashion,Noon
Clue Elegant Tencel Printed Abaya,"1,080",5.02,No Image,No Image,fashion,Noon
Clue Elegant Flow Tencel Kimono,900,4.01,No Image,No Image,fashion,Noon
Clue Tiger Print Tiered Skirt,600,4.43,No Image,No Image,fashion,Noon
Clue Timeless Tencel Kimono,"1,020",5.05,No Image,No Image,fashion,Noon
SHEINNew Women's Elegant Metal Buckle Big Sleeve Design Bodycon Mini Dress,"1,299",5.03,No Image,No Image,fashion,Noon
Clue Oversized Hooded Shirt Dress,900,5.01,No Image,No Image,fashion,Noon
VERO MODA Womens Tessa Highrise Wide Leg Jeans,"1,122",5.04,No Image,No Image,fashion,Noon
"Fashion Quartz Watch – Black Square Case with Black Silicone Strap, Minimalist Modern Design",250,5.01,https://f.nooncdn.com/p/pzsku/ZBC7F541EAFDE6CCBC312Z/45/1761402688/95320024-b7fe-45d5-a2b7-72f3b9d92784.jpg?width=800,product_images/Fashion Quartz Watch  Black Square Case with Black.jpg,fashion,Noon
Clue Timeless Midi-Length Kimono,900,5.01,https://f.nooncdn.com/p/pzsku/ZB9AA27B08162F136D1C0Z/45/1745845892/b306059d-4bca-47a8-8445-4bdfa23c0f4c.jpg?width=800,product_images/Clue Timeless MidiLength Kimono.jpg,fashion,Noon
صن سيت قفطان شيفون للنساء من صن سيت عباره عن عبايه مطعمة بجبير ذهبي - أسود,"2,500",5.03,https://f.nooncdn.com/p/pzsku/Z3AB38E721AD34E3B03CBZ/45/_/1679168632/e7311411-bdd6-4e2f-9c2a-bcc6c271dd08.jpg?width=800,product_images/صن سيت قفطان شيفون للنساء من صن سيت عباره عن عبايه.jpg,fashion,Noon
Carina Solid Pattern Midi Dress,550,5.04,https://f.nooncdn.com/p/pzsku/ZD75898D66EC463DC24FCZ/45/1746611714/c1a8fe84-dcf5-45c2-959f-5ec05ae2ea68.jpg?width=800,product_images/Carina Solid Pattern Midi Dress.jpg,fashion,Noon
Clue Leopard Print Tencel Kimono,780,4.42,https://f.nooncdn.com/p/pzsku/Z54742CC65648C608A34AZ/45/1745845758/6bcb4d78-e737-4da6-a717-04f41eff7e0d.jpg?width=800,product_images/Clue Leopard Print Tencel Kimono.jpg,fashion,Noon
Clue Elegant Printed Cardigan,600,5.03,https://f.nooncdn.com/p/pzsku/Z1AD949C55FF9F020D075Z/45/1745845766/2f06e454-9c6a-4483-92dc-12e02d5b49fc.jpg?width=800,product_images/Clue Elegant Printed Cardigan.jpg,fashion,Noon
Clue Solid Viscose Midi Dress,640,5.01,https://f.nooncdn.com/p/pzsku/Z53F630B9BCF9864E7BA1Z/45/1745845660/f797f153-6a4b-4462-9072-5a7ee2f5aa43.jpg?width=800,product_images/Clue Solid Viscose Midi Dress.jpg,fashion,Noon
Tobay Wide-leg maternity jeans - comfortable and practical with a modern design that suits all stages of pregnancy,"1,722",5.01,https://f.nooncdn.com/p/pzsku/ZE484A3321CC644358386Z/45/1761570452/3b94c323-f984-44b9-a37e-928911a73aba.jpg?width=800,product_images/Tobay Wideleg maternity jeans  comfortable and pra.jpg,fashion,Noon
Clue Timeless Maxi Dress,800,5.02,https://f.nooncdn.com/p/pzsku/ZBEB647573627AD65C407Z/45/1745845730/0a816878-57b0-4de3-af91-1476f51add34.jpg?width=800,product_images/Clue Timeless Maxi Dress.jpg,fashion,Noon
"Tobay Wide-leg maternity jeans – a relaxed, comfortable design with stretchy fabric that supports the belly – a stylish and modern look for all stages of pregnancy","1,370",4.04,https://f.nooncdn.com/p/pzsku/ZE931C266FF1BDB2474E9Z/45/1763888633/534ddc65-f388-498b-b37b-96ff0ae7fb68.jpg?width=800,product_images/Tobay Wideleg maternity jeans  a relaxed comfortab.jpg,fashion,Noon
Clue High Neck Sleeveless Top,320,4.73,https://f.nooncdn.com/p/pzsku/Z02C528BA57DF68012D67Z/45/1745845713/743f45a5-bdcf-4e1d-addf-c1a6f71744f7.jpg?width=800,product_images/Clue High Neck Sleeveless Top.jpg,fashion,Noon
Carina Effortless Pull-On Printed Pants,660,5.01,https://f.nooncdn.com/p/pzsku/ZFBD8DFECFA587FC4B9AEZ/45/1750602061/9a2441f1-6c30-4258-a255-8ba6851a1a06.jpg?width=800,product_images/Carina Effortless PullOn Printed Pants.jpg,fashion,Noon
ICE CLUB Black Lace Up Round Toe Shape Ankle Boots,"1,125",0.0,https://f.nooncdn.com/p/pzsku/Z3CD4877376DDAB259625Z/45/1761484899/e5a3b76f-79a9-4945-b125-79845f872d6a.jpg?width=800,product_images/ICE CLUB Black Lace Up Round Toe Shape Ankle Boots.jpg,fashion,Noon
Clue Dual-Tone Tencel Abaya,900,4.01,https://f.nooncdn.com/p/pzsku/ZE38CB3EE6514AB38CFF5Z/45/1749975908/8b96a5c9-ef2f-44f8-b223-bcfd3560f31c.jpg?width=800,product_images/Clue DualTone Tencel Abaya.jpg,fashion,Noon
Clue Elegant Tencel Abaya,840,5.03,https://f.nooncdn.com/p/pzsku/Z9906EB7C98C33C76CEA2Z/45/_/1741602021/81404c8d-ed1e-4d21-8a52-eb596237c763.jpg?width=800,product_images/Clue Elegant Tencel Abaya.jpg,fashion,Noon
LIFESTYLISH Ankle Boot Leather And Suede With Zipper Elegant E-104 - Havan,"1,155",3.411,https://f.nooncdn.com/p/b2ce688c894b5ce59067f2f338ab3385|pzsku/ZB13A9F1E399BAEAA5E4BZ/45/1768919586/7e7a4fab-c0f8-468e-add0-8df39a815c95.jpg?width=800,product_images/LIFESTYLISH Ankle Boot Leather And Suede With Zipp.jpg,fashion,Noon
"Tobay Women's Wide Leg Maternity Pants | Comfortable, relaxed fit with belly support | Stylish and comfortable for expectant mothers","1,370",5.01,No Image,No Image,fashion,Noon
Carina Chic Printed Hooded Abaya,"1,320",5.01,No Image,No Image,fashion,Noon
Clue Palm Printed Green Abaya,900,5.04,No Image,No Image,fashion,Noon
Carina Chic Cotton Printed Shirt,660,5.01,No Image,No Image,fashion,Noon
La Vie en Rose Modal Boyleg Panty,390,5.01,No Image,No Image,fashion,Noon
Carina Striped Wide-Leg Pants,550,4.18,No Image,No Image,fashion,Noon
Carina Wide Long Sleeves Kimono,880,4.01,No Image,No Image,fashion,Noon
Stylish Kuwaiti Layer Scarf,139,4.05,No Image,No Image,fashion,Noon
Clue Embroidered Tencel Maxi Dress,900,5.01,No Image,No Image,fashion,Noon
Milk® Women Midi Bundle of 3 Printed Design,305,4.226,No Image,No Image,fashion,Noon
"Tobay Formal maternity trousers in a soft, flowing fabric – stylish design with a comfortable elastic waistband – perfect for occasions, meetings, and formal looks","1,095",5.01,No Image,No Image,fashion,Noon
Carina Colorful Palm Printed Kimono,880,5.01,No Image,No Image,fashion,Noon
Carina Asymmetrical Poncho,605,5.01,https://f.nooncdn.com/p/pzsku/ZA860B52006499557514EZ/45/1746611664/3eb98bd5-5b8d-433b-ae47-3187991cab49.jpg?width=800,product_images/Carina Asymmetrical Poncho.jpg,fashion,Noon
SHEIN Sleeveless Asymmetric Ruched Leopard Chiffon Maxi Dress,"1,099",5.02,https://f.nooncdn.com/p/pzsku/ZEA2FEF902C4F4013FC89Z/45/1757168811/e11a6c2c-30c7-49a9-ac86-9fe0a17f7cab.jpg?width=800,product_images/SHEIN Sleeveless Asymmetric Ruched Leopard Chiffon.jpg,fashion,Noon
Shein 3pcs/Pack High Quality Seamless Breathable Crotch Ladies Low Waist Sexy Hipster Panties,449,4.85,https://f.nooncdn.com/p/pzsku/ZF8729C154A00E4394820Z/45/1764018534/4c9c914b-c26a-41a5-bdc8-041b4890a6c8.jpg?width=800,product_images/Shein 3pcsPack High Quality Seamless Breathable Cr.jpg,fashion,Noon
Satin Cloche Skirt Black For Women,745,4.33,https://f.nooncdn.com/p/pzsku/Z351213152A01062A1575Z/45/1746869224/6621e7ed-e69a-4b61-83f4-411a3a10aca9.jpg?width=800,product_images/Satin Cloche Skirt Black For Women.jpg,fashion,Noon
Carina Beige Crescent & Stars Kimono,"1,265",4.01,https://f.nooncdn.com/p/pzsku/ZD4F97FD1576E816C0D5FZ/45/1746611639/3ad1466a-e93b-4b4b-bfcf-7268173b0ca0.jpg?width=800,product_images/Carina Beige Crescent  Stars Kimono.jpg,fashion,Noon
Clue Blue Wide Leg Jeans,900,5.03,https://f.nooncdn.com/p/pzsku/ZA44A1D691B859F07EA57Z/45/_/1741602044/bca56c79-95df-4375-bb45-6153611fc13e.jpg?width=800,product_images/Clue Blue Wide Leg Jeans.jpg,fashion,Noon
Clue Round Neck Cropped Top,480,5.01,https://f.nooncdn.com/p/pzsku/Z4D561FB19FF05C6848D9Z/45/1745845906/7b088625-70fb-4cb0-bcb8-ca52fd79ab10.jpg?width=800,product_images/Clue Round Neck Cropped Top.jpg,fashion,Noon
SunSet SOLID MIDI LEGINE COTTON 100% Skirt For Women - Black,645,4.610,https://f.nooncdn.com/p/pzsku/ZF5B7E1F87004AD7BE369Z/45/_/1676919483/405cc9b2-b27d-4caf-ad3b-09fd3eb7d90f.jpg?width=800,product_images/SunSet SOLID MIDI LEGINE COTTON 100 Skirt For Wome.jpg,fashion,Noon
trendyol Black Straight Button Skater/Waist Opening Midi Knitted Dress,"1,364",0.0,https://f.nooncdn.com/p/pzsku/Z564E53C49A3CB0A9DDAAZ/45/1767014187/876f65b0-21c6-4036-b83f-17a62c023baa.jpg?width=800,product_images/trendyol Black Straight Button SkaterWaist Opening.jpg,fashion,Noon
Fashion Group Womens High Low Dresses Off The Shoulder Cocktail Dress,650,4.47,https://f.nooncdn.com/p/pzsku/Z5C65B43510CC7D2DE199Z/45/_/1664282535/3f7c7ed1-04b1-4a26-9f34-171d9f8b9047.jpg?width=800,product_images/Fashion Group Womens High Low Dresses Off The Shou.jpg,fashion,Noon
Carina Summer Hooded Cardigan,715,5.01,https://f.nooncdn.com/p/pzsku/ZF636978FEC5076838B4CZ/45/1750062071/ec2d4857-b9c8-429b-b6cc-6ca35e8f9cb9.jpg?width=800,product_images/Carina Summer Hooded Cardigan.jpg,fashion,Noon
"Tobay Wide-leg jeans - a modern, wide-leg design in a comfortable fabric and a stylish look for all looks","1,370",5.01,https://f.nooncdn.com/p/pzsku/Z17749DBCFD022838F51EZ/45/1761559767/5fa4d1fc-bdf6-4d31-8d94-67e2c66412c3.jpg?width=800,product_images/Tobay Wideleg jeans  a modern wideleg design in a .jpg,fashion,Noon
BRAVE SOUL Polka Dot Midi Dress Black / White Spot,"1,123",5.04,https://f.nooncdn.com/p/v1609921731/N42872723V_1.jpg?width=800,product_images/BRAVE SOUL Polka Dot Midi Dress Black  White Spot.jpg,fashion,Noon
"Guzel Basic women's crepe dress, Rosaline, first-class imported material from Guzel - non-sheer and transparent - cut - white color",733,3.85,https://f.nooncdn.com/p/pzsku/Z37FB25551AFF568E6ACAZ/45/_/1731855481/d488c694-36d0-4ba4-825d-4beae8013db6.jpg?width=800,product_images/Guzel Basic womens crepe dress Rosaline firstclass.jpg,fashion,Noon
Clue Grey Zip Fly Jeans,"1,200",3.33,https://f.nooncdn.com/p/pzsku/Z5489F00130AFEE24249AZ/45/1745845899/3f543e76-7ae8-40f6-846f-0695f8018e92.jpg?width=800,product_images/Clue Grey Zip Fly Jeans.jpg,fashion,Noon
Clue Cargo Jeans with Pockets,960,4.79,https://f.nooncdn.com/p/pzsku/Z01C2BEDBF1E1A83DDAF2Z/45/1745845845/17e87d10-00f2-4bdb-a9bf-e8e227b13cfe.jpg?width=800,product_images/Clue Cargo Jeans with Pockets.jpg,fashion,Noon
Women's Loafer - Comfortable Wide Heel - Fashion and Stylish,600,4.24,https://f.nooncdn.com/p/pzsku/Z4979AE6BDDA60CDBDC90Z/45/1757357200/6b1d4379-359b-480c-b955-a873f27fdeb9.jpg?width=800,product_images/Womens Loafer  Comfortable Wide Heel  Fashion and .jpg,fashion,Noon
Clue Printed Wide-Leg Pants,660,4.01,https://f.nooncdn.com/p/pzsku/Z2EC4DB87DAFB5EBD244FZ/45/1747849944/033e6f24-be00-457e-8d37-178e84e2ebc4.jpg?width=800,product_images/Clue Printed WideLeg Pants.jpg,fashion,Noon
Carina High-Waisted Cargo Pants,825,5.03,https://f.nooncdn.com/p/pzsku/ZD096924719B38A2E1328Z/45/1750602094/80daf17b-1813-46ba-9f21-2a2e2c1bdde4.jpg?width=800,product_images/Carina HighWaisted Cargo Pants.jpg,fashion,Noon
"Shein 3pcs Women's Golden Styling Buckle Black,White And Brown Versatile Romantic Casual Thin Belt Universal For All Seasons Summer, School Fall, Autumn, Halloween",399,4.817,https://f.nooncdn.com/p/pzsku/Z0610AEE7F4F2EADA726BZ/45/1757943492/3a32f738-d011-4500-bc75-29d4eca43701.jpg?width=800,product_images/Shein 3pcs Womens Golden Styling Buckle BlackWhite.jpg,fashion,Noon
Vanilla Pack of 3 Women's Colorful Printed Bikini Cotton Panties By VNL,239,5.06,https://f.nooncdn.com/p/pzsku/Z2961ADC1307B33E8317CZ/45/1760001451/c7f2d628-e8e0-4dab-a1ea-12f97b4898e0.jpg?width=800,product_images/Vanilla Pack of 3 Womens Colorful Printed Bikini C.jpg,fashion,Noon
Artificial Pearls Hanging Earrings,75,5.02,https://f.nooncdn.com/p/pzsku/Z66B848A8216348D981E5Z/45/_/1663005245/00ef1563-8309-4abb-a4d2-6d1c919933d5.jpg?width=800,product_images/Artificial Pearls Hanging Earrings.jpg,fashion,Noon
Carina Basic Sleeveless T-Shirt,192.50,5.01,https://f.nooncdn.com/p/pzsku/Z758BC00C013F3B72E6E4Z/45/1745396002/b192348c-b25c-42e1-a4a1-d3de75338093.jpg?width=800,product_images/Carina Basic Sleeveless TShirt.jpg,fashion,Noon
LIFESTYLISH SL-102 Elegant leather laser slipper -Black,199,3.224,https://f.nooncdn.com/p/pzsku/ZB5025E5E0B9241C5B0F3Z/45/_/1679262378/f77af87b-02ff-48ae-bcde-f02f1715e193.jpg?width=800,product_images/LIFESTYLISH SL102 Elegant leather laser slipper Bl.jpg,fashion,Noon
trendyol Black Bodycon Pleated Knitted Short Elegant Evening Night Graduation Dress,738,0.0,No Image,No Image,fashion,Noon
Clue Basic Top with Short Sleeves,360,4.62,No Image,No Image,fashion,Noon
Clue Wide-Leg Textured Pants,825,5.01,No Image,No Image,fashion,Noon
SHEINTropical Print Off Shoulder Ruffle Trim Split Thigh Belted Dress .,"1,099",5.03,No Image,No Image,fashion,Noon
Clue Kimono with Detachable Belt,"1,200",5.01,No Image,No Image,fashion,Noon
Clue Kimono in Elastic Cuffs,780,4.22,No Image,No Image,fashion,Noon
ICE CLUB Plain Zipped Ankle Boots - Black,"1,149",5.01,No Image,No Image,fashion,Noon
Clue Strapless Cropped Ribbed Top,224,5.03,No Image,No Image,fashion,Noon
Milk® Women Midi Underwear  Bundle of 3 Basic Colored,265,4.226,No Image,No Image,fashion,Noon
"Premium Cotton Modal ""Sponge"" Hijab - Soft & Non-Slip Headscarf",259,5.011,No Image,No Image,fashion,Noon
trendyol women Dress,"1,234",0.0,No Image,No Image,fashion,Noon
trendyol Beige Leopard Print Midi Woven Dress,866,5.01,No Image,No Image,fashion,Noon
trendyol Black Open Shoulder Carmen Bodycone/Fitted Stretchy Mini Knitted Dress,"1,104",0.0,No Image,No Image,fashion,Noon
Clue Round Neck Crop Top,320,5.02,No Image,No Image,fashion,Noon
"kady Jamila Women One Shoulder Texture Short Dress ,navy-XXL",180,5.01,No Image,No Image,fashion,Noon
Clue Casual Chic Denim Pants,"1,120",5.02,https://f.nooncdn.com/p/pzsku/Z92ED6270CAA55AC2B4D8Z/45/1745845749/1618da52-180b-4a49-a38d-91c21dae7c28.jpg?width=800,product_images/Clue Casual Chic Denim Pants.jpg,fashion,Noon
trendyol Black Single Sleeve Stone Accessory Detailed Stylish Short Evening Night Graduation Dress,969,5.01,https://f.nooncdn.com/p/pzsku/Z8990D5B0C252356FF1E5Z/45/1757858721/35394e7c-524d-4d11-bb5f-1316e1041034.jpg?width=800,product_images/trendyol Black Single Sleeve Stone Accessory Detai.jpg,fashion,Noon
Carina Palm Printed Cardigan,935,5.03,https://f.nooncdn.com/p/pzsku/ZBE264B64F876F7B124DCZ/45/1746611688/6f97f354-316e-4e6d-bb87-189164fd7d7a.jpg?width=800,product_images/Carina Palm Printed Cardigan.jpg,fashion,Noon
"kady Jamila Women Self Pattern Dress with Adjustable Belt ,brown-XXL",240,5.01,https://f.nooncdn.com/p/pzsku/Z4258D115D3761F9B8F67Z/45/1760387479/7dd67d7f-83ba-4063-837d-0deb58dc55b1.jpg?width=800,product_images/kady Jamila Women Self Pattern Dress with Adjustab.jpg,fashion,Noon
trendyol Black Color Block Accessory Detailed Maxi Crepe Knitted Dress,"1,169",0.0,https://f.nooncdn.com/p/pzsku/Z4636D333CD27AEAF4E29Z/45/1767014151/d317dad5-6ce4-430e-9ea5-37a093f6fdd2.jpg?width=800,product_images/trendyol Black Color Block Accessory Detailed Maxi.jpg,fashion,Noon
Carina Classic Long Sleeves Blazer,"1,045",5.02,https://f.nooncdn.com/p/pzsku/Z169BA2412BAC686123B7Z/45/1746611671/f3807250-8d4d-4a2c-8c17-0dca372044f7.jpg?width=800,product_images/Carina Classic Long Sleeves Blazer.jpg,fashion,Noon
trendyol Black Fish Cut Accessory Detailed Woven Long Elegant Evening Night Graduation Dress,"1,010",0.0,https://f.nooncdn.com/p/pzsku/Z9ADF5701C79A37338FFAZ/45/1756368242/ca826db5-2305-4986-8ce3-55ed7ab9f65e.jpg?width=800,product_images/trendyol Black Fish Cut Accessory Detailed Woven L.jpg,fashion,Noon
Carina Soft Bra with Keyhole Design,528,5.01,https://f.nooncdn.com/p/pzsku/Z2FE419AD4B44A07151D7Z/45/_/1772324319/e77ab9d8-75ca-4f59-8fdb-54292889722c.jpg?width=800,product_images/Carina Soft Bra with Keyhole Design.jpg,fashion,Noon
Carina Sleeveless Dress with Back Slit,495,4.35,https://f.nooncdn.com/p/pzsku/ZE8FAED10331D8D8794F2Z/45/1745396057/92aad1e4-b1e4-4e57-ae5c-95d1357a8118.jpg?width=800,product_images/Carina Sleeveless Dress with Back Slit.jpg,fashion,Noon
ONLY Womens Athena Life 3/4 Short Dress Woven,752,0.0,https://f.nooncdn.com/p/pzsku/Z86AF395DAEFE4186EA99Z/45/1747657758/a0807f9f-01cf-4ffb-ae2c-bdd25e1200a9.jpg?width=800,product_images/ONLY Womens Athena Life 34 Short Dress Woven.jpg,fashion,Noon
Clue V-Collared Neck Shirt Dress,780,5.02,https://f.nooncdn.com/p/pzsku/Z22F0D97B3C38B9B6EF18Z/45/1745845744/381eff09-2e5a-43a0-8a70-0db36fd27328.jpg?width=800,product_images/Clue VCollared Neck Shirt Dress.jpg,fashion,Noon
Milk Pack of 3 Printed Cotton High Brief Panties Underwear for Women,345,4.521,https://f.nooncdn.com/p/pzsku/Z6D5C93EBBCD318083482Z/45/_/1721998789/e5133e6d-32c8-443e-ab4d-5caf030141f5.jpg?width=800,product_images/Milk Pack of 3 Printed Cotton High Brief Panties U.jpg,fashion,Noon
trendyol Black Polka Dot A-Cut Midi Strap Satin Woven Dress,873,5.01,https://f.nooncdn.com/p/pzsku/ZBCC37E71B04F6ABF5CE8Z/45/1749698425/0905d773-6f0a-44f1-abf2-f7be1bb6bc0d.jpg?width=800,product_images/trendyol Black Polka Dot ACut Midi Strap Satin Wov.jpg,fashion,Noon
Tobay Maternity skinny jeans – full belly support – ultimate all-day comfort – stylish and modern design – perfect for everyday wear,970,5.02,https://f.nooncdn.com/p/pzsku/ZB1965EBE4AC9C3A507B6Z/45/1763890816/9143207a-78f1-47ed-ab98-55735823c26e.jpg?width=800,product_images/Tobay Maternity skinny jeans  full belly support  .jpg,fashion,Noon
trendyol Black A-Line Bow Detailed Woven Elegant Evening Night Graduation Dress,901,5.01,https://f.nooncdn.com/p/pzsku/ZC782318EB3FB05EFD259Z/45/1760617822/2afef380-72cd-42d5-85d3-c0d1dc659d62.jpg?width=800,product_images/trendyol Black ALine Bow Detailed Woven Elegant Ev.jpg,fashion,Noon
trendyol Black High Waist Wide Leg Jeans TWOAW25JE00089,"2,299",5.02,https://f.nooncdn.com/p/pzsku/ZB50B9FC69F332E1CA6E9Z/45/_/1739718383/a42dcbc0-e1a9-4b89-b3e5-86aae7227de1.jpg?width=800,product_images/trendyol Black High Waist Wide Leg Jeans TWOAW25JE.jpg,fashion,Noon
trendyol Black Bodycon Strapless Woven Short Elegant Chic Evening Dress Graduation Dress,844,0.0,https://f.nooncdn.com/p/pzsku/Z652B82D2A3D90C8F611EZ/45/1757858733/b3239e34-5ab3-47a8-8280-c68c990f0366.jpg?width=800,product_images/trendyol Black Bodycon Strapless Woven Short Elega.jpg,fashion,Noon
trendyol Woman Dress Black,"1,234",5.01,https://f.nooncdn.com/p/pzsku/Z09CD81AE6599D94D450DZ/45/1767014653/b47b2500-4639-4326-baaf-a41f56774036.jpg?width=800,product_images/trendyol Woman Dress Black.jpg,fashion,Noon
LIFESTYLISH SN-502 Sandel Heel Crystal Material Leather - White,399,3.735,No Image,No Image,fashion,Noon
Carina Slim Dress with Back Slit,550,5.02,No Image,No Image,fashion,Noon
SunSet Formal Legane Vest For Women - Color Black,"1,400",3.98,No Image,No Image,fashion,Noon
Karma® Women’s Essential Briefs (Thin Waistband) – Pack of 3 Printed Designs,195,5.06,https://f.nooncdn.com/p/pzsku/ZE763BB0693D4C72E3C17Z/45/_/1774202912/d448a6d6-2fd0-4323-9342-f5e0d877fca6.jpg?width=800,product_images/Karma Womens Essential Briefs Thin Waistband  Pack.jpg,fashion,Noon
trendyol Black Cotton Blend Maxi Woven Dress with Open Waist Skirt,721,5.01,No Image,No Image,fashion,Noon
LIFESTYLISH Ankle Boot Heels Suede And Leather - Black R-17,768,4.412,No Image,No Image,fashion,Noon
American Eagle AE Stretch High-Rise Kick Boot Trouser,"1,155",5.04,No Image,No Image,fashion,Noon
