name,price,rating,image_url,image_path,category,source
"Edna Royal Crepe Material Consists of 3 Pieces Model 9045 , Light Beige","1,105",0.0,https://f.nooncdn.com/p/pzsku/ZD7F94001A078488AD1E0Z/45/_/1772281571/6e47ee8c-df27-477e-a6d1-7c2f1f0bfce2.jpg?width=800,product_images/Edna Royal Crepe Material Consists of 3 Pieces Mod.jpg,fashion,Noon
Kiabi Skinny Stretch Trousers - 5 Pockets - L30,"1,799",0.0,https://f.nooncdn.com/p/d817477656b654a382824ea4509d6431|pzsku/Z6886EC050BC25BEBE748Z/45/1770565368/030c898d-8338-45c3-8225-9a70b6bdd50d.jpg?width=800,product_images/Kiabi Skinny Stretch Trousers  5 Pockets  L30.jpg,fashion,Noon
Elegant Women's Square Watch - Golden Stainless Steel Strap with Royal Black Dial & Colorful Gems,550,0.0,https://f.nooncdn.com/p/pzsku/Z58FC57083068C822E51BZ/45/1768048113/e12ec677-c965-4565-94d6-2d389fd365b0.jpg?width=800,product_images/Elegant Womens Square Watch  Golden Stainless Stee.jpg,fashion,Noon
Printed Modal Cotton Hijab – Marble Pattern in Grey & White – Soft & Lightweight,330,0.0,https://f.nooncdn.com/p/793f8293c9d658ad85e91ec982db89bc|pzsku/Z73D7B96E80CEF59A8B9CZ/45/1769371767/32f02c1b-e79a-41a9-8ebe-fd2700fda38d.jpg?width=800,product_images/Printed Modal Cotton Hijab  Marble Pattern in Grey.jpg,fashion,Noon
Samoon Wide Leg Formal Trousers,"3,060",0.0,https://f.nooncdn.com/p/pzsku/ZBDFA8DF62038D4975C96Z/45/_/1733906867/62e20823-c570-4c23-a3a2-291abbb79a2f.jpg?width=800,product_images/Samoon Wide Leg Formal Trousers.jpg,fashion,Noon
FOREVER 21 Halter Neck Blouse,760,0.0,https://f.nooncdn.com/p/pzsku/ZFC431C0E2614A986321DZ/45/1751124469/b81e0ef4-064a-45b1-b6fb-8902a8a02e35.jpg?width=800,product_images/FOREVER 21 Halter Neck Blouse.jpg,fashion,Noon
Fatah Dark Sky Blue Plain Chiffon Hijab Fatah - All-Season Companion with Elegant Laser Finish,360,0.0,https://f.nooncdn.com/p/pzsku/ZFFA2A719AACCFA23CBEAZ/45/1763233002/f3729a31-33fb-42b0-a514-6d1ae5e0c873.jpg?width=800,product_images/Fatah Dark Sky Blue Plain Chiffon Hijab Fatah  All.jpg,fashion,Noon
Stylish women's slippers with a modern design and comfortable cushioned sole – lightweight and ideal for everyday wear and summer trips – suitable for all occasions,650,0.0,https://f.nooncdn.com/p/pzsku/ZA8107F1A20EC34D53892Z/45/_/1775398621/073f8386-f603-4238-ad7d-48f22765f240.jpg?width=800,product_images/Stylish womens slippers with a modern design and c.jpg,fashion,Noon
Cartier Women’s Gold-Tone Stainless Steel Watch with White Dial and Roman Numerals,"1,750",0.0,https://f.nooncdn.com/p/pzsku/ZDE69878EB0F7BC75619DZ/45/1765778358/c0f83e70-b5a5-4e17-a041-772103ac51ca.jpg?width=800,product_images/Cartier Womens GoldTone Stainless Steel Watch with.jpg,fashion,Noon
IBSO Casual Watch for Women -Analog- Quartz - Silver stainless steel Band - IBM28,"1,365",0.0,https://f.nooncdn.com/p/pzsku/Z8CD16D555B67883A7DE5Z/45/1753015787/31d50d52-7dd8-4395-aedf-c683a0b848b9.jpg?width=800,product_images/IBSO Casual Watch for Women Analog Quartz  Silver .jpg,fashion,Noon
Patek Philippe Ladies Diamond Bezel Stainless Steel Watch by Patek Philippe – Silver,"2,200",0.0,https://f.nooncdn.com/p/22f39b88a4be5577ba25347327719496|pzsku/Z065FA2E11856367A63ADZ/45/1768785552/8d044a5f-a9b9-45e3-8f3c-69b8e900693d.jpg?width=800,product_images/Patek Philippe Ladies Diamond Bezel Stainless Stee.jpg,fashion,Noon
FOREVER 21 Star Snap Hair Clip Set - 4 pack,215,0.0,https://f.nooncdn.com/p/pzsku/ZF57E3C97FAE6AF12B1B1Z/45/1751124239/fefce514-cb38-4ae5-94fb-841638689cca.jpg?width=800,product_images/FOREVER 21 Star Snap Hair Clip Set  4 pack.jpg,fashion,Noon
"ESPRIT Women's Silver Stainless Steel Watch, Champagne Dial|ES1L314M0135","7,600",0.0,No Image,No Image,fashion,Noon
Elegant Women’s Watch with Silver Metal Strap and Black Dial Featuring Roman Numerals with Day & Date Indicator – Classic Quartz Movement Design,550,0.0,No Image,No Image,fashion,Noon
FOREVER 21 Bow Straight Sweatpants,920,0.0,No Image,No Image,fashion,Noon
Onlyou Women's Quartz Wrist Watch – Silver Stainless Steel Strap – Rectangular Design – Suitable for Daily Use,305,0.0,No Image,No Image,fashion,Noon
FOREVER 21 Bodycon Midi Sweater Dress,"1,040",0.0,No Image,No Image,fashion,Noon
promod EMILE high-waist jeans,"1,070",0.0,No Image,No Image,fashion,Noon
"ESPRIT Women's Black Leather Watch, Black Dial|ES1L292L0035","7,000",0.0,No Image,No Image,fashion,Noon
"ESPRIT Women's Black Leather Watch, Silver Dial|ES1L179L0035","7,800",0.0,No Image,No Image,fashion,Noon
"Wide leg maternity jeans – a relaxed, comfortable fit, flexible belly support, and a stylish, casual design suitable for all stages of pregnancy.","1,370",0.0,No Image,No Image,fashion,Noon
"ESPRIT Women's Silver Stainless Steel Watch, Silver Dial|ES1L246M0045","7,700",0.0,No Image,No Image,fashion,Noon
"Edna Royal Crepe Material Consists of 2 Pieces Model 8109 , 3nabi","1,105",0.0,No Image,No Image,fashion,Noon
Geneva Women’s Two-Tone Stainless Steel Watch with Turquoise Blue Dial – Gold & Silver Elegant Analog Wristwatch,"1,950",0.0,No Image,No Image,fashion,Noon
"Edna Royal Crepe Material Consists of 3 Pieces Model 7059 , Black * Dark Beige","1,050",0.0,No Image,No Image,fashion,Noon
"Edna Royal Crepe Material Consists of 4 Pieces Model 9097 , Zytuny","1,105",0.0,No Image,No Image,fashion,Noon
FOREVER 21 Tortoiseshell Hair Tie,240,0.0,No Image,No Image,fashion,Noon
شي إن ساعة سيليكون نسائية أنيقة,550,0.0,No Image,No Image,fashion,Noon
PIERRE CARDIN Women's Watch with Silver Stainless Steel Case and Silver Stainless Steel Band,"10,650",0.0,No Image,No Image,fashion,Noon
"ESPRIT Women's Black Leather Watch, Silver Dial|ES1L276L1035","7,100",0.0,No Image,No Image,fashion,Noon
Onlyou Women's Quartz Wrist Watch – Silver Stainless Steel Strap – Square Design – Suitable for Daily Use,305,0.0,No Image,No Image,fashion,Noon
PIERRE CARDIN Women's Watch with Black Stainless Steel Case and Black Leather Band,"11,300",0.0,No Image,No Image,fashion,Noon
Urban Jewel Heart Bow Coquette Earrings,325,0.0,No Image,No Image,fashion,Noon
FOSSIL Women's Cecile Multi-Function Water Resistant Analog Watch AM4522,"7,900",0.0,No Image,No Image,fashion,Noon
"ESPRIT Women's Black Leather Watch, Silver Dial|ES1L310L0035","7,600",0.0,https://f.nooncdn.com/p/pzsku/ZBB6378845A4138E86992Z/45/1766581514/caf89e67-85dc-475f-a2ae-b1721141d4c1.jpg?width=800,product_images/ESPRIT Womens Black Leather Watch Silver DialES1L3.jpg,fashion,Noon
IBSO IBL22 Classic Women's Watch – Black  Leather Strap – Elegant Analog Design – Two-Hand Quartz Movement,"1,010",0.0,https://f.nooncdn.com/p/dbe9cf2ba2355f3292f4993f3ac4ad82|pzsku/ZE6C62808A1C7975EF154Z/45/1769940694/e6b6117a-735b-4cf4-a26a-75a5275d82d4.jpg?width=800,product_images/IBSO IBL22 Classic Womens Watch  Black  Leather St.jpg,fashion,Noon
"Abaya For Receptions, Morning Wear, And Special Occasions Chiffon Material Consists of 3 Pieces , Model 527 , White","1,345",0.0,https://f.nooncdn.com/p/pzsku/ZA2C83288E1A1805160FFZ/45/_/1771842862/6b468c91-f75b-4835-97f2-4134acbaa1e3.jpg?width=800,product_images/Abaya For Receptions Morning Wear And Special Occa.jpg,fashion,Noon
"Edna Royal Crepe Material Consists of 3 Pieces Model 7047 , Burgundy",910,0.0,https://f.nooncdn.com/p/pzsku/ZB866E98A0AFE881DB5A1Z/45/1762189991/c1a488fb-2256-48f4-b5d9-4826dcf89e44.jpg?width=800,product_images/Edna Royal Crepe Material Consists of 3 Pieces Mod.jpg,fashion,Noon
Patek Philippe Ladies Gold Stainless Steel Watch with Diamond Bezel by Patek Philippe,"2,200",0.0,https://f.nooncdn.com/p/22f39b88a4be5577ba25347327719496|pzsku/Z3012B70E91253169A181Z/45/1768785399/c8286fea-2676-472d-a1cb-e592e76d44b7.jpg?width=800,product_images/Patek Philippe Ladies Gold Stainless Steel Watch w.jpg,fashion,Noon
LIFESTYLISH Boot Heels Leather Ornament R-4 - Havan,349,0.0,https://f.nooncdn.com/p/pzsku/Z5E85963B23708B4DE13CZ/45/1764690535/db312a60-f546-4ec0-a3d4-6aed033e3029.jpg?width=800,product_images/LIFESTYLISH Boot Heels Leather Ornament R4  Havan.jpg,fashion,Noon
"ESPRIT Women's Beige Leather Watch, Silver Dial|ES1L276L0025","7,000",0.0,https://f.nooncdn.com/p/pzsku/ZBC319251E43A25DF01D1Z/45/1766581502/730747cd-c1fe-4517-8aa6-1068a970ce36.jpg?width=800,product_images/ESPRIT Womens Beige Leather Watch Silver DialES1L2.jpg,fashion,Noon
Women's printed crepe chiffon hijab,340,0.0,https://f.nooncdn.com/p/793f8293c9d658ad85e91ec982db89bc|pzsku/ZA62094805DFC0A6AEC76Z/45/1769804973/6adc4920-081d-4b2f-885b-2a5db34eb2b7.jpg?width=800,product_images/Womens printed crepe chiffon hijab.jpg,fashion,Noon
Emporio Armani Sinfonia AR11706 Women’s Quartz Watch White Mother of Pearl Dial Silver Stainless Steel 34mm,"4,200",0.0,https://f.nooncdn.com/p/pzsku/Z6557C9F2B6EEE6D19DC1Z/45/_/1771422729/17c472bb-4fa8-4ef0-9c57-400565fba8df.jpg?width=800,product_images/Emporio Armani Sinfonia AR11706 Womens Quartz Watc.jpg,fashion,Noon
DESIGUAL Mickey™ culotte jeans,"4,100",0.0,https://f.nooncdn.com/p/pzsku/Z0375334D96CA59C777ECZ/45/1765306610/020d41e6-83c6-41a5-930b-eb7f8d05cd88.jpg?width=800,product_images/DESIGUAL Mickey culotte jeans.jpg,fashion,Noon
GUCCI Women’s Square Quartz Watch with Two-Tone Stainless Steel Bracelet & Crystal Bezel,"1,250",0.0,https://f.nooncdn.com/p/pzsku/Z584ACD6BD32BFD20FF5FZ/45/1768229134/8e022181-490d-4575-ac75-deed7d1d0d20.jpg?width=800,product_images/GUCCI Womens Square Quartz Watch with TwoTone Stai.jpg,fashion,Noon
BOSS Hugo Boss Watch For Women 1502730,"3,799",0.0,https://f.nooncdn.com/p/pzsku/Z5CC361E58A42FC0ED37EZ/45/_/1738593926/b1357932-919d-44e2-858a-4a0c682e3142.jpg?width=800,product_images/BOSS Hugo Boss Watch For Women 1502730.jpg,fashion,Noon
Tobay Elegance doesn't stop with  pregnancy: Supportive skinny pants that highlight the beauty of your figure with complete comfort!,970,0.0,https://f.nooncdn.com/p/pzsku/Z4CAA73EFDF4D872D295DZ/45/1761747430/a9e2ed0f-8361-4626-a852-c76e3d752e7f.jpg?width=800,product_images/Tobay Elegance doesnt stop with  pregnancy Support.jpg,fashion,Noon
Libra Sport Chiffon Dress - White,790,0.0,https://f.nooncdn.com/p/pzsku/ZBBEA1F32B65DEB90F9BDZ/45/1759650147/c1e5d369-268d-47ad-b84f-9e3b5441ec01.jpg?width=800,product_images/Libra Sport Chiffon Dress  White.jpg,fashion,Noon
Citizen Style Women's Analog Watch – Gold Dial with Two-Tone Stainless Steel Strap (Silver/Gold),"2,250",0.0,https://f.nooncdn.com/p/pzsku/Z8B9D605B9F6B56756642Z/45/_/1772996070/ea3290e9-3feb-4b01-ab14-8fcd6d0d45ab.jpg?width=800,product_images/Citizen Style Womens Analog Watch  Gold Dial with .jpg,fashion,Noon
PIERRE CARDIN Women's Watch with Gold Stainless Steel Case and Gold Stainless Steel Band,"11,300",0.0,https://f.nooncdn.com/p/pzsku/ZCD2489FA996E7937CEA8Z/45/1766832681/035b8907-0fa7-42b4-95d7-a89e32ab4cdd.jpg?width=800,product_images/PIERRE CARDIN Womens Watch with Gold Stainless Ste.jpg,fashion,Noon
"Edna Royal crepe material Consists of 3 pieces , Model 9050 , Black",965,0.0,https://f.nooncdn.com/p/pzsku/ZEB4B84B103A1DFCCA5A6Z/45/_/1772881715/eba7e5e8-bb1e-4e9b-9416-3870ff89c3b7.jpg?width=800,product_images/Edna Royal crepe material Consists of 3 pieces  Mo.jpg,fashion,Noon
FOREVER 21 Smooth Geo Hoop Earrings,240,0.0,https://f.nooncdn.com/p/pzsku/Z7557DCC5F86FB00993C7Z/45/_/1733339530/bb244d38-39fe-453c-89b2-ebc0b639a23a.jpg?width=800,product_images/FOREVER 21 Smooth Geo Hoop Earrings.jpg,fashion,Noon
Chanel Women’s Gold-Tone Stainless Steel Watch with Crystal Bezel,"1,900",0.0,https://f.nooncdn.com/p/pzsku/ZB7DBA1C47854276D7B50Z/45/1765775253/efebc1e5-688b-45cf-a692-2b8ec35de9d8.jpg?width=800,product_images/Chanel Womens GoldTone Stainless Steel Watch with .jpg,fashion,Noon
Clue Plunge Neck Ribbed Top,599.99,0.0,https://f.nooncdn.com/p/pzsku/Z1299448C0B993B0C3F43Z/45/_/1775561689/912cc92c-ce8e-41ac-9910-5b11bd8b413f.jpg?width=800,product_images/Clue Plunge Neck Ribbed Top.jpg,fashion,Noon
"The Shawl IS Made Plush With Embroidery On The Back Model 1702 , Black",380,0.0,https://f.nooncdn.com/p/80a0b7bf76135202af8e5f1d64f371b5|pzsku/ZEBF9AB9275018D6BADA2Z/45/1769610086/45d4a934-38d9-4a7b-b371-6f32bfaea120.jpg?width=800,product_images/The Shawl IS Made Plush With Embroidery On The Bac.jpg,fashion,Noon
Carina Yellow Hearts Cotton Pyjama Set,495,0.0,https://f.nooncdn.com/p/pzsku/Z663BD6B349A54C0B593BZ/45/1746611683/a323fe3a-be7a-47fa-969a-72ffcdfb7503.jpg?width=800,product_images/Carina Yellow Hearts Cotton Pyjama Set.jpg,fashion,Noon
Shein Women’s Silver Quartz Wristwatch with Textured Dial,"1,599",0.0,https://f.nooncdn.com/p/pzsku/ZAF25362D7A41E6F732EEZ/45/1765843598/a99bcb7d-1ad4-4f24-bd83-0b5c62330030.jpg?width=800,product_images/Shein Womens Silver Quartz Wristwatch with Texture.jpg,fashion,Noon
Digital Crepe Chiffon Hijab – Navy & Mauve,340,0.0,https://f.nooncdn.com/p/793f8293c9d658ad85e91ec982db89bc|pzsku/Z1548F2208613FB01E84BZ/45/1769529343/674e2cea-4ce8-4a15-9868-322c93ab0600.jpg?width=800,product_images/Digital Crepe Chiffon Hijab  Navy  Mauve.jpg,fashion,Noon
"Edna Royal Crepe Material Consists of 3 Pieces Model 8006 , Beige","1,050",0.0,https://f.nooncdn.com/p/pzsku/ZD755CCBB42F537BF6B27Z/45/1762178869/b81d5444-3079-4ca1-99ca-e60b0a492dc5.jpg?width=800,product_images/Edna Royal Crepe Material Consists of 3 Pieces Mod.jpg,fashion,Noon
Chanel Women’s Two-Tone Stainless Steel Watch with Black Dial and Crystal Bezel,"2,199",0.0,https://f.nooncdn.com/p/pzsku/ZFA856FE20F332664A8E9Z/45/1765777280/22ebb256-38b6-4441-bb23-24fd2e6abf3f.jpg?width=800,product_images/Chanel Womens TwoTone Stainless Steel Watch with B.jpg,fashion,Noon
Clue Relaxed Fit Sleeveless Dress,599.99,0.0,https://f.nooncdn.com/p/pzsku/Z45213F8860BC18BD8924Z/45/_/1775561701/3ce7fed7-9662-4864-9462-2338be6115a4.jpg?width=800,product_images/Clue Relaxed Fit Sleeveless Dress.jpg,fashion,Noon
"Abaya For Receptions, Morning Wear, And Special Occasions Chiffon Material Consists of 3 Pieces , Model 523 , Simon","1,205",0.0,https://f.nooncdn.com/p/pzsku/Z385FD4D811C207E3DECBZ/45/_/1771842873/39b85f7e-5e8c-4558-8705-41f4afab5a33.jpg?width=800,product_images/Abaya For Receptions Morning Wear And Special Occa.jpg,fashion,Noon
Rolex Two-Tone Square Women’s Watch with Black Dial and Crystal Hour Markers,"1,550",0.0,https://f.nooncdn.com/p/pzsku/Z05E9CBEF94321B4BE897Z/45/_/1771802404/2625f36c-3f58-4cc2-97eb-17f92c4941d2.jpg?width=800,product_images/Rolex TwoTone Square Womens Watch with Black Dial .jpg,fashion,Noon
"ESPRIT Women's Gold Stainless Steel Watch, Silver Dial|ES1L228M2045","9,200",0.0,https://f.nooncdn.com/p/pzsku/ZD0C3D508FF923854576AZ/45/1766581493/0ec7cc64-b344-495f-ba97-5f4a9da52291.jpg?width=800,product_images/ESPRIT Womens Gold Stainless Steel Watch Silver Di.jpg,fashion,Noon
Carina Colored Midi Length Kimono,880,0.0,https://f.nooncdn.com/p/pzsku/Z99F10EDC1AB1BB1A1D24Z/45/1746611665/3eef4643-b059-461c-8ee7-44128196b93d.jpg?width=800,product_images/Carina Colored Midi Length Kimono.jpg,fashion,Noon
Casio Women'S Black Dial Stainless Steel Band Watch LTP-V300D-2A2UDF,"3,140",0.0,https://f.nooncdn.com/p/pzsku/Z2D61D989216140FC1FBBZ/45/_/1727015594/7a1c362f-5d2e-472c-8231-60aae17be84b.jpg?width=800,product_images/Casio WomenS Black Dial Stainless Steel Band Watch.jpg,fashion,Noon
"Edna Royal crepe material Consists of 3 pieces , Model 7066 , Burgundy","1,050",0.0,https://f.nooncdn.com/p/pzsku/Z11E6089C351C2A46E477Z/45/_/1772881781/f129b83b-f473-4420-972b-a85b79fc753d.jpg?width=800,product_images/Edna Royal crepe material Consists of 3 pieces  Mo.jpg,fashion,Noon
"ESPRIT Women's Silver Stainless Steel Watch, Silver Dial|ES1L314M0105","7,000",0.0,https://f.nooncdn.com/p/pzsku/ZA32FEE3E1F9B9B7CED01Z/45/1766581520/6adc147a-3564-46fc-990e-ef7578c622b0.jpg?width=800,product_images/ESPRIT Womens Silver Stainless Steel Watch Silver .jpg,fashion,Noon
FOREVER 21 Distressed Mid-Rise Baggy Jeans,"1,200",0.0,https://f.nooncdn.com/p/pzsku/Z4C3595BF878E8E6FF2EAZ/45/1751124475/38746ad1-0355-4590-ae40-570949509665.jpg?width=800,product_images/FOREVER 21 Distressed MidRise Baggy Jeans.jpg,fashion,Noon
LIFESTYLISH Mules Leather Elegant SB-700 - Black,666,0.0,https://f.nooncdn.com/p/b2ce688c894b5ce59067f2f338ab3385|pzsku/Z5CBBAA0A755DBFB23454Z/45/1771329336/af487616-fe6e-46b6-84c7-9a4914cdd73f.jpg?width=800,product_images/LIFESTYLISH Mules Leather Elegant SB700  Black.jpg,fashion,Noon
"Casio Women's Quartz Watch, Analog Display and Stainless Steel Strap LTP-VT01L-7B2UDF","2,279",0.0,https://f.nooncdn.com/p/pzsku/Z9A62A21320824A342190Z/45/_/1730130652/dca3b34b-93a0-4929-8c73-5634b084450b.jpg?width=800,product_images/Casio Womens Quartz Watch Analog Display and Stain.jpg,fashion,Noon
"A shawl with simple and elegant embroidery and design, made of velvet - Black",380,0.0,https://f.nooncdn.com/p/pzsku/Z52D88DA1ED58A32D4058Z/45/1768309380/3eaac875-5006-4ac2-8e67-87db6e25ec6c.jpg?width=800,product_images/A shawl with simple and elegant embroidery and des.jpg,fashion,Noon
Clue Asymmetrical Long Sleeve T-Shirt,849.99,0.0,https://f.nooncdn.com/p/pzsku/Z6F82CF79F7EBFF950D74Z/45/_/1775561728/bc310090-6c1f-40ef-8c9d-c4c3b4c7fb27.jpg?width=800,product_images/Clue Asymmetrical Long Sleeve TShirt.jpg,fashion,Noon
Women's slide-style slippers adorned with metal studs – a modern and comfortable design for outings and walks,650,0.0,https://f.nooncdn.com/p/pzsku/Z8A09AB7B28D2E2690FB3Z/45/_/1772112003/4418146d-2f24-4583-abbb-cae72316c93e.jpg?width=800,product_images/Womens slidestyle slippers adorned with metal stud.jpg,fashion,Noon
"Basic, elegant and beautiful long sleeves",670,0.0,https://f.nooncdn.com/p/pzsku/Z0FD8CB70D0DACB35543FZ/45/_/1739913689/df6e6eec-a4cc-459d-b73b-927c748e4ce6.jpg?width=800,product_images/Basic elegant and beautiful long sleeves.jpg,fashion,Noon
Kiabi Straight Jogger,"1,099",0.0,https://f.nooncdn.com/p/d817477656b654a382824ea4509d6431|pzsku/Z92B73FC9B5F863C5DBD9Z/45/1770565377/c9668976-956c-4bb9-b1ab-7b146cc7c032.jpg?width=800,product_images/Kiabi Straight Jogger.jpg,fashion,Noon
"Edna Royal Crepe Material Consists of 1 Pieces Model 8014 , 3nabi",870,0.0,https://f.nooncdn.com/p/pzsku/ZF303E32F8C27B0E51CEAZ/45/1762871264/18292fbd-bad5-4310-aaa1-e71d5f2e2021.jpg?width=800,product_images/Edna Royal Crepe Material Consists of 1 Pieces Mod.jpg,fashion,Noon
Kiabi Large Printed Scarf - Leopard,799,0.0,https://f.nooncdn.com/p/d817477656b654a382824ea4509d6431|pzsku/ZBDE26C1BA18DA1100FD7Z/45/1770565366/d397f710-7d38-4a76-ae3b-5da3faebd340.jpg?width=800,product_images/Kiabi Large Printed Scarf  Leopard.jpg,fashion,Noon
"Stylish women's slippers with a transparent strap and crystal details, square toe, comfortable flat sole – modern design",450,0.0,https://f.nooncdn.com/p/pzsku/Z989F42694ADD11B07BDFZ/45/_/1772110925/9201f6ac-4051-457a-8165-95d547594a3e.jpg?width=800,product_images/Stylish womens slippers with a transparent strap a.jpg,fashion,Noon
"Leffora ""Enjoy elegance and simplicity with this wide fabric hat. """,312,0.0,https://f.nooncdn.com/p/pzsku/ZA9402BF829DF430BB7CBZ/45/1753964682/7690a13f-39fc-4634-806f-7a559acebf66.jpg?width=800,product_images/Leffora Enjoy elegance and simplicity with this wi.jpg,fashion,Noon
Clue Jeans with Asymmetrical Belt,"1,900",0.0,https://f.nooncdn.com/p/pzsku/Z83812A31BAA33BADD211Z/45/_/1775561728/a483162d-726f-49e7-8f5f-09c5e24927d0.jpg?width=800,product_images/Clue Jeans with Asymmetrical Belt.jpg,fashion,Noon
لايف ستيلاش  سابوه  جلد لامع أنيق SB-701 - بيج,833,0.0,https://f.nooncdn.com/p/pzsku/ZF7D3DE49E56959B4516AZ/45/_/1772022502/bf0bcc8d-5d4b-4b61-ac7a-a4fa25703507.jpg?width=800,product_images/لايف ستيلاش  سابوه  جلد لامع أنيق SB701  بيج.jpg,fashion,Noon
Hanady Women's wide-leg pants in a light and comfortable fabric with a modern design for everyday use.,"1,100",0.0,https://f.nooncdn.com/p/pzsku/ZD6E6ABEFC9C7353B5576Z/45/1749979937/501680d2-211a-4abb-b4b9-965892fd99ae.jpg?width=800,product_images/Hanady Womens wideleg pants in a light and comfort.jpg,fashion,Noon
La Vie en Rose Bow & Ruched Cotton Boyshort Panty,900,0.0,https://f.nooncdn.com/p/pzsku/Z449C6787642A41BDA6DAZ/45/_/1775391426/bed3926b-97b2-4226-8dc3-bef61edd5088.jpg?width=800,product_images/La Vie en Rose Bow  Ruched Cotton Boyshort Panty.jpg,fashion,Noon
"The Shawl IS Made Plush With Embroidery On The Back Model 1707 , Black",380,0.0,https://f.nooncdn.com/p/80a0b7bf76135202af8e5f1d64f371b5|pzsku/Z2A7CFD1B9E8650A53895Z/45/1769608234/b0f826b4-4eee-4cc0-a9c8-2556627c1dbe.jpg?width=800,product_images/The Shawl IS Made Plush With Embroidery On The Bac.jpg,fashion,Noon
IBSO casual Watch for Women -Analog- Quartz - Silver stainless steel Band,"1,370",0.0,https://f.nooncdn.com/p/pzsku/ZCC2768785F9E21792786Z/45/1753180291/fdd6f80c-0562-49fd-b426-3e6a744d09e0.jpg?width=800,product_images/IBSO casual Watch for Women Analog Quartz  Silver .jpg,fashion,Noon
FLOWER Signature Timeless Luxury Ultra Soft Breathable Pure Cotton Modal Veil With Elegant Smooth Finish Black 80x200cm,226,0.0,https://f.nooncdn.com/p/pzsku/ZB22D30515B8CF4BEC5D1Z/45/1766840662/bd189e53-6822-4927-b33a-c9e4e83e5e81.jpg?width=800,product_images/FLOWER Signature Timeless Luxury Ultra Soft Breath.jpg,fashion,Noon
cloud Straight Jeans,"1,234",0.0,https://f.nooncdn.com/p/0638a056f32451e18244643f22824952|pzsku/ZE01A39D40545A9671EA3Z/45/1769016318/921cdf2d-b26f-4e7e-94d8-5c79cc9adcbf.jpg?width=800,product_images/cloud Straight Jeans.jpg,fashion,Noon
Clue Heart Prints Top,560,0.0,https://f.nooncdn.com/p/pzsku/Z329441B996AD089EFE01Z/45/1745845883/74f77348-9ce0-4e68-b6f7-73da8224bffa.jpg?width=800,product_images/Clue Heart Prints Top.jpg,fashion,Noon
"Casio LTP-V009D-1EUDF Women's Rectangular Petite Stainless Steel Black Dial Dress Watch, gold","2,999",0.0,No Image,No Image,fashion,Noon
"The Shawl IS Made Plush With Embroidery On The Back Model 1713 , Black",380,0.0,No Image,No Image,fashion,Noon
Casual Easy New Fashion Shoes,575,0.0,No Image,No Image,fashion,Noon
Classic Women's Wristwatch with Gold  Silver  Stainless Steel Strap - Rust-Resistant & Elegant.,550,0.0,No Image,No Image,fashion,Noon
Lingerie Dress C1,899,0.0,No Image,No Image,fashion,Noon
Kiabi High-Waisted Control Briefs,699,0.0,No Image,No Image,fashion,Noon
Clue Flowy High-Waist Pants,750,0.0,No Image,No Image,fashion,Noon
FOREVER 21 Faux Pearl Chain Drop Earrings,240,0.0,No Image,No Image,fashion,Noon
Feather Earrings,55,0.0,No Image,No Image,fashion,Noon
La Vie en Rose Modal Boyshort Panty,900,0.0,No Image,No Image,fashion,Noon
Clue V-Neck Tencel Blouse,600,0.0,No Image,No Image,fashion,Noon
Clue Patchwork Hooded Kimono,"1,500",0.0,No Image,No Image,fashion,Noon
Clue Sleeveless Tencel Vest,720,0.0,No Image,No Image,fashion,Noon
JEWELED CROWN Cotton Pantacourt Legging- Black,245,5.01,No Image,No Image,fashion,Noon
حذاء لوفر كاجوال رائع -اسود,850,4.01,No Image,No Image,fashion,Noon
Cartier Women’s Two-Tone Stainless Steel Watch with Black Dial and Roman Numeral Bezel,"1,800",0.0,No Image,No Image,fashion,Noon
Carina Satin Balloon Pants,825,0.0,No Image,No Image,fashion,Noon
Casio LTP-V005D-1B2UDF Stainless Steel Black Dial Contrast Markers Round Analog Watch for Women - Silver,"1,879",0.0,No Image,No Image,fashion,Noon
Carina Sleeveless V-Neck Blouse,275,0.0,No Image,No Image,fashion,Noon
ICE CLUB White Lace Up Flat Ankle Boots,975,0.0,No Image,No Image,fashion,Noon
"Elegant Veron Fabric Abaya – Modern Design with Integrated Waist Belt , Model 176 , Black * Gray , 4XL (90 KG)",660,0.0,https://f.nooncdn.com/p/pzsku/ZC6D10A235E1C86861AB2Z/45/_/1773761933/0ab24688-4cea-47b7-8036-26f47fd20620.jpg?width=800,product_images/Elegant Veron Fabric Abaya  Modern Design with Int.jpg,fashion,Noon
Clue Back Printed Cotton T-Shirt,420,0.0,https://f.nooncdn.com/p/pzsku/Z4174FB2A89B081E20B86Z/45/1745845874/559ded4d-f41e-4db0-a827-a2cf3174c46e.jpg?width=800,product_images/Clue Back Printed Cotton TShirt.jpg,fashion,Noon
Classic Women's Wristwatch with  Gold Stainless Steel Strap - Rust-Resistant & Elegant.,550,0.0,https://f.nooncdn.com/p/1e0d30f752665028914cf1330e32386b|pzsku/Z2795DE6D2C45585C20CCZ/45/1771087011/40d5d8bd-7bbd-41bf-a225-da34867ba72f.jpg?width=800,product_images/Classic Womens Wristwatch with  Gold Stainless Ste.jpg,fashion,Noon
Carina Boat Neck Slim Fit Top,480,0.0,https://f.nooncdn.com/p/pzsku/Z403D469DEA776F432F8BZ/45/_/1775989921/333487ad-1ed6-42db-9195-33527e5bb798.jpg?width=800,product_images/Carina Boat Neck Slim Fit Top.jpg,fashion,Noon
coachoutlet Coach Black Leather Tote Handbag for Women – Elegant Everyday Shoulder Bag,"4,199",0.0,https://f.nooncdn.com/p/a08d70036cc0568ba09d249bd6dde52a|pzsku/ZDC7DD878DE4FBC2E8760Z/45/1770714387/83310aab-e82a-4c1d-90e4-d6e39df729b4.jpg?width=800,product_images/coachoutlet Coach Black Leather Tote Handbag for W.jpg,fashion,Noon
"Nona fashion For lovers of trendy clothing and elegance, this sweatshirt is made just for you! 100% soft and comfortable cotton. A unique design that makes you stand out anywhere. Designed by Nona Fashion. Color: Gray and black, with a front zipper and hood (sizes M, L, XL). Material: 100% cotton. Limited quantity - add it to your collection today!",560,5.01,https://f.nooncdn.com/p/pzsku/Z3E8C9A05F3DA8582855FZ/45/1762541342/ec80ac5f-632c-4081-a76d-7ee3cc9b2546.jpg?width=800,product_images/Nona fashion For lovers of trendy clothing and ele.jpg,fashion,Noon
Clue Classic Solid Kimono,780,0.0,https://f.nooncdn.com/p/pzsku/ZA6BF51A824FF23624F79Z/45/1745845655/b7de2299-7ec8-499b-8858-500ed324bd7c.jpg?width=800,product_images/Clue Classic Solid Kimono.jpg,fashion,Noon
DESIGUAL Wide-leg Pink Panther jeans,"2,870",0.0,https://f.nooncdn.com/p/pzsku/ZCDEC01DEEEDB537AB1E9Z/45/_/1681899317/48ba4806-b467-402c-bea2-7c4d0e35c57b.jpg?width=800,product_images/DESIGUAL Wideleg Pink Panther jeans.jpg,fashion,Noon
Carina Relaxed Fit Basic Top,337.50,0.0,https://f.nooncdn.com/p/c629f51ed9815f3e9b7a3c234f4d230b|pzsku/Z46815DBAACF08ABC478AZ/45/1771161886/1ad3c50b-ad4c-4a71-a04c-c3001a2b3f2c.jpg?width=800,product_images/Carina Relaxed Fit Basic Top.jpg,fashion,Noon
