name,price,rating,image_url,image_path,category,source
"ANBERNIC RG552 Handheld Game Console , RK3399 Chip Dual OS Linux , Android System Support HDMI / WIFI Online Games Built-in 64G SD Card 2500 Classic Games (Black)","19,775",0.0,https://f.nooncdn.com/p/pzsku/ZDEF7342278BB5D3C5E6BZ/45/_/1772414968/d0a89de9-7711-483c-807e-b2713c62ef9c.jpg?width=800,product_images/ANBERNIC RG552 Handheld Game Console  RK3399 Chip .jpg,gaming & consoles,Noon
havit USB Gaming Keyboard,"1,499",0.0,https://f.nooncdn.com/p/v1584776204/N36142449A_1.jpg?width=800,product_images/havit USB Gaming Keyboard.jpg,gaming & consoles,Noon
"Redragon Hylas H260 RGB Gaming Headphones - Gaming Headphones with Stereo Sound - Large Earpads - Compatibility Xbox One, Nintendo Switch, PS4/5, Mac, PC or Laptop","1,050",5.01,https://f.nooncdn.com/p/pzsku/Z791BF3D424E21DFEB581Z/45/_/1773327917/03d3c601-a69e-4aef-8da5-e36c01796988.jpg?width=800,product_images/Redragon Hylas H260 RGB Gaming Headphones  Gaming .jpg,gaming & consoles,Noon
"HYPERX Cloud Mini, Wired Gaming Headset, Tuck-away Boom Microphone, Immersive Audio, Comfortable And Lightweight, Volume Level Below 85 dB, Multiplatform Compatibility, For Ages 8-12, Black | 7G8F4AA","1,798",3.313,https://f.nooncdn.com/p/pnsku/N70098368V/45/_/1742843280/93bdb78f-9158-4c67-968b-d84fd2dc7a18.jpg?width=800,product_images/HYPERX Cloud Mini Wired Gaming Headset Tuckaway Bo.jpg,gaming & consoles,Noon
"ASUS ROG Ally X Gaming (Upgraded Version) Laptop Handheld With 7-Inch Full HD Display, AMD Ryzen Z1 Extreme Processor/24GB RAM/1TB SSD/AMD Radeon Graphics/Windows 11 Home/ Black","99,000",4.825,No Image,No Image,gaming & consoles,Noon
"REDRAGON K681 CYRUS PRO edition ,Wireless RGB Gaming Keyboard 75% gasket mounted , hot Swappable Compact Mechanical Keyboard Dedicated Arrow Keys, for PC and laptop use in home and office - Black Switch","3,499",4.01,No Image,No Image,gaming & consoles,Noon
"Marvo Scorpion H8321S Gaming Headset, Stereo Sound, Flexible Omnidirectional Microphone, 40mm Audio Drivers, On-ear Volume Control, 3.5mm Connection, Black and Red",475,0.0,No Image,No Image,gaming & consoles,Noon
MI Excite Gaming PC G6MATX ECO With Core i5 14400F CPU Processor/16GB RAM DDR5 /1TB SSD/Windows 11 Pro/Nvidia GeForce RTX 3060 Graphics/ White,"61,000",5.03,No Image,No Image,gaming & consoles,Noon
FANTECH ATOM63 MK874V2 60% Gaming Mechanical Keyboard – Hot Swap BLUE Switches – 17 RGB Lighting Modes – Removable Type-C cable – 63 PBT Arabic / English Keycap | SKY BLUE,"1,299",0.0,No Image,No Image,gaming & consoles,Noon
Rwnq Screw  Paper Game suitable for family and friends gatherings. Board Games for Adults and Family  Fun Card Games and Parties  Endless Challenges and Laughter  Card Games Group Games Family Games,149,5.02,No Image,No Image,gaming & consoles,Noon
"ANBERNIC RG35XXSP Retro Flip Handheld Game Console, 3.5-inch IPS Screen, Linux H700 Video Game Player, Support Streaming WIFI Bluetooth (Transparent Black, 128G)","9,942",0.0,No Image,No Image,gaming & consoles,Noon
REDRAGON Rgb Ratri Mechanical Gaming Keyboard - Silent Black Switches - Media Control,"2,555",4.73,No Image,No Image,gaming & consoles,Noon
Philips Wired Gaming Mouse Black,345,5.01,No Image,No Image,gaming & consoles,Noon
Point GAMING MOUSE WITH LED PT-216 Point,249,0.0,No Image,No Image,gaming & consoles,Noon
"SKYLOONG GK61 PRO Wireless,Bluetooth & Wired Three Mode RGB Gaming Keyboard – Gateron Red Switch – ABS Black Case (Industrial Titanium ash)","2,999",5.02,No Image,No Image,gaming & consoles,Noon
"Game Console R36s 3.5"" IPS 640X480 - Black","3,599",0.0,No Image,No Image,gaming & consoles,Noon
"GameSir G8 Galileo Type-C Mobile Gaming Controller for Android & iPhone 15 Series (USB-C), Plug and Play Gamepad with Hall Effect Joysticks/Hall Trigger, 3.5mm Audio Jack","8,999",3.965,No Image,No Image,gaming & consoles,Noon
"Attack Shark G3PRO Wireless Gaming Mouse with Magnetic Charging Dock, PixArt PAW3311 Sensor, Up to 25000 DPI, BT/2.4Ghz/Wired, 100M Clicks, 500mAh, 59g SUPERLIGHT Mice for PC/Xbox/Mac -Berry Red & Tape","1,900",4.52,No Image,No Image,gaming & consoles,Noon
"Havit Hv-Mp860 Gaming Mousepad Features A 700X300X3Mm Premium Fine-Mesh Surface, Anti-Slip Rubber Base, Durable Edges Black",275,4.718,No Image,No Image,gaming & consoles,Noon
MI Excite Gaming PC G4MATX ECO With Core i5 13400F CPU Processor/ Nvidia GeForce RTX 4060 Graphics/  16GB RAM DDR4 /1TB SSD/ Windows 11 Pro White,"77,000",0.0,No Image,No Image,gaming & consoles,Noon
"REDRAGON EISA P047S Anime Gaming Mouse Pad - Smooth Lycra Surface, Anti-Slip Rubber Base, Spill-Resistant, Durable Thick Design, size 330x260x3mm",729,0.0,No Image,No Image,gaming & consoles,Noon
"HP (Upgraded Version) Omen 16-wd0073dx Gaming Laptop With 16.1-Inch FHD IPS 165Hz Display, Core i7-13620H Processor/16GB RAM/2TB SSD/8GB Nvidia GeForce RTX 4060 Graphics Card/Windows 11 Home Free With HP Gaming Headset / Shadow English/Arabic Shadow Black","266,000",0.0,No Image,No Image,gaming & consoles,Noon
"Gaming Mouse and Keyboard Combo – Ergonomic, Responsive, and Stylish for PC Gamers","2,300",0.0,No Image,No Image,gaming & consoles,Noon
VGN VXE Siren V1 Tri-Mode Lightweight Gaming Headset,"2,513",0.0,https://f.nooncdn.com/p/pzsku/Z4EC93A8DC4F0EA01F9BFZ/45/1756288914/0267dc29-9865-4a16-876b-1acfac47d98c.jpg?width=800,product_images/VGN VXE Siren V1 TriMode Lightweight Gaming Headse.jpg,gaming & consoles,Noon
"ASUS ROG Cetra True Wireless SpeedNova Gaming Headphones, 2.4 GHz & Bluetooth 5.3, ROG SpeedNova, 24-bit 96 kHz Audio, AI Microphones, Adaptive ANC, 46H Battery Life, Moonlight White | 90YH03Y0-BTUA10","23,875",0.0,https://f.nooncdn.com/p/pnsku/N70088392V/45/_/1719902227/368cc303-1e5c-403d-b623-8c3ff7c61be1.jpg?width=800,product_images/ASUS ROG Cetra True Wireless SpeedNova Gaming Head.jpg,gaming & consoles,Noon
"RAZER Huntsman Mini 60% Gaming Keyboard: Fast Keyboard Switches, Linear Optical Switches, Chroma RGB Lighting, PBT Keycaps, Onboard Memory Snap Tap - White","6,998",4.420,https://f.nooncdn.com/p/pnsku/N44263880A/45/_/1695751451/77bbf3a2-46f5-4405-bbb8-858b905fb731.jpg?width=800,product_images/RAZER Huntsman Mini 60 Gaming Keyboard Fast Keyboa.jpg,gaming & consoles,Noon
"HP (Upgraded Version) Omen 16-wd0073dx Gaming Laptop With 16.1-Inch FHD IPS 165Hz Display, Core i7-13620H Processor/32GB RAM/2TB SSD/8GB Nvidia GeForce RTX 4060 Graphics Card/Windows 11 Home Free With HP Gaming Headset / Shadow English/Arabic Shadow Black","141,600",0.0,https://f.nooncdn.com/p/pnsku/N70142850V/45/_/1736851059/c60d0853-150c-4b82-8e95-812a65db1bda.jpg?width=800,product_images/HP Upgraded Version Omen 16wd0073dx Gaming Laptop .jpg,gaming & consoles,Noon
"RAZER Huntsman Mini 60% Gaming Keyboard (Purple Switches): Fast Keyboard Switches, Clicky Optical Switches, Chroma RGB Lighting, PBT Keycaps, Onboard Memory, Snap Tap - Black","6,699",4.855,https://f.nooncdn.com/p/v1603474213/N40857343A_1.jpg?width=800,product_images/RAZER Huntsman Mini 60 Gaming Keyboard Purple Swit.jpg,gaming & consoles,Noon
"Kids Games, Catch Bugs Game - Family Board Games for Kids Ages 4, 5, 6, 7, 8, 9, 10 Year Old Boys Girls, Games for Kids Ages 4-8 for Christmas Birthday Gifts","6,121",0.0,https://f.nooncdn.com/p/pzsku/Z8D61BB7EB931E85699B2Z/45/_/1718535768/5fb303ff-0f3d-414d-9777-168959e1e9a3.jpg?width=800,product_images/Kids Games Catch Bugs Game  Family Board Games for.jpg,gaming & consoles,Noon
"BOLT Customized Gaming PC,Core i5-14600K Processor/32GB RAM/1TB SSD/16GB GeForce RTX 4060 Graphics Card/Windows 11 Home Black","77,944",0.0,https://f.nooncdn.com/p/pnsku/N70057426V/45/_/1711027111/1901116e-bd5b-4886-ad27-57b0e03960b8.jpg?width=800,product_images/BOLT Customized Gaming PCCore i514600K Processor32.jpg,gaming & consoles,Noon
"Shinmaster Puzzle Game for Adults and Kids, Electronic Puzzle Games with 500 Challenges, Board Game and STEM Toys for Boys and Girls, Gift Ideas - Creative and Logical Thinking","1,350",0.0,https://f.nooncdn.com/p/pzsku/Z7758C9F69099AB6753DBZ/45/1742851985/c3b6799f-b082-4a11-9488-b36c80719f93.jpg?width=800,product_images/Shinmaster Puzzle Game for Adults and Kids Electro.jpg,gaming & consoles,Noon
"ASUS ROG Strix Scope II RX Gaming Keyboard, IP57 Water/Dust Resistant, RX Optical Switches, RGB Per-Key, Media Knob, Hotkeys, Detachable Wrist Rest, Sound-Dampening, USB-C Wired, 1000Hz, Anti-Ghosting, Onboard Memory | 90MP0350-BKCA00","7,221",4.84,https://f.nooncdn.com/p/pnsku/N70053338V/45/_/1710098196/b9e20f07-78b7-4856-8d6c-8c298b3d5088.jpg?width=800,product_images/ASUS ROG Strix Scope II RX Gaming Keyboard IP57 Wa.jpg,gaming & consoles,Noon
Single One Hand Mechanical Gaming Keyboard Black,"2,349",0.0,https://f.nooncdn.com/p/v1557232686/N24991212A_1.jpg?width=800,product_images/Single One Hand Mechanical Gaming Keyboard Black.jpg,gaming & consoles,Noon
Inder 2-Piece SUP Game Boxes Mini Handheld Consoles,900,3.716,https://f.nooncdn.com/p/v1662124860/N51083908A_1.jpg?width=800,product_images/Inder 2Piece SUP Game Boxes Mini Handheld Consoles.jpg,gaming & consoles,Noon
"ASUS (Upgraded Version) TUF A15 Gaming Laptop With 15.6-inch Full HD (1920x1080) 144Hz Display, Ryzen 7 7435HS Processor/8GB RAM/512GB SSD/ Nvidia Geforce RTX 2050 4GB/Windows 11/ English/Arabic Graphite Black English/Arabic Graphite Black","58,500",4.77,https://f.nooncdn.com/p/pnsku/N70108925V/45/_/1726030916/5e61323a-5ceb-4729-9d36-67d89e1c77b6.jpg?width=800,product_images/ASUS Upgraded Version TUF A15 Gaming Laptop With 1.jpg,gaming & consoles,Noon
Forev FV‑K98 98% Compact Mechanical Gaming Keyboard,"1,099",0.0,https://f.nooncdn.com/p/pzsku/Z712D339130CB75F1C2EFZ/45/1756908368/cbd4e3b5-9838-4c25-9ff3-06f159559ccf.jpg?width=800,product_images/Forev FVK98 98 Compact Mechanical Gaming Keyboard.jpg,gaming & consoles,Noon
REDRAGON M711 RGB Wired Gaming Mouse Black,900,3.79,https://f.nooncdn.com/p/v1536573486/N16855329A_1.jpg?width=800,product_images/REDRAGON M711 RGB Wired Gaming Mouse Black.jpg,gaming & consoles,Noon
Zero ZR-2100 Gaming Mouse 3200 Dpi 5 Buttons - Black,265,0.0,https://f.nooncdn.com/p/pzsku/ZACD75EEED3E700D2053FZ/45/_/1727096228/dca09c40-fb1c-43c4-a066-3c1fd9636252.jpg?width=800,product_images/Zero ZR2100 Gaming Mouse 3200 Dpi 5 Buttons  Black.jpg,gaming & consoles,Noon
"SteelSeries Aerox 3 Wireless Gaming Mouse, 40G Acceleration, 18000 DPI Optical Sensor, Ultra Lightweight, Water Resistant Design, Bluetooth 5.0, 200 Hour Battery Life, USB-C, Onyx | 62612","5,299",4.213,https://f.nooncdn.com/p/pnsku/N53272264A/45/_/1727340795/a832bceb-a459-45be-97a8-7c6c5a371a3e.jpg?width=800,product_images/SteelSeries Aerox 3 Wireless Gaming Mouse 40G Acce.jpg,gaming & consoles,Noon
"Onikoma Wired Gaming Headset with RGB Light, Headphones Over Ear, Circle Earpiece, 3.5Mm Jack, Volume Control, Compatible with PS5, PS4, Laptops, Smartphone, Mac Nintendo Switch Games (X15 Pro, Pink)","2,190",0.0,https://f.nooncdn.com/p/c289748d560b585bb661063133fb8d53|pzsku/Z12059FCFD0594AD4243EZ/45/1770644896/9d01935d-5b8e-424e-a516-05803716606a.jpg?width=800,product_images/Onikoma Wired Gaming Headset with RGB Light Headph.jpg,gaming & consoles,Noon
SUP Handheld Gaming Triggers For Smartphone,629,2.56,https://f.nooncdn.com/p/v1569414605/N30159700A_1.jpg?width=800,product_images/SUP Handheld Gaming Triggers For Smartphone.jpg,gaming & consoles,Noon
SUP Handheld Game Console – 400 Classic Games in One Portable Device,450,0.0,https://f.nooncdn.com/p/pzsku/Z089BD75A2A8BF47FE9F7Z/45/1760624790/08237f20-048c-4479-9218-aee9fe11c4d8.jpg?width=800,product_images/SUP Handheld Game Console  400 Classic Games in On.jpg,gaming & consoles,Noon
Zero Gaming Mouse 3600 DPI with 6 Buttons and LED Backlight – Metal Design for Gamers,450,0.0,https://f.nooncdn.com/p/pzsku/Z372B377003E7D917F82AZ/45/1761993414/52568e3d-7333-4d8d-833d-4e8b5a3cbda8.jpg?width=800,product_images/Zero Gaming Mouse 3600 DPI with 6 Buttons and LED .jpg,gaming & consoles,Noon
"Advanced Wind Mechanical Gaming Keyboard - Multi-Mode RGB Lighting, Durable Metal Design & N-Key Rollover (Arabic/English Layout)","1,104",0.0,No Image,No Image,gaming & consoles,Noon
"Attack Shark Superlight Magnesium Alloy Wireless Gaming Mouse R3 46g , BT/2.4Ghz/Wired Computer Mouse, 8000Hz Wireless Polling Rate, PAW3395 26K DPI Sensor, Programmable Mice, PC/Laptop/Mac - silver","4,235",5.01,No Image,No Image,gaming & consoles,Noon
RAZER Huntsman Mini 60% Gaming Keyboard with Linear Optical Switch - US - Black,"6,830",4.381,No Image,No Image,gaming & consoles,Noon
Silicone Skin Case Cover for Gaming Controller - Grey Camo,120,4.01,No Image,No Image,gaming & consoles,Noon
FANTECH TOM PRO63 MK912 MECHANICAL GAMING KEYBOARD,"2,899",0.0,No Image,No Image,gaming & consoles,Noon
"Beexcellent GM270 Gaming Headset with Microphone LED Light, 3.5mm input - for PC, PS4, Xbox One, Nintendo Switch",250,3.868,No Image,No Image,gaming & consoles,Noon
onikuma G55 60% Mechanical Gaming Keyboard - BROWN Switches - RGB Rainbow Backlighted - Detachable USB Wired – 61 Keys EN  - Double injection key caps Illumination | Black,875,4.415,No Image,No Image,gaming & consoles,Noon
"K552 60% Mechanical Gaming Keyboard – LED Rainbow Backlit, Red Switches, Wired USB, UK QWERTY Layout – Compact Keyboard for Windows Gaming PC (White)","4,680",0.0,No Image,No Image,gaming & consoles,Noon
MSI Clutch GM41 Lightweight Gaming Mouse Black,"3,145",0.0,No Image,No Image,gaming & consoles,Noon
"Large Gaming Mouse Pad, Chinese Landscape  Extended Desk Mat, Large Desk Pad for Computer Keyboard, Mouse Pad with Stitched Edges, (70cm x 30cm x 2mm) Waterproof Desk Pad for Office and Home",179,4.86,No Image,No Image,gaming & consoles,Noon
"Lenovo (Upgraded Version) LOQ Gaming 15ARP9 with 15.6"" FHD 144HZ Display/ AMD Ryzen 7 7435HS/ 16GB RAM/ 512GB SSD/ Nvidia RTX 4050 (6GB Graphics)/ Windows 11 Home/ White Backlit Keyboard English Luna Grey English Luna Grey","109,200",4.46,No Image,No Image,gaming & consoles,Noon
FANTECH Mk875 V2 Atom 81 Mizu Edition Mechanical Keyboard - Blue Switch,"1,220",0.0,No Image,No Image,gaming & consoles,Noon
Lenovo Ideapad Gaming 3 Laptop With 15.6 Inch FHD /Core I7-11370H /16 GB Ram /1.256 GB SSD+Hdd (Hybrid)/ 4 GB Geforce Rtx 3050/ Free Dos /English/Arabic Black With Casual Leather Laptop Backpack Black English/Arabic Black,"55,870",0.0,No Image,No Image,gaming & consoles,Noon
"ASUS ROG Strix B860-I Gaming Wi-Fi Motherboard, Intel® Core™ Ultra Processors (Series 2) Support, 16+2+2 Power Stages, PCIe 5.0 x16, DDR5 up to 9066+ MT/s (Max 128GB), Wi-Fi 7 (2.9Gbps), Thunderbolt™ 4, Intel® 2.5Gb Ethernet, Dual M.2 Slots (PCIe 5.0/4.0), USB 20Gbps, Realtek ALC1220P 7.1 Audio, Mini-ITX Form Factor | 90MB1JB0-M0EAY0 Black","22,000",5.01,No Image,No Image,gaming & consoles,Noon
GMS Gaming Mouse Pad 9 Lighting Modes,175,3.85,No Image,No Image,gaming & consoles,Noon
"REDRAGON Gaming Keyboard K715 FINKE Custom QMK/VIA , 81 Keys Wireless Programmable Gasket Mechanical Keyboard w/Hot-Swap Socket, Dedicated Knob Control & 5-Layer Noise Dampening, Custom Linear Switch","4,199",0.0,No Image,No Image,gaming & consoles,Noon
"REDRAGON Gaming Keyboard K707 PRO - RGB with 80% Wireless Gasket, 3 Modes and 87 Keys, TKL Mechanical Keyboard with Hot Swap Socket, PBT Round Keycaps and Noise Damping","3,350",0.0,No Image,No Image,gaming & consoles,Noon
Wireless Gaming Controller – Black | Compatible with PlayStation 4,"1,500",0.0,No Image,No Image,gaming & consoles,Noon
Backlit I8 Mini Wireless USB Gaming Keyboard,275,2.318,No Image,No Image,gaming & consoles,Noon
Havit KB926L Gamenote Backlit Mechanical Gaming Keyboard,"1,348",0.0,No Image,No Image,gaming & consoles,Noon
MI Excite Gaming PC G6MATX PRO With Core i5 14400F CPU Processor/ Nvidia GeForce RTX 4060 Graphics/   32GB RAM DDR5 /1TB SSD/ Windows 11 Pro/ White,"78,500",0.0,No Image,No Image,gaming & consoles,Noon
"REDRAGON M909 EMPEROR RGB Gaming Mouse - Optical Sensor 12,400 DPI - 7 Programmable Buttons - Software Support",899,5.03,No Image,No Image,gaming & consoles,Noon
"Japanese Yin and Yang Koi Carp Gaming Mouse Pad Large, Non Slip Rubber Base Mousepad, Stitched Edges Desk Pad, Extended Large Mouse Pad 30cm x 70cm x 2mm",180,3.812,No Image,No Image,gaming & consoles,Noon
"onikuma Wired Gaming Headset X31 with Hi-Res Surround Sound , Noise cancelling Microphone for Clear Communication During Gaming , RGB Lighting Adds a Touch of Beauty to Your Desk , Ergonomic Design with Soft Ear Cushions and Adjustable Headband , Compatible with PC, PS5, Xbox, and Mobile for an Immersive Gaming Experience on All Platforms",647,0.0,No Image,No Image,gaming & consoles,Noon
Wireless Mechanical Gaming Keyboard – Ultra-Compact 60% Layout – Bluetooth Connectivity – Clicky Blue Switches – Ideal for Daily Use & Multi-Device Setup,"3,000",0.0,No Image,No Image,gaming & consoles,Noon
"Wired Mechanical Gaming Keyboard 108 Keys, Red Mechanical Switches, RGB Backlit, Anti‑Ghosting, Magnetic Hand Rest","2,640",0.0,No Image,No Image,gaming & consoles,Noon
MI Excite Gaming PC G4MATX ECO With Core i5 13400F CPU Processor/ Nvidia GeForce RTX 3060 Graphics/  16GB RAM DDR4 /1TB SSD/ Windows 11 Pro/ Black,"59,399",0.0,https://f.nooncdn.com/p/pnsku/N70154209V/45/_/1739987035/5c97617f-886e-4ae2-b175-280379d8b176.jpg?width=800,product_images/MI Excite Gaming PC G4MATX ECO With Core i5 13400F.jpg,gaming & consoles,Noon
REDRAGON Phoenix M702-2 RGB Gaming Mouse,925,5.03,https://f.nooncdn.com/p/v1577093684/N32921971A_1.jpg?width=800,product_images/REDRAGON Phoenix M7022 RGB Gaming Mouse.jpg,gaming & consoles,Noon
"T-DAGGER Arena TGK321 60% Mechanical Gaming Keyboard , 61 Keys Blue Switch RGB Rainbow Backlit, Compact Wired Keyboard with USB Type-C, DoubleShot Keycaps, Floating Key Design, Durable 50M Keystrokes, Black",795,4.58,https://f.nooncdn.com/p/pzsku/ZE3CADA4864E1CE5124F8Z/45/_/1772882502/daea452c-493d-4227-ad8b-8c2a7e6e618d.jpg?width=800,product_images/TDAGGER Arena TGK321 60 Mechanical Gaming Keyboard.jpg,gaming & consoles,Noon
MI Excite Gaming PC ECO With Core i5 14400F Processor/16GB RAM DDR4/1TB SSD M.2/6GB Nvidia GeForce RTX 3050 Graphics/Windows 11 Pro/ Black,"55,800",0.0,https://f.nooncdn.com/p/pnsku/N70137362V/45/_/1765455928/c0792bc7-f484-4ef9-8e68-de5a5373592c.jpg?width=800,product_images/MI Excite Gaming PC ECO With Core i5 14400F Proces.jpg,gaming & consoles,Noon
Wired Mechanical RGB Gaming Keyboard,952,3.25,https://f.nooncdn.com/p/v1548738012/N20640174A_1.jpg?width=800,product_images/Wired Mechanical RGB Gaming Keyboard.jpg,gaming & consoles,Noon
Philips SPK9404 Wired Gaming Mouse Black,447.95,0.0,https://f.nooncdn.com/p/v1629409743/N50043990A_1.jpg?width=800,product_images/Philips SPK9404 Wired Gaming Mouse Black.jpg,gaming & consoles,Noon
"onikuma X26 Wired Gaming Headset, Professional Over-Ear Headphones with HD Stereo Surround Sound, Noise Cancelling Microphone, RGB Lighting, Comfortable Design, Compatible with PC, PS4, PS5, Xbox, Switch, Mobile",935,5.03,https://f.nooncdn.com/p/pzsku/ZF80860BB0FB917257B77Z/45/1757842980/96c7e6c0-bf9c-4e0d-af20-1a47dd61adac.jpg?width=800,product_images/onikuma X26 Wired Gaming Headset Professional Over.jpg,gaming & consoles,Noon
Wireless Bluetooth Game Controller – Lightweight & Easy-to-Use Joystick for Smooth Gaming Experience,"6,894",0.0,https://f.nooncdn.com/p/pzsku/Z75BBBDE4888E37A7C1B9Z/45/1758538087/b923735e-d33f-4d87-8214-63c5e3cb6a3b.jpg?width=800,product_images/Wireless Bluetooth Game Controller  Lightweight  E.jpg,gaming & consoles,Noon
"HP H100 Gaming Headset with Microphone, Volume Control, 50mm Stereo Sound Drivers, Adjustable Headband, Cool RGB Lighting, Lightweight & Comfortable Design for PC, Laptop, PS4, PS5, Xbox",545,4.43,https://f.nooncdn.com/p/pzsku/Z294BF430796539E2EFEFZ/45/1766303802/bcf0f628-b68c-4ddf-894e-376441d40bf0.jpg?width=800,product_images/HP H100 Gaming Headset with Microphone Volume Cont.jpg,gaming & consoles,Noon
"Spark Gaming Headset , Comfortable RGB Caps Headset H105 , With 3.5*1+USB and 5.1 Audio Cable , Noise Cancelling MIC , Surround Sound 360 Audio Directional Pinpoint , 110dB High Sensitivity , Captures Sound Source at all Distance , Compatible With PS/4 , PS/5 , XBOX , Switch - Black",575,4.22,https://f.nooncdn.com/p/pzsku/ZEB9630FC495A4F2CA770Z/45/_/1740408394/bd9985b1-480d-4e39-bb74-3b1581f070c2.jpg?width=800,product_images/Spark Gaming Headset  Comfortable RGB Caps Headset.jpg,gaming & consoles,Noon
"SteelSeries Apex 3 TKL Wired Membrane Gaming Keyboard, 8-Zone RGB Illumination, 24 Keys N-Key Roll Over, Gaming-Grade Anti-Ghosting, English (US) Layout, White | 64819","5,098",5.04,https://f.nooncdn.com/p/pnsku/N70152112V/45/_/1739526361/d2e1b151-d321-4b2b-9fdf-ee7aa9ac3565.jpg?width=800,product_images/SteelSeries Apex 3 TKL Wired Membrane Gaming Keybo.jpg,gaming & consoles,Noon
Rainbow Backlit Mechanical Feeling USB Wired Gaming Keyboard and Mouse Combo – Multi-Color LED,888,0.0,https://f.nooncdn.com/p/pzsku/ZC3A79F76E0242BEE838EZ/45/1748771290/719d5027-7d91-43df-ad1a-fda360651dea.jpg?width=800,product_images/Rainbow Backlit Mechanical Feeling USB Wired Gamin.jpg,gaming & consoles,Noon
FANTECH WG13S Tanto S Wireless Gaming Mouse - Black,"3,999",0.0,https://f.nooncdn.com/p/pzsku/Z99A6F04DBA15B3D220D6Z/45/1765631618/efb69deb-4b8c-4930-9666-d9216f51360a.jpg?width=800,product_images/FANTECH WG13S Tanto S Wireless Gaming Mouse  Black.jpg,gaming & consoles,Noon
5500DPI Gaming Mouse USB Wired Optical 7-Buttons Black,532,4.3352,https://f.nooncdn.com/p/v1523014746/N13654874A_1.jpg?width=800,product_images/5500DPI Gaming Mouse USB Wired Optical 7Buttons Bl.jpg,gaming & consoles,Noon
REDRAGON RGB USB Gaming Mouse,"1,214",4.18,https://f.nooncdn.com/p/v1602770089/N41214361A_1.jpg?width=800,product_images/REDRAGON RGB USB Gaming Mouse.jpg,gaming & consoles,Noon
"REDRAGON Mechanical Gaming Keyboard K669CLO ZIGGS PRO , 94 Keys Compact Layout, 2.4G/Wired/Bluetooth 3-Modules, Hot-Swappable Switches, RGB Backlit, PBT Keycaps, Programmable Software, Detachable Type-C Cable","3,450",0.0,https://f.nooncdn.com/p/pzsku/Z20ABA9DB7EF248614B7BZ/45/1756735121/d7773dfc-d049-45fc-8365-808cdfc180a1.jpg?width=800,product_images/REDRAGON Mechanical Gaming Keyboard K669CLO ZIGGS .jpg,gaming & consoles,Noon
Japanese Pencil Art Cherry Blossoms Mouse Pad  – Gaming  Mat XL Size Anti Slip Base – Speed Edition | 70 X 30 cm,175,4.33,https://f.nooncdn.com/p/pzsku/Z1CFC7C211F0FD49FB8FBZ/45/1756159974/9da6980b-ed42-4805-9518-608684e62d20.jpg?width=800,product_images/Japanese Pencil Art Cherry Blossoms Mouse Pad   Ga.jpg,gaming & consoles,Noon
"Bloody GP30 USB Gaming Controller - PC, PS3, Switch, Android",699,5.01,https://f.nooncdn.com/p/37ede85c7cfa5f6da16c818ef971215d|pzsku/ZEE8E63A67083E7F0CE5FZ/45/1768912247/e3fe537f-df6f-4374-a6d6-dd571b857d1b.jpg?width=800,product_images/Bloody GP30 USB Gaming Controller  PC PS3 Switch A.jpg,gaming & consoles,Noon
Wireless Game Controller – Rechargeable USB Gamepad with Motion Control – Ideal for Daily Gaming on PS3,456,0.0,https://f.nooncdn.com/p/pzsku/Z635C800A7F119086FD4BZ/45/1749549923/c2916aea-6f0e-460c-baf4-3af8db9c0ba5.jpg?width=800,product_images/Wireless Game Controller  Rechargeable USB Gamepad.jpg,gaming & consoles,Noon
"A-jazz AJ139 V2 MC 3 Modes Wireless Gaming Mouse with Charging Base, Adjustable 12,000 DPI, PAW3311 Sensor, 500mAh Battery, 1000 Polling Rate, 66g Lightweight, Win/Mac","1,499",4.48,https://f.nooncdn.com/p/pzsku/Z77694F967F9678D6BE37Z/45/1760352038/e42e24cb-acc5-4fcb-90df-c294cf3b15d2.jpg?width=800,product_images/Ajazz AJ139 V2 MC 3 Modes Wireless Gaming Mouse wi.jpg,gaming & consoles,Noon
"MARVO Wired Backlit  stereo Gaming Headset technology HG8921 Tactic 30 (RGB) ,  Lightweight Stereo Gaming Headsets with Mic - Black",775,0.0,https://f.nooncdn.com/p/pzsku/ZFACB74333AFE585CCF71Z/45/_/1738594926/4a3cc372-f774-4e49-99e7-a8f3346e14c3.jpg?width=800,product_images/MARVO Wired Backlit  stereo Gaming Headset technol.jpg,gaming & consoles,Noon
MI Excite Gaming PC PRO Core i5 13400F CPU RTX 4070 Super GPU DDR5 H610 WIF MB DDR5 16GB RAM 1000GB SSD M.2 120 AC CPU Cooler 700w PSU  Black Black RTX 4070 S,"74,000",0.0,https://f.nooncdn.com/p/pnsku/N70137363V/45/_/1739513126/1a788c32-4bbb-4031-a608-23eb08e0a872.jpg?width=800,product_images/MI Excite Gaming PC PRO Core i5 13400F CPU RTX 407.jpg,gaming & consoles,Noon
Redragon K539 Anubis Wireless RGB Mechanical Gaming Keyboard with Brown Switch - 2.4Ghz / Bluetooth 5.0 / Wired Type C White,"2,800",5.01,No Image,No Image,gaming & consoles,Noon
ANBERNIC ANBERNIC RG40XX H Retro Handheld Game Console 64 TF Card Portable Game Console Linux 64-bit System 4.0 Inch IPS Screen WiFi Bluetooth HD & TV Out Gray,"8,399",0.0,No Image,No Image,gaming & consoles,Noon
"REDRAGON Wired Gaming Controller G710 - Dual Vibration Motors, Rapid Trigger, Ergonomic Design, 4 Programmable Keys, Customizable Macros, Adjustable Joystick Heights - Work for PC & Android & NS","1,166",3.59,No Image,No Image,gaming & consoles,Noon
"Xtrike Me GM-227 Wired Backlit Gaming Mouse, Ergonomic Design, 7 Colors Backlight, 6 Buttons, 4 DPI Levels",673,0.0,No Image,No Image,gaming & consoles,Noon
RAZER Kraken V3 X Wired Gaming Headset 7.1 Surround Sound Headset With TRIFORCE 40mm Driver Unit HYPERCLEAR Cardioid Microphone,"4,500",4.03,No Image,No Image,gaming & consoles,Noon
SEEKYOU 3-Piece Black Skull Printed Gaming Console And Controller Skin Sticker Set For PlayStation 4,245,0.0,No Image,No Image,gaming & consoles,Noon
REDRAGON P012 Capricorn Gaming Mouse Waterproof Large 33x26cm Stitched Edges,299,4.712,No Image,No Image,gaming & consoles,Noon
Smoke Colors Gaming Mouse Pad for Keyboard & Mouse (80 X 30 cm ) - Desk Mat Mousepad L Extended Size - Anti Slip Rubber Base - Stitched Edges - Waterproof - Speed Edition | Black,299,3.96,No Image,No Image,gaming & consoles,Noon
Gaming Keyboard & Mouse Set – Rainbow LED Backlit Wired Keyboard and 3200 DPI Mouse for PC & Mac (White),"2,998",0.0,No Image,No Image,gaming & consoles,Noon
