name,price,rating,image_url,image_path,category,source
"REDRAGON K708WLG Pro Wireless Mechanical Gaming Keyboard – 75% Layout 81 Keys, Tri-Mode 2.4G / Bluetooth / USB-C, Gasket Mount, Hot-Swap Pre-Lubed Switches, RGB Backlit, Smart LCD Screen & Control Knob, White & Green","3,495",3.33,No Image,No Image,gaming & consoles,Noon
IRON PAZZEL- iron puzzel-Metal wire puzzles-Brain teaser-Puzzle games for adults puzzles-,169,5.01,No Image,No Image,gaming & consoles,Noon
Turtle Beach Recon Cloud Hybrid Wireless Gaming Controller - Blue Magma,"10,999",0.0,No Image,No Image,gaming & consoles,Noon
"ASUS ROG Azoth 75 Wireless DIY Custom Gaming Keyboard, OLED display, Gasket-Mount, Three-Layer Dampening, Hot-Swappable Pre-lubed ROG NX Red Switches And Keyboard Stabilizers, PBT Keycaps, RGB, US layout","25,000",3.43,No Image,No Image,gaming & consoles,Noon
( UNO) Flex Card Game Fun Games for Adults and Party Game Night,94.45,0.0,No Image,No Image,gaming & consoles,Noon
"Pocket Game, Break Game | 9999 Games (Yellow)",140,0.0,No Image,No Image,gaming & consoles,Noon
"JeDEL WD139 Wireless 2.4Ghz , Bluetooth Rechargeable Gaming Mouse - Optical Sensor 1600 DPI - Magnetic Charging Dock (White)",599,4.3149,No Image,No Image,gaming & consoles,Noon
FANTECH VX6 PHANTOM II Wired Gaming Mouse Black,616,5.01,No Image,No Image,gaming & consoles,Noon
"Professional Gaming Headset G900 with RGB LED Lighting, Stereo Sound, Noise isolation, Compatible with PC, Laptop, Mobile, Tablet, 3.5m For Sound And USB For RGB, (Random colors received)",940,0.0,No Image,No Image,gaming & consoles,Noon
Vintage Aesthetic XL Extended Large Gaming Mouse Pad - Black Academia Mystical Green Plant Design - Computer Laptop Keyboard and Mouse Mat Desktop Protector - 70 x 30 cm,139,5.04,No Image,No Image,gaming & consoles,Noon
"Logitech G515 TKL Wired Low Profile Gaming Keyboard, Fully Customizable RGB, Double-Shot PBT Keycaps, Tactile/Brown Switches - Black","6,095",5.01,No Image,No Image,gaming & consoles,Noon
"Pink Japan Desk Pad Anime Gaming Green Mouse Pad Large Mouse Pad For Desk Computer Pc Laptop Office Decor For Women, Anime Mouse Keyboard Pad Stitched Edges Non-Slip Rubber Mat Desk Pad (70x30cm)",159,4.521,No Image,No Image,gaming & consoles,Noon
Nintendo Switch 2 + Mario Kart World Bundle,"34,998",3.9163,No Image,No Image,gaming & consoles,Noon
Mattel Games Uno Card Game Mcm,285,0.0,https://f.nooncdn.com/p/v1616682907/N45782981A_1.jpg?width=800,product_images/Mattel Games Uno Card Game Mcm.jpg,gaming & consoles,Noon
Geekay games New Super Mario Bros. - (Intl Version) - Adventure - Nintendo Switch,"3,652",0.0,https://f.nooncdn.com/p/v1569821930/N30229357A_1.jpg?width=800,product_images/Geekay games New Super Mario Bros  Intl Version  A.jpg,gaming & consoles,Noon
MSI LAPTOP MSI  Cyborg 15 A2RUDX  CPU Core 7 240H RAM16G DDR5 8GB*2 HDD 512GB NVMe PCIe SSD Gen4x4 VGA RTX 3050 6GB GDDR6 6GB 15.6 FHD (1920*1080) 144Hz Blue Backlit Gaming Keyboard Windows 11Home A 2 Years Warranty ( 9S7-15K111-2081) english_arabic Translucent Black,"50,555",0.0,https://f.nooncdn.com/p/5c6e95c6bee35f1da03dc4d761e34074|pzsku/Z4EF38EC3C68660C61593Z/45/1768488929/1405b572-d033-461f-a620-44b0d4ca71db.jpg?width=800,product_images/MSI LAPTOP MSI  Cyborg 15 A2RUDX  CPU Core 7 240H .jpg,gaming & consoles,Noon
MSI LAPTOP MSI Katana 15 HX B14WEK Black Intel Core i7-14650HX RAM 16G DDR5 8GB*2 SSD 512 GB NVMe VGA NVIDIA GeForce RTX 5050  GDDR7 8GB 15.6 QHD ( 2560*1440 ) 165Hz Windows 11 Home A  ( 9S7-1587C1-832 ) english_arabic,"61,488",0.0,https://f.nooncdn.com/p/5c6e95c6bee35f1da03dc4d761e34074|pzsku/ZFF82F35D5D4CF33013B4Z/45/1768486085/d9303548-a3ff-4e8a-8718-6f95ce504ad4.jpg?width=800,product_images/MSI LAPTOP MSI Katana 15 HX B14WEK Black Intel Cor.jpg,gaming & consoles,Noon
"14 Piece Magnetic Chess Game with Dice – Portable Tabletop Strategy Game for Kids 8+ and Adults, Fun Multiplayer Family Board Game-multicolor",175,0.0,https://f.nooncdn.com/p/pzsku/ZA3D88789707291CDF59CZ/45/_/1774700522/5622685e-f517-42cd-876c-42cedec971d7.jpg?width=800,product_images/14 Piece Magnetic Chess Game with Dice  Portable T.jpg,gaming & consoles,Noon
"Connect Four Win Action, Mini Games Four Win Games On the Go Games for On the Go Games Outdoor Travel Game, Game for Children 3+ 4 5 6 Years (Small)",70,0.0,https://f.nooncdn.com/p/pzsku/Z9508C1D09723088913C6Z/45/_/1736159665/d357f697-ef82-4793-aff3-ca8e4b715c6a.jpg?width=800,product_images/Connect Four Win Action Mini Games Four Win Games .jpg,gaming & consoles,Noon
Tic-Tac-Toe Game Electronic Board Games Set Portable Indoor/Outdoor Games Puzzle Toy for Children,423.50,0.0,https://f.nooncdn.com/p/pzsku/Z3A4D0DEB3F6058E2C115Z/45/1754058424/d2b7fbe8-e900-4ff2-8bcf-1dbaba05fedd.jpg?width=800,product_images/TicTacToe Game Electronic Board Games Set Portable.jpg,gaming & consoles,Noon
تي-داجر ماوس الألعاب T-DAGGER TGM-113,375,0.0,https://f.nooncdn.com/p/pzsku/Z9AE4C35D251FB3285301Z/45/1755607870/7fb988aa-db53-445a-b844-012a33a605fe.jpg?width=800,product_images/تيداجر ماوس الألعاب TDAGGER TGM113.jpg,gaming & consoles,Noon
Vinyl Decal 3-Piece Printed Gaming Console And Controller Skin Stickers Set For Sony PlayStation 4,245,0.0,https://f.nooncdn.com/p/v1600672167/N39931556A_1.jpg?width=800,product_images/Vinyl Decal 3Piece Printed Gaming Console And Cont.jpg,gaming & consoles,Noon
"Gaming Laptop Cooling Pad Stand – 6 Powerful LED Fans, Iron Mesh, Dual USB Ports – Supports 12″ to 17″ Devices",834,0.0,https://f.nooncdn.com/p/pzsku/Z111B0BD9AD766330F358Z/45/1763448224/a57460be-cb61-4c95-af01-b30e84fb4d94.jpg?width=800,product_images/Gaming Laptop Cooling Pad Stand  6 Powerful LED Fa.jpg,gaming & consoles,Noon
havit “HAVIT CF923 Gaming Chassis – Sleek Gaming PC Case with Efficient Cooling Tempered Glass Side Panel,"1,950",3.33,https://f.nooncdn.com/p/a8687c11f1165e6aaea05d8e220b9b60|pzsku/Z7E488D4D83F52DD8E661Z/45/1771232698/bb987013-f3f8-4c0e-a24f-35a0fdff660a.jpg?width=800,product_images/havit HAVIT CF923 Gaming Chassis  Sleek Gaming PC .jpg,gaming & consoles,Noon
REDRAGON P016 Large Waterproof Stitched Edges Gaming Mouse Pad,310,4.628,https://f.nooncdn.com/p/v1684847722/N40695220A_1.jpg?width=800,product_images/REDRAGON P016 Large Waterproof Stitched Edges Gami.jpg,gaming & consoles,Noon
"AULA F99 Wireless RGB Gaming Mechanical Keyboard Wireless Bluetooth Wired, Hot-Swappable Flame Purple Switches, RGB Backlit, 8000mAh Battery (Green)","2,799",5.03,https://f.nooncdn.com/p/pzsku/Z80116193BCC62DC4C340Z/45/1766670023/54cb81a1-9324-4f7a-b7ef-dcc49903ada0.jpg?width=800,product_images/AULA F99 Wireless RGB Gaming Mechanical Keyboard W.jpg,gaming & consoles,Noon
HUANGER Soccer Game Spider Man Board Games,"1,400",0.0,https://f.nooncdn.com/p/pzsku/Z88C89D763ED06F3095DEZ/45/_/1732142069/deb83878-51a5-411b-b740-5593a0b2ed33.jpg?width=800,product_images/HUANGER Soccer Game Spider Man Board Games.jpg,gaming & consoles,Noon
Spinmaster 🚁 Spin Master Games PAW Patrol Rescue Mission Board Game – Team Play Fun,"1,450",0.0,https://f.nooncdn.com/p/37a82f5568fa553181fded018586709b|pzsku/ZA881D143A37BCE540B16Z/45/1768836627/358f149a-8bb1-4797-a681-78a4cd3871b8.jpg?width=800,product_images/Spinmaster  Spin Master Games PAW Patrol Rescue Mi.jpg,gaming & consoles,Noon
"Memo Phone Cooler for Gaming, 27W iPhone Cooling Fan with RGB LED Semiconductor Heatsink Cooling Case Enfriador para Celular, for iPhone/Android Phone Gaming, Live Streaming, AI Smartphone Temperature",950,3.83,https://f.nooncdn.com/p/pzsku/Z16E6929F78309C887B37Z/45/1758004721/2393a4ec-48cb-4994-ad01-33011a75a4fe.jpg?width=800,product_images/Memo Phone Cooler for Gaming 27W iPhone Cooling Fa.jpg,gaming & consoles,Noon
Redragon K587 Magic-Wand RGB Mechanical Gaming Keyboard,"2,555",5.01,No Image,No Image,gaming & consoles,Noon
"ETZ Mouse Pad Gaming Large Desk Pad (30cm x 70cm x 2mm) Washable Keyboard Pad Laptop Desk Mat, Japanese Mouse Pad with Anti-Slip Rubber Base, Extended Mouse Pad for Office & Home",155,4.217,No Image,No Image,gaming & consoles,Noon
"Spakon 6 Pieces Video Game Art Print - Colorful Gaming Themed Canvas Wall Art 8x10 Inch - Neon Posters for Kids Boy Wall Decor, Teens Bedroom, Game Room",725,0.0,No Image,No Image,gaming & consoles,Noon
External USB Cooling Fan with LED Lights – Compatible with Gaming Consoles,900,0.0,No Image,No Image,gaming & consoles,Noon
"BDL705 Audio-Visual Stereo Gaming Headphones – Dolby Digital Optimized, Professional Mic & Ergonomic Fit",666,0.0,No Image,No Image,gaming & consoles,Noon
"Mouse Pad XL 70cmx30cmx2mm  – Extended Gaming & Office Mousepad with Non-Slip Rubber Base – Smooth Surface for Precise Control, Durable & Comfortable for Keyboard and Mouse Setup – Ideal for Gamers & Professionals",149,0.0,No Image,No Image,gaming & consoles,Noon
Topographic Lines Gaming Mouse Pad for Keyboard & Mouse (80 X 30 cm ) - Desk Mat Mousepad L Extended Size - Anti Slip Rubber Base - Stitched Edges - Waterproof - Speed Edition | Black,299,3.914,No Image,No Image,gaming & consoles,Noon
Fantech MP905 ATO super maxfit GY Mouse Pad  900x400x4mm for comfort and control,659,0.0,No Image,No Image,gaming & consoles,Noon
COMBATWING M180 Pro PC Headset PS4 Compatible 3.5mm Computer Gaming Headphones,999,0.0,No Image,No Image,gaming & consoles,Noon
FANTECH HG20 CHIEF II RGB GAMING HEADSET SPACE EDITION 3.5MM FOR SOUND  + USB FOR RBG LIGHT,813,0.0,No Image,No Image,gaming & consoles,Noon
Cool Gear Controller 4 Wireless Controller For PlayStation 4 (PS4),699,3.315,No Image,No Image,gaming & consoles,Noon
"OVLENG USB Headphone for Gaming Compatible with Laptop, PS4, Smartphone OV-Q5 (Black & Red)","1,282",0.0,No Image,No Image,gaming & consoles,Noon
"Microsoft Xbox Core Wireless Gaming Controller – Astral Purple – Xbox Series X|S, Xbox One, Windows PC, Android, and iOS","9,999",4.618,No Image,No Image,gaming & consoles,Noon
PINK World Map Gaming Mouse Pad - (80×30cm) for Keyboard and Mouse Desk Mat for PC - Non Slip Rubber - Speed Edition | 800× 300×2 mm,125,4.476,https://f.nooncdn.com/p/pzsku/Z4EF23FF8B6A9B6844329Z/45/_/1721122422/dcf2d587-8cdf-4ed3-8cec-8507a5ddcbdd.jpg?width=800,product_images/PINK World Map Gaming Mouse Pad  8030cm for Keyboa.jpg,gaming & consoles,Noon
MARVO M112 USB Wired Gaming Programmable Mouse Multi DPI Speed and LED Lights,299,4.610,https://f.nooncdn.com/p/v1634949767/N51500827A_1.jpg?width=800,product_images/MARVO M112 USB Wired Gaming Programmable Mouse Mul.jpg,gaming & consoles,Noon
"PC Wired Controller, Game Controller for Xbox 360 with Dual-Vibration Turbo Compatible with Xbox 360/360 Slim and PC Windows 7,8,10,11",399,4.16,https://f.nooncdn.com/p/pzsku/Z2B5CED54E00CFB8275C0Z/45/1745234911/af971343-a42f-49d1-8483-1c265fe94a71.jpg?width=800,product_images/PC Wired Controller Game Controller for Xbox 360 w.jpg,gaming & consoles,Noon
"International Chess Set Board Travel Games Folding Magnetic Chess for Single Player, Age 3 & Above","3,520",0.0,https://f.nooncdn.com/p/pzsku/ZF261A84029CCB06709DAZ/45/1745185567/039f8704-53f0-4d41-bb27-b07df7ea3343.jpg?width=800,product_images/International Chess Set Board Travel Games Folding.jpg,gaming & consoles,Noon
"Card Games, HD Game Card Waterproof PVC Gold Foil with Gift Box, Card Game 54 Perfect for Party and Game",175,0.0,https://f.nooncdn.com/p/pzsku/Z688A0271B45AD91803D8Z/45/1747645569/3579efdc-118b-42f8-8ae3-4e850e495a73.jpg?width=800,product_images/Card Games HD Game Card Waterproof PVC Gold Foil w.jpg,gaming & consoles,Noon
"St ICE07 Gaming Laptop Cooler with Mobile Stand, 2 Large Fan Colorful Lights RGB Light, LCD Display,(2x140mm) - With Speed Control (250:1000 RPM) - USB Power & HUB - Phone holder","1,379",4.0263,https://f.nooncdn.com/p/pzsku/Z2A3F46BE75B2824BE6FEZ/45/_/1773926256/6bc44231-e62a-4810-89e2-8064cda230a1.jpg?width=800,product_images/St ICE07 Gaming Laptop Cooler with Mobile Stand 2 .jpg,gaming & consoles,Noon
REDRAGON Full Mechanical Rgb Backlit Gaming Keyboard - 104 Blue Switch,"1,900",0.0,https://f.nooncdn.com/p/v1622036372/N47669205A_1.jpg?width=800,product_images/REDRAGON Full Mechanical Rgb Backlit Gaming Keyboa.jpg,gaming & consoles,Noon
"P47 Wireless Gaming Headset, Bluetooth 5.0 Cat Ear Headphones, Kids Headphones,LED Light Up Bluetooth Over Ear Headphones for Kids and Adults Wearing(Black))",274,4.013,https://f.nooncdn.com/p/pzsku/ZEF18085E30825D286CDBZ/45/_/1669124005/5a9dea55-db1b-4e98-a748-22ff4b8fdc32.jpg?width=800,product_images/P47 Wireless Gaming Headset Bluetooth 50 Cat Ear H.jpg,gaming & consoles,Noon
Red Dead Redemption 2 PS4 Games - playstation_4_ps4,"1,699",5.01,https://f.nooncdn.com/p/v1568617426/N29855657A_1.jpg?width=800,product_images/Red Dead Redemption 2 PS4 Games  playstation_4_ps4.jpg,gaming & consoles,Noon
"Aigo A68 Wireless, Bluetooth & Wired Mechanical Gaming Keyboard - Yellow Switches, 68 Keys, Hot Swapabble, PBT Keycaps, Detchable USB-C Cable, Rechargable Battery (Brown Sugar)","2,760",0.0,https://f.nooncdn.com/p/c289748d560b585bb661063133fb8d53|pzsku/ZB8E46F41EF2AC4D81A26Z/45/1770644532/530796d9-9d7b-4115-a529-c25212495724.jpg?width=800,product_images/Aigo A68 Wireless Bluetooth  Wired Mechanical Gami.jpg,gaming & consoles,Noon
"Logitech G305 Lightspeed Wireless Gaming Mouse, HERO Sensor, 12,000 DPI, Lightweight, 6 Programmable Buttons, 250h Battery Life, On-Board Memory, Compatible with PC / Mac - White","2,167",2.9392,https://f.nooncdn.com/p/v1647344312/N16549207A_1.jpg?width=800,product_images/Logitech G305 Lightspeed Wireless Gaming Mouse HER.jpg,gaming & consoles,Noon
"Magnetic Chess Game, New Multiplayer Magnetic Chess Games with Stones, Fun Family Magnetic Game Set for Tabletop - Portable Chess Board for Kids Adults 20 Pieces",157,5.01,https://f.nooncdn.com/p/6696588b42ac5bf196fa67a259dc1167|pzsku/ZC07793829AF5BA9FBCCEZ/45/1769788306/62e79343-0fb4-4dc7-abe0-7452e1c48704.jpg?width=800,product_images/Magnetic Chess Game New Multiplayer Magnetic Chess.jpg,gaming & consoles,Noon
BAVIN Highly Compatibility Gaming Headset BH29 w/Microphone/Headphone 3.5mm Jack for Mobile Phone/Tablet/PC/Desktop/Laptop,499,3.611,https://f.nooncdn.com/p/pzsku/ZEC3FA9F4FA26DF94046FZ/45/1759333112/0266ea22-db7c-41d3-8ad5-5cdc435a2b4b.jpg?width=800,product_images/BAVIN Highly Compatibility Gaming Headset BH29 wMi.jpg,gaming & consoles,Noon
Zero ZR-5001 GamePad Trubo Joystick USB 1.5 meter cable - Black,299,4.130,https://f.nooncdn.com/p/pzsku/Z6808EC88A73150FBED0FZ/45/1767809028/09dc70d2-be6b-4f7e-a18a-9fc326148f51.jpg?width=800,product_images/Zero ZR5001 GamePad Trubo Joystick USB 15 meter ca.jpg,gaming & consoles,Noon
"Mattel Uno Original and Uno Flip Card Games, Combo Pack of 2",126.50,0.0,https://f.nooncdn.com/p/pzsku/Z49F5DD1C095528734DB9Z/45/1757280598/1fd6945c-5ea8-4bf2-9ed7-3e7e8f903de6.jpg?width=800,product_images/Mattel Uno Original and Uno Flip Card Games Combo .jpg,gaming & consoles,Noon
"Ovleng GT-81 Gaming Headset with Noise Cancelling Microphone,3D Stereo Surround Sound, Volume Control, Compatible with PC, Mac & Consoles - Black Blue","1,142",0.0,https://f.nooncdn.com/p/c289748d560b585bb661063133fb8d53|pzsku/ZEE2F2007BA8317634EC8Z/45/1770590388/c9079f61-12c0-4c81-b52d-890478cb8af1.jpg?width=800,product_images/Ovleng GT81 Gaming Headset with Noise Cancelling M.jpg,gaming & consoles,Noon
Havit H2049D RGB Light Over-Ear Wired USB Gaming Headset with 3.5mm Surround Sound Detachable Microphone,789,0.0,https://f.nooncdn.com/p/pnsku/N70305106V/45/_/1772452728/f45465e2-33e5-4929-90e4-76f64c543ad3.jpg?width=800,product_images/Havit H2049D RGB Light OverEar Wired USB Gaming He.jpg,gaming & consoles,Noon
Controller 4 Wireless Controller,626.30,3.425,https://f.nooncdn.com/p/v1688556895/N40930113A_1.jpg?width=800,product_images/Controller 4 Wireless Controller.jpg,gaming & consoles,Noon
TECHNO ZONE V70-FBS USB Programmable Gaming Mouse With RGB LED & optical sensor PMW3325 FOR COMPUTER - 2725611510622,"2,565",0.0,https://f.nooncdn.com/p/c289748d560b585bb661063133fb8d53|pzsku/ZB0B3A3C7CDB5911D7B8CZ/45/1770584758/326bb2b6-ffe8-432b-a1d6-b4c61a4900fa.jpg?width=800,product_images/TECHNO ZONE V70FBS USB Programmable Gaming Mouse W.jpg,gaming & consoles,Noon
Pubg Player Large Thick Mouse Pad Cartoon Color Pattern Big Game Pad 30-70Cm,118,5.01,No Image,No Image,gaming & consoles,Noon
"T-DAGGER Arena TGK321 60% Mechanical Gaming Keyboard – 61 Keys Brown Switch RGB Rainbow Backlit, Compact Wired Keyboard with USB Type-C, DoubleShot Keycaps, Floating Key Design, Durable 50M Keystrokes, Black",795,4.58,No Image,No Image,gaming & consoles,Noon
"Memo Fast Cooling Mobile Phone Cooler CX12 , Phone Cooler for Gaming With Cable Type-C , Magnetic and Clip Semiconductor Ice Affect Refrigerator Radiator, RGB Light, Ultra Quiet , Compatible with iPhone & Android Gaming Phones","1,020",4.26,No Image,No Image,gaming & consoles,Noon
Vinyl Decal 3-Piece Joker And Batman Printed Gaming Console And Controller Sticker Set For PlayStation 4,245,0.0,No Image,No Image,gaming & consoles,Noon
"Gaming Mouse Pad Large Thick Extended Mouse Mat Non-Slip Spill-Resistant Desk Pad with Special-Textured Surface, Anti-Fray Stitched Edges for Keyboard, PC - Black",299,4.449,No Image,No Image,gaming & consoles,Noon
Ideal Go Master: Youtubers Edition Trivia Board Game,"3,588",0.0,No Image,No Image,gaming & consoles,Noon
"RAZER Kraken X Lite Ultralight Gaming Headset- for PC, Xbox, PS4, Nintendo Switch - Classic Black","1,986",4.21,No Image,No Image,gaming & consoles,Noon
"Mobile Gaming Finger Sleeves Set – Anti-Sweat, Breathable, Enhanced Control",78,0.0,No Image,No Image,gaming & consoles,Noon
Vinyl Decal 3-Piece Bleeding Printed Gaming Console And Controller Skin Sticker Set For PlayStation 4 Slim,245,0.0,No Image,No Image,gaming & consoles,Noon
"Moyo Magic Cube 3×3 CD Games, Silver",100,4.52,No Image,No Image,gaming & consoles,Noon
"Redragon GS500 Stentor PC Gaming Speaker, 2.0 Channel Stereo Desktop Computer Speaker with Red Backlight","1,115",4.014,No Image,No Image,gaming & consoles,Noon
ONIKUMA GAMING ONIKUMA X31 Wired Headphones with RGB Colorful Lighting Surround Sound Wired Headset for PC Gamers Gaming Xbox,"1,255",0.0,No Image,No Image,gaming & consoles,Noon
"Attack Shark R6 Tri-mode Wireless 2.4G/Bluetooth/wired Gaming Mouse, 42K DPl PAW 3950Max Sensor Nordic 52480, 8KHz Polling, OMRON Optical Switch Ultralight 39g","3,199",4.784,No Image,No Image,gaming & consoles,Noon
"High-Precision Wireless Gaming Mouse (2400 DPI) - Ergonomic, Easy-to-Use & Durable - Ideal for Professional PC Gaming and Daily Office Use",540,0.0,No Image,No Image,gaming & consoles,Noon
Markero Group Sleek & Functional Black Gamer Computer Desk – Perfect for Ultimate Gaming Setup and Productivity.,"4,785",0.0,https://f.nooncdn.com/p/pzsku/ZADF04CC142B2230E817CZ/45/_/1742813538/9abc0a0e-b175-4fd9-b017-b66823892f97.jpg?width=800,product_images/Markero Group Sleek  Functional Black Gamer Comput.jpg,gaming & consoles,Noon
"Mattel Uno Dos Games - Match Card 🎴 Enjoy a faster and stronger challenge with Mattel Uno Dos, an atmosphere of excitement and competition that brings together family and friends in every round full of surprises!",72.23,0.0,https://f.nooncdn.com/p/pzsku/Z9B9F93811E160FCBBC4FZ/45/_/1772558154/c01a0089-ed3e-4790-a8d3-9a0e8e20bea5.jpg?width=800,product_images/Mattel Uno Dos Games  Match Card  Enjoy a faster a.jpg,gaming & consoles,Noon
"Samsung 27 Inch Odyssey G4 Gaming Monitor, 240Hz refresh rate, 1ms, FHD With HDR10 IPS Panel, Nvidia G-Sync, LS27BG402EMXUE Black","13,285",4.542,https://f.nooncdn.com/p/pzsku/ZD63D767C6F8461CB586FZ/45/_/1772090612/8e7fcbef-c438-42c7-a470-70f20539443a.jpg?width=800,product_images/Samsung 27 Inch Odyssey G4 Gaming Monitor 240Hz re.jpg,gaming & consoles,Noon
"AL-11 Mobile Cooler, Gaming Mobile Cooler with Digital Display, Universal Mobile Cooling Fan, Gaming Mobile Cooling Fan, Suitable for Most Smartphones",499,0.0,https://f.nooncdn.com/p/pzsku/ZC42F630A5EDE9B459F76Z/45/1765794660/21148d4e-5305-446e-8058-41b0dc8ec6ac.jpg?width=800,product_images/AL11 Mobile Cooler Gaming Mobile Cooler with Digit.jpg,gaming & consoles,Noon
"8GB GDDR5 Graphics Card – 256-Bit Gaming GPU for PC with Dual Power (8+6 Pin), High Performance","11,400",0.0,https://f.nooncdn.com/p/pzsku/Z56BFDBCD1796D5DF9B9EZ/45/1756878910/0b6a5c5f-0331-4632-9627-975817f4e798.jpg?width=800,product_images/8GB GDDR5 Graphics Card  256Bit Gaming GPU for PC .jpg,gaming & consoles,Noon
"Azonee Race Game, Magic Block Game Board Games for 2 Players Genius Square Game Sequence Puzzle-Brain teasers-Board Games for Boys and Girls Rubiks Race Game 5+ Year Olds",222,0.0,https://f.nooncdn.com/p/pzsku/ZF50DC40F905E1CB9FF45Z/45/_/1742205381/5c4c47fe-8354-4196-950e-9c73d7ce9459.jpg?width=800,product_images/Azonee Race Game Magic Block Game Board Games for .jpg,gaming & consoles,Noon
"Skull Mouse Pad Japanese Ukiyo-e Mouse Pad Large Anime Big Mouse Pads for Desk Large Gaming Large Mouse Pad for Men Desk Pad with Stitched Edges Non-Slip Large Computer Mat, 30cm x 70cm x 2mm",130,3.09,https://f.nooncdn.com/p/pzsku/Z579DF17EF94EABC69317Z/45/_/1737295043/169dcc5c-371b-4cd6-94b8-5856306fb126.jpg?width=800,product_images/Skull Mouse Pad Japanese Ukiyoe Mouse Pad Large An.jpg,gaming & consoles,Noon
WB Games Lego The Ninjago Movie (Intl Version) - action_shooter - playstation_4_ps4,"1,139",5.02,https://f.nooncdn.com/p/v1512978655/N12742332A_1.jpg?width=800,product_images/WB Games Lego The Ninjago Movie Intl Version  acti.jpg,gaming & consoles,Noon
"HP (Upgraded Version) Omen 16-wd0073dx Gaming Laptop With 16.1-Inch FHD IPS 165Hz Display, Core i7-13620H Processor/64GB RAM/4TB SSD/8GB Nvidia GeForce RTX 4060 Graphics Card/Windows 11 Home Free With HP Gaming Headset English Shadow Black English Shadow Black","150,000",0.0,https://f.nooncdn.com/p/pnsku/N70142752V/45/_/1736851057/2b65247b-8131-4599-844f-20ca7dc6b63e.jpg?width=800,product_images/HP Upgraded Version Omen 16wd0073dx Gaming Laptop .jpg,gaming & consoles,Noon
Nintendo Gaming Console With Controller,"32,700",0.0,https://f.nooncdn.com/p/v1596038428/N34313802A_6.jpg?width=800,product_images/Nintendo Gaming Console With Controller.jpg,gaming & consoles,Noon
onikuma K19 RGB Wired Gaming Headset - Open Sealed,595,0.0,https://f.nooncdn.com/p/96b1fa253e6053fabb435119f30e25c6|pzsku/Z2352C41EB8F8658A64B4Z/45/1769088180/92c8d1c2-4183-491d-b0a4-f976ed00dea2.jpg?width=800,product_images/onikuma K19 RGB Wired Gaming Headset  Open Sealed.jpg,gaming & consoles,Noon
"T-DAGGER Arena TGK321 Mechanical Gaming Keyboard with 60% key travel, 61 keys with blue switches and rainbow RGB backlighting, compact wired keyboard with USB Type-C port, double-layer keycaps, floating key design, durability up to 50 million keystrokes, black color",795,0.0,https://f.nooncdn.com/p/pzsku/ZC6D26982FDE4363F11FFZ/45/_/1774971102/96353497-5d4f-4931-963f-75f8f0277a98.jpg?width=800,product_images/TDAGGER Arena TGK321 Mechanical Gaming Keyboard wi.jpg,gaming & consoles,Noon
"Nutty Exciting Russian Table Game Large Size 60*30cm, Kids Games, Table Hockey Game, Slingshot Soccer Game, Wooden Hockey Game, Fast Table Battle Speed ​​Series, Party Games, Kids Games, Adult Games",300,0.0,https://f.nooncdn.com/p/pzsku/Z532E27A8E32C8AE93095Z/45/1760450854/3fbbde89-07a9-47e4-8ba8-8b8f6d121634.jpg?width=800,product_images/Nutty Exciting Russian Table Game Large Size 6030c.jpg,gaming & consoles,Noon
Fantech Alto 7.1 GH26 Wired Over-Ear Gaming Headset – 7.1 Surround Sound + Noise Cancelling Microphone – Ergonomic Foam Cushions – PC/PS4/Switch/Mobile – Black,"1,850",0.0,https://f.nooncdn.com/p/pzsku/ZF6D507E8213B4CF39A8AZ/45/_/1773340796/27537356-4598-4f99-a98e-e208c7eaf3e1.jpg?width=800,product_images/Fantech Alto 71 GH26 Wired OverEar Gaming Headset .jpg,gaming & consoles,Noon
AK61 60% Gaming Keyboard – Hot Swap Blue Switch Mechanical – RGB Luminous – Type-C (detachable) Wired Keyboard – 61 English Layout Key | Black,"1,050",4.59,https://f.nooncdn.com/p/pzsku/Z8DE3A9FBED201F5CD5C8Z/45/1741047390/54a05407-1764-4c39-9f5b-8bcbd14ad404.jpg?width=800,product_images/AK61 60 Gaming Keyboard  Hot Swap Blue Switch Mech.jpg,gaming & consoles,Noon
"ASUS ROG Azoth 96 HE Wireless Gaming Keyboard – 96% Layout, Hot-Swappable HFX V2 Magnetic Hall Effect Switches, Adjustable Actuation, OLED Display, Tri-Mode Connectivity, RGB Per-Key Lighting, Gasket-Mounted, Metal Top, Detachable Wrist Rest, Black | 90MP040H-BKCA00 Black","12,305",0.0,https://f.nooncdn.com/p/pnsku/N70276820V/45/_/1767707377/821ce6e3-d018-4268-9e82-1d6da858cfab.jpg?width=800,product_images/ASUS ROG Azoth 96 HE Wireless Gaming Keyboard  96 .jpg,gaming & consoles,Noon
Wooden Gaming System Skin Cover For Laptop Universal Fit Multicolour,196,0.0,https://f.nooncdn.com/p/v1639244045/N52130422A_1.jpg?width=800,product_images/Wooden Gaming System Skin Cover For Laptop Univers.jpg,gaming & consoles,Noon
"Ovleng GP40M 3.5mm Wired Over-Ear E-sports Gaming Headset with Rotation Microphone, Noise Canceling, 3D Stereo Surround Sound, Volume control, Compatible with PC, Mac & Consoles - Camouflage Grey",657,0.0,https://f.nooncdn.com/p/c289748d560b585bb661063133fb8d53|pzsku/Z0D78C9047DA058E6E1AFZ/45/1770644913/13b9ead6-cd25-4566-b619-166aa4dc7b68.jpg?width=800,product_images/Ovleng GP40M 35mm Wired OverEar Esports Gaming Hea.jpg,gaming & consoles,Noon
Gamers Wall Art Set – 3 Pieces for PlayStation & Gaming Fans,599,0.0,https://f.nooncdn.com/p/pzsku/Z9707A73111F580B3200AZ/45/1759132275/6803516e-fc46-4c1d-9089-0364ad5311ed.jpg?width=800,product_images/Gamers Wall Art Set  3 Pieces for PlayStation  Gam.jpg,gaming & consoles,Noon
Tic-Tac-Toe Game Electronic Trouble Board Games Set Portable Indoor Party Gifts Puzzle Toy for Children,450,0.0,No Image,No Image,gaming & consoles,Noon
"Fury Florpad Fury FM1-1102 Gaming Chair Mat for Gaming Chair Gaming Bean Bag, Red | FM1-1102","3,445",0.0,No Image,No Image,gaming & consoles,Noon
