name,price,rating,image_url,image_path,category,source
Genius Scorpion K5 Gaming Keyboard,343,4.565,https://f.nooncdn.com/p/pzsku/Z03A9436DB2218444C485Z/45/_/1721044764/e33ec53a-2bee-4261-925f-9b8616abe897.jpg?width=800,product_images/Genius Scorpion K5 Gaming Keyboard.jpg,gaming & consoles,Noon
"ZIDLI M81 Gaming Mouse – 8800 DPI Optical Sensor, 7 Buttons, Avago A3050 Sensor, 3 Million Click Lifetime, Ergonomic Design, Black",340,0.0,https://f.nooncdn.com/p/pzsku/Z5F77F9CB7ED0BB397741Z/45/_/1715073806/5e99d91b-d7b2-4977-9a29-edea6495f323.jpg?width=800,product_images/ZIDLI M81 Gaming Mouse  8800 DPI Optical Sensor 7 .jpg,gaming & consoles,Noon
JeDEL KL141 68% Mechanical Gaming Keyboard (Arabic/English) 68 Keys – RED Switch - Rainbow LED Backlit – Double injection key caps Illumination – USB Wired For PC (Black/Red),775,4.442,https://f.nooncdn.com/p/7bb9086fa6605aa5a8d32044b08a9ba4|pzsku/Z4DFB9E9B41BE96B01600Z/45/1769805926/34e18241-63ef-4469-97ba-84428d287dab.jpg?width=800,product_images/JeDEL KL141 68 Mechanical Gaming Keyboard ArabicEn.jpg,gaming & consoles,Noon
Gaming Keyboard and Mouse Combo Set with RGB Backlit – USB Wired for PC and Laptop,540,0.0,https://f.nooncdn.com/p/27c4eb53c1f0533bbd76856e8fdd0084|pzsku/Z47E5DD52A3D5CFA17FB4Z/45/1769427549/0061f25b-eb47-4998-b8e7-fad8c1a47dc3.jpg?width=800,product_images/Gaming Keyboard and Mouse Combo Set with RGB Backl.jpg,gaming & consoles,Noon
Rwnq Screw  Paper Game suitable for family and friends gatherings. Board Games for Adults and Family  Fun Card Games and Parties  Endless Challenges and Laughter  Card Games  Group Games  Family Games,135,3.814,https://f.nooncdn.com/p/pzsku/Z36F725C5D235BD1482F0Z/45/1762596683/5a1783d3-c496-4835-8d2b-b613f1d5ce5a.jpg?width=800,product_images/Rwnq Screw  Paper Game suitable for family and fri.jpg,gaming & consoles,Noon
FANTECH Mk886 Atom  Rgb Full Mechanical Gaming Keyboard – Red Switch - Double Injection Keycaps,"1,608",0.0,https://f.nooncdn.com/p/62424582ed07541085ca08afaa3bf749|pzsku/Z96E9094EB7E46483E4CDZ/45/1770734815/9620a338-a8e8-4f90-8051-37c22c286a87.jpg?width=800,product_images/FANTECH Mk886 Atom  Rgb Full Mechanical Gaming Key.jpg,gaming & consoles,Noon
Redragon K565R RUDRA Gaming Mechanical Keyboard - RED Switch- Rainbow LED Lighting - English & Arabic Keys - Black,"1,690",3.815,https://f.nooncdn.com/p/v1661176610/N44755355A_1.jpg?width=800,product_images/Redragon K565R RUDRA Gaming Mechanical Keyboard  R.jpg,gaming & consoles,Noon
Mini Wired Video Game Console With Two Button TV Handheld Gaming With 2 Controllers For Nes 620 Built-in Classical Games US-Plug,"1,161",0.0,https://f.nooncdn.com/p/v1549601717/N20749136A_1.jpg?width=800,product_images/Mini Wired Video Game Console With Two Button TV H.jpg,gaming & consoles,Noon
"DXRacer Gaming Desk With Z Shaped Legs, Professional Game Work Station, Pc Gamer Table With Stand Cup Holder, Headphone Hook & Large Mouse Pad-Carbon Fiber Surface (Black/Red)","14,499",0.0,https://f.nooncdn.com/p/pnsku/N70077801V/45/_/1716613282/70997fb0-de1a-4ee0-9bd1-76658d49e3e0.jpg?width=800,product_images/DXRacer Gaming Desk With Z Shaped Legs Professiona.jpg,gaming & consoles,Noon
"REDRAGON H888 Tri-Mode Gaming Headset with 7.1 Surround Sound, 40mm Drivers, Dual Microphones, Bluetooth 5.3, 2.4GHz Wireless & Wired 3.5mm – Lightweight Design with Long Battery Life , White","2,450",5.04,https://f.nooncdn.com/p/pnsku/N70205144V/45/_/1761650034/efa2f9d4-c12a-440b-80bd-b0ac2e8f294f.jpg?width=800,product_images/REDRAGON H888 TriMode Gaming Headset with 71 Surro.jpg,gaming & consoles,Noon
"ZIDLI M82 RGB Gaming Mouse – 16000 DPI Optical Sensor, 6D Design, 69g Ultra-Lightweight, 7-Color RGB Backlight, Avago A3050, 500Hz Polling Rate, Black",385,0.0,https://f.nooncdn.com/p/pzsku/ZD3EFFA211395A0375AFDZ/45/_/1714388546/14c99352-46d9-4208-b461-7dce03974f60.jpg?width=800,product_images/ZIDLI M82 RGB Gaming Mouse  16000 DPI Optical Sens.jpg,gaming & consoles,Noon
Spear Pc Gaming PC With Intel Core i5-14400F Processor/16GB RAM DDR5/1TB SSD/8GB Nvidia GeForce RTX 5060 Graphics/Windows 11 Pro/ Black,"76,500",0.0,https://f.nooncdn.com/p/pnsku/N70208212V/45/_/1756363946/9023d723-0679-4b35-a331-31afe3fc4c03.jpg?width=800,product_images/Spear Pc Gaming PC With Intel Core i514400F Proces.jpg,gaming & consoles,Noon
"Razer Kishi V2 for Android - Universal Mobile Gaming Controller (Universal Fit with USB-C, Extendable Bridge, Stream PC and Console Games, Ergonomic Design, Nexus App) Black","6,999",5.02,https://f.nooncdn.com/p/pnsku/N53346499A/45/_/1771419721/a7dcb178-3d5f-47c9-aca3-e106f3688c3f.jpg?width=800,product_images/Razer Kishi V2 for Android  Universal Mobile Gamin.jpg,gaming & consoles,Noon
"65% Mechanical Gaming Keyboard – 68 Keys, Quiet Red Switches, RGB Backlight, Hot-Swappable, Wired USB, Compact Layout with Arrow Keys","4,620",0.0,https://f.nooncdn.com/p/pzsku/ZDDF4B0DDD0B6F9982B2DZ/45/1753006899/8516a28f-83d0-42ae-b61a-46c81df9875e.jpg?width=800,product_images/65 Mechanical Gaming Keyboard  68 Keys Quiet Red S.jpg,gaming & consoles,Noon
"Redragon K617 Magnetic Switch Rapid Trigger Gaming Keyboard, 60% Wired Mechanical Keyboard w/ 8k Hz Polling Rate(0.1ms), Hyper-Fast 0.2mm Actuation Custom Switch Adjustable via Software, Misty Grey","2,350",4.86,https://f.nooncdn.com/p/pnsku/N70136378V/45/_/1737033344/44911b92-0b07-4044-a6d0-6247a76afa6e.jpg?width=800,product_images/Redragon K617 Magnetic Switch Rapid Trigger Gaming.jpg,gaming & consoles,Noon
"Aula-H508 Gaming RGB Mouse With Side Wings, 4800 Dpi, Usb, Ergonomic,with multiple custom accessories ,support macro programing , 6 gear adjustable DPi  Backlit For Laptop And Desktop (WHITE OR BLACK)",599,3.35,https://f.nooncdn.com/p/pzsku/ZC1175BBE63949011EE44Z/45/_/1716295527/aa8f701a-01b5-4c91-b960-f5aa0a9a3cd8.jpg?width=800,product_images/AulaH508 Gaming RGB Mouse With Side Wings 4800 Dpi.jpg,gaming & consoles,Noon
REDRAGON Yaksa Usb Programmable Gaming Keyboard 7 Color Backlight Nemeanlion Usb Gaming Mouse Keyboard Set,"2,096",0.0,https://f.nooncdn.com/p/v1622039724/N47669219A_1.jpg?width=800,product_images/REDRAGON Yaksa Usb Programmable Gaming Keyboard 7 .jpg,gaming & consoles,Noon
"SVEN KB-G9500 Mechanical programmable keyboard Blue switches With Detachable wrist rest for computer and laptop, can be used at home, office, personal use",795,4.04,https://f.nooncdn.com/p/pzsku/Z210495317A2E24458E4CZ/45/_/1714391901/3cd2ee1c-eb37-4434-b3f5-8118aec11a2e.jpg?width=800,product_images/SVEN KBG9500 Mechanical programmable keyboard Blue.jpg,gaming & consoles,Noon
"onikuma Wired Professional Gaming Headset X10 Oxhorn RGB with Noise Cancelling Microphone, Over-Ear Fabric Cushions, Clear Sound Performance and Comfortable Design for PC, Laptop and Gaming Consoles (Black & Red)",975,4.043,https://f.nooncdn.com/p/f6159fb546225540ad6a8eed56e12ba3|pzsku/ZBAF10266641B17BE5818Z/45/1769691452/0d546fd2-15f2-40e3-b337-f5bc4c0c91f0.jpg?width=800,product_images/onikuma Wired Professional Gaming Headset X10 Oxho.jpg,gaming & consoles,Noon
Handheld Game Console With 168 Games,420,3.280,https://f.nooncdn.com/p/pnsku/N20471465A/45/_/1767607653/52f8580b-c1a9-45a4-8fa0-1bade09b11d2.jpg?width=800,product_images/Handheld Game Console With 168 Games.jpg,gaming & consoles,Noon
"OVLENG Gaming Stereo Headset GT66 with Rotatable Microphone, RGB Lighting, and Volume Control – Compatible with PS4, Laptop, and Mobile Devices -BLUE",589,0.0,https://f.nooncdn.com/p/pzsku/Z6F88CA244682CFE3F0EDZ/45/1741426572/cefeafe5-7aff-4a73-9c78-927be0309261.jpg?width=800,product_images/OVLENG Gaming Stereo Headset GT66 with Rotatable M.jpg,gaming & consoles,Noon
"Forev E-Sports gaming mouse with 1.5M USB Cable , silent key ,macro program ming , optical engine , LED Light , 4-level adjustable (1200 - 1800 - 2400 - 3600 DPI ) , Support windows 2000 / XP / win7 / win8 / win10 / vista / 32bit IOS or latest - FV-X9 , black",295,4.01,https://f.nooncdn.com/p/pzsku/ZF9B995BF3CD37F065B8EZ/45/_/1726745372/c1a71b34-87f8-45af-87ad-15d0c118db5a.jpg?width=800,product_images/Forev ESports gaming mouse with 15M USB Cable  sil.jpg,gaming & consoles,Noon
LEISHE X100 Gaming Kit (Mouse and Keyboard) Wired,425,0.0,https://f.nooncdn.com/p/pzsku/ZF262577C160C6FC7A386Z/45/1767379927/d938e5e1-05fa-47a2-997f-69f9fcae3d21.jpg?width=800,product_images/LEISHE X100 Gaming Kit Mouse and Keyboard Wired.jpg,gaming & consoles,Noon
REDRAGON Bluetooth Wireless Gaming Headset-Black,"2,699",3.617,https://f.nooncdn.com/p/v1686112468/N53411619A_1.jpg?width=800,product_images/REDRAGON Bluetooth Wireless Gaming HeadsetBlack.jpg,gaming & consoles,Noon
"BOLT FPS Booster Gaming PC Core i5-14600KF, RTX 4070 Super 12GB, Z790-P Wifi, 32GB RAM, 1TB SSD, 750W PSU, 360mm Liquid Cooler Black","78,200",0.0,https://f.nooncdn.com/p/pnsku/N70102961V/45/_/1724695688/f8a3da8f-7f26-4c88-8bb6-b08f8f014556.jpg?width=800,product_images/BOLT FPS Booster Gaming PC Core i514600KF RTX 4070.jpg,gaming & consoles,Noon
OVANN X27 Gaming Headset,450,0.0,https://f.nooncdn.com/p/bb3a81620001551e9c858ef80e987441|pzsku/Z46AC54BEB3324B482C9CZ/45/1769023027/4c2fb743-a0a2-4326-911f-7bf785d6a45a.jpg?width=800,product_images/OVANN X27 Gaming Headset.jpg,gaming & consoles,Noon
"Connect 4 Kids Toys, Classic Board Game 4 in a Row Strategy Game for Children, Fun Family Outdoor & Indoor Grid Game 2 Player , Perfect Gift for Kids, Ages 6 and Up",295,0.0,https://f.nooncdn.com/p/pzsku/ZC7E4C51A8F743E701ACAZ/45/1766580976/e2c673e7-1652-4949-aafa-d177068c5fc9.jpg?width=800,product_images/Connect 4 Kids Toys Classic Board Game 4 in a Row .jpg,gaming & consoles,Noon
REDRAGON K565R RUDRA Gaming Mechanical Keyboard - Blue Switch- Rainbow LED Lighting - English & Arabic Keys - Black,"1,505",5.04,https://f.nooncdn.com/p/v1611603400/N43973469A_1.jpg?width=800,product_images/REDRAGON K565R RUDRA Gaming Mechanical Keyboard  B.jpg,gaming & consoles,Noon
1STPLAYER PC Gaming TMD Intel Core i5-10400F Processor/ 16GB RAM 3200MB / 1TB SSD / Windows 10 Pro / NVIDIA GeForce RTX  Dual 12GB Black,"48,500",0.0,https://f.nooncdn.com/p/pzsku/Z93EA5475C63598D0296AZ/45/_/1775716456/51073a1c-e654-4bbd-8105-4761d10ed8d6.jpg?width=800,product_images/1STPLAYER PC Gaming TMD Intel Core i510400F Proces.jpg,gaming & consoles,Noon
"REDRAGON H888 Tri-Mode Gaming Headset with 7.1 Surround Sound, 40mm Drivers, Dual Microphones, Bluetooth 5.3, 2.4GHz Wireless & Wired 3.5mm – Lightweight Design with Long Battery Life , Black","2,450",0.0,https://f.nooncdn.com/p/pnsku/N70205145V/45/_/1762857828/aaf7754e-552b-4606-9d65-efe6f1bb1c0c.jpg?width=800,product_images/REDRAGON H888 TriMode Gaming Headset with 71 Surro.jpg,gaming & consoles,Noon
Card Game Stage 10,242,0.0,https://f.nooncdn.com/p/pzsku/ZCD01E66CE7F4BE1CA3F4Z/45/_/1718536496/0e70edee-f082-48ff-9131-6ac1390ec2f7.jpg?width=800,product_images/Card Game Stage 10.jpg,gaming & consoles,Noon
Spear Pc Gaming PC With Intel Core i5-14400F Processor/32GB RAM DDR5/1TB SSD/8GB Nvidia Geforce RTX 5060 Graphics/Windows 11 Pro/ Black,"72,000",0.0,https://f.nooncdn.com/p/pnsku/N70293991V/45/_/1771413360/510f9712-5892-44b0-ad7f-6f0e38c3b9bf.jpg?width=800,product_images/Spear Pc Gaming PC With Intel Core i514400F Proces.jpg,gaming & consoles,Noon
"Gaming Keyboard - Mechanical, RGB Backlit, High-Performance Keys for Gamers",959,0.0,https://f.nooncdn.com/p/pzsku/ZF5675DC3AF71A5E9E383Z/45/1748152802/dd8029bf-9812-45e1-aa63-c29fe9a38908.jpg?width=800,product_images/Gaming Keyboard  Mechanical RGB Backlit HighPerfor.jpg,gaming & consoles,Noon
Gamemax Mechanical Gaming Keyboard Rgb (Kg901),"2,567",0.0,https://f.nooncdn.com/p/pzsku/ZB01074BC55F16CF1839FZ/45/_/1687210280/31848532-ef00-4482-953d-423f939cd17f.jpg?width=800,product_images/Gamemax Mechanical Gaming Keyboard Rgb Kg901.jpg,gaming & consoles,Noon
Point PT-010 7.1 Gaming Headset - 50mm High-Magnetic Driver - 360° Adjustable Microphone - Comfortable and Lightweight Design - Cool RGB Lighting - USB Port - Black,901,0.0,https://f.nooncdn.com/p/pzsku/ZD0ADC990C0DD09B677BDZ/45/1761380030/422ceb3c-b4e0-46be-8a8b-12a9bad7f41d.jpg?width=800,product_images/Point PT010 71 Gaming Headset  50mm HighMagnetic D.jpg,gaming & consoles,Noon
"Anime Sword Gaming Mouse Pad , Large Extended Keyboard and Mouse Mat for PC , Non Slip Desk Mat | 800× 300×3 mm,",179,4.136,https://f.nooncdn.com/p/pzsku/Z5D22AE94461147EE3735Z/45/_/1692699036/8174c123-730e-40bc-ae00-56baf7f565f2.jpg?width=800,product_images/Anime Sword Gaming Mouse Pad  Large Extended Keybo.jpg,gaming & consoles,Noon
FOREV FV-G93 Stereo Gaming Headset | 50mm Drivers | RGB Lighting | Metal Frame | Omnidirectional Microphone | For PC & Mac (Black / Pink),689,0.0,https://f.nooncdn.com/p/pzsku/ZD558A0C6CA1C5F1FD839Z/45/1762337489/8358f5be-717e-4827-9c38-55a031191898.jpg?width=800,product_images/FOREV FVG93 Stereo Gaming Headset  50mm Drivers  R.jpg,gaming & consoles,Noon
Forev FV-Q301 Rainbow TKL Mechanical Gaming Keyboard – Blue Switch – 87 keys – Black Red,975,0.0,https://f.nooncdn.com/p/pzsku/ZC095E3E62AB5767BC7E8Z/45/_/1723895381/fc8f4100-336a-4265-bec3-89151b742ba2.jpg?width=800,product_images/Forev FVQ301 Rainbow TKL Mechanical Gaming Keyboar.jpg,gaming & consoles,Noon
ASESTEK AK104 RGB Gaming Keyboard With Wrist rest – Hot Swap Blue Switch Mechanical – RGB Luminous – Durable & Detachable wrist rest – USB Wired – 104 English Layout Key | Black,"1,450",0.0,https://f.nooncdn.com/p/pzsku/Z62F6675176CB3AEE0962Z/45/_/1740355739/0bbcffb4-4e33-4221-8bc6-47a0f75ea2a9.jpg?width=800,product_images/ASESTEK AK104 RGB Gaming Keyboard With Wrist rest .jpg,gaming & consoles,Noon
"JOYROOM Gaming Headset  JR-HG2, Noise-Canceling, Over-Ear Design","1,030",0.0,https://f.nooncdn.com/p/pzsku/ZC5DA5E16D38E9F8A0BCEZ/45/1758711977/dc9ebe4f-fa53-465a-81ec-a1dfcc9e26ed.jpg?width=800,product_images/JOYROOM Gaming Headset  JRHG2 NoiseCanceling OverE.jpg,gaming & consoles,Noon
Onikuma CW905 RGB Gaming Mouse - 6400 DPI -  7 Programable Buttons - Black,499,3.89,https://f.nooncdn.com/p/v1622199915/N47715573A_1.jpg?width=800,product_images/Onikuma CW905 RGB Gaming Mouse  6400 DPI   7 Progr.jpg,gaming & consoles,Noon
Forev V-G304 Wireless Gaming Mouse For PC | AA Battery | 2.4 GHZ with Nano USB Receiver,485,0.0,https://f.nooncdn.com/p/pzsku/Z687C0EB3765873D8C7B8Z/45/_/1730110295/23dc3d28-f424-4ea1-80f5-f56be8f82db1.jpg?width=800,product_images/Forev VG304 Wireless Gaming Mouse For PC  AA Batte.jpg,gaming & consoles,Noon
"REDRAGON M909 EMPEROR RGB Gaming Mouse | Optical Sensor 12,400DPI Pixart 3327 | 8 Programmable Buttons",899,0.0,https://f.nooncdn.com/p/v1611603512/N43973418A_1.jpg?width=800,product_images/REDRAGON M909 EMPEROR RGB Gaming Mouse  Optical Se.jpg,gaming & consoles,Noon
REDRAGON K681 MG-RGB-PRO Cyrus PRO 75% layout wireless Gasket mounted gaming mechanical keyboard 75% improved layout BT-2.4G-Wired provides better typing experience Hot swappable  Customized handle design for easy control,"2,950",4.723,https://f.nooncdn.com/p/pnsku/N70113162V/45/_/1726886954/635dc91f-e692-43c7-8ff8-4022126319e5.jpg?width=800,product_images/REDRAGON K681 MGRGBPRO Cyrus PRO 75 layout wireles.jpg,gaming & consoles,Noon
"Wired gaming mouse for computer and laptop, LED model GM2, Fire Cam, colorful with high accuracy - for home and office use, comfortable design for the hand and bright colors",325,0.0,https://f.nooncdn.com/p/pzsku/Z093D91E8F51523AEAFB6Z/45/_/1708938462/e630fbf2-5405-4b14-bf8f-840dd683f1a1.jpg?width=800,product_images/Wired gaming mouse for computer and laptop LED mod.jpg,gaming & consoles,Noon
"Blulory Tv Gaming System | Wireless Console Retro Gaming Console |4K Ultra HD |Plug & Play Wireless TV Video Game System | 24,000+ Games | 10 Emulators | Dual-Player Setup | 2.4G Wireless Game Stick","1,027",5.01,https://f.nooncdn.com/p/pzsku/Z263490E343C6A2F80D78Z/45/_/1772056780/94a77b4d-1101-4386-a3a9-b7f67cc9983c.jpg?width=800,product_images/Blulory Tv Gaming System  Wireless Console Retro G.jpg,gaming & consoles,Noon
"Wired Gaming Keyboard & Mouse Combo – RGB Backlit Mechanical-Feel Keyboard with Hand Rest & Phone Holder, High-Precision 6-Button Mouse, Large RGB Mouse Pad","1,410",0.0,https://f.nooncdn.com/p/pzsku/Z73911EEE90C41E9023BDZ/45/1762177388/1c440996-7942-46f3-905d-7a668548ecc6.jpg?width=800,product_images/Wired Gaming Keyboard  Mouse Combo  RGB Backlit Me.jpg,gaming & consoles,Noon
"onikuma G52 RGB Wired Mechanical Gaming Keyboard with 82 Keys,","1,295",0.0,https://f.nooncdn.com/p/f6159fb546225540ad6a8eed56e12ba3|pzsku/Z5A513B656C0FD90F3DF4Z/45/1769954534/5e3cf3da-eca6-4282-bdb1-76f3ff433fd9.jpg?width=800,product_images/onikuma G52 RGB Wired Mechanical Gaming Keyboard w.jpg,gaming & consoles,Noon
REDRAGON H370 Cadmus RGB USB Gaming Headset – Surround Sound 7.1,"1,999",5.02,https://f.nooncdn.com/p/pnsku/N70093245V/45/_/1721118722/f0d05a8c-f5c5-4daf-b20f-117e05cdb4b0.jpg?width=800,product_images/REDRAGON H370 Cadmus RGB USB Gaming Headset  Surro.jpg,gaming & consoles,Noon
HASBRO - GAMING Taboo Board Game A4626,300,0.0,https://f.nooncdn.com/p/v1612441552/N23780973A_1.jpg?width=800,product_images/HASBRO  GAMING Taboo Board Game A4626.jpg,gaming & consoles,Noon
"Wired Gaming Keyboard - Metal Panel & Ergonomic Design - 26 Keys Anti-ghosting, Mix LED Backlit for PC and Laptop","1,500",0.0,https://f.nooncdn.com/p/pzsku/ZEB4332CCDC996F0AB39AZ/45/1762605330/0ca9e9ae-4810-4e66-a2cb-91d8b39e5da3.jpg?width=800,product_images/Wired Gaming Keyboard  Metal Panel  Ergonomic Desi.jpg,gaming & consoles,Noon
Wireless Bluetooth Gaming Controller – Lightweight & Ergonomic Gamepad for PC and Consoles,"6,900",0.0,https://f.nooncdn.com/p/pzsku/ZF92A4F87779F9C6D9A63Z/45/1759052006/670c5182-aa4b-4060-805d-5f457e0620d8.jpg?width=800,product_images/Wireless Bluetooth Gaming Controller  Lightweight .jpg,gaming & consoles,Noon
"REDRAGON K642-RGB Akali Wired Gaming Mechanical Keyboard ,60% layout keyboard ,Hot-swappable design, Durable ABS keycaps and mechanical switches, Detachable type C cable-Red Switches, Black","1,875",0.0,https://f.nooncdn.com/p/pnsku/N70167088V/45/_/1744213707/b59d5ccf-40f5-4b90-861a-303c19603cd4.jpg?width=800,product_images/REDRAGON K642RGB Akali Wired Gaming Mechanical Key.jpg,gaming & consoles,Noon
Wired Gaming Keyboard and Mouse Combo – USB Connection – Multi-Color LED Backlight (Rainbow) – Black,888,0.0,https://f.nooncdn.com/p/pzsku/ZB615805F3054C03E1C66Z/45/1747134946/6a4d50b2-b94b-4a17-9061-1e263e5d1c49.jpg?width=800,product_images/Wired Gaming Keyboard and Mouse Combo  USB Connect.jpg,gaming & consoles,Noon
REDRAGON Gerberus M703 Gaming Mouse with 6 Programmable Buttons,650,3.73,https://f.nooncdn.com/p/v1537792302/N16863833A_1.jpg?width=800,product_images/REDRAGON Gerberus M703 Gaming Mouse with 6 Program.jpg,gaming & consoles,Noon
"Attack Shark X8PRO 8K Mouse with Grip Tape for Large Hand, 55 g Superlight, PixArt PAW3395PRO Gaming Sensor, BT/2.4G Wireless/Wired, 6 Adjustable DPI up to 40,000, 500 mAh Battery - Black","2,970",5.02,https://f.nooncdn.com/p/pzsku/ZFAE38D2331FE008847A4Z/45/1757770085/8c2e1005-6990-49b1-921e-db465f782a31.jpg?width=800,product_images/Attack Shark X8PRO 8K Mouse with Grip Tape for Lar.jpg,gaming & consoles,Noon
TWINS Double Shock USB Gaming Controller – Ergonomic Design with Vibration Feedback & Turbo Mode,600,0.0,https://f.nooncdn.com/p/pzsku/Z5D73184E09F7AB3B7B61Z/45/1743057317/e4ad86a8-441f-49e1-8ef1-09c9ef118405.jpg?width=800,product_images/TWINS Double Shock USB Gaming Controller  Ergonomi.jpg,gaming & consoles,Noon
1STPLAYER PC Gaming Fox SUPER With  Core i5-12400F Processor / 16GB RAM 3200MB / 1TB SSD / Windows 10 Pro /Nvidia GTX 1660 Black,"55,200",4.47,https://f.nooncdn.com/p/pzsku/ZD6B8DEE3CB6B8067EB87Z/45/_/1775716420/b1d1c6bb-cd83-461d-a5c3-626e4f1f3ed4.jpg?width=800,product_images/1STPLAYER PC Gaming Fox SUPER With  Core i512400F .jpg,gaming & consoles,Noon
"Fantech P31 3-in-1 RGB Gaming Combo – Keyboard, Mouse & Pad",799,0.0,https://f.nooncdn.com/p/pzsku/Z0DFE17D488938A61C3D4Z/45/1763060441/330d5a6c-819a-4a5e-8ccd-6f54e0bfbf88.jpg?width=800,product_images/Fantech P31 3in1 RGB Gaming Combo  Keyboard Mouse .jpg,gaming & consoles,Noon
"Tyshen Gaming Mouse - Rgb Lights With 7 Buttons 3200DPI , MSG-M27",315,0.0,https://f.nooncdn.com/p/pzsku/ZAD0763C0144231A08C73Z/45/_/1709042757/fc27f349-50bc-4df6-8186-2f4b7a9f818f.jpg?width=800,product_images/Tyshen Gaming Mouse  Rgb Lights With 7 Buttons 320.jpg,gaming & consoles,Noon
DOBE Stereo Gaming Headphone Black- TP5-3592,572,0.0,https://f.nooncdn.com/p/pzsku/Z30684F73361DEFCAD73BZ/45/1755525271/2c366885-ec9b-4e63-8bee-ff8069dc739b.jpg?width=800,product_images/DOBE Stereo Gaming Headphone Black TP53592.jpg,gaming & consoles,Noon
"DASEEN Gaming Tower PC, Core i7-10700F Processor/16GB DDR4 RAM/1TB HDD+240GB SSD/Windows 10/Wi-Fi Ready/NVIDIA GeForce RTX2060 6GB Graphic Card Black","65,938",3.45,https://f.nooncdn.com/p/v1636437219/N49176800A_1.jpg?width=800,product_images/DASEEN Gaming Tower PC Core i710700F Processor16GB.jpg,gaming & consoles,Noon
"JeDEL Rechargeable Wireless Gaming Mouse WD141 , Dual Bluetooth & 2.4GHz Connection , 1200DPI High Sensitivity , Ergonomic and Lightweight Design for Long-Term Use , Professional RGB Lighting , Powerful Long Life Battery , Compatible with PC, Laptop, and Gaming Systems - White",395,5.03,https://f.nooncdn.com/p/pzsku/ZE83A410BEC50424893D0Z/45/1750509549/a3f19028-dae0-40ec-a93c-5121f7900fea.jpg?width=800,product_images/JeDEL Rechargeable Wireless Gaming Mouse WD141  Du.jpg,gaming & consoles,Noon
MI Excite Gaming PC G6MATX PRO With Core i5 14400F CPU Processor/ Nvidia GeForce RTX 4070 Super Graphics/   32GB RAM DDR5 /1TB SSD/  Windows 11 Pro/ Black,"73,000",0.0,https://f.nooncdn.com/p/pnsku/N70154383V/45/_/1739986994/aeb6c497-38e7-413f-b87d-30286ff774fa.jpg?width=800,product_images/MI Excite Gaming PC G6MATX PRO With Core i5 14400F.jpg,gaming & consoles,Noon
"HP Victus 16-r0045ne Gaming 13th I7-13700H 14-Cores, 16 GB DDR5-5200 MHz RAM, 1TB SSD, 16.1"" FHDNVIDIA GeForce RTX 4050 6GB Backlit Keyboard English/Arabic Mica Silver","65,066",0.0,https://f.nooncdn.com/p/pnsku/N70135301V/45/_/1734008531/d4bd88ff-4c4d-4920-8a6e-dfaaf0abdd58.jpg?width=800,product_images/HP Victus 16r0045ne Gaming 13th I713700H 14Cores 1.jpg,gaming & consoles,Noon
Sup Double Game Box 400 in 1 Retro Gaming Console Classic USB Charging Birthday Gift for Kids (White),"2,073",0.0,https://f.nooncdn.com/p/pzsku/Z4D0C280BF27EA7A91777Z/45/1745180036/699597b8-ba1a-4632-9cd5-49286ea37508.jpg?width=800,product_images/Sup Double Game Box 400 in 1 Retro Gaming Console .jpg,gaming & consoles,Noon
"ASUS Monitor +  Super Gaming Pro PC Bundle - Intel Core i7-14700F, DDR5 32GB (2*16) 6200MHz Ram, 2TB NVMe M.2 SSD, RTX 4080 Super OC Edition 16GB GDDR6, 3 Fan AIO Liquid Cooler, 850W PSU, Windows 11 Pro + Asus P514 Rog Gladius III Wired Gaming Mouse + ASUS TUF K1 Membrane Gaming Keyboard + Razer Black Shark V2 X Wired Esports Gaming Headset + RAZER GIGANTUS Mouse Pad V2 XXL + 27 inch FHD, 280Hz, IPS, ELMB Sync, 1ms (GTG), Freesync Premium™, G-Sync, Variable Overdrive, sRGB, HDR Gaming Monitor Black","190,798",0.0,https://f.nooncdn.com/p/pnsku/N70106180V/45/_/1725442990/8c3b797b-eb92-40d5-807d-f5a74a39b2f9.jpg?width=800,product_images/ASUS Monitor   Super Gaming Pro PC Bundle  Intel C.jpg,gaming & consoles,Noon
"REDRAGON K677 Pro Rammus RGB Gaming Mechanical Keyboard, BT/2.4Ghz/Wired 3-Mode, Brown Switch","2,599",0.0,https://f.nooncdn.com/p/pnsku/N70119628V/45/_/1729050430/9d1cd959-f385-444b-89fe-0c430f554ad9.jpg?width=800,product_images/REDRAGON K677 Pro Rammus RGB Gaming Mechanical Key.jpg,gaming & consoles,Noon
"HP Full Size RGB Backlit Wired Mechanical Gaming Keyboard GK100F , 104 buttons , Gaming buttons rated at up to 50 million-clicks , Color uniform,  Blue Switch , overall lighting , friendly design - black",725,4.425,https://f.nooncdn.com/p/pzsku/ZA6C66A9594B11214409BZ/45/_/1772371423/3694a731-743e-456a-92e9-46094203044e.jpg?width=800,product_images/HP Full Size RGB Backlit Wired Mechanical Gaming K.jpg,gaming & consoles,Noon
"onikuma CW930 RGB Tri-Mode Wireless Gaming Mouse,Dynamic RGB Lighting Effects",745,0.0,https://f.nooncdn.com/p/f6159fb546225540ad6a8eed56e12ba3|pzsku/Z90539FD1FEAE4D8B20D5Z/45/1769874665/444afb9d-a302-4b38-986a-62cf780039c2.jpg?width=800,product_images/onikuma CW930 RGB TriMode Wireless Gaming MouseDyn.jpg,gaming & consoles,Noon
MI Excite Gaming PC G6MATX PRO With Core i5 13400F CPU Processor/ Nvidia GeForce RTX 4070 Super Graphics/   32GB RAM DDR5 /1TB SSD/  Windows 11 Pro/ Black,"73,000",0.0,https://f.nooncdn.com/p/pnsku/N70154293V/45/_/1739987062/704a6724-0903-4566-8e06-d5ca463e252f.jpg?width=800,product_images/MI Excite Gaming PC G6MATX PRO With Core i5 13400F.jpg,gaming & consoles,Noon
uRage | SoundZ 300 V2 Gaming Headset | Black,888,4.01,https://f.nooncdn.com/p/pzsku/Z0FE3142DAA13ACBF73B8Z/45/1764506602/e86caba8-6490-4cec-9ff5-9805c76b54e0.jpg?width=800,product_images/uRage  SoundZ 300 V2 Gaming Headset  Black.jpg,gaming & consoles,Noon
"havit Gaming Headphone (RGB) , Model H2040D , 50MM Dynamic unit,  Surround Sound Wired (3.5mm audio + USB) , Headphone With Noise Cancelling Microphone & In-Line Volume Control",935,0.0,https://f.nooncdn.com/p/pnsku/N70119813V/45/_/1729058510/717070bd-3102-4d58-be3d-17a22d97d18d.jpg?width=800,product_images/havit Gaming Headphone RGB  Model H2040D  50MM Dyn.jpg,gaming & consoles,Noon
Forev Gaming Mouse RGB Breathable Backlit LED - 6400 DPI - For PC FV-509,385,0.0,https://f.nooncdn.com/p/pzsku/ZEEAA332E3B5F9C5981C8Z/45/_/1711182355/8d0223b8-2da5-4dd7-8335-d3652072890e.jpg?width=800,product_images/Forev Gaming Mouse RGB Breathable Backlit LED  640.jpg,gaming & consoles,Noon
