name,price,rating,image_url,image_path,category,source
"Logitech G102 Light Sync Gaming Mouse with Customizable RGB Lighting, 6 Programmable Buttons Light Weight Black",999,3.71,https://f.nooncdn.com/p/pnsku/N28863701A/45/_/1767607881/e2b34618-9869-494a-b1ba-22a1897df09d.jpg?width=800,product_images/Logitech G102 Light Sync Gaming Mouse with Customi.jpg,gaming & consoles,Noon
onikuma X31 Wired Gaming Headphone with RGB Colorful Lighting Surround Sound Wired Headset for PC Gamers,475,4.393,https://f.nooncdn.com/p/f6159fb546225540ad6a8eed56e12ba3|pzsku/Z5ECA142254D7FC0A32F3Z/45/1771154460/f6fca65d-ce88-4f7b-a5a0-270c33add1fe.jpg?width=800,product_images/onikuma X31 Wired Gaming Headphone with RGB Colorf.jpg,gaming & consoles,Noon
T-DAGGER TGK313 BORA Gaming Mechanical Keyboard with LED Lighting Rainbow - Blue Switch,875,4.8161,https://f.nooncdn.com/p/pzsku/ZB1A285F7DFC5C7104C1FZ/45/_/1677407933/c42581d1-0f04-4962-bc78-f3bcab7efbec.jpg?width=800,product_images/TDAGGER TGK313 BORA Gaming Mechanical Keyboard wit.jpg,gaming & consoles,Noon
"Onikuma X31 RGB Wired Gaming Headset with Noise Cancelling Microphone Nintendo Switch, Xbox One, PS4, PS5, Bass Surround and Noise Cancelling with Flexible Mic, RGB Headphones for Laptop PC iPad Smartphones",440,4.1130,https://f.nooncdn.com/p/pzsku/Z745EC4657D1E920EB558Z/45/1761135844/2c1ab624-a776-472f-aa65-368c4d69ce4e.jpg?width=800,product_images/Onikuma X31 RGB Wired Gaming Headset with Noise Ca.jpg,gaming & consoles,Noon
AULA S20 Usb Wired Gaming Mouse |Programmable |Optical Ergonomic Mouse |With Breathing Led Lights | For Pc Laptop,225,4.2982,https://f.nooncdn.com/p/pnsku/N49539104A/45/_/1697541440/5e05e16d-87e6-4012-8815-edcbf1d9f7b8.jpg?width=800,product_images/AULA S20 Usb Wired Gaming Mouse Programmable Optic.jpg,gaming & consoles,Noon
"Redragon H270 RGB Gaming Headset with Microphone, Wired, Compatible with Xbox One, Nintendo Switch, PS4, PS5, PC, Laptops and Nintendo Switch (Black)",980,4.351,https://f.nooncdn.com/p/v1643545636/N52510391A_1.jpg?width=800,product_images/Redragon H270 RGB Gaming Headset with Microphone W.jpg,gaming & consoles,Noon
"FIFINE K688CT Dynamic Podcast Microphone XLR/USB Kit with Boom Arm Stand for Vocal Voice-Over Streaming, Studio Metal Mic with Mic Mute, Headphone Jack, Monitoring Volume Control, Windscreen","4,599",0.0,https://f.nooncdn.com/p/pzsku/ZDFD6ECEDED385CC04CA5Z/45/_/1774902643/aacdf782-3ecb-4465-97e0-3e5aeb0d939b.jpg?width=800,product_images/FIFINE K688CT Dynamic Podcast Microphone XLRUSB Ki.jpg,gaming & consoles,Noon
"Logitech G502 Hero High Performance Wired Gaming Mouse, Hero 25K Sensor, 25,600 Dpi, Rgb, Adjustable Weights, 11 Programmable Buttons, On-Board Memory, Pc/Mac - Black","2,400",4.22,https://f.nooncdn.com/p/pnsku/N21961435A/45/_/1767607792/6320d274-c154-4f0e-87b7-c8993a898fdb.jpg?width=800,product_images/Logitech G502 Hero High Performance Wired Gaming M.jpg,gaming & consoles,Noon
"Hiper M021 USB Condenser Gaming Microphone with 3.5 mm Headphone Jack , Micro Gamer for Podcast Streaming Youtube Conference, USB Compatible with PC, Laptop, PS4/5",799,4.325,https://f.nooncdn.com/p/pzsku/Z423B16AC2C782974EED3Z/45/1767809322/a09d034c-59b8-4922-aebb-0705e7cfdb09.jpg?width=800,product_images/Hiper M021 USB Condenser Gaming Microphone with 35.jpg,gaming & consoles,Noon
"REDRAGON FIZZ K617 60% Mechanical Keyboard, Red Key Switches, Hot-Swappable, Detachable Type-C Cable, Pro Software Customizable RGB, Full Rollover 61-Keys, White/Gray | K617-RGB","1,499",4.6289,https://f.nooncdn.com/p/pnsku/N52734335A/45/_/1764242053/aec7af20-1404-4be1-bf56-67f2c835a6fe.jpg?width=800,product_images/REDRAGON FIZZ K617 60 Mechanical Keyboard Red Key .jpg,gaming & consoles,Noon
REDRAGON K552 Rainbow Gaming Mechanical Keyboard - Outemu Red Switch - METAL ABS CONSTRUCTION,"1,449",4.7175,https://f.nooncdn.com/p/pnsku/N43973446A/45/_/1764173753/855f4ef2-7a78-4acb-b437-275b0450f101.jpg?width=800,product_images/REDRAGON K552 Rainbow Gaming Mechanical Keyboard  .jpg,gaming & consoles,Noon
KOTION EACH G9000 Pro Gaming Wired Headset 3.5mm Stereo Jack With Mic LED Light For Xbox One S/Xbox one/PS4/Tablet/Laptop/Cell Phone,650,4.12,https://f.nooncdn.com/p/v1667311903/N22849306A_1.jpg?width=800,product_images/KOTION EACH G9000 Pro Gaming Wired Headset 35mm St.jpg,gaming & consoles,Noon
"X-SCOOT XS-650 High Resolution Stereo Bass Headphones with HD Noise Reduction Mic, Extended Playtime, Extra Soft Cushions, TF Card Support, AUX-In, Type-C Charging and Voice Assistant Compatibility , Foldable Design for Music & Hands Free Calls - Black",590,4.813,https://f.nooncdn.com/p/pzsku/Z9C315ACFEC7E4B2DCF5DZ/45/1763311164/52f70d19-0d3b-499a-b5c1-1e619682b806.jpg?width=800,product_images/XSCOOT XS650 High Resolution Stereo Bass Headphone.jpg,gaming & consoles,Noon
"X-SCOOT XS-651 Stereo Bass Headphones with Hi-Res Audio, Simple Folding Design, Extra-Soft Cushions, Voice Assistant Ready, 3.5mm AUX-In, Hands-Free Calls , Lightweight and Easy to Carry - Black",495,3.711,https://f.nooncdn.com/p/pzsku/Z37ED1DEF07F64987C13AZ/45/1763381309/095fd084-5d46-4326-a116-4afdcd8799d3.jpg?width=800,product_images/XSCOOT XS651 Stereo Bass Headphones with HiRes Aud.jpg,gaming & consoles,Noon
KZ ZSN Pro X In-Ear Earphones,"1,399",3.49,https://f.nooncdn.com/p/v1608161415/N43101207A_1.jpg?width=800,product_images/KZ ZSN Pro X InEar Earphones.jpg,gaming & consoles,Noon
XTRIKE ME XMC-03 USB RGB Gaming Streaming Microphone Live Streaming Desktop Omnidirectional mic - 12 RGB Lighting Modes - 360 Degree rotatable body - Shielded Cable For PC,599,3.981,https://f.nooncdn.com/p/pzsku/Z37D03A5CB6C076D00FC8Z/45/1767808672/37794f19-b67a-4e6e-95f1-8601f8647b74.jpg?width=800,product_images/XTRIKE ME XMC03 USB RGB Gaming Streaming Microphon.jpg,gaming & consoles,Noon
"havit H2002D Black Gaming Headset, 53mm Drivers, 3.5mm Wired Connection, Detachable Omnidirectional Mic, Adjustable Headband & Protein Leather Earmuffs, 20Hz-20kHz Frequency Response, 2.0m Cable, Compatible with PC, Laptop, PS4, PS5, Xbox & Mobile","1,790",4.564,No Image,No Image,gaming & consoles,Noon
"REDRAGON M711 Cobra Gaming Mouse with 16.8 Million RGB Color Backlit, 12,400 DPI Adjustable, Comfortable Grip, 8 Programmable Buttons, Black",900,4.6304,No Image,No Image,gaming & consoles,Noon
"REDRAGON K1NG M724 Wired Gaming Mouse, 42G Ultra-Light 12,400 Max DPI Optical Gaming Mouse with 5 Programmable Buttons, Ergonomic Natural Grip Build, Software Supports DIY Keybinds & DPI, Black",999,4.766,No Image,No Image,gaming & consoles,Noon
"X-SCOOT XS-652 Foldable Stereo Headphones with Pure Sound 40mm Drivers, Extended Battery Life, HD Mic, Voice Assistant Support, TF Card & 3.5mm AUX-In , Comfortable Cushions for Everyday Use - Black",595,3.928,No Image,No Image,gaming & consoles,Noon
Forev FV-Q1S Rainbow Wired Gaming Keyboard English & Arabic,325,2.828,No Image,No Image,gaming & consoles,Noon
"Beexcellent GM5 Gaming Headset, 7.1 Surround Sound PS4 Headset with Microphone, For Games, PC Headphones, Heavy Bass, Telescopic, Noise Isolation, Wired, FPS Compatible, LED Light",499,4.031,No Image,No Image,gaming & consoles,Noon
"X-SCOOT XS-653 Foldable Stereo Headphones with Pure Bass Sound, Hi-Res Audio, HD Mic, Extra-Soft Cushions, TF Card Support & 3.5mm AUX-In , Comfortable Over Ear Design for Music, Calls & Daily Use - Black",575,3.835,No Image,No Image,gaming & consoles,Noon
"REDRAGON H848 Bluetooth Wireless Gaming Headset - Lightweight  - 40MM Drivers - Detachable Microphone - Multi Platforms for PC, PS5/4/3, NS, Mobile","2,650",3.866,No Image,No Image,gaming & consoles,Noon
FINEC Textured Gaming Mouse Pad,38,4.42,No Image,No Image,gaming & consoles,Noon
T-DAGGER TGK313 BORA Gaming Mechanical Keyboard with LED Lighting Rainbow Brown Switch,975,4.721,No Image,No Image,gaming & consoles,Noon
"onikuma K8 RGB Gaming Headset  7.1 Surround Sound Noise Canceling Mic ,PC , PS4-3 , Mobile And Xbox",843,4.12,No Image,No Image,gaming & consoles,Noon
"X-SCOOT XS-655 Wireless Bluetooth Headphones, 40mm Deep Bass Drivers, Hands-Free Calls, TF Card & 3.5mm AUX, Extra Soft Cushions, 24H Playtime, USB-C Charging",595,4.512,No Image,No Image,gaming & consoles,Noon
"MSI H991 Wired Gaming Headset, Built-in Mic, Noise Cancellation, In-line Control, Ergo Design, Adjustable Headband for PC, PS4, PS5, Xbox One, Switch, Notebook/Mobile",699,3.810,No Image,No Image,gaming & consoles,Noon
"Logitech G102 Light Sync Gaming Mouse with Customizable RGB Lighting, 6 Programmable Buttons, Gaming Grade Sensor, 8 k dpi Tracking,16.8mn Color, Light Weight (White)","1,100",3.5568,No Image,No Image,gaming & consoles,Noon
"REDRAGON K1NG M724 Wired Gaming Mouse, 42G Ultra-Light 12,400 Max DPI Optical Gaming Mouse with 5 Programmable Buttons, Ergonomic Natural Grip Build, Software Supports DIY Keybinds & DPI, White",999,4.761,No Image,No Image,gaming & consoles,Noon
"Maono AU-A04 USB Microphone, MAONO  Plug & Play PC Computer Podcast Condenser Cardioid Metal Mic Kit with Professional Sound Chipset for Recording, Gaming, Singing, YouTube","2,199",4.324,No Image,No Image,gaming & consoles,Noon
"RUNMUS K2 Wired Gaming Headset, Green LED Lights with Mic",450,3.219,No Image,No Image,gaming & consoles,Noon
"FIFINE A8 Gaming Condenser RGB Microphone, USB PC Mic for Streaming, Podcasts, Recording, with Control, Mute Touch, Headphone Jack, Pop Filter","2,799",0.0,No Image,No Image,gaming & consoles,Noon
"X-SCOOT Wireless Foldable Headphones with Pure Bass Sound, Double Bass Effect, 24 Hours Playtime, Voice Assistant Ready, Hi-Res Audio, HD Mic for Hands Free Calls, TF Card Support & Ergonomic Comfortable - Black",585,4.026,No Image,No Image,gaming & consoles,Noon
"Razer DeathAdder Essential Gaming Mouse – 6400 DPI Optical Sensor, Ergonomic Right-Handed Design, 5 Programmable Buttons, Razer Mechanical Switches, Wired, Green LED, Durable 10M Clicks, Black | RZ01-03850100-R3M1","1,199",3.81,No Image,No Image,gaming & consoles,Noon
"REDRAGON H260 HYLAS RGB Gaming Headset-With Microphone,Wired,Compatible With Xbox One,Nintendo Switch,PS4,PS5,PCS,LAPTOPS",975,4.360,No Image,No Image,gaming & consoles,Noon
"REDRAGON H260 RGB Gaming Headset with Microphone, Wired, Compatible with Xbox One, Nintendo Switch, PS4, PS5, PCs, Laptops and Nintendo Switch",910,4.251,No Image,No Image,gaming & consoles,Noon
"X-SCOOT XS-650 High Resolution Stereo Bass Headphones with HD Noise isolation Mic, Extended Playtime, Extra Soft Cushions, TF Card Support, AUX-In, Type-C Charging and Voice Assistant Compatibility , Foldable Design for Music & Hands Free Calls - Grey",595,3.54,No Image,No Image,gaming & consoles,Noon
"FIFINE K688 Dynamic Podcast Microphone XLR/USB for Vocal Voice-Over Streaming, Studio Metal Mic with Mic Mute, Headphone Jack, Monitoring Volume Control, Windscreen","3,999",4.015,No Image,No Image,gaming & consoles,Noon
onikuma X80 Abyss Mirror Wired RGB Gaming Headphone with Microphone,825,3.719,No Image,No Image,gaming & consoles,Noon
"Logitech H390 Wired Headset, Stereo Headphones With Noise-Cancelling Microphone, USB, In-Line Controls, PC/Mac/Laptop Black","1,380",5.04,No Image,No Image,gaming & consoles,Noon
"T-DAGGER Arena TGK321 Mechanical Gaming Keyboard with 60% key travel, 61 keys with red switches and rainbow RGB backlighting, compact wired keyboard with USB Type-C port, double-layer keycaps, floating key design, durability up to 50 million keystrokes, black color.",795,0.0,No Image,No Image,gaming & consoles,Noon
HyperX Cloud III  Wired Gaming Headset,"4,399",4.129,No Image,No Image,gaming & consoles,Noon
"Maono PD100X XLR/USB Gaming Microphone with Software, Dynamic PC Microphone with RGB for Streaming Podcast Vocal Recording, Computer Mic with Noise Cancellation, Mute Button, Gain Knob, Desktop Stand","2,065",3.812,No Image,No Image,gaming & consoles,Noon
"REDRAGON ZEUS 2, Wired headset, with Adapter, 7.1 Surround, 53mm Drivers, 110±3dB Sensitivity, Detachable Mic, Adjustable Headband With Lightweight Durable Made Steel Frame, Black | ZEUS 2 H510-1","2,250",4.4175,No Image,No Image,gaming & consoles,Noon
"X-SCOOT XS-653 Foldable Stereo Headphones with Pure Bass Sound, Hi-Res Audio, HD Mic, Extra-Soft Cushions, TF Card Support & 3.5mm AUX-In , Comfortable Over Ear Design for Music, Calls & Daily Use - Beige",545,3.47,No Image,No Image,gaming & consoles,Noon
"Logitech H340 USB Headset, Plug And Play, Noise Cancelling Microphone, USB Type A, Adjustable Headband - Black","1,000",4.2150,No Image,No Image,gaming & consoles,Noon
"REDRAGON H510-RGB Zeus X Wired Gaming Headset, Ergonomic Design, 7.1 Surround Sound, 53mm Drive, Detachable Microphone & RGB Lights, 3.5mm Cable, USB Control Box & 3.5mm Jack Input, Black | H510-RGB","2,410",4.3111,No Image,No Image,gaming & consoles,Noon
"REDRAGON K688-RGB-BRAGI PRO Wireless Mechanical Gaming Keyboard, 3 Mode Gasket Mounted RGB Gaming Keyboard with Volume Knob, Pre-Lubed Linear Switches, MDA-Profile, 98 Keys Hot Swappable Creamy Keyboard for PC/Tablet/Xbox/PS4","3,399",5.016,No Image,No Image,gaming & consoles,Noon
"REDRAGON M811 Aatrox MMO Gaming Mouse, 15 Programmable Buttons, Wired RGB Gaming Mouse with Natural Ergonomic Grip, 10 Side Macro Keys","1,299",3.110,https://f.nooncdn.com/p/pnsku/N70007399V/45/_/1695801751/5859fc25-16ef-4cb9-8323-5cf06f3d7757.jpg?width=800,product_images/REDRAGON M811 Aatrox MMO Gaming Mouse 15 Programma.jpg,gaming & consoles,Noon
"REDRAGON M918 PRO 3-Mode Wireless Gaming Mouse, 49G Lightweight 26K DPI Gamer Mouse w/Ergonomic Natural Grip Build, Full Programmable Buttons, Software Supports DIY Keybinds & DPI","1,999",4.33,https://f.nooncdn.com/p/pnsku/N70262027V/45/_/1764085927/3b1ab48f-a8c5-49a2-9394-66e49fd12b22.jpg?width=800,product_images/REDRAGON M918 PRO 3Mode Wireless Gaming Mouse 49G .jpg,gaming & consoles,Noon
"REDRAGON M690 PRO Wireless Gaming Mouse, 8000DPI Wired/Wireless Gaming Mouse with Quick Fire Button, 8 Macro Buttons, Ergonomic Design for PC/Mac/Laptop","1,500",4.714,https://f.nooncdn.com/p/pnsku/N70008915V/45/_/1695974603/b941d915-bc8f-4bfb-b27a-04b676f1b8f3.jpg?width=800,product_images/REDRAGON M690 PRO Wireless Gaming Mouse 8000DPI Wi.jpg,gaming & consoles,Noon
"REDRAGON K1NG M724 Wired Gaming Mouse, 42G Ultra-Light 12,400 Max DPI Optical Gaming Mouse with 5 Programmable Buttons, Ergonomic Natural Grip Build, Software Supports DIY Keybinds & DPI, Pink for Laptop & PC Gamers",925,0.0,https://f.nooncdn.com/p/pnsku/N70212064V/45/_/1757254177/e492856a-af3f-461e-9127-9db5a365f4ca.jpg?width=800,product_images/REDRAGON K1NG M724 Wired Gaming Mouse 42G UltraLig.jpg,gaming & consoles,Noon
Redragon M910H Ranger Basic Wired RGB Gaming Mouse,875,0.0,https://f.nooncdn.com/p/pnsku/N70142804V/45/_/1736848016/f2e35785-66e6-45db-828a-d73f37dd9697.jpg?width=800,product_images/Redragon M910H Ranger Basic Wired RGB Gaming Mouse.jpg,gaming & consoles,Noon
AULA Rainbow Full Gaming Mechanical Keyboard Black,840,4.87,https://f.nooncdn.com/p/v1634951827/N51501101A_1.jpg?width=800,product_images/AULA Rainbow Full Gaming Mechanical Keyboard Black.jpg,gaming & consoles,Noon
"REDRAGON M913 Impact Elite Wireless & Wired Gaming Mouse – 16,000 DPI Pixart 3335 Sensor, 16 Programmable Buttons (12 Side Buttons), RGB Lighting, 45-Hour Battery, Ergonomic Design for MMO/MOBA, USB-C & 2.4GHz Connectivity, Black","1,599",4.452,https://f.nooncdn.com/p/v1666792971/N39323144A_1.jpg?width=800,product_images/REDRAGON M913 Impact Elite Wireless  Wired Gaming .jpg,gaming & consoles,Noon
"Point Gaming Keyboard, multimedia shortcuts, WaterProof, Wired USB interface, English and Arabic - Point PT-70",299,4.220,https://f.nooncdn.com/p/pzsku/Z3F8050CDD78185CAE401Z/45/1767808022/e2ac6b72-c2a1-4f2e-886a-6ea6d37dcd5a.jpg?width=800,product_images/Point Gaming Keyboard multimedia shortcuts WaterPr.jpg,gaming & consoles,Noon
"REDRAGON H848G Bluetooth Wireless Bluetooth Gaming Headset - Lightweight - 7.1 Surround Sound - 40mm Driver - Detachable Microphone - Multi platforms for PC, PS5/4/3, Switch, Mobile Phone","2,750",3.55,https://f.nooncdn.com/p/pnsku/N70220926V/45/_/1758635810/665bdd35-ac91-4f97-9bb6-5fed3e8c0783.jpg?width=800,product_images/REDRAGON H848G Bluetooth Wireless Bluetooth Gaming.jpg,gaming & consoles,Noon
Utopia Gaming Keyboard BA-505 with Rainbow Color LED Lighting and Plastic Gaming Surface - Easy and comfortable to use.,325,5.02,https://f.nooncdn.com/p/pzsku/Z200406AC400D9C05259EZ/45/_/1731241282/8e77405e-0ef0-4631-9791-9bdeec52cfdf.jpg?width=800,product_images/Utopia Gaming Keyboard BA505 with Rainbow Color LE.jpg,gaming & consoles,Noon
"AULA G1000 USB Gamepad Dual Vibration Motor Turbo Mode Accurate Joysticks Ergonomic Design V-strip LED Indicator High Performance Gaming Controller/Remote Plug And Play Supports PC, PS3",499,3.912,https://f.nooncdn.com/p/pzsku/ZBBB090A57A7558E43AFBZ/45/1766227856/fe29413c-d23a-48e4-a570-515602da751b.jpg?width=800,product_images/AULA G1000 USB Gamepad Dual Vibration Motor Turbo .jpg,gaming & consoles,Noon
"Zero Electronics Wired Gaming Mouse - 4800 DPI, with 7 Programmable Buttons and Built-in LED Lighting - Black",250,4.73,https://f.nooncdn.com/p/ed9fe0d122795e71b79d2bba00088fa8|pzsku/ZEAE5822865E5E0F76F2BZ/45/1768822581/facdd732-7f3c-47dd-9eec-a513109c1da5.jpg?width=800,product_images/Zero Electronics Wired Gaming Mouse  4800 DPI with.jpg,gaming & consoles,Noon
"HYPERX Pulsefire Haste 2 Core Wireless Gaming Mouse – 12,000 DPI, 6 Buttons, TTC Gold Switches, 1,000Hz Polling, LED RGB, Dual Wireless (2.4GHz/Bluetooth), 70g, 100-Hour Battery - Black | 8R2E6AA","2,400",4.411,https://f.nooncdn.com/p/pnsku/N70100921V/45/_/1766986597/b2427084-5ca7-4294-9eb0-2321e72a17ad.jpg?width=800,product_images/HYPERX Pulsefire Haste 2 Core Wireless Gaming Mous.jpg,gaming & consoles,Noon
REDRAGON Griffin M607 Wired USB Gaming Mouse with 7 Programmable Buttons / 7200 DPI/RGB Lighting for Windows/Mac PC,869,4.7180,https://f.nooncdn.com/p/pnsku/N30390336A/45/_/1764242517/a3f1979f-3350-4c3a-af17-bddfd4473ef7.jpg?width=800,product_images/REDRAGON Griffin M607 Wired USB Gaming Mouse with .jpg,gaming & consoles,Noon
"REDRAGON M991 Wireless Gaming Mouse, 19000 DPI Wired/Wireless Gamer Mouse w/Rapid Fire Key","2,325",4.58,https://f.nooncdn.com/p/v1690984927/N53425331A_1.jpg?width=800,product_images/REDRAGON M991 Wireless Gaming Mouse 19000 DPI Wire.jpg,gaming & consoles,Noon
"HYPERX Pulsefire Fuse Wireless Gaming Mouse, Ambidextrous Lightweight 75g, Pixart PAW3311 Sensor Up to 12,000 DPI, Dual Wireless 2.4GHz & Bluetooth, 85-Hour Battery Life, RGB Lighting, Black | A1KY6AA","2,100",4.99,https://f.nooncdn.com/p/pnsku/N70177258V/45/_/1747655562/e8324623-b93e-46ae-b297-d71e69a76266.jpg?width=800,product_images/HYPERX Pulsefire Fuse Wireless Gaming Mouse Ambide.jpg,gaming & consoles,Noon
REDRAGON K565R-1 RUDRA Rainbow Backlit Mechanical Gaming Keyboard Brown Switch,"1,650",4.915,https://f.nooncdn.com/p/v1658133110/N53336340A_1.jpg?width=800,product_images/REDRAGON K565R1 RUDRA Rainbow Backlit Mechanical G.jpg,gaming & consoles,Noon
"REDRAGON M987 Reaping RGB Gaming Mouse - Honeycomb Light Weight Only [55 Grams] - Optical Sensor 12,400 DPI - 6 Programmable Buttons","2,310",4.49,https://f.nooncdn.com/p/v1655271158/N53331008A_1.jpg?width=800,product_images/REDRAGON M987 Reaping RGB Gaming Mouse  Honeycomb .jpg,gaming & consoles,Noon
"REDRAGON M901 PERDITION 3 Wired Gaming Mouse – 24000DPI (White) - 1200FPS , Super Fast Game Engine","1,999",0.0,https://f.nooncdn.com/p/pnsku/N70053114V/45/_/1709879460/bcaf443c-544d-4c50-b4d5-156423ee4e19.jpg?width=800,product_images/REDRAGON M901 PERDITION 3 Wired Gaming Mouse  2400.jpg,gaming & consoles,Noon
"REDRAGON M816-PRO Wireless Gaming Mouse, 26K DPI Tri-Mode 61G Ultra-Light Mouse Gaming, RGB, 6 Full Programmable Buttons Mice, Software Support, 200Hrs Long Battery Life for PC, Mac","1,950",4.63,https://f.nooncdn.com/p/pnsku/N70212070V/45/_/1763895816/64fb51e5-09e0-4b40-a361-c520c7de335f.jpg?width=800,product_images/REDRAGON M816PRO Wireless Gaming Mouse 26K DPI Tri.jpg,gaming & consoles,Noon
"REDRAGON M617-LIT Ultralight Honeycomb Shell Wired Gaming Mouse, 41g, 10,000 DPI, 6 Programmable Buttons, Drag-Free Paracord, Type-C Gamer Mouse with 2 Side Buttons for PC/Mac/Laptop, Black",799,5.06,https://f.nooncdn.com/p/pnsku/N70205147V/45/_/1767607849/0be90032-ee9a-426f-a983-9feb504d9429.jpg?width=800,product_images/REDRAGON M617LIT Ultralight Honeycomb Shell Wired .jpg,gaming & consoles,Noon
"REDRAGON H231 Scream Gaming Headset, Stereo Surround Sound, 40mm Drivers",970,0.0,https://f.nooncdn.com/p/pnsku/N70094720V/45/_/1721716650/e3d90c38-475a-4686-ac73-4ea4159b15a5.jpg?width=800,product_images/REDRAGON H231 Scream Gaming Headset Stereo Surroun.jpg,gaming & consoles,Noon
Universal Phone Cooling Handle - FOR PUPG Mobile Gaming Grip with Integrated ICE Cooling Fan | Ergonomic Radiator for All Smartphones - Low Noise Design Prevents Overheating During Long Gaming Sessio,699.99,5.01,https://f.nooncdn.com/p/pzsku/Z668593694B3524A919C9Z/45/1754207655/312f7978-7d81-4a3e-b5d3-66e0cf3e1f20.jpg?width=800,product_images/Universal Phone Cooling Handle  FOR PUPG Mobile Ga.jpg,gaming & consoles,Noon
Grand Gaming Mouse Colorful Lightning With 7 Button And Nylon Braided Wire Elegant Appearance Efficient Gaming Mouse 2400 Dpi For Laptop & For Computer - Black Silver,219,3.520,https://f.nooncdn.com/p/984598a2f42f543f88a1401457250260|pzsku/ZDDA6B597FC1BD0D77A8DZ/45/1769385066/18c43f7a-af6b-4c53-a708-c1ca80c106ed.jpg?width=800,product_images/Grand Gaming Mouse Colorful Lightning With 7 Butto.jpg,gaming & consoles,Noon
"ASUS ROG Spatha X Wireless Gaming Mouse Magnetic Charging Stand, 12 Programmable Buttons, 19,000 DPI, Push-Fit Hot Swap Switch Sockets, ROG Micro Switches, ROG Paracord and Aura RGB Lighting","6,847",5.01,https://f.nooncdn.com/p/pnsku/N70011678V/45/_/1741204132/cb40fb30-2a38-4cf9-9587-ae737782a967.jpg?width=800,product_images/ASUS ROG Spatha X Wireless Gaming Mouse Magnetic C.jpg,gaming & consoles,Noon
"Gaming Mouse Pad (90 X 40) Thick Extended Mouse Mat Non-Slip Spill-Resistant Desk Pad with Special-Textured Surface, Anti-Fray Stitched Edges for Keyboard, PC - Black",299,4.449,https://f.nooncdn.com/p/pzsku/Z65E7B122625C9E5660DBZ/45/_/1772125803/96e45015-824b-42d8-9efb-f97a378cd0a1.jpg?width=800,product_images/Gaming Mouse Pad 90 X 40 Thick Extended Mouse Mat .jpg,gaming & consoles,Noon
J36 Ultra Game Console 3.5 Inch Portable Retro Game Console Built-in 20000+ Games With 64GB Memory Card Video Games Console 20+ Supported Simulator Platform 3000mAh Battery IPS Screen Toys And Games For Kids And Adults WHITE,"2,804",0.0,https://f.nooncdn.com/p/pzsku/ZA0D976E19C288FAC0CAEZ/45/1761219655/c2c1a452-eb1d-4d6a-9117-aba28fe59500.jpg?width=800,product_images/J36 Ultra Game Console 35 Inch Portable Retro Game.jpg,gaming & consoles,Noon
"onikuma Professional Gaming Headset X7 Pro with High-Quality Stereo Sound, Adjustable Microphone with Noise Isolation, RGB Lighting, 40mm Drivers, 3.5mm Input + USB for Lighting, Ergonomic Design with Soft Ear Cushions, Compatible with PC, PlayStation, Xbox, and Mobile",541,3.814,https://f.nooncdn.com/p/pzsku/Z9B367C729F6818147107Z/45/1752667705/63ed778c-1e2b-482f-90e8-330d804e82c3.jpg?width=800,product_images/onikuma Professional Gaming Headset X7 Pro with Hi.jpg,gaming & consoles,Noon
M27 Retro Handheld Game Console - Green,"4,555",0.0,https://f.nooncdn.com/p/4b8bc6b5e47a5caba4fea9ba43be5cc2|pzsku/ZDFC4C9503A34157817B4Z/45/1770713693/9c31ec75-26cb-4e04-be94-a8f93bd14bbd.jpg?width=800,product_images/M27 Retro Handheld Game Console  Green.jpg,gaming & consoles,Noon
"Blulory 4K Smart Video Game TV Stick,Video Game Consoles,10,000 Games 32/64GB Retro Classic Gamin 2.4G Wireless Gamepads Controller (64G,10000+ Games)",949,0.0,https://f.nooncdn.com/p/6696588b42ac5bf196fa67a259dc1167|pzsku/Z6014D98CD1F2DE99807AZ/45/1770589077/82996013-b8e4-4a2b-972d-8ac2ca7e6562.jpg?width=800,product_images/Blulory 4K Smart Video Game TV StickVideo Game Con.jpg,gaming & consoles,Noon
XTRIKE ME GK916 Gaming Mechanical Keyboard - Red Switches - Rainbow LED Lighting,750,4.3167,https://f.nooncdn.com/p/pzsku/Z1AEE719D06E25A285038Z/45/1749035002/0f3863ec-8916-46f0-abc3-b63bf0045619.jpg?width=800,product_images/XTRIKE ME GK916 Gaming Mechanical Keyboard  Red Sw.jpg,gaming & consoles,Noon
"REDRAGON K662 Gwern Dual Mode Wireless, Bluetooth Gaming Mechanical Keyboard, Red Switch","1,599",3.58,https://f.nooncdn.com/p/pnsku/N70116258V/45/_/1727858879/ae607d47-36c7-4c9c-8f97-4b736810d3cd.jpg?width=800,product_images/REDRAGON K662 Gwern Dual Mode Wireless Bluetooth G.jpg,gaming & consoles,Noon
Fantech Gaming PC 5-in-1 Keyboard Combo with Mouse / Mousepad / Headset / Headset ...,"1,550",0.0,No Image,No Image,gaming & consoles,Noon
"Rwnq Box 3 in 1 card games suitable for family and friends gatherings, consisting of 3 games (Scrow - Open A Topic - Welaa) Fun group games Board Games Group Games Card Games  Games for Friends and Family",199,0.0,No Image,No Image,gaming & consoles,Noon
Avalon Pharma REVOO Gaming Headset - Stereo Surround Sound - Blue LED Lighting,469,0.0,No Image,No Image,gaming & consoles,Noon
REDRAGON M607 Wired Gaming Optical Mouse,790,4.98,No Image,No Image,gaming & consoles,Noon
REDRAGON H280 MEDEA RGB Gaming Headset – Stereo (Black),"1,335",4.415,No Image,No Image,gaming & consoles,Noon
KOMC G312 LED Gaming Headset for PC – Camouflage Design,530,0.0,No Image,No Image,gaming & consoles,Noon
"REDRAGON H270 MENTO RGB Gaming Headset with Microphone, Wired, Compatible with Xbox One, Nintendo Switch, PS4, PS5, PC, Laptops and Nintendo Switch Pink","1,225",0.0,No Image,No Image,gaming & consoles,Noon
