name,price,rating,image_url,image_path,category,source
"Touch Meat Grinder and Garlic Peeler 40544 , 1.5 Liter, 6 Blades - Black White 700 Watt","1,468",4.4107,https://f.nooncdn.com/p/pzsku/ZE0798D1D142CCF1410FFZ/45/1762465247/03f3b0e4-eaed-43b8-a8a6-b4957d21603b.jpg?width=800,product_images/Touch Meat Grinder and Garlic Peeler 40544  15 Lit.jpg,home appliances,Noon
"Philips Essential Xl Electric Fryer Hd927090 6.2 L 2000 W Hd927090 , HD9270/91 Black","8,035",4.62,https://f.nooncdn.com/p/v1643400958/N52490753A_1.jpg?width=800,product_images/Philips Essential Xl Electric Fryer Hd927090 62 L .jpg,home appliances,Noon
QQ 12x Steel Electric Kettle  1.5L 1500W,"2,349",4.4161,https://f.nooncdn.com/p/pzsku/Z7B52955202508D2F1877Z/45/_/1735565178/b6f6ca61-a6f8-4732-a14a-1820ed563545.jpg?width=800,product_images/QQ 12x Steel Electric Kettle  15L 1500W.jpg,home appliances,Noon
"Bissell Featherweight 2-In-1 Upright Vacuum Cleaner 2024E Lightweight 0.5L Capacity, 450W Power, Converts To Handheld, Ideal For Hard Floors| 2-Year Warranty 0.5 L 450 W 2024E Black/Titanium/Blue","3,450",4.32,https://f.nooncdn.com/p/pnsku/N14453328A/45/_/1764242055/96ac4bff-14f1-42d0-ab70-67b3af99c1c5.jpg?width=800,product_images/Bissell Featherweight 2In1 Upright Vacuum Cleaner .jpg,home appliances,Noon
BLACK+DECKER 3 In 1 Interchangeable Grill & Waffle& Sandwich Maker 650 - 780 W TS2130-B5 Black,"2,299",4.5915,No Image,No Image,home appliances,Noon
"Fresh Stand Fan 240 V Shabah 18"" GSFP-18 Multicolor","1,942",4.6524,No Image,No Image,home appliances,Noon
"Ariston Electric Water Heater, 50 Liters - RUBIS PRO 50 V EG White","3,650",4.2105,https://f.nooncdn.com/p/pnsku/N70152388V/45/_/1764173451/3955e1bd-93dd-4618-bf96-191f606e9311.jpg?width=800,product_images/Ariston Electric Water Heater 50 Liters  RUBIS PRO.jpg,home appliances,Noon
"PHILIPS Air Fryer NA120/00, uses up to 90% less fat, 1500W, 4.2 Liter, with Rapid Air Technology (Black), Large 4.2 L 1500 W NA120/00 black","3,999",4.930,https://f.nooncdn.com/p/pnsku/N70113010V/45/_/1764242101/d2fd8fe3-4756-4800-9754-0a0a59257564.jpg?width=800,product_images/PHILIPS Air Fryer NA12000 uses up to 90 less fat 1.jpg,home appliances,Noon
ARISTON Water Heater 10 Liter Natural Gas With adaptor Speed EVO 10 L NG ADPT White,"5,604",4.848,No Image,No Image,home appliances,Noon
"Panasonic Replacement Water Filter Cartridge For 6RF, 3RF, CS10, CS20, 2RF and 1RF Multicolor","1,124",4.5738,No Image,No Image,home appliances,Noon
"ELMAGHRABY Electric Power strip multicolour - 2000 watt, 6 Outlet ,  , 3 Port USB and 1 port type-c for Laptop, PC, MacBook , Home and Office Electrical appliances and Mobile charger",305,4.2132,https://f.nooncdn.com/p/pzsku/ZAB7C3BB9CB8BD7290BFAZ/45/_/1775639218/1b60a94d-6065-4f30-9e93-d8e4ba380192.jpg?width=800,product_images/ELMAGHRABY Electric Power strip multicolour  2000 .jpg,home appliances,Noon
Midea Mission Pro - Cool Only 12K (1.5 HP) MSC1T-12CR-N 46308672 White,"21,999",4.5710,https://f.nooncdn.com/p/pnsku/N53401322A/45/_/1766380637/c1b714c5-ac37-4d74-bc7e-450f4d51650b.jpg?width=800,product_images/Midea Mission Pro  Cool Only 12K 15 HP MSC1T12CRN .jpg,home appliances,Noon
"KENWOOD Digital Air Fryer XXXL, With Max Crisp Function Recipe, Book Rapid Hot Air Circulation For Frying Grilling Broiling Roasting Baking And Toasting 7 L 1800 W HFM80.000SS Silver","7,679",4.5456,https://f.nooncdn.com/p/pnsku/N53405921A/45/_/1764242332/0bd8cd00-2c3a-47e1-97ba-72073219fbe4.jpg?width=800,product_images/KENWOOD Digital Air Fryer XXXL With Max Crisp Func.jpg,home appliances,Noon
Unionaire Artify 12 HV 1.5 HP Cooling & Heating Air Conditioner,"17,999",4.56,https://f.nooncdn.com/p/pzsku/Z4BF4564F002DE01EDC58Z/45/_/1771688403/d7af9768-2344-4b4b-b57c-157617ec431d.jpg?width=800,product_images/Unionaire Artify 12 HV 15 HP Cooling  Heating Air .jpg,home appliances,Noon
"KENWOOD Glass Blender Smoothie Maker With Grinder Mill, Chopper Mill, Ice Crush Function 2 L 1000 W BLM45.720SS Silver/Clear/Black","3,649",4.1458,https://f.nooncdn.com/p/v1668779824/N41645928A_1.jpg?width=800,product_images/KENWOOD Glass Blender Smoothie Maker With Grinder .jpg,home appliances,Noon
Jac Microwave 20 L 1200 W MW20-JA11A Black,"3,850",4.4148,https://f.nooncdn.com/p/pnsku/N46938459A/45/_/1766380488/59c797b0-1919-4b20-a572-9b603465f4c3.jpg?width=800,product_images/Jac Microwave 20 L 1200 W MW20JA11A Black.jpg,home appliances,Noon
"Haier Split Air Conditioner, 1.5 HP, Cooling Only, White - HSU-12KCROC White","20,700",4.591,No Image,No Image,home appliances,Noon
"Samsung Washing Machine With Hygiene Steam, Digital Inverter Technology 1200 RPM - Enoc - 7 Kg WW70T4020CX1AS 7.0 kg WW70T4020CX1AS Inox","16,499",4.648,No Image,No Image,home appliances,Noon
"Arzum Okka Rich Turkish Milk Coffee Machine Spin Pro, 1-5 Cups, 950 ml 700 W OK0026-K Chrome","5,183",4.7168,No Image,No Image,home appliances,Noon
"Fresh Stand Fan Shabah Remote 18"" GSFP-18 Red/Black","2,100",4.51,No Image,No Image,home appliances,Noon
"BLACK+DECKER 8L Air Fryer, 1700W Power, Digital Touch Control, Spacious Rectangular Basket, 7 Preset Functions, Rapid Air Convection, Adjustable Temperature, Smokeless Cooking, Black - SAF80W-B5 8 L 1700 W SAF80W-B5 Black","7,399",4.5242,No Image,No Image,home appliances,Noon
"Beko Microwave 20L Mechanical control, 700-Wat 6 power levels MOC20100BFB 20 L 700 W MOC20100BFB black","3,998",4.722,No Image,No Image,home appliances,Noon
Jac Vacuum cleaner 2400 watt red from Jack,"2,850",4.471,No Image,No Image,home appliances,Noon
Midea AI Eco Master 1.5 HP Inverter Cool Only Split AC – M1SEFT-12CRDN8F M1SEFT-12CRDN8F White,"26,499",4.912,No Image,No Image,home appliances,Noon
"De'Longhi Dedica Coffee Machine, Barista Pump Espresso and Cappuccino Maker, Ground Coffee and ESE Pods can be used, Milk Frother for Latte Macchiato and more 1.1 L 1450 W EC685.M Silver/Black","9,199",4.3941,No Image,No Image,home appliances,Noon
"De'Longhi Dedica Pump Espresso Manual Coffee Machine | Cappuccino, Latte Macchiato With Milk Frother | Thermo Block Heating System For Accurate Temperature | Easy To Clean 1 L 1300 W EC685.BK Black","9,190",4.3698,No Image,No Image,home appliances,Noon
Oraimo CyberVac 270W Wireless Stick Vacuum Cleaner OSV-225A 270 W OSV-225A,"6,499",4.214,No Image,No Image,home appliances,Noon
Arzum Okka Rich Pro Plus Turkish Coffee Maker with Water Tank 1.3 L 700 W OK0038-05 Chrome,"6,735",4.4105,No Image,No Image,home appliances,Noon
"Philips Air Fryer 3.2L Rapid Air Technology , NA110/00 - Black 3.2 L 1300 W NA110/00 black","3,349",4.6164,No Image,No Image,home appliances,Noon
LG Top Loading Washing Machine LG Smart Inverter 11 kg T1164NEHGB Black,"17,699",4.022,No Image,No Image,home appliances,Noon
BOSCH Series 6 Air Fryer Black MAF671B0 7.2 L 1800 W MAF671B0 black/silver,"7,900",5.05,No Image,No Image,home appliances,Noon
"Tefal Silence Force Stand Fan with Remote Control, 16 Inch, 3 Speeds, VG4130EE Black","2,499",4.41,No Image,No Image,home appliances,Noon
BOSCH Vacuum Cleaner Bagless Series 4 Hepa Hygienic Filter 2000 W BGS21WPOW Black,"9,017",4.715,No Image,No Image,home appliances,Noon
LG Mh8265Dis - Smart Inverter Microwave With Grill 42 L 1200 W Mh8265Dis Black,"12,999",4.5476,No Image,No Image,home appliances,Noon
"Fresh Fan 240 volt 240 W Shabah Wall 18"" Red/Black","1,735",4.5266,No Image,No Image,home appliances,Noon
Fresh Electric Water Heater Relax 50 Liter EWH RELAX 50L Multicolour,"3,885",4.5671,No Image,No Image,home appliances,Noon
"KENWOOD Digital Air Fryer XXXL, With Max Crisp Function Recipe, Book Rapid Hot Air Circulation For Frying Grilling Broiling Roasting Baking And Toasting 7 L 1800 W HFP80.000BK Black","7,399",4.5763,No Image,No Image,home appliances,Noon
"KENWOOD Stand Mixer Kitchen Machine HOMEBAKE, K-Beater, Whisk, Dough Hook, Splash Guard, Variable Speed, Compact Design 5 L 1400 W KHH01.000SI Silver","9,055",4.3237,No Image,No Image,home appliances,Noon
Oraimo CyberVac 180W Wireless Stick Vacuum Cleaner OSV-102B 180 W OSV-102B,"4,669",5.07,No Image,No Image,home appliances,Noon
"KENWOOD Food Processor, 3L Bowl, 1.5L Blender, 11 Processing Tools, Multi Mill, Grinder, Juicer extractor, Whisk, Dough Maker, Citrus Juicer, Salad Maker 3 L 1000 W FDP65.880SI 1000W Silver","8,700",4.4268,No Image,No Image,home appliances,Noon
"Ariston Electric Water Heater, 50 Liters - RUBIS PRO 50 V EG-1 White","3,599",4.716,No Image,No Image,home appliances,Noon
"Carrier XCool Inverter 1.5 HP Split Air Conditioner, Cooling & Heating, R32, QHEFT12DN8-708F","32,455",0.0,No Image,No Image,home appliances,Noon
Stanvi 2×1 Stick & Handheld Vacuum Cleaner,"6,499",4.756,No Image,No Image,home appliances,Noon
KENWOOD Stainless Steel Electric Kettle - 1.7 L 2200 W ZJM01 / ZJM01.A0BK Silver,"2,057",4.6213,No Image,No Image,home appliances,Noon
KENWOOD Ceramic Steam Iron 350 ml 2600 W STP70.000WG Green,"1,691",4.5258,No Image,No Image,home appliances,Noon
HOHO Stainless Steel Electric Kettle 1.5 L 1500 W hoho1.5 Multicolour,500,4.21,No Image,No Image,home appliances,Noon
"Ariston AURES Multi Electric Instantaneous Water Heater 9.5kW, Multi-Point, 3195258 - Multicolor","10,599",4.344,No Image,No Image,home appliances,Noon
"Unionaire No Frost Refrigerator, 330 Liters, 2 Doors, Digital Touch Screen, URN-400LBLBA","14,999",3.619,No Image,No Image,home appliances,Noon
"Toshiba Refrigerator Fixed Speed Pure BIO Filter, Air FALL Cooling, Voltage Stability, 411L - GR-RT559WE-DMN(49) Grey","26,999",4.456,No Image,No Image,home appliances,Noon
"Fresh Meat kibbeh, 700 watts, 2 liters, anti-break, from Fresh","1,500",4.3393,No Image,No Image,home appliances,Noon
LumaBella Luma Bella LB-56015 2 Liter 400 Watt Stainless Steel Food Chopper,715,5.01,https://f.nooncdn.com/p/pzsku/Z99DD8E6C71BB3DA20C9DZ/45/1764617694/d542a28a-dffa-4a2b-95e5-99b427ccc24c.jpg?width=800,product_images/LumaBella Luma Bella LB56015 2 Liter 400 Watt Stai.jpg,home appliances,Noon
BLACK+DECKER Garment Steamer 1500W 260.0 ml 1500.0 W HST1500-B5 Clear/Purple,"2,900",3.533,https://f.nooncdn.com/p/v1616177072/N30982084A_1.jpg?width=800,product_images/BLACKDECKER Garment Steamer 1500W 2600 ml 15000 W .jpg,home appliances,Noon
KENWOOD Air fryer HDM80.000SS 7 L 1800 W HFM80.000SS Silver/Black,"7,500",4.443,https://f.nooncdn.com/p/v1680257151/N53398123A_1.jpg?width=800,product_images/KENWOOD Air fryer HDM80000SS 7 L 1800 W HFM80000SS.jpg,home appliances,Noon
"Philips 3000 Series Blender, Smooth blends with no lumps in 45 seconds 1.9 L 450 W HR2041/10 White","2,799",4.3434,https://f.nooncdn.com/p/pnsku/N52756248A/45/_/1764241729/75986452-7958-4f7f-a663-90ead34bf577.jpg?width=800,product_images/Philips 3000 Series Blender Smooth blends with no .jpg,home appliances,Noon
Beko NeoFrost Top Freezer Refrigerator - 406 Liters - ProSmart Inverter Motor - Harvest Fresh Technology - Dairy Compartment - Digital Touch Control Tact Display RDNE455M20XBIDS Silver ( Prinpia),"27,299",5.03,https://f.nooncdn.com/p/pnsku/N70112109V/45/_/1726631464/d68d406d-cca8-4099-86f2-78b74ba6f461.jpg?width=800,product_images/Beko NeoFrost Top Freezer Refrigerator  406 Liters.jpg,home appliances,Noon
MIENTA Pratico Chopper 450W,"1,194",5.04,https://f.nooncdn.com/p/pzsku/Z46234BC622CACA88FB55Z/45/1754300204/1931031a-ec08-4ddf-9d3d-ec1d49ef0582.jpg?width=800,product_images/MIENTA Pratico Chopper 450W.jpg,home appliances,Noon
Oraimo Infiwave Lite Low Noise Operation Inverter Microwave 20 L 700 W OMO-221A Graphite Grey,"5,049",0.0,https://f.nooncdn.com/p/pnsku/N70284897V/45/_/1770029520/c3bcb96f-0ebe-4e8f-8a33-e12388ddc523.jpg?width=800,product_images/Oraimo Infiwave Lite Low Noise Operation Inverter .jpg,home appliances,Noon
"Tefal Pro Style Garment Steamer, 1700 W IT3420EG - Black/Beige 1.5 L 1700 W IT3420EG black","6,599",1.84,https://f.nooncdn.com/p/pnsku/N70063931V/45/_/1713771059/fb102025-3b8c-4c40-bdcb-d8c6cb2102dc.jpg?width=800,product_images/Tefal Pro Style Garment Steamer 1700 W IT3420EG  B.jpg,home appliances,Noon
Panasonic Steam Iron 2 L 2200 W NI-JW660T-PTV White/Pink,"3,199",5.016,https://f.nooncdn.com/p/v1623426354/N46938993A_1.jpg?width=800,product_images/Panasonic Steam Iron 2 L 2200 W NIJW660TPTV WhiteP.jpg,home appliances,Noon
Philips Egg Cooker 3000 Series 400 W HD9137/91 Deep Black,"2,310",4.6113,https://f.nooncdn.com/p/pnsku/N70068039V/45/_/1716319196/1fd54e46-512d-491c-8d94-a4df4a3d8722.jpg?width=800,product_images/Philips Egg Cooker 3000 Series 400 W HD913791 Deep.jpg,home appliances,Noon
"Bergen Water Dispenser with refrigerator, three tabs Hot, Cold and normal – BYB538 (Silver)","9,950",0.0,https://f.nooncdn.com/p/pzsku/Z250DAE2EF9DC265280DCZ/45/1752851067/eefa1533-875d-4871-9869-92650bc6ad98.jpg?width=800,product_images/Bergen Water Dispenser with refrigerator three tab.jpg,home appliances,Noon
Philips Series 5000 Steam Iron 320 ml 2400 W DST5010/16 Grey/White,"3,499",4.5566,https://f.nooncdn.com/p/v1636031927/N51681045A_1.jpg?width=800,product_images/Philips Series 5000 Steam Iron 320 ml 2400 W DST50.jpg,home appliances,Noon
"BLACK+DECKER Twin Pole Garment Steamer, Fast Heating, 35g/min Steam Rate, 6 Steam Levels, Stainless Steel Head, Auto Cut-Off,Extended Steaming Capacity, 1.5 L 2400 W GST2400-B5 White/Gold","5,999",4.1278,https://f.nooncdn.com/p/pnsku/N53331418A/45/_/1767607889/2fcc31d4-d8f9-498e-a588-13d01ef4c104.jpg?width=800,product_images/BLACKDECKER Twin Pole Garment Steamer Fast Heating.jpg,home appliances,Noon
"Toshiba Refrigerator, Pure Bio Filter, Tropical Compressor, Electronic Temperature Control, 338L  - GR-RT468WE-DMN(49) Lixiue Grey","19,649",3.823,https://f.nooncdn.com/p/pnsku/N70016875V/45/_/1767607855/ce1257e7-69aa-4b59-ab3e-e6d94048ab52.jpg?width=800,product_images/Toshiba Refrigerator Pure Bio Filter Tropical Comp.jpg,home appliances,Noon
Luma Bella Luma-Bella Chopper Grinder Stainless Steel  2 Liter 2 Speed ​​800 Watt LB-56008,825,4.52,https://f.nooncdn.com/p/pzsku/Z52D0076FD559AE075BBBZ/45/1763377078/0de3abc3-9d09-47b8-823e-fedb53770500.jpg?width=800,product_images/Luma Bella LumaBella Chopper Grinder Stainless Ste.jpg,home appliances,Noon
"KENWOOD Steam iron, Non Stick Soleplate, Self Clean Function, Water Spray, 120G Steam Shot 250 ml 2000 W STP40.000WP White","1,229",4.0473,https://f.nooncdn.com/p/pnsku/N41112606A/45/_/1766380592/a2ed185b-9266-429f-9e53-162ed3edfbd4.jpg?width=800,product_images/KENWOOD Steam iron Non Stick Soleplate Self Clean .jpg,home appliances,Noon
smeg 50's Retro Style Toaster 1500W 4 Slices 1500.0 W TSF02BLUK Black/Silver,"14,850",0.0,https://f.nooncdn.com/p/pzsku/ZA823705A1297AB827608Z/45/_/1773225687/8845ebb6-145a-4daa-9793-22496eb3bd3f.jpg?width=800,product_images/smeg 50s Retro Style Toaster 1500W 4 Slices 15000 .jpg,home appliances,Noon
"KENWOOD Health Grill, Variable Temperature Control, Adjustable Grill Positions, 180 Degree Opening Grill, Oven Grill, Timer 2000 W HGM80.000SS Silver","4,199",4.566,https://f.nooncdn.com/p/v1668695015/N48624854A_1.jpg?width=800,product_images/KENWOOD Health Grill Variable Temperature Control .jpg,home appliances,Noon
Swiss Pro+ Air Fryer without Fat - Stainless Steel Silver Black - 5L- 1450W,"3,899",0.0,https://f.nooncdn.com/p/pzsku/Z7E6E05A9BD5039A04F6CZ/45/_/1740672225/95a421a3-0d0a-4408-bd12-d43c44182c62.jpg?width=800,product_images/Swiss Pro Air Fryer without Fat  Stainless Steel S.jpg,home appliances,Noon
Ariston DGI 6L DF Natural Gas Water Heater DGI 6L DF NG White,"3,980",4.4296,https://f.nooncdn.com/p/v1671543747/N24948235A_1.jpg?width=800,product_images/Ariston DGI 6L DF Natural Gas Water Heater DGI 6L .jpg,home appliances,Noon
"Arshia 16 in 1 Multi-Function Halogen Air Fryer, 6.5L Capacity with Digital Display","7,650",0.0,https://f.nooncdn.com/p/pzsku/Z95676215663D3B21C56EZ/45/1747125561/8a8788df-d359-4d0d-b953-fc5eed541ad5.jpg?width=800,product_images/Arshia 16 in 1 MultiFunction Halogen Air Fryer 65L.jpg,home appliances,Noon
Luma Bella Luma-Bella Chopper Grinder Stainless Steel  2 Liter ​​4 Weapons 500 Watt LB-56001,549,0.0,https://f.nooncdn.com/p/pzsku/Z1F9559497333EB1A9D32Z/45/1755093606/c330d17d-fa63-40e5-8c2d-2ea7ac4c2ad8.jpg?width=800,product_images/Luma Bella LumaBella Chopper Grinder Stainless Ste.jpg,home appliances,Noon
KENWOOD Food Processor 3.0 L 1000.0 W FDP65.880SI-s Silver,"8,399",3.710,https://f.nooncdn.com/p/v1613825589/N44412724A_1.jpg?width=800,product_images/KENWOOD Food Processor 30 L 10000 W FDP65880SIs Si.jpg,home appliances,Noon
Swiss Pro+ Digital Air Fryer - Stainless Steel - See Through Window Black & Gold - 5L- 1500W SP-AF5L.FB,"2,999",4.63,https://f.nooncdn.com/p/pzsku/ZEBD120284AB36162DCBCZ/45/1750695206/158f87fa-f5c4-417a-aece-cf94a1f52a26.jpg?width=800,product_images/Swiss Pro Digital Air Fryer  Stainless Steel  See .jpg,home appliances,Noon
HITACHI Unique Design Vacuum Cleaner 21 L 2200 W CV-960F SS220 Black,"9,000",4.561,https://f.nooncdn.com/p/v1667393577/N37845101A_1.jpg?width=800,product_images/HITACHI Unique Design Vacuum Cleaner 21 L 2200 W C.jpg,home appliances,Noon
CITY 7-in-1 multi-use sandwich and waffle maker,"2,249",4.84,https://f.nooncdn.com/p/pzsku/Z60B595757FB194CF3940Z/45/1767808709/691339cd-61c8-483d-a65a-6b6d0de221fa.jpg?width=800,product_images/CITY 7in1 multiuse sandwich and waffle maker.jpg,home appliances,Noon
UNIONAIRE Refrigerator Digital UR-350BGNA-C10 Black,"19,500",5.02,https://f.nooncdn.com/p/v1617119133/N45962060A_1.jpg?width=800,product_images/UNIONAIRE Refrigerator Digital UR350BGNAC10 Black.jpg,home appliances,Noon
Toshiba No Frost Digital Deep Freezer Upright 7 Drawers 238L 150 W GR-RU312WE-DMN(37H) Satin Grey,"27,899",4.836,https://f.nooncdn.com/p/pnsku/N70113018V/45/_/1767608055/60ace287-c545-47f4-a728-a234a48fbad6.jpg?width=800,product_images/Toshiba No Frost Digital Deep Freezer Upright 7 Dr.jpg,home appliances,Noon
Haier Refrigerator 4 Doors (Bottom freezer) -Humidity & Dry zone - TWIN-Inverter - ABT Filter - Super Cool & Super Frez - 502 L- Silver Metal Door - HRF-550TDPD Platinum Inox,"58,490",5.02,https://f.nooncdn.com/p/pnsku/N70102483V/45/_/1760874268/92501061-2d0f-4aa7-9788-f8cfc9a18a0c.jpg?width=800,product_images/Haier Refrigerator 4 Doors Bottom freezer Humidity.jpg,home appliances,Noon
"KENWOOD Hand Mixer (Electric Whisk) With 5 Speeds + Turbo Button, Twin Stainless Steel Kneader And Beater For Mixing, Whipping, Whisking, Kneading 0 L 450 W HMP30.A0WH White","2,399",4.539,https://f.nooncdn.com/p/v1648208122/N48624843A_1.jpg?width=800,product_images/KENWOOD Hand Mixer Electric Whisk With 5 Speeds  T.jpg,home appliances,Noon
"Sokany SK-12003 1500W Hand Hield Clothes Steam Iron, 260 ml Size, 1 Year Warranty","1,563",4.737,https://f.nooncdn.com/p/pzsku/Z7DDF3E5F00F0F9268D9AZ/45/1748784812/fcdacc77-5509-41b5-8ffd-1a634f0f3aa9.jpg?width=800,product_images/Sokany SK12003 1500W Hand Hield Clothes Steam Iron.jpg,home appliances,Noon
KENWOOD 3-In-1 Sandwich Maker 750 W SMM01.A0BK Black/Silver,"2,226",4.5130,https://f.nooncdn.com/p/pnsku/N37823084A/45/_/1766380647/fc1760f1-741e-4f1e-b078-31d46c3ecd90.jpg?width=800,product_images/KENWOOD 3In1 Sandwich Maker 750 W SMM01A0BK BlackS.jpg,home appliances,Noon
"MIENTA Chopper, 500ML Liter, 450 Watt","1,149",4.36,https://f.nooncdn.com/p/pzsku/ZBD7E4E3A3E9169DDA3C2Z/45/1746965091/206e3880-f6b8-4354-a8af-71c67eaaa852.jpg?width=800,product_images/MIENTA Chopper 500ML Liter 450 Watt.jpg,home appliances,Noon
"SHARP Air Fryer Dual Cook, Glass Touch Screen, 12 Auto Menus, Sync Finish & Dual Cook Functions, Healthy Oil-Free Cooking with Rapid Air Technology - 8 L 1800 W KF-DF80RT-EK2 Stainless Steel","11,729",5.02,https://f.nooncdn.com/p/pnsku/N70207901V/45/_/1756288423/ea8d5078-db4f-4dc3-a2f0-db56658f63cd.jpg?width=800,product_images/SHARP Air Fryer Dual Cook Glass Touch Screen 12 Au.jpg,home appliances,Noon
Fresh black plastic kettle 1.7 litres,850,4.3192,https://f.nooncdn.com/p/pzsku/Z4036ED5FBB8DD371C960Z/45/_/1727450928/195c611f-b47c-4fea-a4e0-2e1dd52e4917.jpg?width=800,product_images/Fresh black plastic kettle 17 litres.jpg,home appliances,Noon
Bergen BY90 Top-Load Freestanding Water Dispenser - Silver,"8,040",4.01,https://f.nooncdn.com/p/pzsku/ZA3124D156B21CD1A710DZ/45/1752846350/d402448a-bdb4-4a98-9813-1db19f269431.jpg?width=800,product_images/Bergen BY90 TopLoad Freestanding Water Dispenser  .jpg,home appliances,Noon
Home Egypt Digital Stainless kettle 1850 Watt 1.7 Liter - k 434,"1,575",0.0,https://f.nooncdn.com/p/pzsku/ZB867BAC3E2A54D94681CZ/45/_/1773520131/75bfd2a6-71a9-434c-9431-6725d0ed3c77.jpg?width=800,product_images/Home Egypt Digital Stainless kettle 1850 Watt 17 L.jpg,home appliances,Noon
"Tefal Compact Power Vacuum Cleaner, Bagless,  1.5L Capacity, 2000 W TW3751EG Black / Blue","5,567",4.733,https://f.nooncdn.com/p/pnsku/N70014588V/45/_/1748273693/6f09c4fc-4220-4e71-8a5b-a3c656be6f8b.jpg?width=800,product_images/Tefal Compact Power Vacuum Cleaner Bagless  15L Ca.jpg,home appliances,Noon
هوم HOME Plastic kettle K520 1.7 LTR 1850 W,994,0.0,https://f.nooncdn.com/p/pzsku/Z903011CA70DA6F76EFA8Z/45/_/1773521713/c02c7495-9bf8-4cbf-80d5-46127cd8820f.jpg?width=800,product_images/هوم HOME Plastic kettle K520 17 LTR 1850 W.jpg,home appliances,Noon
HOOVER Automatic Carpet Washer - Platinum Smart Wash Upright Vacuum Cleaner 3.5 L 1200 W CDCW-SWME Charcoal Blue/Grey/Black,"23,499",4.2222,https://f.nooncdn.com/p/pnsku/N45105065A/45/_/1748343689/e249e828-ff27-4d66-a2d6-300b7e475533.jpg?width=800,product_images/HOOVER Automatic Carpet Washer  Platinum Smart Was.jpg,home appliances,Noon
"Kenwood Air Fryer, 1800 Watt, 7 Liters, Silver - HFM80.000SS 7 L 1800 W HFM80.000SS sliver","7,499",4.5106,No Image,No Image,home appliances,Noon
"Stainless Steel Manual Press Garlic Press, Multifunctional Manual Press Garlic Press for Mincing Garlic, Chopping Peppers and Onions-457",360.36,1.03,No Image,No Image,home appliances,Noon
Swiss Pro+ Food Processor 13 Pieces - Kitchen Mixer - Vegetable Cutter Electric 600-800 W - Food Processor - Plastic - Red - 1.2 L,"1,999",5.01,No Image,No Image,home appliances,Noon
BLACK+DECKER Electric Kettle With Stainless Steel Body 1.7 L 2200 W JC450-B5 Silver/Black,"2,100",4.5480,No Image,No Image,home appliances,Noon
BOSCH Serie | 6 Bag Less Vacuum Cleaner 2.4 L 2200 W BGS412234 Black/Silver/Clear,"10,499",4.780,No Image,No Image,home appliances,Noon
Toshiba Water Dispenser With Cabinet – Compressor Cooling - Stainless Steel Cold Tank - Over Heat Protection - Child Safety Lock - RWF-W2467TEG(K) Black and Silver,"9,699",0.0,No Image,No Image,home appliances,Noon
"BLACK+DECKER Portable Garment Steamer, Universal Bottle Adapter, Fine Mist Spray, Ergonomic Compact Design, Effective on All Fabrics, 0.26 L 1500 W HST1500-B5 Dark Purple","2,749",4.02,No Image,No Image,home appliances,Noon
"KENWOOD Stand Mixer Kitchen Machine Chef XL  With  Stainless Steel Bowl, K-Beater, Whisk, Dough Hook, Blender 6.7 L 1200 W KVL4110S Steel","20,999",4.626,No Image,No Image,home appliances,Noon
"Beko 2 Door - 557L - Stainless - Nofrost -ProSmart Inverter, HF Digital - B3RDNE590ZXB Prinpia Brushed Silver","51,740",5.02,No Image,No Image,home appliances,Noon
Olympic Electric Mechanical Water Heater Hero 50 liters,"4,038",4.440,No Image,No Image,home appliances,Noon
BRAUN Multiquick 5 Hand Blender - MQ5235 White,"3,899",4.3102,No Image,No Image,home appliances,Noon
"De'Longhi Magnifica Start Fully Automatic Coffee Machine,The Freshest Coffee ,Sift Touch Control Panel,Traditional Milk Frother ,One Touch Recipes 1.8 L 1450 W ECAM220.22.GB Black/Grey","27,499",4.723,No Image,No Image,home appliances,Noon
"LG Neochef Microwave Oven With Grill, 42 L 1200 W MH8265DIS Black","13,499",4.7178,No Image,No Image,home appliances,Noon
"KENWOOD Health Grill, 3 Adjustable Grill Positions 2000 W HGM31.000SI Silver","3,900",4.3198,No Image,No Image,home appliances,Noon
"Philips Contact Grill 5000 Series - 2200W, Open 180° Flat Grilling, Adjustable Height, Removable Plates, High Power, Handle Lock 2200 W HD6301/90 Silver/Black","14,999",4.846,No Image,No Image,home appliances,Noon
smeg 50's Retro Style Aesthetic Electric Kettle - 1.7 L 2500.0 W KLF03CRAU / KLF03CRUK Cream,"14,300",4.115,No Image,No Image,home appliances,Noon
Samsung Vacuum Cleaner Bagless 1.3 L 1800.0 W VCC4540S36/EGT Black / Blue,"5,999",4.5126,No Image,No Image,home appliances,Noon
Philips Essential XL Air Fryer 6.2 L 2000 W HD9270/90/91/70 Black,"8,280",4.61,No Image,No Image,home appliances,Noon
Philips Electric Kettle 3000 series 1.7 L 1.7 L 2200 W HD9350/92 grey/silver HD9350/92,"2,800",4.6866,No Image,No Image,home appliances,Noon
"Philips Plastic Kettle 3000 Series - With Pilot Light, Spring Opening, 1.7 L 2200 W HD9318/01 White","2,003",4.7969,No Image,No Image,home appliances,Noon
Philips Airfryer 3000 Series 4.1 L 1500 W HD9243/90 Black,"4,610",4.37,No Image,No Image,home appliances,Noon
Philips Essential Air Fryer With Rapid Air Technology 4.1 L 1400 W HD9200/91/90 Black,"5,800",4.55,No Image,No Image,home appliances,Noon
Swiss Pro+ Digital Air Fryer without Fat - Stainless Steel - Green- 7L - 1750W,"3,999",4.01,https://f.nooncdn.com/p/pzsku/ZF84049A38439D8C85E35Z/45/_/1740671212/b05704d2-241a-47a0-a2f8-5ba92eb830a9.jpg?width=800,product_images/Swiss Pro Digital Air Fryer without Fat  Stainless.jpg,home appliances,Noon
"JAMAKY Italy 2000W Electric Grill for Delicious and Healthy Barbecues, Featuring a Non-Stick Coating and Stainless Steel Body (JMK2035)","1,499",0.0,https://f.nooncdn.com/p/pzsku/ZFDA6664E3E9960AE78E1Z/45/1764681405/07a0a3c2-a382-48d3-8469-8abbd7225782.jpg?width=800,product_images/JAMAKY Italy 2000W Electric Grill for Delicious an.jpg,home appliances,Noon
Mienta Chopper With Blender(CH-645)-1000W+Free Gift,"2,199",4.33,https://f.nooncdn.com/p/pzsku/Z92BEEF742258E67A1EAAZ/45/1755776402/3c53ae8e-87cd-4cb0-8189-6d7ee5de16a4.jpg?width=800,product_images/Mienta Chopper With BlenderCH6451000WFree Gift.jpg,home appliances,Noon
