name,price,rating,image_url,image_path,category,source
"Atlantic Ego electric water heater, 50 liters, Indicator , white , 8414030","4,045",0.0,No Image,No Image,home appliances,Noon
sokany SK-3024 Coffee Grinder 50g 150W,898,0.0,No Image,No Image,home appliances,Noon
Akher el Ankoud Hello Kitty Thermos Bottle 500Ml -Off-white,325,0.0,https://f.nooncdn.com/p/pzsku/Z276E4032802B0C4E3373Z/45/1759651876/83aefeec-fe87-45b5-a54b-f5aa81d018bb.jpg?width=800,product_images/Akher el Ankoud Hello Kitty Thermos Bottle 500Ml O.jpg,home appliances,Noon
"RAF Stand Mixer R.6615, 2000 Watt, 12 Liter, Black","13,999",0.0,No Image,No Image,home appliances,Noon
HYUNDAI Instant Electrical Water Heater Q0490D Black,"8,499",0.0,No Image,No Image,home appliances,Noon
"Purity Built-in Electric Oven 60cm, 65L Capacity, 7 Cooking Functions, Turbo Heater 1900W, Digital Timer, Soft Close Doors, Black (Made in Turkey) – OPT601EED","15,490",0.0,No Image,No Image,home appliances,Noon
Happy Home Multifunction Electric Sandwich Maker 900W Non-Stick Waffle Panini Grill Toaster Machine with Cool Touch Handle – Fast Heating Breakfast Maker for Sandwiches Omelette French Toast Waffles and Snacks – Compact Home Kitchen Appliance 220-240V 50-60Hz Easy Clean Plates,"1,100",0.0,No Image,No Image,home appliances,Noon
"Sokany Handheld Garment Steamer 1470W, 120ml Water Tank, Fast Heat-Up Portable Clothes Steamer – Model SK-GT-3065, 1 Year Warranty","1,375",0.0,No Image,No Image,home appliances,Noon
JAMAKY Italy Waffle Maker With Non-Stick Coating Plate & Automatic Temperature Control 1000W -JMK2002,799,0.0,No Image,No Image,home appliances,Noon
sokany Steam Iron/Ceramic Soleplate/380ml/Dry Steam Spray/2400W(SK-11015),"1,190",0.0,No Image,No Image,home appliances,Noon
"Arion Hand Blender 2×1 – 900W, Model AR- 2in1","1,319",0.0,No Image,No Image,home appliances,Noon
Philips Electric Kettle 1.6L 1.6 L HD4631/20 Silver/Black,"2,999",5.01,No Image,No Image,home appliances,Noon
"Casa Home 250ml Ceramic Mug Midnight Blue with White Drips, Heat-Resistant, Microwave/Oven/Dishwasher Safe",310,0.0,No Image,No Image,home appliances,Noon
Arshia Blender with 1000W High Power Motor TB145-3448,"4,900",0.0,No Image,No Image,home appliances,Noon
"Portable handheld steam iron with spray nozzle, compact electric garment press with anti-drip design, lightweight for travel, garment care, crafts, sewing, and home use with silicone pad.",355,0.0,No Image,No Image,home appliances,Noon
BOSCH Vacuum Cleaner 2000 Watt Series 4 Bagless HEPA Hygienic Filter Black BGS21WPOW 2.4 L 2000 W BGS21WPOW Black,"9,999",4.25,No Image,No Image,home appliances,Noon
Espresso Percolator Coffee Maker Silver/Black,349.95,3.961,No Image,No Image,home appliances,Noon
"Happy Home Stainless Steel Thermal Coffee Carafe, 2.5 Liter Tea and Coffee Dispenser Jug, Double Walled Vacuum Insulated Thermos Teapot for Keeping Your Drink Hot (Blue/Silver)",755,0.0,No Image,No Image,home appliances,Noon
ALASKA Defrost Electric Drawer Freezers - 140 L UP140 White,"10,445",5.02,No Image,No Image,home appliances,Noon
TORNADO Steam Iron 2000 Watt Ceramic Soleplate Orange TST-2000NC,"1,577",0.0,No Image,No Image,home appliances,Noon
"Castle Garment Steamer, 2200 Watt, 2.5 Liters, Silver Black - GS2260","5,799",0.0,No Image,No Image,home appliances,Noon
"Tank Super Blender, 1.5L Glass Jug, 250ml BPA Free Plastic Grinder, 250ml BPA Free Plastic Meat Mincer, 600 Watts, White, YB-010, 2-Year Warranty","1,807",0.0,No Image,No Image,home appliances,Noon
"Sokany SK-1733 Portable Coffee Blender – 25W Multi-Purpose Hand Blender with 50ml Capacity – Ideal for preparing coffee, lattes, and baby food",474,0.0,No Image,No Image,home appliances,Noon
Silicone Foldable Travel Electric Kettle 600ml 600W Collapsible Hot Water Boiler 220V Compact Portable Design with On Off Button for Fast Boiling at Home Office Camping Easy Storage (Pink),599,0.0,No Image,No Image,home appliances,Noon
Home Gold 2 in 1 Brush and Hair Dryer for Easy Straightening and Hot Air Distribution HG-1917,650,0.0,https://f.nooncdn.com/p/pzsku/ZB5D3987D99E55A42F261Z/45/1747580217/5e52d49f-0b2f-4c54-bde6-cf3265dee1f9.jpg?width=800,product_images/Home Gold 2 in 1 Brush and Hair Dryer for Easy Str.jpg,home appliances,Noon
"MININGEEK 20cm heat sealing machine, small film sealing machine, plastic bag sealing machine, manual heat sealing machine for heat-sealed plastic films",849,0.0,https://f.nooncdn.com/p/pzsku/ZBC6E4865268F4890584FZ/45/_/1774817116/0bb947bb-274d-46ec-a332-a4209deb367a.jpg?width=800,product_images/MININGEEK 20cm heat sealing machine small film sea.jpg,home appliances,Noon
KARCHER VC 4S Cordless Handheld Vacuum Cleaner 18 W 11982910 White/Black/Yellow,"14,299",3.66,https://f.nooncdn.com/p/v1633807663/N47452048A_1.jpg?width=800,product_images/KARCHER VC 4S Cordless Handheld Vacuum Cleaner 18 .jpg,home appliances,Noon
"Silver Crest 4-in-1 Hand Blender 1800W – Multi-Function Stick Blender with Chopper 500ml, Measuring Cup 600ml, Whisk Attachment, Stainless Steel Blades","1,199",0.0,https://f.nooncdn.com/p/pzsku/Z768CFECAA33CF86B6A98Z/45/_/1772722266/988368db-d377-4750-b363-4d2afd02f1fb.jpg?width=800,product_images/Silver Crest 4in1 Hand Blender 1800W  MultiFunctio.jpg,home appliances,Noon
Purity hood PTSLIM PLUS BL 90  Cooker  -LED lighting- Suction power 450 m3/h (Black) with remote,"4,585",0.0,https://f.nooncdn.com/p/pzsku/Z9CF4AA4FE5A621DFF9D3Z/45/1752564356/4d859a87-b953-4624-b35a-b2a5dd4a9edf.jpg?width=800,product_images/Purity hood PTSLIM PLUS BL 90  Cooker  LED lightin.jpg,home appliances,Noon
sokany SK-10037 Sokani Digital Fryer 8.8 liters 2000 watts,"4,290",0.0,https://f.nooncdn.com/p/pzsku/Z195CBBEACAEF819CAA77Z/45/_/1773755223/efdc19bd-f095-4d17-8858-f9f8999223e6.jpg?width=800,product_images/sokany SK10037 Sokani Digital Fryer 88 liters 2000.jpg,home appliances,Noon
HYUNDAI Instant Electrical Water Heater 12KW White -Digital Touch Control -Q09120 White,"9,499",0.0,https://f.nooncdn.com/p/pzsku/ZE4E177CD1F480DF75AC9Z/45/1761641613/a37f5da1-ecc0-42a3-9286-ccf4ff82407d.jpg?width=800,product_images/HYUNDAI Instant Electrical Water Heater 12KW White.jpg,home appliances,Noon
MIJIA Xiaomi Mi Robot Vacuum-Mop1C/2Pro+/2Ultra Filter,977.96,0.0,https://f.nooncdn.com/p/pzsku/ZCCDCC190A1CCCFB28F99Z/45/1761493757/2b85664d-726b-45d9-b637-bd55b76e9052.jpg?width=800,product_images/MIJIA Xiaomi Mi Robot VacuumMop1C2Pro2Ultra Filter.jpg,home appliances,Noon
TORNADO Hand Mixer 300 Watt 6 Speeds Turbo Speed Black THM-300WL,"2,176",0.0,https://f.nooncdn.com/p/pzsku/Z1E355FCEB23F660FD3B1Z/45/1748966169/7cbb3c96-edc6-48dd-8677-022081b301de.jpg?width=800,product_images/TORNADO Hand Mixer 300 Watt 6 Speeds Turbo Speed B.jpg,home appliances,Noon
هابي هوم أغطية حماية للكي – 2 قطع من قماش شبكي مقاوم للحرارة للحماية من الحروق والتلف أثناء الكي – قماش واقي للملابس للكي بالبخار أو الحديد الساخن – 60×40 سم لكل قطعة – مناسب لجميع أنواع الأقمشة,130,0.0,https://f.nooncdn.com/p/pzsku/ZFA86E98B7B9FCC3B9A6EZ/45/_/1772440806/69b7b7b6-a9c1-4d9b-9446-5f6850439dd2.jpg?width=800,product_images/هابي هوم أغطية حماية للكي  2 قطع من قماش شبكي مقاو.jpg,home appliances,Noon
NINJACREAMI SWIRL SOFT SERVE ICE CREAM MAKER 0.47 L 800 W NC701ANZ Platinum Silver,"44,000",4.85,https://f.nooncdn.com/p/pnsku/N70217461V/45/_/1767607599/ecb2066e-ddda-4e85-bae7-85ed07f8d5d5.jpg?width=800,product_images/NINJACREAMI SWIRL SOFT SERVE ICE CREAM MAKER 047 L.jpg,home appliances,Noon
"DSP KD1178 Steam Iron, DSP","1,099",0.0,https://f.nooncdn.com/p/pzsku/Z7ABF2EDC928F276E9116Z/45/_/1774712885/652ae583-ab4b-429e-a485-8a190ed4062a.jpg?width=800,product_images/DSP KD1178 Steam Iron DSP.jpg,home appliances,Noon
TORNADO Hand Blender With Stainless Steel Whisk And Blades 400W HB-400 Silver/Black/Clear,"2,478",0.0,https://f.nooncdn.com/p/v1538556548/N18282960A_1.jpg?width=800,product_images/TORNADO Hand Blender With Stainless Steel Whisk An.jpg,home appliances,Noon
Sokany Sandwich Maker 750 Watt SK-08067,820,0.0,https://f.nooncdn.com/p/pzsku/Z4A166D8C8472DA4AC46EZ/45/1753087409/8cbec6fd-a557-430c-b0b7-d1dbc30cf5af.jpg?width=800,product_images/Sokany Sandwich Maker 750 Watt SK08067.jpg,home appliances,Noon
"Happy Home Deep Fryer Pot 2.2L – Stainless Steel Deep Frying Pan for Tempura, Japanese Style, with Lid, Removable Oil Filter Rack, and Thermometer, Perfect for Frying Chicken, Fries, Shrimp, Fish, Calamari Rings, Pumpkin Pie, and Other Fried Foods, Durable, Easy to Clean, Rust-Resistant, Ideal for Daily Use, Family Picnics, Camping, and Special Occasion Gifts","1,100",0.0,https://f.nooncdn.com/p/a4690c11c34e53b684932aa3972b5b43|pzsku/Z4FB6DD1B184F9068956EZ/45/1769684152/5522f166-6ad2-446f-b819-a1393d160199.jpg?width=800,product_images/Happy Home Deep Fryer Pot 22L  Stainless Steel Dee.jpg,home appliances,Noon
RAF Ceramic Steam Iron 1600W with Self-Cleaning – Multicolor – Model R.1216,850,0.0,https://f.nooncdn.com/p/eab1f94b78445297a4d9572574f04e21|pzsku/ZBF1B45E5C9DE9D93FA04Z/45/1769159588/aafe5e27-5828-40f1-bc74-fead52a6fcad.jpg?width=800,product_images/RAF Ceramic Steam Iron 1600W with SelfCleaning  Mu.jpg,home appliances,Noon
"LEVON Gas water heater 10L, JSD20-10DG5, Levon, Silver grey, Digital display, Dual ignition, Copper heat exchanger, Overheating & pressure protection","5,668",0.0,No Image,No Image,home appliances,Noon
DSP Professional Coffee and Espresso Machine with 1.8L Water Tank and 0.5L Milk Tank KA3149,"9,900",0.0,https://f.nooncdn.com/p/pzsku/Z6C2D4DD60B8685846151Z/45/_/1773135506/e80e39a7-2ab2-422b-8048-9777b396fdb5.jpg?width=800,product_images/DSP Professional Coffee and Espresso Machine with .jpg,home appliances,Noon
DSP Electric cooking pot - Multicooker - 4in1 - KC3040,"5,191",0.0,No Image,No Image,home appliances,Noon
Fresh Air heater quarts 2100.0 W 259-07429861-18 Silver-Black,"1,499",4.52,No Image,No Image,home appliances,Noon
Coffee And Tea Maker 0.4 L ST 105 Black/Clear,137,4.0106,No Image,No Image,home appliances,Noon
Home Gold 1200W Power Hair Dryer and Brush HG-905,650,0.0,No Image,No Image,home appliances,Noon
HOOVER Washing Machine Fully Automatic 8 kg H3WS383TAC3R-ELA Silver,"20,960",4.36,No Image,No Image,home appliances,Noon
Toshiba Refrigerator - 683 L - 6 Doors - Inverter technology - Tropical Compressor – XXL – Black Glass - GR-RM921WI-PGN(B1) GR-RM921WI-PGN(B1) black glass,"254,999",0.0,No Image,No Image,home appliances,Noon
"Beko Split Air Conditioner with Inverter , 1.5 HP, Cooling and Heating - BIHT1240 White","28,899",3.77,No Image,No Image,home appliances,Noon
Al-Karnak Granite Round Oven 24 Cm,425,0.0,No Image,No Image,home appliances,Noon
De'Longhi Multifry Extra Chef Low Oil Fryer Multicooker 1.7 kg 1400 W FH1394/1 Black,"12,999",4.04,No Image,No Image,home appliances,Noon
sokany USB Hand Stick Mixer - Egg Beater Sk-201A Multicolour,326,4.01,No Image,No Image,home appliances,Noon
"Casa Home 250ml Ceramic Mug Pink, Heat-Resistant, Microwave/Oven/Dishwasher Safe",310,0.0,No Image,No Image,home appliances,Noon
"passap Kitchen Cooker Hood, 90cm wall mounted,650m³/h Suction Power,3 filters, 3 speeds, Stainless Steel, LED Lighting, silver matt inox (D004-90-IX)","4,750",0.0,https://f.nooncdn.com/p/pzsku/Z85B3F7872C7A5303C595Z/45/1742981959/8a81d1eb-9a3b-4635-9c96-b7779633ea67.jpg?width=800,product_images/passap Kitchen Cooker Hood 90cm wall mounted650m³h.jpg,home appliances,Noon
"Handheld Steam Cleaner – Multi-Purpose High Pressure Steamer with 10-Piece Set, Chemical-Free Deep Cleaning for Carpets, Curtains, Windows, Floors & Car Seats – Yellow/Black/White","1,299",3.221,No Image,No Image,home appliances,Noon
Kiriazi Electric Water Heater KEH 55 V White,"4,280",4.89,No Image,No Image,home appliances,Noon
jac Hand Steam Iron 1500W Black SB16JA211,"1,775",5.01,https://f.nooncdn.com/p/pzsku/Z0635EE682409EE1707DDZ/45/1759741963/69508e37-898c-4199-8def-a08ad4ccb20e.jpg?width=800,product_images/jac Hand Steam Iron 1500W Black SB16JA211.jpg,home appliances,Noon
"sokany SK-1033 Electric Kettle, 2200W, 1.7L, Black","1,149",5.01,https://f.nooncdn.com/p/5b5f1580d4585785996ca8fcc55473be|pzsku/Z30203A6D66752190B2BBZ/45/1768990633/251cfbae-a900-4117-8ca6-9fc2c64ec1f0.jpg?width=800,product_images/sokany SK1033 Electric Kettle 2200W 17L Black.jpg,home appliances,Noon
"Smeg Tsf01Pguk, 50's Retro Style 2 Slice Toaster,6 Browning Levels,2 Extra Wide Bread Slots, Defrost And Reheat Functions, Removable Crumb Tray, Pastel Green, 950.0 W Tsf01Pguk Green","13,970",0.0,https://f.nooncdn.com/p/pzsku/Z1C936903C1DCA3412222Z/45/_/1773225569/f6f9a47d-fdad-48af-b898-1f400c72a6d6.jpg?width=800,product_images/Smeg Tsf01Pguk 50s Retro Style 2 Slice Toaster6 Br.jpg,home appliances,Noon
Multi use hand blender,399,0.0,No Image,No Image,home appliances,Noon
BLACK+DECKER Blender With Grinder Mill And Chopper Mill 1.5 L 400 W BX365E-B5 Black,"2,399",3.356,No Image,No Image,home appliances,Noon
"Carrier 53QHCT24N-708 Carrier Optimax Pro 3 HP Cooling & Heating Air Conditioner, White","48,050",0.0,No Image,No Image,home appliances,Noon
4-piece washing machine base set to stabilize and protect home appliances,120,0.0,No Image,No Image,home appliances,Noon
BLACK+DECKER Steam Iron 380 ml 2400 W X2400-B5 Pink/White,"2,599",4.19,No Image,No Image,home appliances,Noon
Fresh Healthy Grill 2000 W HG 2000 Black,"2,295",3.519,No Image,No Image,home appliances,Noon
COLDFILL Foldable and portable heating tray with nano silicone material and adjustable temperature,"2,291",0.0,No Image,No Image,home appliances,Noon
"7STARS 7-Speed Electric Hand Mixer, Lightweight, Powerful Portable Kitchen Mixer, Stainless Steel Egg Beater Includes 2 Ball Beaters and 2 Dough Mixers - White",345,3.39,https://f.nooncdn.com/p/pzsku/Z4C457327EB1821A57980Z/45/1753271722/3daaad47-3029-41c9-b2bb-0fa8e9e6f6e5.jpg?width=800,product_images/7STARS 7Speed Electric Hand Mixer Lightweight Powe.jpg,home appliances,Noon
TORNADO Ceramic Heater 2000 Watt 16 meter Remote Black TPH-2000DF,"6,499",5.01,https://f.nooncdn.com/p/pzsku/ZF7B8AE6F19651917706BZ/45/_/1731599477/27345af1-1cb4-4aa0-b429-a42bd2f19659.jpg?width=800,product_images/TORNADO Ceramic Heater 2000 Watt 16 meter Remote B.jpg,home appliances,Noon
"Silicone cover to protect clothes from burns, shine and dirt stains",160,3.520,https://f.nooncdn.com/p/pzsku/ZA333E0896FD685DFEA5CZ/45/1746208829/b2216491-e0d7-4d9c-a4a6-1cc84ed56285.jpg?width=800,product_images/Silicone cover to protect clothes from burns shine.jpg,home appliances,Noon
BOSCH CompactPower Meat Mincer 500W 1600 W MFW3630I Red/White,"5,899",3.85,https://f.nooncdn.com/p/v1587027517/N36625238A_1.jpg?width=800,product_images/BOSCH CompactPower Meat Mincer 500W 1600 W MFW3630.jpg,home appliances,Noon
"sokany Turkish Coffee Machine, 550 Watt, Black- SK-0137","1,899",3.33,https://f.nooncdn.com/p/pzsku/Z72AFDBA80EE6E7D0EA3AZ/45/_/1739026133/68d9fd14-24e6-4f8a-9034-3748f2df9ec3.jpg?width=800,product_images/sokany Turkish Coffee Machine 550 Watt Black SK013.jpg,home appliances,Noon
Philips Series 3000 Kettle With Light Indicator 1.7 L 1850 W HD931821 Black,"2,310",3.515,https://f.nooncdn.com/p/pnsku/N53373551A/45/_/1744386326/3a3f89f1-d567-4306-a683-692dc31b6925.jpg?width=800,product_images/Philips Series 3000 Kettle With Light Indicator 17.jpg,home appliances,Noon
"Happy Home Kitchen Tongs Stainless Steel – Heavy Duty Steak Clamp & Flipping Spatula Tongs Clip for Beefsteak, Hamburger, BBQ Meats, Pizza, Pies, Bread, Fish – Comfortable Ergonomic Grip, Food-Grade Stainless Steel, Multi-Purpose Cooking & Serving Tool for Indoor Kitchen & Outdoor Barbecue",120,0.0,https://f.nooncdn.com/p/pzsku/Z8F061EC8F9E1E69EF2C5Z/45/_/1775374426/33cc13e1-95f1-44f0-8683-aedc650a9746.jpg?width=800,product_images/Happy Home Kitchen Tongs Stainless Steel  Heavy Du.jpg,home appliances,Noon
"Turkish coffee maker, 4 cups",825,3.99,https://f.nooncdn.com/p/pzsku/Z420C29023B5BDF26EBE7Z/45/1750941752/c5597319-265d-4695-9d91-de1939207a3d.jpg?width=800,product_images/Turkish coffee maker 4 cups.jpg,home appliances,Noon
"Happy Home Set of 4 Anti-Vibration Pads for Washing Machines - Strong rubber feet to stabilize the washing machine and prevent slipping, vibration, and noise. Suitable for all types of washing machines or dryers - Protect the floor and improve the performance of the machine.",65,3.68,https://f.nooncdn.com/p/pzsku/ZDC3C94E4FF7FAC3FCE84Z/45/1760866766/2afe15e2-7ec6-41e5-8855-22de3dbb991d.jpg?width=800,product_images/Happy Home Set of 4 AntiVibration Pads for Washing.jpg,home appliances,Noon
franke Electric Oven - Stainless Steel Fma 97 116.0606.100 Black,"27,989",0.0,https://f.nooncdn.com/p/v1619570587/N46890101A_1.jpg?width=800,product_images/franke Electric Oven  Stainless Steel Fma 97 11606.jpg,home appliances,Noon
KENWOOD Mini Chopper 0.5 L 500.0 W CHP61.000WH SilverxWhite,"3,199",3.44,https://f.nooncdn.com/p/v1667977657/N53364741A_1.jpg?width=800,product_images/KENWOOD Mini Chopper 05 L 5000 W CHP61000WH Silver.jpg,home appliances,Noon
SIVOLT turkish coffee maker,279,5.01,https://f.nooncdn.com/p/pzsku/Z98F6F499872209311883Z/45/1760721020/ee355519-2439-4788-97e1-0136b3160ba6.jpg?width=800,product_images/SIVOLT turkish coffee maker.jpg,home appliances,Noon
"Sokany Sk-17A Biscuit Maker, 1400 Watt - Black","1,999",0.0,https://f.nooncdn.com/p/53b4eb4edf36501eabb0c2a0b92735e8|pzsku/ZB8D8A22F512B15077356Z/45/1771328037/82347dc2-c144-432a-9b78-ddad5624a1c4.jpg?width=800,product_images/Sokany Sk17A Biscuit Maker 1400 Watt  Black.jpg,home appliances,Noon
"White Smart Thermal Bottle with Digital Temperature Display – Insulated Water Bottle, Keeps Drinks Hot or Cold, Durable, Leak-Proof, Ideal for Home, Office, Travel",152,0.0,https://f.nooncdn.com/p/pzsku/Z12218B9CEDFDC992C2C2Z/45/1762766204/203c9b75-510c-4ff3-a917-d669438ca8b2.jpg?width=800,product_images/White Smart Thermal Bottle with Digital Temperatur.jpg,home appliances,Noon
DSP Sandwich Maker - 750 W (KC 1159),649,0.0,https://f.nooncdn.com/p/pzsku/ZD3708A09448E0FFD8A7AZ/45/1746688613/f862b2fe-9187-4bb7-9e1c-997a88298653.jpg?width=800,product_images/DSP Sandwich Maker  750 W KC 1159.jpg,home appliances,Noon
BLACK+DECKER Electric Sandwich Maker 600.0 W TS1000-B5 Black,"1,500",4.25,https://f.nooncdn.com/p/v1599729452/N30981916A_1.jpg?width=800,product_images/BLACKDECKER Electric Sandwich Maker 6000 W TS1000B.jpg,home appliances,Noon
"KENWOOD Blender ,1.5 Litres, 1.5 L 500 W BLP15.360BK Black","2,499",4.02,https://f.nooncdn.com/p/pnsku/N70065307V/45/_/1746520005/912b0355-6f7f-4834-a33b-ea331156e337.jpg?width=800,product_images/KENWOOD Blender 15 Litres 15 L 500 W BLP15360BK Bl.jpg,home appliances,Noon
TOUCH Elzenouki Storm Steam Iron 2200 Watt,"1,074",0.0,https://f.nooncdn.com/p/pzsku/ZE7D03013BEE9B97414FAZ/45/1765184135/72c374b6-79d5-4d8d-a603-6c8b2e66a0dd.jpg?width=800,product_images/TOUCH Elzenouki Storm Steam Iron 2200 Watt.jpg,home appliances,Noon
"UNIONAIRE 60cm Built-in Gas Oven/Gas Grill, Fan, Stainless Steel, Full Safety Features by Unionaire","10,999",3.97,https://f.nooncdn.com/p/bdad23d12b615cfc9fc49afc3cb4a4ba|pzsku/Z5BABE13028352C48EDC5Z/45/1770325287/7f9bd7bf-90dc-4324-ac05-daceb0f13426.jpg?width=800,product_images/UNIONAIRE 60cm Builtin Gas OvenGas Grill Fan Stain.jpg,home appliances,Noon
Fresh Flat Stainless Steel Plate Stove HAFR90CMSC1 Silver,"11,999",3.66,https://f.nooncdn.com/p/v1646579131/N52834716A_1.jpg?width=800,product_images/Fresh Flat Stainless Steel Plate Stove HAFR90CMSC1.jpg,home appliances,Noon
sokany SK-0808 Sokany kettle 1 liter,629,5.02,No Image,No Image,home appliances,Noon
Fresh Hot Plate Single Ceramic 1500 Wt Black Code 13423,"1,685",4.74,No Image,No Image,home appliances,Noon
HOOVER Platinum Brush And Wash Vacuum Cleaner 3.5 L 1200 W CWKTH012 Black/Clear,"21,950",5.01,No Image,No Image,home appliances,Noon
Gorenje Built in Electric oven With Grill from Gorenje 60 cm 77 liter multi-function Stainless Steel BSA6737E15X Silver,"34,799",0.0,No Image,No Image,home appliances,Noon
Gorenje Built-In Electric Ceramic Hob 30 Cm 2 Burners EC321BCSC Black,"16,799",0.0,No Image,No Image,home appliances,Noon
Arzum Airtasty Air Fryer 4 L 1350 W AR2062-G black/Silver,"5,499",5.05,No Image,No Image,home appliances,Noon
"Beko Bean To Cup Espresso Coffee Machine, Water Tank Capacity, B 19 Bar Pressure, 1350W, 13 Griding Levels, Milk Frother, 5 Preset Coffee Options, LCD Display 2 L CEG7302B ‎Black","29,990",4.64,No Image,No Image,home appliances,Noon
Koldair Water Dispenser Top-Load With Fridge Type AF 2 Taps (Hot & Cold) - Black,"9,239",4.24,No Image,No Image,home appliances,Noon
BOSCH Serie 2 Cooker Hood DWK095G60 Silver/Black 216 W DWK095G60 Silver/Black,"20,999",5.02,No Image,No Image,home appliances,Noon
"Midea Microwave EG0P042MX-S Grill, Digital, 1000W, 6 Auto Menus, 11 Power level, Eco Mode, 32L Silver with Mirror Door 32 L 1000 W EG0P042MX-S Silver","8,149",5.02,No Image,No Image,home appliances,Noon
"SHARP Microwave Grill Sharp, 25 Liter 900 Watt 8 Menus, R-250MGR-BK2 - Black 25 L 900 W R-250MGR-BK2 Black","9,352",4.33,No Image,No Image,home appliances,Noon
"Gorenje Built in Gas Hob 60 cm, 4 burners, Front Knobs, self-igniting, Cast iron grid, G641EX Stainless steel","20,594",0.0,No Image,No Image,home appliances,Noon
Jano Pasta Maker 2724328143291 Silver,626,3.06,No Image,No Image,home appliances,Noon
Bissell 750W Versatile Cleaning Spotclean Pro Portable Carpet Vacuum Cleaner Black 39.1 x 44.3 x 31.4 cm 1558G 750 W 1558G Black,"13,859",4.17,No Image,No Image,home appliances,Noon
"KARCHER DVAC 1800 Bagless Canister Vacuum Cleaner, 1800W, 20L, Blower Function, Adjustable Suction 20 L 1800 W DVAC 1800 *AE Black","9,180",4.03,No Image,No Image,home appliances,Noon
TOSHIBA Refrigerator Inverter No Frost 395L 400 W GR-EF51Z-FS Silver,"31,942",3.715,No Image,No Image,home appliances,Noon
"Beko Kettle 1,7L 2200 Watt White -WKM 4215 W 1.7 L 2200 W WKM 4215 W White","2,599",4.919,No Image,No Image,home appliances,Noon
akai elictrec oven with grill 45 litre 2200 watt,"1,899",3.415,No Image,No Image,home appliances,Noon
Beko Hand Blender stainless HBA 81762 BX Black,"4,399",5.02,No Image,No Image,home appliances,Noon
TORNADO Automatic Turkish Coffee Maker Designed With Luminasense Technology And Equipped With Protection System Tcme-100 Rg 330.0 L 735.0 W TCME-100RG-Red Red,"3,099",3.93,No Image,No Image,home appliances,Noon
BOSCH Electric Coffee Grinder 75g 180W MKM6003NGB Black,"1,999",5.03,No Image,No Image,home appliances,Noon
Sokany Electric Kettle 2200 Watt 1.7 Liter  SK-09006 Black,955,5.01,No Image,No Image,home appliances,Noon
"Toshiba Microwave 25 Liter With Grill ,Inverter , 900 WATT, Black - MW3-EG25PEI(BK) 25 L 900 W MW3-EG25PEI(BK) Black","7,100",0.0,No Image,No Image,home appliances,Noon
BLACK+DECKER Handheld Steam Iron 2200W X2050-b5 Grey,"2,199",4.227,No Image,No Image,home appliances,Noon
"Tefal Easygliss Plus Steam Iron, 2700 Watt, Blue - FV5751E0 1 kg 2700 W FV5751E0 blue","2,499",3.73,No Image,No Image,home appliances,Noon
LG Washing Machine Dryer​ With Ai Dd Technology inverter motor 1400 RPM F4R5VGG2E Black,"37,949",4.52,https://f.nooncdn.com/p/v1630318677/N50510502A_1.jpg?width=800,product_images/LG Washing Machine Dryer With Ai Dd Technology inv.jpg,home appliances,Noon
"Sokany Stand Mixer, 1000 Watt, 5 Liters, Black and Silver - SC-206","6,000",5.01,https://f.nooncdn.com/p/pzsku/Z577D196D14D3704043C4Z/45/_/1732018277/1d9ae95c-e33a-40bd-85ef-dbde36020bd9.jpg?width=800,product_images/Sokany Stand Mixer 1000 Watt 5 Liters Black and Si.jpg,home appliances,Noon
Penguin SMART Top Mount Refrigerator - 303 L - 11 Ft FG330,"14,100",3.217,https://f.nooncdn.com/p/pzsku/Z8BAE31BE566F17499576Z/45/_/1679993486/0fcd641e-b163-4135-8b7a-4b34be478888.jpg?width=800,product_images/Penguin SMART Top Mount Refrigerator  303 L  11 Ft.jpg,home appliances,Noon
"Tank Safe Touch Glass Kettle, 1.5L Capacity, 1500 Wa","2,051",5.01,https://f.nooncdn.com/p/pzsku/Z16DC0D9C03CB7D393B36Z/45/1751365975/73e35811-75c6-4b4b-9467-afe5756af29a.jpg?width=800,product_images/Tank Safe Touch Glass Kettle 15L Capacity 1500 Wa.jpg,home appliances,Noon
"Smeg KLF05RDUK 50's Retro Style mini Kettle, 0.8 L Capacity with Water Level Indicator, 360 Swivel Base, Anti-Slip Feet, Stainless Steel, Red,1 Year Warranty 0.8 L 1400.0 W KLF05RDUK Red","8,942",5.01,https://f.nooncdn.com/p/pzsku/ZE65B7ED507299E68616CZ/45/_/1773225245/ae285c37-0eaa-4148-bfdb-32afb4ec6beb.jpg?width=800,product_images/Smeg KLF05RDUK 50s Retro Style mini Kettle 08 L Ca.jpg,home appliances,Noon
White Point Front Load Full Automatic Washing Machine 9 KG - WI FI - Touch Screen with Inverter Motor & Steam Wash - Big Black PC Cover Door -Dark Inox Color - 1400 RPM - ITALY,"22,101",5.01,https://f.nooncdn.com/p/pzsku/Z118215AE31191ADC8B79Z/45/1755775425/b12cd241-a31d-4c00-89ec-938242f18d1d.jpg?width=800,product_images/White Point Front Load Full Automatic Washing Mach.jpg,home appliances,Noon
BOSCH Built-In Gas Hob PCR9A5B90 Silver,"32,699",5.02,https://f.nooncdn.com/p/v1669645094/N13045647A_1.jpg?width=800,product_images/BOSCH BuiltIn Gas Hob PCR9A5B90 Silver.jpg,home appliances,Noon
"De'Longhi Combi Coffee Machine, Traditional Pump Espresso And Filter Coffee, 1.25 Liter 1.25 L 1750 W BCO431.s Black, Stainless Steel","15,400",5.01,https://f.nooncdn.com/p/v1675245764/N53380957A_1.jpg?width=800,product_images/DeLonghi Combi Coffee Machine Traditional Pump Esp.jpg,home appliances,Noon
Beko Split Air Conditioner (2.25 HP) Cooling Only Pro Smart Inverter Ultra-fast cooling Airflow Volume 1140 m³/h BICT1821X BICT1821X White,"39,999",4.25,https://f.nooncdn.com/p/pnsku/N70090747V/45/_/1720418530/f1e0435d-7d14-4e94-9c68-0162bdfa5186.jpg?width=800,product_images/Beko Split Air Conditioner 225 HP Cooling Only Pro.jpg,home appliances,Noon
