name,price,rating,image_url,image_path,category,source
"Moulinex Turbomix Plus Hand Blender, 350 Watt, beaker 800 ml, Stainless Steel Foot, DD1011EG White","1,379",4.127,https://f.nooncdn.com/p/pnsku/N43979991A/45/_/1767607706/3ae31e26-00b7-4e21-93d9-2b7c0291bd3a.jpg?width=800,product_images/Moulinex Turbomix Plus Hand Blender 350 Watt beake.jpg,home appliances,Noon
DSP Coffee Tea Appliances Grinder 100 Gram 650 Watt,"3,399",0.0,https://f.nooncdn.com/p/pzsku/Z6822F7EBE9E4AC31D6F7Z/45/_/1701346234/61e816de-d9fd-40b8-8bbd-64d930c27755.jpg?width=800,product_images/DSP Coffee Tea Appliances Grinder 100 Gram 650 Wat.jpg,home appliances,Noon
"Garkoo Air flow deflector for split air conditioners, 2.25 HP, 3 HP, 4 HP, 5 HP, adjustable from 25cm to 65 cm, acrylic, white color","1,079",4.126,https://f.nooncdn.com/p/pzsku/Z62599A3D1D719B1302C2Z/45/_/1678336189/dc7b6cba-7e7c-4bd5-8f8e-b736388f47b8.jpg?width=800,product_images/Garkoo Air flow deflector for split air conditione.jpg,home appliances,Noon
"Fresh Crystal electric oven, 48 liters, grill, lamp, and fan","3,750",4.023,https://f.nooncdn.com/p/pzsku/ZE364A5DA649E11BA9427Z/45/1767809157/185d7aec-40b9-416a-83b7-e17860c3894e.jpg?width=800,product_images/Fresh Crystal electric oven 48 liters grill lamp a.jpg,home appliances,Noon
Fresh Handheld Vacuum Cleaner 1600 W 500018947 Red/Black/Silver,"3,159",4.121,https://f.nooncdn.com/p/v1630234531/N23171638A_1.jpg?width=800,product_images/Fresh Handheld Vacuum Cleaner 1600 W 500018947 Red.jpg,home appliances,Noon
De'Longhi 12 Fin Room Heater Oil Filled Cover 75 m Room  -  3 Speeds 2500 W TRRSE1225 White,"9,499",4.318,https://f.nooncdn.com/p/pnsku/N70022569V/45/_/1767607926/795a808c-1160-45cb-a96e-d666b348d087.jpg?width=800,product_images/DeLonghi 12 Fin Room Heater Oil Filled Cover 75 m .jpg,home appliances,Noon
"Alaska Refrigerator Defrost,337 Litres,Silver-KSD335","15,908",5.01,https://f.nooncdn.com/p/pzsku/ZC96F06FF76D9CB5E31CAZ/45/_/1738855623/be83e359-1486-4166-a1b6-a59cbabc093d.jpg?width=800,product_images/Alaska Refrigerator Defrost337 LitresSilverKSD335.jpg,home appliances,Noon
"Xiaomi Truclean W20 Wet Dry Vacuum | 3-in-1 vacuum | 15,000Pa | 500rpm fast mopping | 200 W C305HW | BHR8809GB / BHR8833EU White","16,323",4.222,https://f.nooncdn.com/p/pnsku/N70090710V/45/_/1767607844/fbffc76b-b03f-4ecb-b16f-fcb954f55706.jpg?width=800,product_images/Xiaomi Truclean W20 Wet Dry Vacuum  3in1 vacuum  1.jpg,home appliances,Noon
"De'Longhi Dedica Duo EC890.WI, Barista Coffee Machine with Pump, Espresso and Cold Brew, Manual Coffee Machine with LatteArt Steam Rod, 15 cm Wide, 2 Espresso, Touch Screen, Cups up to 13 cm, White 1 L 1450 W EC890.WI White","12,849",5.02,https://f.nooncdn.com/p/pnsku/N70248372V/45/_/1775026154/60ed9097-e9fd-462b-9d33-b6affc01d785.jpg?width=800,product_images/DeLonghi Dedica Duo EC890WI Barista Coffee Machine.jpg,home appliances,Noon
Sokany 7 in 1 Sandwich Maker Set 750 Watt SK-907 Sokany Sandwich Maker,"2,699",4.511,https://f.nooncdn.com/p/pzsku/Z942D7066B4A5C69A8D21Z/45/1767808743/d5db38a2-382c-4f20-8d40-2cd2ab4d7d4d.jpg?width=800,product_images/Sokany 7 in 1 Sandwich Maker Set 750 Watt SK907 So.jpg,home appliances,Noon
"Beko Gas Built-In Hob, 4 Burners HIAW64225SX Stainless Steel","13,499",0.0,https://f.nooncdn.com/p/pnsku/N70011722V/45/_/1696582861/63b3618f-e173-4590-bbee-f2f289f41f57.jpg?width=800,product_images/Beko Gas BuiltIn Hob 4 Burners HIAW64225SX Stainle.jpg,home appliances,Noon
"KENWOOD Personal Blender Smoothie Blender/Smoothie Maker with two Tritan Smoothie2Go Bottle and Lid, Ice Crush Function 2 L 350 W BLM05.A0BK Black","3,080",4.6241,https://f.nooncdn.com/p/pnsku/N37375723A/45/_/1746519923/fc24a9bc-d540-416b-bc84-be404a6742bf.jpg?width=800,product_images/KENWOOD Personal Blender Smoothie BlenderSmoothie .jpg,home appliances,Noon
"KENWOOD Hand Blender, Stainless Steel Wand, Variable Speed Control, Turbo Function, Removable Wand HBM02.001WH White","3,080",4.4278,https://f.nooncdn.com/p/v1672999151/N53374412A_1.jpg?width=800,product_images/KENWOOD Hand Blender Stainless Steel Wand Variable.jpg,home appliances,Noon
"BRAUN CareStyle 1 Steam Generator Iron, World’s first FreeGlide3D soleplate 1.5 L 2200 W IS 1014 ‎White / Violet","5,249",4.08,https://f.nooncdn.com/p/pnsku/N70060203V/45/_/1712082784/6a091786-6e99-4339-bd50-deb06a46ea2d.jpg?width=800,product_images/BRAUN CareStyle 1 Steam Generator Iron Worlds firs.jpg,home appliances,Noon
"Toshiba Washing Machine, Inverter, Steam, Ultra Fine Bubbles, Smart Control (Wifi), Automatic - 8 kg TW-BK90GF4EG(MK) Morandi Grey","20,199",4.46,https://f.nooncdn.com/p/pnsku/N70031587V/45/_/1767607759/6bfee263-777c-476e-8441-66c2a03be5d8.jpg?width=800,product_images/Toshiba Washing Machine Inverter Steam Ultra Fine .jpg,home appliances,Noon
TORNADO Automatic Turkish Coffee Maker - 280 ml 735 W TCME-100 RG Red x Black,"3,493",4.570,https://f.nooncdn.com/p/v1669895978/N35344962A_2.jpg?width=800,product_images/TORNADO Automatic Turkish Coffee Maker  280 ml 735.jpg,home appliances,Noon
Fresh Wall Fan Brilliant 220.0 W 500004513 Multicolour,"1,425",4.721,No Image,No Image,home appliances,Noon
City hand mixer for nescafe and capuccino 35.0 W 4181721596417 White,345,3.768,No Image,No Image,home appliances,Noon
"Philips Fully Automatic Coffee Machine Series 5500-20 Beverages, LatteGo, Extra Shot, Silent Brew, Intuitive Display, 4 User Profiles, 12 Settings for Ceramic Grinder, Chrome 1.8 L 1500 W EP5547/90 Black","51,999",4.348,No Image,No Image,home appliances,Noon
"SHARP Air Fryer Sharp, Double Basket, Digital 8 L 1800 W KF-DF80RT-EK2 Stainless Steel","11,115",0.0,No Image,No Image,home appliances,Noon
"BOSCH Fully Automatic Coffee Machine, Vero Barista 400, Sapphire Black Metallic, Removable Water Tank 1500 W TIS65429RW Black","34,920",5.04,No Image,No Image,home appliances,Noon
"Tefal Steam Iron Express Steam Plus, 45g/min, Auto-off, 300 ml 2500 W FV2868E2 Blue","1,798",4.035,No Image,No Image,home appliances,Noon
Touch El-Zenouki 41109 Style Fan Heater - 2000 W purple/white,878,4.449,No Image,No Image,home appliances,Noon
DSP Stand Mixer 1200 watts 1200.0 W km-3007 White,"8,000",0.0,No Image,No Image,home appliances,Noon
Midea Mission Cooling And Heating Plasma Air Conditioner- 1.5 Horse Power MSMB1T-12HRJ White,"23,999",3.98,No Image,No Image,home appliances,Noon
Home Electric Nescafe Racket Foam Maker - White,899,0.0,No Image,No Image,home appliances,Noon
KENWOOD Electric Kettle 2200W 1.7 L 2200.0 W ZJM01 A0BK Silver/Black,"2,120",4.716,No Image,No Image,home appliances,Noon
Home Egypt Electric Kettle 1850 Watt 1.7 Liter - TM1014,"1,194",0.0,No Image,No Image,home appliances,Noon
"De'Longhi Coffee Machine MAGNIFICA EVO Fully Automatic Bean to Cup Coffee Machine, 12+ Functions, Ideal for Espresso, Americano, Cappuccino, Latte, Macchiato & More Coffee Recipes 1.8 L 1450 W ECAM290.81.TB Black","41,212",4.070,No Image,No Image,home appliances,Noon
Sokany Electric Coffee Grinder 500 Watt Silver,"2,499",0.0,No Image,No Image,home appliances,Noon
"Bissell Spotclean Hydrosteam 3700E Portable Deep Cleaner With Hydrosteam Technology, Powerful Stain Removal For Carpets With The Power Of Steam, Upholstery & Hard Surfaces, Compact & Lightweight Design | 2-Year Warranty 1000 W 3700E Black/ Copper Harbor","16,999",4.172,No Image,No Image,home appliances,Noon
BRAUN Plastic Hand Blender MQ10.000 White/Blue,"1,275",4.434,No Image,No Image,home appliances,Noon
"Toshiba Washing Machine Automatic, Ultra Fine Bubbles, The Great Waves, Steam, Wi-Fi 9Kg Washer + 6Kg Dryer, Origin Inverter - 9 kg TWD-BM100GF4EG(MK) Morandi Grey","28,499",5.03,No Image,No Image,home appliances,Noon
"BLACK+DECKER Digital Kettle, Touch Screen, Double Wall Design, 6 Preset Temps, 30-Min Keep Warm, LED Display, Auto Shut-Off, Boil-Dry Protection, Cool-Touch Exterior, 1.7 L 2200 W JCD200-B5 Black","3,499",4.7121,No Image,No Image,home appliances,Noon
"Toshiba Microwave ML3-EM36PFI(MB) ORIGIN INVERTER, SMART SENSOR COOK, 1200W MICROWAVE POWER OUTPUT, AUTO MENUS, 36 Liters,Silver Mirror 36 L 1900 kW ML3-EM36PFI(MB) Silver","8,550",5.01,No Image,No Image,home appliances,Noon
"Beko Refrigerator, 390L Net, Top Freezer, Traditional Defrost System, Adjustable Glass Shelves, Fast Cooling, Energy Efficient, RDNE420KD silver","20,499",0.0,No Image,No Image,home appliances,Noon
"BLACK+DECKER Digital Aero Fry - 13 in 1, 4 L Non-Stick Pan - 3.7L Detachable Basket - 60 Mins Timer - From 80°C to 200°C 4 L 1500 W AF4037-B5 Black","4,900",4.677,No Image,No Image,home appliances,Noon
Kenwood Steam Iron 2600 Watts Green/White STP76.000WG 5011423009483 20 L 2600 W STP76.000WG green/white,"2,683",4.01,No Image,No Image,home appliances,Noon
"Toshiba Top Loading Washing Machine, Ultra Fine Bubble, Great Waves, Water Shield Filter, Memory, Quick Wash 15Min, Automatic - 13 kg AW-DUK1300KUPEG(SK) Silver","18,999",4.640,No Image,No Image,home appliances,Noon
De'Longhi Traditional Pump Espresso Machine Coffee Maker ECP31.21 Black,"9,020",4.329,No Image,No Image,home appliances,Noon
Tefal Steam Iron Express Steam Plus 270 ml 2600 W FV2869E2 Black,"2,435",4.327,No Image,No Image,home appliances,Noon
"Fresh 5 burner 90cm professional black gas stove with safety fan, combustion timer, code 0087","19,379",0.0,No Image,No Image,home appliances,Noon
"KENWOOD Kettle, Stainless Steel, Auto Shut-Off, Removable Mesh Filter 1.7 L 2200 W ZJM10.000SS Silver","2,399",4.4120,No Image,No Image,home appliances,Noon
"TORNADO Automatic Turkish Coffee Maker, 735 Watt,330 ML 330.0 ml 735.0 W TCME-100W Black","3,493",0.0,No Image,No Image,home appliances,Noon
Beko Flat Under Cabinet Hood 90 cm Stainless Steel CFB 9433 XF CFB9433XF stainless steel - Black,"7,299",5.04,https://f.nooncdn.com/p/pnsku/N70119560V/45/_/1729047735/b8ebcf7e-01de-4283-b184-94571df92abd.jpg?width=800,product_images/Beko Flat Under Cabinet Hood 90 cm Stainless Steel.jpg,home appliances,Noon
Beko Hand Blender - 1500 Watts - 1.75 Litres Capacity - Full Stanless Steel Cutting System - White - RHB 5050,"3,549",4.88,https://f.nooncdn.com/p/pnsku/N70072716V/45/_/1715747477/9d302ea6-8d75-4243-bcfd-0de785868f65.jpg?width=800,product_images/Beko Hand Blender  1500 Watts  175 Litres Capacity.jpg,home appliances,Noon
Samsung Refrigerator 340 Liter 2 Doors Black Mirror RT33DG3000BVMR RT33DG3000BVMR Black Mirror,"21,149",4.113,https://f.nooncdn.com/p/pzsku/ZEAEF9E8F66123CDDF8D3Z/45/_/1772091158/b76271ba-1d26-454b-9dbc-751fafb6ad2f.jpg?width=800,product_images/Samsung Refrigerator 340 Liter 2 Doors Black Mirro.jpg,home appliances,Noon
"Moulinex Blender Genuine, Grinder, 1.5 L 400 W LM2411EG White","1,599",3.938,https://f.nooncdn.com/p/pnsku/N31739434A/45/_/1767607834/24ed5030-0de4-4dde-a492-9ce1a1b7f8d4.jpg?width=800,product_images/Moulinex Blender Genuine Grinder 15 L 400 W LM2411.jpg,home appliances,Noon
Home Egypt Electric Hot Plate 1500 Watt,"1,278",5.01,https://f.nooncdn.com/p/pzsku/Z1E6533006447C684AFE1Z/45/_/1723881691/04812d9c-9be5-4178-8d14-a378057ed8d3.jpg?width=800,product_images/Home Egypt Electric Hot Plate 1500 Watt.jpg,home appliances,Noon
Skyline Wall Ventilator Two Direction 25 Cm 25x25,529,3.932,https://f.nooncdn.com/p/pzsku/Z098151D99D75695A3547Z/45/1767808739/371d2ad1-9831-4b1c-b989-ed81081a9b50.jpg?width=800,product_images/Skyline Wall Ventilator Two Direction 25 Cm 25x25.jpg,home appliances,Noon
Home Gold Single Burner Electric Stove with Non-Stick Hot Plate and Overheat Protection 1000W - Black - 1 Year Warranty,650,5.01,https://f.nooncdn.com/p/pzsku/Z59195A5809217BF55C2DZ/45/1751643091/28d93126-5381-4a0d-bea8-1b6fd9107ee5.jpg?width=800,product_images/Home Gold Single Burner Electric Stove with NonSti.jpg,home appliances,Noon
Jack Water Dispenser with 3 Taps (Cold/Hot/Light Temperature) - White/Black - Equipped with a Bottom Storage,"4,600",4.422,https://f.nooncdn.com/p/pzsku/ZE0F5FFD5D25B2F85A911Z/45/_/1775236368/2dab19fd-9fbe-4c63-b28e-24615250c40e.jpg?width=800,product_images/Jack Water Dispenser with 3 Taps ColdHotLight Temp.jpg,home appliances,Noon
Fresh Built In Microwave 25L Grill Digital Stainless FBMW-25ECG -STW,"11,085",5.03,https://f.nooncdn.com/p/pzsku/ZEBF0F74BBC477235C3ADZ/45/_/1727263955/46130b3b-7958-4ffb-aa24-7ef78d8e768a.jpg?width=800,product_images/Fresh Built In Microwave 25L Grill Digital Stainle.jpg,home appliances,Noon
Fresh Electric Stainless Kettle & Thermos 1.3 L 1200.0 W 500004550 White,"1,599",0.0,https://f.nooncdn.com/p/e19eb24008a252f48a0e4be4c161817b|pzsku/ZB632387EA41642BAB1BCZ/45/1769873741/90638222-f81a-4b50-807b-312fa0696df3.jpg?width=800,product_images/Fresh Electric Stainless Kettle  Thermos 13 L 1200.jpg,home appliances,Noon
"TOSHIBA Refrigerator Pure BIO Filter, Tropical Compressor, Electronic temperature control, 338L GR-RT468WE DMN Grey","21,200",0.0,https://f.nooncdn.com/p/pnsku/N70047698V/45/_/1760620757/5ecb8240-031d-47bc-a3a6-3533735577fb.jpg?width=800,product_images/TOSHIBA Refrigerator Pure BIO Filter Tropical Comp.jpg,home appliances,Noon
"KENWOOD Kitchen Machine, Stainless Steel Bowl, Prospero 4 Attachments, Variable Speed, K-Beater, Whisk, Dough Hook, Blender, 4.3 L 1000 W KHC29.B0SI Silver","9,790",3.838,https://f.nooncdn.com/p/v1667313115/N41188852A_1.jpg?width=800,product_images/KENWOOD Kitchen Machine Stainless Steel Bowl Prosp.jpg,home appliances,Noon
"Sokany sk-758  electric hand blender stainless steel with cup 1200 watt - with ice crushing blades - copper motor, 1 Year Warranty","1,330",4.660,https://f.nooncdn.com/p/pzsku/Z932232CFB4020B6DB5C4Z/45/1753342502/b08ca3e4-8778-4c76-96e1-1a3fbd203e15.jpg?width=800,product_images/Sokany sk758  electric hand blender stainless stee.jpg,home appliances,Noon
"Unionaire 440L No-Frost Digital Refrigerator with Inverter Motor, Black Glass, URN-600LBG1A-DTHR","19,700",4.38,https://f.nooncdn.com/p/pzsku/ZF2276CB88E857E8166B5Z/45/_/1771943010/e2f34279-272a-41c6-9974-db64f00cb7fa.jpg?width=800,product_images/Unionaire 440L NoFrost Digital Refrigerator with I.jpg,home appliances,Noon
"BOSCH Food processor, MultiTalent 3 Plus, Black, Brushed Stainless Steel 2.3 L 900 W MCM3PM386 Black","9,499",4.511,https://f.nooncdn.com/p/v1628071735/N49661338A_1.jpg?width=800,product_images/BOSCH Food processor MultiTalent 3 Plus Black Brus.jpg,home appliances,Noon
Philips Steam Iron 300 ml 2200 W DST3020/20 Blue,"2,200",4.239,https://f.nooncdn.com/p/pnsku/N70029367V/45/_/1702272690/8e97d86c-be8b-4e4f-8ab6-bc2d006903ce.jpg?width=800,product_images/Philips Steam Iron 300 ml 2200 W DST302020 Blue.jpg,home appliances,Noon
Simfer Built in 60 Cm - Stainless steel - 4 burners,"23,680",0.0,https://f.nooncdn.com/p/pzsku/Z5A98AE31A7DB67C65811Z/45/1764850889/a8716d95-5885-4641-9f76-baca8bfaf3f9.jpg?width=800,product_images/Simfer Built in 60 Cm  Stainless steel  4 burners.jpg,home appliances,Noon
"SILVER CREST Unbreakable jug mixer, 32000 RPM, copper motor + rust-resistant steel blades","1,416",0.0,https://f.nooncdn.com/p/pzsku/Z6803B95CC112E8277F56Z/45/1762101520/a024be23-7b8f-4b4f-8689-7e6d694fe5c1.jpg?width=800,product_images/SILVER CREST Unbreakable jug mixer 32000 RPM coppe.jpg,home appliances,Noon
Toshiba Washing Machine Top Automatic 11 Kg With Pump AEW-E1150SUP White,"17,999",4.79,https://f.nooncdn.com/p/v1657630922/N43898158A_1.jpg?width=800,product_images/Toshiba Washing Machine Top Automatic 11 Kg With P.jpg,home appliances,Noon
ALASKA Double Door Refrigerator 8 feet Defrost 222 L / KSD 25 Silver,"12,899",4.62,https://f.nooncdn.com/p/pnsku/N50090153A/45/_/1716281898/36a49faf-96db-44eb-98ec-c9001b02c34c.jpg?width=800,product_images/ALASKA Double Door Refrigerator 8 feet Defrost 222.jpg,home appliances,Noon
Philips Fully Automatic Coffee Machine 1.8 L 1500 W 3200 Black,"38,000",0.0,https://f.nooncdn.com/p/pnsku/N70097879V/45/_/1722585677/cd7e6771-4998-453b-9287-083c6b934514.jpg?width=800,product_images/Philips Fully Automatic Coffee Machine 18 L 1500 W.jpg,home appliances,Noon
"TORNADO Orbit Fan 16 Inch, 4 Blades TOF-49Y White","2,049",4.438,https://f.nooncdn.com/p/v1639890112/N48465096A_1.jpg?width=800,product_images/TORNADO Orbit Fan 16 Inch 4 Blades TOF49Y White.jpg,home appliances,Noon
"De'Longhi Magnifica S SMART Bean To Cup Fully Automatic Coffee Machine With Milk Frother, Built In Grinder, Americano, Cappuccino, Latte, Macchiato & Espresso Maker 1 L 1450 W ECAM 250.23.SB Silver & Black","48,998",0.0,https://f.nooncdn.com/p/v1693233559/N53431840A_1.jpg?width=800,product_images/DeLonghi Magnifica S SMART Bean To Cup Fully Autom.jpg,home appliances,Noon
"Passap Defrost Refrigerator, 320 Liters, Silver - FG360","13,395",0.0,https://f.nooncdn.com/p/pzsku/Z8F766259BB23C588865EZ/45/1759257125/7254f56d-0f84-4f48-a791-bc3a173d138b.jpg?width=800,product_images/Passap Defrost Refrigerator 320 Liters Silver  FG3.jpg,home appliances,Noon
"Unionaire Max 12-60/90 cm Gas Cooker, 5 Burners, Cast Iron Grates, Fan, Safety Timer, Oven and Grill C69SS-GC-447-ISOF-M12-2W-AL","11,750",3.427,https://f.nooncdn.com/p/pzsku/ZCB79EF637E398D85F91AZ/45/_/1771945354/8f5776c3-8c58-47d1-86f3-4700391af469.jpg?width=800,product_images/Unionaire Max 126090 cm Gas Cooker 5 Burners Cast .jpg,home appliances,Noon
BLACK+DECKER Steam Iron 220 ml 2200 W X2200-B5 Black/Red,"2,499",4.347,https://f.nooncdn.com/p/pnsku/N70075427V/45/_/1717415823/e104fdfc-cf9b-4414-9aff-42a531d394c5.jpg?width=800,product_images/BLACKDECKER Steam Iron 220 ml 2200 W X2200B5 Black.jpg,home appliances,Noon
Beko Garment Steamer 230 ml 1600 W STM4116B Black,"3,262",4.316,https://f.nooncdn.com/p/pnsku/N70021560V/45/_/1699072281/e9038211-b886-4129-971c-3ccd1fdc1034.jpg?width=800,product_images/Beko Garment Steamer 230 ml 1600 W STM4116B Black.jpg,home appliances,Noon
TEFAL All-in-One Standing Garment Steamer - Steam Flow up to 90 Grams per minute - 2980W - Water tank capacity 1.0 Litre - 50/60Hz - IXEO+ All-in-One QT1510G0 1 L 2980 W QT1510G0 / QT1510 G0/AM0-1625 / QT1510 G0/AM0-3025 Black/White,"19,650",4.5132,https://f.nooncdn.com/p/pnsku/N53379551A/45/_/1767607802/7bde5d89-3ef1-4b10-9614-c75421ab0e11.jpg?width=800,product_images/TEFAL AllinOne Standing Garment Steamer  Steam Flo.jpg,home appliances,Noon
"De'Longhi Dedica Duo EC890.PK, Barista Coffee Machine with Pump, Espresso and Cold Brew, Manual Coffee Machine with LatteArt Steam Rod, 15 cm Wide, 2 Espresso, Touch Screen, Cup up to 13 cm, Pink 1 L 1450 W EC890.PK Pink","11,499",4.39,No Image,No Image,home appliances,Noon
Sonifer Compact Electric Oven 7 L 640 W SF-4042 pink,"1,999",5.01,No Image,No Image,home appliances,Noon
KENWOOD 2-In-1 Sandwich Maker 1300 W SMP94.A0WH White,"3,088",4.88,No Image,No Image,home appliances,Noon
"Fresh Rafale 56"" Ceiling Fan Set of 3 75 W 500004511 White","4,676",3.947,No Image,No Image,home appliances,Noon
"Universal gas stove, 5 burners, 60/90, stainless, with fan, new classic","10,500",4.08,No Image,No Image,home appliances,Noon
Beko Turkish Coffee Maker Machine 0.7 L 670 W BKK 2300 Grey black,"14,098",4.871,No Image,No Image,home appliances,Noon
Jac Wall Fan 26 Inch 200.0 W NGSF-013 Black,"3,950",4.711,No Image,No Image,home appliances,Noon
smeg Retro Style Aesthetic Citrus Juicer 70W 1.0 L 70.0 W YTRE987945 White,"19,499",5.01,No Image,No Image,home appliances,Noon
"NIKAI 46L Electric Oven, 1500W Power, Adjustable Temperature, 7 Heating Stages, 60-Min Timer with Bell Ring, Indicator Light, Keep Warm Function, High-Efficiency Heating, Accessories Included - 46 L 1500 W NT655N2/ NT655RX2 Black","22,475",4.1233,No Image,No Image,home appliances,Noon
"Sokany Sokany 3 in 1 Sandwich Maker - 750 Watt - SK-302N - Grill, waffle, toast with double side heating","1,850",3.417,No Image,No Image,home appliances,Noon
Hamburg Defrost Refrigerator - 11 Feet - 2 Doors - 300 Liters - FB30 - Silver,"10,999",3.829,No Image,No Image,home appliances,Noon
Beko high efficiency machine 19 Bar Pressure - Power 1350 watt - Water Tank 1.5 liter - with Milk Frother and 5 levels Grinding - CEG 3192 B 1.5 L 1350 W 8911403200 Black,"23,157",5.01,No Image,No Image,home appliances,Noon
"KENWOOD Coffee Machine Up To 6 Cup Coffee Maker For Drip Coffee And Americano 550W 40 Min Auto Shut Off, Reusable Filter, Anti Drip Feature, Warming Plate And Easy To Clean CMM05.000BM Black","3,900",4.669,No Image,No Image,home appliances,Noon
Home ElECTRIC KETTLE  1850-2200 W - 1.7 L  - CC2241,"1,320",0.0,No Image,No Image,home appliances,Noon
BLACK+DECKER Pivot Hand Vacuum Cleaner 440ml 14.4V PV1420L 440 ml PV1420L-B5 White,"5,810",4.334,No Image,No Image,home appliances,Noon
KENWOOD Air Fryer 5.5 L 1800 W HFP50 / HFP50.000BK Black,"6,677",4.4275,No Image,No Image,home appliances,Noon
"Toshiba 450L Refrigerator with Glass Door, Inverter Compressor, AirFALL Cooling, Voltage Stability, Pure BIO Filter, GR-RT624WE-PGN(72) Sliver","34,900",5.01,No Image,No Image,home appliances,Noon
"Sokany SK-3080 1200W Handheld Steamer for Clothes, Curtains and Upholstery - Blue (1 Year Warranty)","1,750",5.03,No Image,No Image,home appliances,Noon
smeg 50's Retro Style Aesthetic Countertop Kettle 1.7 L 3000.0 W KLF03SSUK Chrome,"19,999",0.0,No Image,No Image,home appliances,Noon
سيلفر كريست مطحنة قهوة وتوابل كهربائية ستانيلس ستيل من سيلفركرقست موتور نحاس قوى 300 واط سعة 150 جرام مع 6 شفرات حادة من الستانلس ستيل للتوابل والمكسرات والاعشاب والقهوة طحن قوى سهلة التنظيف,550,4.01,No Image,No Image,home appliances,Noon
"BLACK+DECKER Coffee Grinder, One Speed with Pulse, Stainless Steel Cup & Blade, Safety Lock Lid, Quick & Controlled Grinding for Coffee, Compact, 150 W CBM4-B5 Brown","2,108",4.4493,No Image,No Image,home appliances,Noon
"BRAUN Multi Quick 7 Hand Blender, 1.5L Food Processor, 0.600L Beaker, Whisk, Stainless Steel Shaft, ACTIVEBlade Technology, Splash Control MQ7045X Black","5,895",4.2126,No Image,No Image,home appliances,Noon
Philips Azur 8000 Series Steam Iron 300 ml 3000 W DST8021/36 Purple/Black,"6,710",4.4204,No Image,No Image,home appliances,Noon
Mienta Stainless Steel Hand Beater 200 W BT-BM1 Multicolour,899,4.669,https://f.nooncdn.com/p/v1670948894/N33657682A_1.jpg?width=800,product_images/Mienta Stainless Steel Hand Beater 200 W BTBM1 Mul.jpg,home appliances,Noon
"BRAUN Multi Quick 5, 21 Speeds, 0.500L Chopper, 0.600L Beaker, Stainless Steel Whisk MQ5235WH White","4,235",4.4342,https://f.nooncdn.com/p/pnsku/N50585426A/45/_/1767088884/3a2fe5a4-fa95-4662-82a3-d012b789b5c3.jpg?width=800,product_images/BRAUN Multi Quick 5 21 Speeds 0500L Chopper 0600L .jpg,home appliances,Noon
"JAMAKY Italy 3-Liter 300W Chopper with Stainless Steel Bowl for Grinding Meat and Vegetables, Copper Motor by Jamaki, Model JMK-8102",999,0.0,https://f.nooncdn.com/p/pzsku/ZFAEE7C2042442069312BZ/45/_/1773432260/265ae322-112a-4db9-aed2-d393818ad357.jpg?width=800,product_images/JAMAKY Italy 3Liter 300W Chopper with Stainless St.jpg,home appliances,Noon
smeg Electric Toaster 950W 950.0 W TSF01BLUK Black,"10,999",4.73,https://f.nooncdn.com/p/pzsku/ZF09249FEAC6ACC1A1F72Z/45/_/1773225420/c7747bad-9a57-4070-9b21-d1b1fc1971cf.jpg?width=800,product_images/smeg Electric Toaster 950W 9500 W TSF01BLUK Black.jpg,home appliances,Noon
Toshiba Washer Top Load 13 Kg Silver AW-DUK1300KUPEG(SK) AW-DUK1300KUPEG(SK) Silver,"18,999",5.03,https://f.nooncdn.com/p/pnsku/N70099803V/45/_/1723271569/b4a4fa02-774a-43f2-8c1b-077bfb4d4748.jpg?width=800,product_images/Toshiba Washer Top Load 13 Kg Silver AWDUK1300KUPE.jpg,home appliances,Noon
BRAUN MultiQuick 1 Hand Blender MQ10.000PWH White/Blue,"1,299",4.116,https://f.nooncdn.com/p/pnsku/N70018595V/45/_/1698309052/c6b1cfca-dbd4-473e-8cf0-8ba032482f05.jpg?width=800,product_images/BRAUN MultiQuick 1 Hand Blender MQ10000PWH WhiteBl.jpg,home appliances,Noon
"TORNADO Wall Fan 16 Inch, 4 Blades, Remote 250 W TWF-30 White","2,499",4.2143,https://f.nooncdn.com/p/v1653376219/N48465102A_1.jpg?width=800,product_images/TORNADO Wall Fan 16 Inch 4 Blades Remote 250 W TWF.jpg,home appliances,Noon
BRAUN Food Processor 350.0 ml 1000.0 W MQ 5245 WH White/Grey/Clear,"4,950",4.458,https://f.nooncdn.com/p/v1621268190/N44122139A_1.jpg?width=800,product_images/BRAUN Food Processor 3500 ml 10000 W MQ 5245 WH Wh.jpg,home appliances,Noon
"De'Longhi Oil Heater, 9 Fins 2000 W TRRS0920 White","8,107",4.99,https://f.nooncdn.com/p/pnsku/N70021227V/45/_/1698994982/9908d65f-393d-428c-8ba6-a578b18c6f5f.jpg?width=800,product_images/DeLonghi Oil Heater 9 Fins 2000 W TRRS0920 White.jpg,home appliances,Noon
Mienta Stainless Steel Electric Kettle 1.7 L 2150.0 W EK20920A Silver,"1,980",4.714,https://f.nooncdn.com/p/v1582617382/N35124785A_1.jpg?width=800,product_images/Mienta Stainless Steel Electric Kettle 17 L 21500 .jpg,home appliances,Noon
sokany Hotdog Cake Baking Machine 750.0 W Kj-105 Black/Grey,968,4.225,https://f.nooncdn.com/p/v1616513350/N45716482A_1.jpg?width=800,product_images/sokany Hotdog Cake Baking Machine 7500 W Kj105 Bla.jpg,home appliances,Noon
"Toshiba No-Frost TOSHIBA Refrigerator Pure BIO Filter, Origin Inverter, Air FALL Cooling, Voltage Stability,411L, GR-RT559WE-DMN49 Grey","25,999",4.512,https://f.nooncdn.com/p/pnsku/N70019808V/45/_/1698679912/31e47ef8-ae70-46b7-91b4-1b6266e9f151.jpg?width=800,product_images/Toshiba NoFrost TOSHIBA Refrigerator Pure BIO Filt.jpg,home appliances,Noon
"Philips Air Purifier High Performance for Rooms Size of 78 m² Removes House Dust/Aerosols And Uncomfortable Smell, Series 1000 [NEW! 2023 Version] AC1711/90 White/Grey","18,699",4.5236,https://f.nooncdn.com/p/pnsku/N53349190A/45/_/1726065467/d633583f-1e21-42eb-a522-bb16690bd41f.jpg?width=800,product_images/Philips Air Purifier High Performance for Rooms Si.jpg,home appliances,Noon
