name,price,rating,image_url,image_path,category,source
"Midea Water Heater MGWH06-12MZLEG(S) Bomb Gas,Healthy Water, 6 Liter, MGWH06-12MZLEG(S) Silver","4,249",5.04,No Image,No Image,home appliances,Noon
Levon stainless steel blender. 1000 watts. 1.7 liters.,"2,052",4.014,No Image,No Image,home appliances,Noon
KENWOOD Electric Meat Grinder 2 kg 1600 W MG510 Silver,"7,260",4.337,No Image,No Image,home appliances,Noon
AKAI Stand Fan 18 Inches 3 Speeds 5 Blades 1 Years Warranty 65 W AK-18SA (White) white,918,4.37,No Image,No Image,home appliances,Noon
BOSCH Wall Mounted Chimney Hood 135W 135 W DWP94CC50T Grey/Silver,"10,799",0.0,No Image,No Image,home appliances,Noon
ATA Water Dispenser 3 Taps 595 Watt 4 Liters with Cabinet- Black Silver,"4,500",0.0,No Image,No Image,home appliances,Noon
Beko Cook Master Gas Built-in Oven - 90cm - Large Capacity 96 Liters - Cooling And Cooking Fans - Stainless Steel - BBWHT12106XS inox,"26,229",4.04,No Image,No Image,home appliances,Noon
Hans Built in 90 CM Gas Stove 4 burner Stainless steel HANS 9131-05,"16,150",0.0,https://f.nooncdn.com/p/pzsku/Z9E9A7D3027197CB14887Z/45/_/1718209954/5c515770-4ce5-4a86-ace4-5c2ce0b255b4.jpg?width=800,product_images/Hans Built in 90 CM Gas Stove 4 burner Stainless s.jpg,home appliances,Noon
"Waves Upright Garment Steamer – 3.5 L Tank & 1950 W Power – Integrated Ironing‑Board Support, Adjustable Height & Fabric Brush – Black/Silver – Professional Steaming","3,499",4.14,https://f.nooncdn.com/p/pzsku/ZD5581755E59F03506BCFZ/45/1752743212/1bec9a6d-9254-47f5-a0f8-9bc81464f82e.jpg?width=800,product_images/Waves Upright Garment Steamer  35L Tank  1950W Pow.jpg,home appliances,Noon
Samsung Vacuum Cleaner 1.3 L 2000.0 W SC4570 Black,"6,930",3.212,https://f.nooncdn.com/p/pzsku/ZEEE421859E4B59DCD0C0Z/45/_/1772091176/ba1b1584-8f21-4eda-9f88-67546ac87b0c.jpg?width=800,product_images/Samsung Vacuum Cleaner 13 L 20000 W SC4570 Black.jpg,home appliances,Noon
sokany SK-3080 Multi-Function Portable Garment Steamer,"1,325",3.34,https://f.nooncdn.com/p/pzsku/Z540689462896495B5EF1Z/45/_/1740175022/a6cf7409-b485-4086-8b04-f570ef77c78e.jpg?width=800,product_images/sokany SK3080 MultiFunction Portable Garment Steam.jpg,home appliances,Noon
Bergen Hot And Cold Water Dispenser White 2 Taps BYT-553,"6,999",0.0,https://f.nooncdn.com/p/pzsku/Z42C76BD75A2BFA7A1BE7Z/45/_/1772958828/a3b35eb6-bb6a-4475-bf7d-77f9dfeab28b.jpg?width=800,product_images/Bergen Hot And Cold Water Dispenser White 2 Taps B.jpg,home appliances,Noon
DSP Egg Boiler Steamer - (KA5001),739,5.01,https://f.nooncdn.com/p/5b5f1580d4585785996ca8fcc55473be|pzsku/Z283EB319A9056DA1A994Z/45/1768991975/eb717124-dfa7-458c-a39e-ab6244e4c43a.jpg?width=800,product_images/DSP Egg Boiler Steamer  KA5001.jpg,home appliances,Noon
smeg 50's Retro Style Aesthetic 2-Slice Toaster 950W 2 Slices 1035.0 W TSF01SSUK White,"16,499",0.0,https://f.nooncdn.com/p/pzsku/Z6493A2E30FD37AEA38DDZ/45/_/1773225431/c75789e5-4591-426c-b233-6a20d2ada112.jpg?width=800,product_images/smeg 50s Retro Style Aesthetic 2Slice Toaster 950W.jpg,home appliances,Noon
"first Quartz Electric Heater with Easy Carry Handle - 600W, 2 Candles and Safety Switch (1 Piece)",299,4.114,https://f.nooncdn.com/p/pzsku/ZBF38DFE65F902E09BD4AZ/45/1767574073/a8a0eebc-bbe5-41f7-86fe-91567372e3ec.jpg?width=800,product_images/first Quartz Electric Heater with Easy Carry Handl.jpg,home appliances,Noon
"Sokany Electric Waffle Maker, 1000 Watt, Black and Silver - SK-BBQ-225","1,466",4.32,https://f.nooncdn.com/p/pzsku/ZC97C0F40309E92E665D9Z/45/_/1739276039/268898a2-8091-4331-9740-d24a254bcefc.jpg?width=800,product_images/Sokany Electric Waffle Maker 1000 Watt Black and S.jpg,home appliances,Noon
"Luma Bella Luma-Bella Steam Iron with Ceramic Base, 2600 Watt, B-6006",999,0.0,https://f.nooncdn.com/p/pzsku/Z807155D94790E987121CZ/45/_/1771620569/0469a754-97d5-45b3-b09a-0be8d7d10239.jpg?width=800,product_images/Luma Bella LumaBella Steam Iron with Ceramic Base .jpg,home appliances,Noon
"RAF R.1207 High Efficiency Electric Steam Iron -2600W, Perfect Ironing, Easy and Fast 320ML Water","1,360",0.0,https://f.nooncdn.com/p/pzsku/ZC2E7105DFFC72B4D3579Z/45/_/1716973144/90acd1f3-7b9b-4f1d-bdbb-04c059067893.jpg?width=800,product_images/RAF R1207 High Efficiency Electric Steam Iron 2600.jpg,home appliances,Noon
Home Egypt Hand Blender 250 Watt - SA1390,"1,302",0.0,https://f.nooncdn.com/p/pzsku/ZD22B0C38F5EA819670C1Z/45/1759747291/533844b3-68b0-4212-96dc-8b77a1dd2776.jpg?width=800,product_images/Home Egypt Hand Blender 250 Watt  SA1390.jpg,home appliances,Noon
"Xiaomi Truclean W30 Pro Wet Dry Vacuum Cleaner, Self-Cleaning Base,18000Pa Turbo Suction,40Min Runtime,80 Degree Hot Air Drying, Water Tank 1000 ml 300 W E303HW White","24,222",4.04,https://f.nooncdn.com/p/pnsku/N70248418V/45/_/1760612187/4ddb0f90-92ce-4073-811e-ea5307c36f66.jpg?width=800,product_images/Xiaomi Truclean W30 Pro Wet Dry Vacuum Cleaner Sel.jpg,home appliances,Noon
IDO Hand Mixer from IDO 500 Watt 5 Speeds Black HM500-BK,"1,149",0.0,https://f.nooncdn.com/p/pzsku/ZE8586D3907AEEEB11ECEZ/45/_/1739898265/03708934-7b6c-44a5-b9b1-8700df3d03d1.jpg?width=800,product_images/IDO Hand Mixer from IDO 500 Watt 5 Speeds Black HM.jpg,home appliances,Noon
"KENWOOD Drum Vacuum Cleaner, 8M Long Power Cord, Removable and Washable Filter 20 L 2000 W VDM40.000BR Silver","7,260",3.913,https://f.nooncdn.com/p/v1685984224/N53390500A_1.jpg?width=800,product_images/KENWOOD Drum Vacuum Cleaner 8M Long Power Cord Rem.jpg,home appliances,Noon
"Dsp Sandwich Maker & Waffles, Nuts, Donuts, Shells Maker 4 * 1 With Thermostat 800W KC1237 Black*Silver","1,958",0.0,No Image,No Image,home appliances,Noon
"Philips Handblender Daily Collection - 650W, Plastic, Includes Beaker HR2531/00 White","1,979",0.0,No Image,No Image,home appliances,Noon
"Philips 2000 Series Steam Iron, Non-stick soleplate, 4 steam settings, 250 ml water tank, 2000W, Red 250 ml 2000 W DST2010/40 Red","1,799",5.01,No Image,No Image,home appliances,Noon
"dsp waffle maker machine 4 in 1, 800W Multi-Plate Cooker with Non-Stick Coating, Overheat Protection & Safety Lock – Includes Waffle, Nuts, Donut, and Shells Plates, KC1237","1,899",0.0,No Image,No Image,home appliances,Noon
Home Egypt Hand Blender 600 Watt - SA1382,"1,319",0.0,No Image,No Image,home appliances,Noon
Arshia Egg Beater HM092-2287,"2,900",0.0,https://f.nooncdn.com/p/pzsku/ZB9817576AB5A19302F57Z/45/1747054363/66de934d-78f6-441b-802f-f31f4f64df3f.jpg?width=800,product_images/Arshia Egg Beater HM0922287.jpg,home appliances,Noon
Beko Built-in Gas Hob 4 Burners Stainless Steel 60cm HIAW64225SX Silver,"12,999",3.74,No Image,No Image,home appliances,Noon
JAMAKY Italy Jamaky 2200W Garment Steamer with Teflon Soleplate and Self-Cleaning Feature - JMK 1100 Non-Stick Ceramic Soleplate,699,3.410,No Image,No Image,home appliances,Noon
TORNADO Automatic Turkish Coffee Maker Water Tank 560 ml 1470 W TCME-100D-PRO Brown x Black,"6,900",3.822,No Image,No Image,home appliances,Noon
"Philips Plastic Kettle 3000 Series - With Pilot Light, Spring Opening, 1.7 L 2200 W HD9318/01 Black 1.7 L 2200 W HD9318/01 Black","2,099",4.04,No Image,No Image,home appliances,Noon
Scarlett Hand Mixer 180W 180.0 W KD-133 White/Black,250,4.014,No Image,No Image,home appliances,Noon
"Simfer Built-In Gas Hob 90 cm Titanium Finish, 5 Sabaf Burners, Front Control Knobs, Heavy-Duty Cast Iron Pan Supports, Auto Ignition, Full Safety – Model H9505AGSSP","16,598",0.0,No Image,No Image,home appliances,Noon
"Plan A 300W High Efficiency Electric Coffee Grinder Spice Grinder, Stainless Steel Blades 4 Blades, 100g Jar, for Grinding Fresh Coffee, Herbs, Grains and Nuts with Clear Lid",699,4.01,No Image,No Image,home appliances,Noon
BOSCH CompactPower Meat Mincer 500.0 W MFW3612A Black/White,"5,875",5.01,No Image,No Image,home appliances,Noon
"Xiaomi Handheld Steam Iron | 10 steam holes | 1200W Power | Steam, Wet and Dry Ironing | 150ml Water Tank Capacity | 150 ml 1200 W B502CN | BHR9026GB | BHR9034EU White","4,210",4.33,No Image,No Image,home appliances,Noon
"DSP Professional Waffle Maker, DSP Heart Shape 1000W KC1144A White*silver","1,099",5.01,No Image,No Image,home appliances,Noon
Winning Star Electric Oven SilverSt-9690,"9,080",0.0,No Image,No Image,home appliances,Noon
SIVOLT Steam iron sivolt 2200 watt,"1,025",5.02,No Image,No Image,home appliances,Noon
"DSP Sandwich Maker 750W with Stainless Steel Grill, Non-Stick Coated Plates, Cold-Touch Exterior, Indicator Light, Non-Slip Feet, Easy-to-Open Handle, Compact Vertical Storage, KC1191",863,0.0,No Image,No Image,home appliances,Noon
Panasonic NI-JW650 Electric Powerful Steam Iron 2200W 2200.0 W NI-JW650T Multicolour,"3,409",4.219,No Image,No Image,home appliances,Noon
"Coffee Grinder, Multifunctional Electric Spice Grinder, Small Household Fine Spice Mill, 300W",430,4.226,No Image,No Image,home appliances,Noon
"HongXin Milk Frother - Hand Blender Mixer Froth Whisker Latte Maker for Milk Coffee Egg Beater Juicer,",235,3.54,No Image,No Image,home appliances,Noon
BLACK+DECKER Aerofry Digital Air Fryer 4 L 1500 W AF400 Black/Gold,"4,730",4.316,No Image,No Image,home appliances,Noon
5-In-1 Portable Steam Mop Cleaner Set 0.38L x5 Green/Black/White,"2,500",4.1101,No Image,No Image,home appliances,Noon
sokany long stick multi-use steam cleaning device with 450ml water capacit 2000W,"3,780",5.01,https://f.nooncdn.com/p/pzsku/ZDF411F917A213DB06B96Z/45/_/1773451863/8dfc4472-d4ff-4988-926d-87a2e840fa3d.jpg?width=800,product_images/sokany long stick multiuse steam cleaning device w.jpg,home appliances,Noon
Tefal Express Steam Plus 2500W Steam Iron with Ceramic X-Glide Soleplate - Auto-Off - Continuous Steam up to 45 g/min & 160 g/min Boost - Vertical Steam — Blue Salt - FV2868E2 270 ml 2500 W FV2868E2 Blue salt,"1,799",5.01,https://f.nooncdn.com/p/pnsku/N70297748V/45/_/1771772395/3b65c2d5-402b-47d0-b4d9-5b8a1eebdbf2.jpg?width=800,product_images/Tefal Express Steam Plus 2500W Steam Iron with Cer.jpg,home appliances,Noon
Sokany SK-0137 Sokany Coffee Machine 250ml 550W,"1,792",4.27,https://f.nooncdn.com/p/pzsku/Z26515F44BF40233A77C7Z/45/1766601546/7dc2f2a2-f88a-4ede-955e-035774d2e8b9.jpg?width=800,product_images/Sokany SK0137 Sokany Coffee Machine 250ml 550W.jpg,home appliances,Noon
"Bergen 2 Taps Hot And Cold Water Dispenser With Cabinet, BYB 87 Red","10,109",0.0,https://f.nooncdn.com/p/pzsku/Z6B51794E0FCC261B5DCDZ/45/_/1669313319/cd81260a-606a-4f6b-9d73-33c9fc9c7934.jpg?width=800,product_images/Bergen 2 Taps Hot And Cold Water Dispenser With Ca.jpg,home appliances,Noon
"DSP Stand Mixer KM3032 With 1500W, 10L Stainless Steel Silver","15,080",0.0,https://f.nooncdn.com/p/pzsku/Z3EDC4A3FA3FF5D48C324Z/45/_/1734171350/44bbb912-aac0-4336-93a9-1a49d9a0d097.jpg?width=800,product_images/DSP Stand Mixer KM3032 With 1500W 10L Stainless St.jpg,home appliances,Noon
Samsung Vacuum Cleaner With Bag 2000.0 W VC20M2510WB-SG-Blue blue,"6,480",5.03,https://f.nooncdn.com/p/pzsku/Z0011015A66DC76882B4CZ/45/_/1772091074/e156aba0-7541-412c-bb80-888b65cb4469.jpg?width=800,product_images/Samsung Vacuum Cleaner With Bag 20000 W VC20M2510W.jpg,home appliances,Noon
Smeg 2-Slice Retro Toaster 1035.0 W TSF01PKUK Pink,"11,770",0.0,https://f.nooncdn.com/p/pzsku/ZC954A85F2D973A69F144Z/45/_/1773225669/eec31544-7296-47fa-8b92-726bc55716dc.jpg?width=800,product_images/Smeg 2Slice Retro Toaster 10350 W TSF01PKUK Pink.jpg,home appliances,Noon
DSP Stainless Steel Hand Blender/Variable Speed Regulator/1000W(KM1150),"1,049",5.01,https://f.nooncdn.com/p/pzsku/Z92E8274249A01EC29D85Z/45/_/1773493257/4a5a70eb-a68f-442d-a755-e279902c8905.jpg?width=800,product_images/DSP Stainless Steel Hand BlenderVariable Speed Reg.jpg,home appliances,Noon
Shelly  Mini 1PM Gen3,"2,599",0.0,https://f.nooncdn.com/p/pzsku/Z3C1496E2B59CCB162A7EZ/45/_/1722422361/29de0b6a-7e9f-4b14-8b18-9d30285a78e4.jpg?width=800,product_images/Shelly  Mini 1PM Gen3.jpg,home appliances,Noon
TORNADO Microwave Solo 25 Liter 900 Watt Silver TMD-25SE-S,"7,727",5.01,https://f.nooncdn.com/p/pzsku/Z4E27B8F31E3F63E6AB36Z/45/_/1711797544/6f8ee7ab-f603-4bee-9dce-7334ce4146da.jpg?width=800,product_images/TORNADO Microwave Solo 25 Liter 900 Watt Silver TM.jpg,home appliances,Noon
"TOUCH Elzenouki Turbine Plus Vacuum Cleaner, 2600 Watt- 40805","5,868",0.0,https://f.nooncdn.com/p/pzsku/Z7C668BD63EE7C253922BZ/45/_/1737887722/09959b53-13f3-4f8c-b668-695125732d97.jpg?width=800,product_images/TOUCH Elzenouki Turbine Plus Vacuum Cleaner 2600 W.jpg,home appliances,Noon
Simfer Built-in Gas Hob 90 cm  – Black Glass – 5 Sabaf Burners – Front Controls – Auto Ignition – Full Safety – Strong Cast-Iron Pan Supports - H9505HGSSP,"15,998",0.0,https://f.nooncdn.com/p/pzsku/Z8D05DF29B69D89747002Z/45/1761385695/00c5e98b-f076-46c0-948b-a6e85e5dc827.jpg?width=800,product_images/Simfer Builtin Gas Hob 90 cm   Black Glass  5 Saba.jpg,home appliances,Noon
"Philips Barista Brew Semi-Automatic Espresso Machine, 280 G Dual Bean Container, 58 Mm Stainless Steel Portafilter, Premium Calibrated Tamper, Pid Temperature Control And Pre-Infusion,Metal Conical Burr Grinder With 15 Grind Sizes,15 Bar Pressure 450 ml 1350 W PSA3228/01 Silver","50,600",0.0,https://f.nooncdn.com/p/pnsku/N70151169V/45/_/1739860366/0307f2f3-6bbf-440f-8d59-c6383f4474d4.jpg?width=800,product_images/Philips Barista Brew SemiAutomatic Espresso Machin.jpg,home appliances,Noon
Sonifer 2 In 1 Portable Vertical Wire Vacuum Cleaner 400W Power 0.7 L 400 W SF-2238 Multicolor,"2,860",0.0,https://f.nooncdn.com/p/pnsku/N70136696V/45/_/1735102985/c61bcfe4-09b7-49de-8b28-e04ca89c96e8.jpg?width=800,product_images/Sonifer 2 In 1 Portable Vertical Wire Vacuum Clean.jpg,home appliances,Noon
TORNADO Teflon Soleplate Steam Iron,"1,779",4.42,https://f.nooncdn.com/p/pzsku/Z15CA79454B9B9CB21E4AZ/45/1759048047/178c08d1-f73d-46e9-98f8-02b50dc8214d.jpg?width=800,product_images/TORNADO Teflon Soleplate Steam Iron.jpg,home appliances,Noon
Shelly uni,"2,287",0.0,https://f.nooncdn.com/p/pzsku/ZE9A919C1C2924FD3DE35Z/45/_/1722697207/53f0d78f-3755-4c1c-b480-a1c30ec9a1c3.jpg?width=800,product_images/Shelly uni.jpg,home appliances,Noon
Tefal Easygliss Steam Iron 270.0 ml 2500.0 W FV5718 Blue And White,"2,530",4.017,https://f.nooncdn.com/p/v1686303439/N53412566A_1.jpg?width=800,product_images/Tefal Easygliss Steam Iron 2700 ml 25000 W FV5718 .jpg,home appliances,Noon
Arzum stainless Kettle 1.7 L 2200 W AR3074 Silver/Black,"1,731",4.73,https://f.nooncdn.com/p/pnsku/N47042118A/45/_/1744386458/fcd485bb-054c-428d-b72d-5a967fd50bde.jpg?width=800,product_images/Arzum stainless Kettle 17 L 2200 W AR3074 SilverBl.jpg,home appliances,Noon
"Jamaky JMK9011, Electric Coffee Pot 0.5-Ltr",329,3.73,https://f.nooncdn.com/p/pzsku/ZAC8D5B5DD85603852D87Z/45/1750752736/3eab489e-26a4-4711-8ac9-a8d4182fb063.jpg?width=800,product_images/Jamaky JMK9011 Electric Coffee Pot 05Ltr.jpg,home appliances,Noon
Home Egypt Microwave 30 Liter 1400 Watt,"6,102",0.0,https://f.nooncdn.com/p/pzsku/Z105AB875A1917E490172Z/45/_/1723966711/4c7cb207-8160-4d3a-8617-0ce1e6d74afb.jpg?width=800,product_images/Home Egypt Microwave 30 Liter 1400 Watt.jpg,home appliances,Noon
"Gorenje Electric oven 60 cm, stainless steel color, 77 liters, Homemade, Defrost, Gentle Close door hinge, Air Fry, Double illumination, BOS6747A01X BOS6747A01X silver","39,899",0.0,https://f.nooncdn.com/p/pnsku/N70145802V/45/_/1737643692/de36d0dc-9741-49b9-b6a2-d43244a3d3d6.jpg?width=800,product_images/Gorenje Electric oven 60 cm stainless steel color .jpg,home appliances,Noon
Jamaky Hand Blender - 500 Watts - JMK-3002,599,5.01,https://f.nooncdn.com/p/pzsku/Z74FEFDBDBE7817C19BC1Z/45/1750681003/ea08b940-338f-4397-b812-56306117de9a.jpg?width=800,product_images/Jamaky Hand Blender  500 Watts  JMK3002.jpg,home appliances,Noon
BRAUN مضرب بيض براون مالتي ميكس 500 W HM3105 White/Silver/Clear,"3,499",3.56,https://f.nooncdn.com/p/v1589397830/N27550095A_1.jpg?width=800,product_images/BRAUN مضرب بيض براون مالتي ميكس 500 W HM3105 White.jpg,home appliances,Noon
Spice Grinder 300W Electric Coffee Grinder With Stainless Steel Blades For Spices Nuts Herbs Powerful Mini Grinding Machine Easy Clean Compact Design,450,3.25,https://f.nooncdn.com/p/pzsku/ZB7F4D2FD94C17FBDE640Z/45/1754911060/7bcc5e19-1eda-4c16-b828-97ca28f751c8.jpg?width=800,product_images/Spice Grinder 300W Electric Coffee Grinder With St.jpg,home appliances,Noon
Midea upright vacuum cleaner 3*1 model SC861 600 W SC861 Blue,"3,025",5.01,https://f.nooncdn.com/p/pnsku/N70065999V/45/_/1714447946/8540aea5-1d50-4b4b-95eb-09044f8688fe.jpg?width=800,product_images/Midea upright vacuum cleaner 31 model SC861 600 W .jpg,home appliances,Noon
"smeg Retro 50's Style Jug Blender with Stainless Steel Blades, 4 Speed Settings and 3 Pre-set Programs, 1 Year Warranty 1.5 L 800.0 W BLF03WHUK white","16,830",0.0,https://f.nooncdn.com/p/pzsku/Z72A3E7880ADA067B6EFCZ/45/_/1773225663/71872814-5fd0-4eb4-a581-556f532d569b.jpg?width=800,product_images/smeg Retro 50s Style Jug Blender with Stainless St.jpg,home appliances,Noon
smeg 50's Retro Style Aesthetic 4 Slice Toaster 800 W 1635 W 4 Slices 1635.0 W TSF02PBUK Pastel Blue,"14,000",0.0,No Image,No Image,home appliances,Noon
sokany Sandwich Maker and Grill 1400W Large Size SK-08101,"1,899",3.56,No Image,No Image,home appliances,Noon
Toshiba TL 15KG Steam - Heater UFB - Great Waves - DDM 15 kg AW-DUHN1600LUPEG(SK) Silver,"22,500",5.01,No Image,No Image,home appliances,Noon
Arshia pump iron,"6,900",4.01,No Image,No Image,home appliances,Noon
"Xiaomi Semi Automatic Espresso Machine, Milk Frother 20bar Pump 0.9L Stainless Steel CME003 0.9 L 1350 W BHR9798EU Silver","8,237",0.0,No Image,No Image,home appliances,Noon
Pluto Silver BC-92 Hotel Mini Bar Refrigerator,"7,800",3.88,No Image,No Image,home appliances,Noon
"BLACK+DECKER Glass Blender, Six Blade System, Variable Speed, Pulse Function, Includes Accessories, Modern Chrome Design, 1.5 L 600 W BX600G-B5 Silver/Black","6,780",4.2237,No Image,No Image,home appliances,Noon
Home Egypt Plastic kettle 1850 Watt 1.7 Liter - K468,984,5.01,No Image,No Image,home appliances,Noon
"Cute Duck Shaped Broom and Dustpan for Garbage Cupboard, Clean Broom Set for Gifts | for Home, Kitchen, Office, Hallway, Floor and Closet Cleaning",299,5.02,No Image,No Image,home appliances,Noon
"HongXin Milk Frother Machine with Handheld Milk Frother Latte Mixer, Coffee and Drink Mixer, Cappuccino Mini Frother, Ice Cream Hot Chocolate and Coffee Creamer, Egg",235,4.25,No Image,No Image,home appliances,Noon
"Toshiba Top Load Automatic Washing Machine, 13 KG, Inverter Motor Silver- AW-DK1300KUPEG 13 kg AW-DK1300KUPEG multicolor","18,999",3.510,No Image,No Image,home appliances,Noon
"BRAUN FreeStyle 3 Steam Iron | 3D FreeGlide Technology, SuperCeramic Soleplate, Ultimate FastClean, Auto Shut-Off 270 ml 2700 W FI3144BL Blue","2,750",4.425,No Image,No Image,home appliances,Noon
حامل غساله متحرك عالي الجودة ومتين مع 24 عجلة,261,3.77,No Image,No Image,home appliances,Noon
"Arion Ceramic Steam Iron 3000W, AR-606","1,759",4.01,No Image,No Image,home appliances,Noon
arzum okka Pro M Fully Automatic Espresso Machine - OK0028-05 - Black&Chrome,"32,500",4.02,No Image,No Image,home appliances,Noon
sokany Waffle Maker 2 Pieces - 1400 Watts - silver * black SK-08027,"1,799",5.01,https://f.nooncdn.com/p/pzsku/Z3BA08EC7901E2741F94CZ/45/_/1735206032/38a51170-eef6-49be-8492-aa04dfaeb48a.jpg?width=800,product_images/sokany Waffle Maker 2 Pieces  1400 Watts  silver  .jpg,home appliances,Noon
Hervy Glass Ventilating fan 20 ( Vento glass ),590,0.0,https://f.nooncdn.com/p/pzsku/Z87BE53F1046E420930D8Z/45/_/1702980811/0d148d22-a51b-4d2f-a858-17cf08758439.jpg?width=800,product_images/Hervy Glass Ventilating fan 20  Vento glass .jpg,home appliances,Noon
"DSP, KM1021, Electric Hand Blender 2-Speed, Stainless Steel, 300w",943,5.01,https://f.nooncdn.com/p/pzsku/ZBCA269A771A156C7F47DZ/45/_/1737821324/7c58bb19-4f9d-48f8-aeac-5da928a7a77f.jpg?width=800,product_images/DSP KM1021 Electric Hand Blender 2Speed Stainless .jpg,home appliances,Noon
"JAMAKY Multi Capsule Coffee Maker with Italian technology jmk-9012, Household 1450W Automatic Drip Coffee Machine 0.6L Water Capacity","6,950",4.52,https://f.nooncdn.com/p/pzsku/Z0B9E0DB609CB02589BEAZ/45/1746694313/398ae8a8-680a-47f8-a5a2-ab0973a65805.jpg?width=800,product_images/JAMAKY Multi Capsule Coffee Maker with Italian tec.jpg,home appliances,Noon
"DSP Hand Blender, 500W, White, Stainless Steel Blade, KM1139",649,5.01,https://f.nooncdn.com/p/5b5f1580d4585785996ca8fcc55473be|pzsku/ZAED4DE52125A0461A48EZ/45/1768993158/7e0fa558-fb15-4885-aea0-901ee0118b6c.jpg?width=800,product_images/DSP Hand Blender 500W White Stainless Steel Blade .jpg,home appliances,Noon
Toshiba 45L Solo Digital Membrane Microwave Oven 45 L 1200 W ML3-EM45PFI(MB) Silver,"9,999",0.0,https://f.nooncdn.com/p/pnsku/N70149844V/45/_/1738828112/78543725-09d0-4235-97d8-9a04127b8aba.jpg?width=800,product_images/Toshiba 45L Solo Digital Membrane Microwave Oven 4.jpg,home appliances,Noon
Ikea Galvanised Holder for Iron-Silver,599,5.01,https://f.nooncdn.com/p/pzsku/ZD4EC6D9A18212FA8CE27Z/45/1767808189/bfce902e-2e44-4a7b-aaff-cb9f52507cff.jpg?width=800,product_images/Ikea Galvanised Holder for IronSilver.jpg,home appliances,Noon
BOSCH Serie | 6 Built-in oven 60 x 60 cm Stainless steel HBJ558YS0G Black,"26,349",5.01,https://f.nooncdn.com/p/v1667991931/N51479196A_1.jpg?width=800,product_images/BOSCH Serie  6 Builtin oven 60 x 60 cm Stainless s.jpg,home appliances,Noon
Beko Contact Grill 2000 W 6 Slice Zone 4 Heat Levels up to 180°C Gray TM 5206 G 2000 W TM 5206 G Silver,"4,399",5.01,https://f.nooncdn.com/p/pnsku/N70158229V/45/_/1740996215/91a8fe44-f146-4203-9250-7493f6096df0.jpg?width=800,product_images/Beko Contact Grill 2000 W 6 Slice Zone 4 Heat Leve.jpg,home appliances,Noon
BLACK+DECKER Steam Iron 2400 Watt 2400.0 W X2150B5 White/Blue,"2,475",4.52,https://f.nooncdn.com/p/v1576684847/N32628527A_1.jpg?width=800,product_images/BLACKDECKER Steam Iron 2400 Watt 24000 W X2150B5 W.jpg,home appliances,Noon
Koldair Coldair top loading hot and cold water dispenser with   refrigerator AF3.1 LED digital display,"8,999",5.01,https://f.nooncdn.com/p/pzsku/Z7F0BC0A8BB1C5638C875Z/45/_/1723288722/f5167bd9-0095-4cd6-b252-40ccc41f604f.jpg?width=800,product_images/Koldair Coldair top loading hot and cold water dis.jpg,home appliances,Noon
IDO Toaster oven 50 liters 2000 watts TO50DG-SV-IDO,"4,700",5.02,https://f.nooncdn.com/p/pzsku/ZA15AD90E565F33D4FADEZ/45/_/1678195219/253f4ed9-73ff-4a21-b2fa-bc1138d206ce.jpg?width=800,product_images/IDO Toaster oven 50 liters 2000 watts TO50DGSVIDO.jpg,home appliances,Noon
Hand Mixer 180W 18 W GE810HL02MTLGNAFAMZ-2965859 White/Black,242,3.810,https://f.nooncdn.com/p/v1568814294/N30082752A_1.jpg?width=800,product_images/Hand Mixer 180W 18 W GE810HL02MTLGNAFAMZ2965859 Wh.jpg,home appliances,Noon
DSP Sandwich maker with thermostat 800W KC1170 Black*Silver,799,3.95,https://f.nooncdn.com/p/pzsku/ZC80EF44A6286AAA7FC94Z/45/1744549536/b8cabd66-73bf-4953-be41-8a226ab5ba5a.jpg?width=800,product_images/DSP Sandwich maker with thermostat 800W KC1170 Bla.jpg,home appliances,Noon
Kenwood Triblade Hand Blender 1000W Black HBM60.307GY Black/Silver,"4,349",3.53,https://f.nooncdn.com/p/pnsku/N70203071V/45/_/1754999520/3e72007f-26be-4166-b38f-a04bf697b172.jpg?width=800,product_images/Kenwood Triblade Hand Blender 1000W Black HBM60307.jpg,home appliances,Noon
بيانكا طقم كنك قهوة جرانيت بيانكا -4 قطع,"1,129",5.06,https://f.nooncdn.com/p/7e4454fd64f258118b3b5cf7871239f3|pzsku/ZE76358A7D1A5380E6F85Z/45/1768891742/3ed32b65-a0e6-47e9-a433-72d08ba796f8.jpg?width=800,product_images/بيانكا طقم كنك قهوة جرانيت بيانكا 4 قطع.jpg,home appliances,Noon
"sokany SK-1907 Professional Hair Straightener Flat Iron SK-1907, Ceramic Nano Silver Plates up to 750°F, Fast Heating Wet & Dry Hair Styler, Smooth Frizz-Free Finish, 43W, 220–240V 50/60Hz for All Hair Types, Salon & Home Use",410,5.01,https://f.nooncdn.com/p/pzsku/Z2AE59FB7B4D7121948DFZ/45/_/1772530956/d9395929-9b18-41c6-bc97-4595607d6d2a.jpg?width=800,product_images/sokany SK1907 Professional Hair Straightener Flat .jpg,home appliances,Noon
Agfa Stainless Steel Clothes Hanger Set 10 Pieces Silver 40.5 x 21cm,170,3.73,No Image,No Image,home appliances,Noon
Tefal Steam Iron 2500 Watt No water stains Auto off Express Steam Plus 270 ml 2500 W FV2868E2 Blue,"1,800",4.04,No Image,No Image,home appliances,Noon
JAMAKY Hand Blender - 1000 Watt - JMK3022,739,4.84,https://f.nooncdn.com/p/pzsku/ZCF51A663E2EB7043C408Z/45/1753606173/fadec81a-c777-44da-9876-b9a291bda64a.jpg?width=800,product_images/JAMAKY Hand Blender  1000 Watt  JMK3022.jpg,home appliances,Noon
"Ariete 4137 Vaporì Jet Steam Gun, Aluminum Boiler, 1050 W, 250 cc, 3.5 bar, Accessory Kit included, White","3,949",3.97,No Image,No Image,home appliances,Noon
"Beko Steam Iron, Ceramic Coated Soleplate with Steam Pools, Auto Shut-Off 240 ml 2600 W SIM3126R Purple","1,999",4.45,No Image,No Image,home appliances,Noon
sokany KJ-507 Electric Pancake Maker - Non-stick Crepe and Pancake Maker - Perfect Fluffy Crepes at Home - Black,"1,820",4.01,No Image,No Image,home appliances,Noon
Tesla HAND MIXER 300w 5 speeds TSL-HM100 silver,"1,299",5.01,No Image,No Image,home appliances,Noon
IDO Toaster oven 50 liters 2000 watts TO50SG-BK-IDO,"4,450",5.01,No Image,No Image,home appliances,Noon
"JAMAKY Electric hand mixer made of plastic, elegant design, easy to use, high quality, ideal for preparing desserts, 5 adjustable speeds, eject button to remove the beaters and dough hooks, 500 watts, model JMK6017",700,5.02,No Image,No Image,home appliances,Noon
De'Longhi Stilosa  Espresso & Coffee Makers EC230.BK Black,"8,649",4.25,No Image,No Image,home appliances,Noon
Panasonic Steam Iron NI-WL41 Purple,"2,629",3.45,No Image,No Image,home appliances,Noon
